Title,Location,Link,Raised,Target,MostRecentDonation,Created,Organization,OrganizationDetails,DonationCount,Donations,Story,Complete
" Help Me Support The Earth's Most Ancient Culture ","Chearsley, South East England, United Kingdom",https://uk.gofundme.com/f/help-me-support-the-earths-most-ancient-culture,2000,2600,,2019-11-10,,,0,,"The Kalahari San Bushpeople of which the Ju/‘Hoansi are one group  are direct descendants of the oldest people who once roamed over much of Africa. They have been exploited  persecuted and displaced for many hundreds of years  and have experienced enormous hardship.    It has become increasingly difficult for the San Bushmen to continue to practice their traditional way of life as hunter-gatherers and now only fifteen active master trackers remain. The situation today is an urgent and critical one; we now have precious time left to help preserve this most ancient way of life and the wisdom they hold.     In March 2020 I will journey deep into the Kalahari Desert to this remote tribe with WildWise in association with The Old Way and CyberTracker . Our small group are all graduates from the WildWise “Call of the Wild ” programme and we will travel to the part of the desert which is the last place in Africa where they still retain rights to their ancestral lands  where they are still able to hunt with a bow and arrow and where the community still remain with some of their traditional ways of life intact.    Living among the Ju/‘Hoansi  we will immerse ourselves in their way of life  experiencing the way they live together in community  raise their children  and going out in small groups at dawn tracking with the bow hunting master trackers.       Why we need this original wisdom    Being the longest continuous intact human culture affords the San Bushpeople a unique intelligence missing in the modern world. They retain a deep inter-connection with the land and it gives them an exceptional and astounding ability to read the earth for stories and track and trail animals for days. This is a continuous tradition that goes back more than 100 000 years  the longest of any human tradition. Their skills and way of life are a vital source of information about human evolution and how to live in deep connection to the living world.    This older  deeper wisdom is lacking from our world right now but through it we might find the distant tracks of some of the answers to the profound questions and challenges the world is facing.    But just when we need it most  the opportunity to experience it is diminishing due to the long-standing persecution and displacement that the San have faced. This has made it impossible for the San to sustain this way of living.    It is my view that preserving this ancient culture that once supported all human life is as critical as saving the last 15 of any species on earth.     The time to act is now.    How the invitation came about    This invitation came from the Ju/‘Hoansi Bushpeople themselves. I am fully aware of the trap which many Western organisations fall into of thinking they know what’s best for other communities. Our primary guide is the renowned anthropologist  scientist and founder of CyberTracker Louis Liebenberg. Louis has been working with the Bushpeople in the Kalahari since 1985  and being a true master tracker himself is highly respected and trusted.    He was asked by the elders of the tribe in 1990 to help them to pass on their cultural practices to the younger generation who have abandoned the traditional ways of living because it is no longer a viable way to survive within the constraints forced upon them. Louis Liebenberg has been tirelessly working with the San Bushmen to ensure that their invaluable tracking expertise is passed on to the younger generation by reviving the ancient practice of tracking as a way to sustain life within the community.    By using free and easy-to-use software designed by CyberTracker  trackers are able to record complex data about wildlife populations and plant biodiversity. By becoming ‘qualified’ as trackers they are able to get jobs in ecotourism  as rangers in anti-poaching units  in wildlife monitoring and scientific research.    This programme of employment creation is vital to ensure that their invaluable tracking expertise is passed on to the younger generation of San by incentivising and motivating them to keep their knowledge and skills alive.      How the money will be used    1 - Money you offer will go directly to supporting the San communities. It will be a lifeline of employment for them whilst also encouraging them to continue their ancient and important cultural practices. This trip will support all the 15 remaining master trackers in the Namibian conservancy for 4 months of the year. We pay them in one week what it takes them 2 or 3 months to earn picking the devil’s claw plant; which is their only other source of income. The tracking work provides a valued source of income which helps preserve their culture and unique scientific knowledge; The Tracker qualification programme in turn helps to support the livelihoods of the village as a whole.    2 - We will pay the other villagers such as the elders & youth who provide valuable knowledge and host us and help us with various tasks around camp.    3 - We also provide financial support through the purchase of handicrafts which provides a crucial source of income for the women as there is next to no potential employment for them in this region. This again supports a wide number of villages as well as helping them to preserve their heritage craft skills. The women will also be paid to teach us to build grass huts for us to sleep in which  like the handicrafts  provides a crucial source of income for the women as well as preserving the knowledge and skill set to build our species first kinds of homes.    4 - We pay an entrance fee to the conservancy  translators and apprentice translators.    5 - Subject to having enough money leftover and if external funds are not forthcoming from elsewhere then we will also provide funding for food for people coming to the TB soup kitchen in Tsumkwe  the clinic is thus able to stay open for longer and provide a better service; we supplement the funding of the clinic provided by others.     I will pay for my own travel to and from Namibia.    My hopes and dreams    Whilst the money raised will deliver vital funding to support the San Bushpeople to continue their traditional ways of life. It is also my hope that there will be other benefits.    My own journey for the last few years has been one of a profound personal transformation and exploration into my own rewilding. It has unlocked for me an intense longing to be reminded of the wisdom that my ancestors held and their connection to their communities the earth. What does it mean to re-wild ourselves and the communities we live in? Is it possible to bridge the modern world and all that it offers with an older  wilder way of being? How can I raise my children with this greater wisdom  in a community that thrives and supports one another? It is my hope that through this visit I will also find wisdom to bring back to my life  my children and the communities I live and work in.     Thank you for reading! Please help in whatever way you can.    With deep gratitude and love     Elena xxx      WildWise    Outdoor environmental education based in the magical Dartmoor National Park in Devon. They offer a diverse programme of courses and events designed for adults  children and families  including the year-long “Call of the Wild ” programme that I attended back in 2017  which is where my journey really began.    The Old Way    If this is something you would like to personally experience and support  then it is possible to join a similar trip journeying into the Kalahari with “The Old Way” which is a year-long program exploring hunter-gatherer life ways which takes place in Devon and the Kalahari.    More about the San Bushpeople    It is thought likely that the Bushmen are the descendants of the ancestral source  from which all modern humans diverged as they started spreading around the world about 60 000 years ago. Their cultural practices date back 100 000 years - all human beings once lived in this original way. It still lives deep in all of us.    Like ll indigenous cultures the San have been subject to long-standing persecution and pressures from all sides. It is extraordinary that the people and their culture has been able to persist. Hunter-gathering by its very nature relies on an ability to roam great distances to source the food they need. Today their ancestral lands are divided up into farms and given away to diamond miners; the small areas left ‘designated’ for the bushmen are not compatible with their way of life. They have been evicted  starved of food and water and hunted like animals. Most San have now been resettled to camps  where disease and alcoholism is rife. It is a far cry from their traditional ways that work in harmony with the land living in community. Something so many of us seem to be striving for today as a way out of the ecological crisis we find ourselves in.    Somehow  against the odds a small number of San Bushmen persist in living according to their ancient traditions. It is thought that the number is now around 10-15 individuals and this number is declining. It is very likely that if nothing changes their way of life will be lost forever in the next few years  a human extinction that will go unnoticed. I don’t want to sit passively to let that happen.    This is why new ways of supporting the San are vital  so that they continue to value their traditional ways  passing them on to their young people so that they might keep alive a culture from which all human life originated.",False
" Help Jas Help Others ","Oldbury, West Midlands, United Kingdom",https://uk.gofundme.com/f/20squld56o,1353,1000,,2020-05-31,,,0,," Welcome to my Go Fund page. Sponsor me to help to achieve my goal to become a vegetarian. During this Covid 19 crisis and still until today  I have had support from a charity called The Sikh Soup Kitchen being one from the vulnerable group. Having no family around and Mom stranded in India I have had to call on them for support. They provide me with a hot meal  sandwiches and snacks along with daily essentials  so that I do not have to worry about going out. I am not the only one and they provide this support to the elderly and vulnerable- I am amazed for the amount of work that they do. They provide it to anyone in the Community that require any support. They provide a Street Food Bank Service every Friday and Saturday on Soho Road  Handsworth  where they hand out food to the people in need regardless of faith or race as they have strong Sikh principles to help anyone that they come across. The Sikh Soup Kitchen are a community/ food bank based service  whom you can call on and they will provide you with support and vegetarian cooked meals including any social support adhering strictly to the Government guidelines. I have been inspired by them to become a vegetarian from the lovely cooked meals that they have been providing to me in this pandemic. They also have a dedicated phone line  where you can call during the pandemic for a ‘friend to chat’ service. Please help me to achieve my goal to become a vegetarian and the money raised will go to The Sikh Soup Kitchen  so that they can continue to support the community in need with daily deliveries and Street Food Bank service (everything brought is transparent as receipts are shown on social media). If anybody wants to see them in action or volunteer then please contact me and I can arrange this for you. You are able to follow them on Twitter and see their daily work in action. @SikhSoup Please support me- I want to become a vegetarian and also support The Sikh Soup Kitchen with their ongoing selfless service. All funding achieved will go to them which will continue to provide the daily meals and Serve the Street Food Bank. Thank you Jas Kaur ",False
" Feeding the Homeless this Christmas ","London, Greater London, United Kingdom",https://uk.gofundme.com/f/yj3ytb-feeding-the-homeless-this-christmas,1350,2500,,2020-12-17,,,0,,"The unemployed bringing delicious chef-cooked comfort food to the homeless this Christmas.     A great Chef I know has decided that as he won't be working over the Christmas period he is going to get a team of unemployed (some not eligible for furlough) chefs together and aim to feed 20 000 homeless a Christmas dinner. Him and the team did over 10 000+ meals for the NHS in Lockdown 1.0.     All of the chefs are trained and trying to cook good meals and make as good memories as they can for the homeless during this shite time.     I know that times are really hard for people right now so honestly no worries/pressure  but if you could spare a bit of change to help make this possible it would be much appreciated.     If anyone has any links or contacts for food banks or soup kitchens. Shelters?     Thanks in advance     Charly x",False
" Turning the tide on TB: Supporting the San Bushman ","Ringmer, South East England, United Kingdom",https://uk.gofundme.com/f/yvtdj5-supporting-humanities-oldest-culture-san-bushmen,11107,10000,,2020-05-02,,,0,,"The San people of southern Africa  believed to be the longest surviving culture on earth by tens of thousands of years and the last tribe on earth to pursue the persistence hunt  have faced centuries of oppression and marginalisation. The Ju’/hoansi  the San people living in the Nyae Nyae Conservancy  now face a critical struggle against tuberculosis  a treatable and preventable disease.     This crowdfunder aims to raise money to support local efforts to beat this disease. The money raised will pay for projects which provide vital food  information and testing which is necessary to eliminate TB and support good recovery. The projects had a private funder  but she recently died  and government and NGOs have not picked up the funding shortfall. In addition  the collapse of tourism in the Nyae Nyae due to COVID19 has caused a major fall in local income  meaning this crowdfunder is more important than ever.       The San culture is under threat from many directions  but TB is particularly dangerous. It is the leading cause of death from any infectious disease worldwide and there are four strains of TB in the region. We’re working with organisations and doctors on the ground the Nyae Nyae to make sure this money gets to the right people at the right time.       The priority is to provide food for recovering TB patients as eating regular good food is essential for the treatment to work. Government funding pays for medicines distributed by the clinic in Tsumkwe  which serves the whole of the Nyae Nyae. However  this funding does not provide accommodation or food. There is a separate soup kitchen project which provides nutritious meals twice a day in Tsumkwe to TB patients  but it is facing massive funding cuts. The soup kitchen urgently requires £500 a month to continue to provide this vital service.     Funding is also desperately required for an outreach team that carries out testing and education in the remote villages. As we've learned from COVID19  testing is an important part of controlling infectious disease. The outreach team can identify the disease in the early stages  which limits the spread of infection within the villages. This outreach team requires £300 a month to operate.    Since TB flares up when people are malnourished or otherwise immuno-compromised  the longer term aim is to tackle food security. One vision to do this is to support the San to create gardens and food forests within each of the 39 villages in the Nyae Nyae Conservancy. Seeds  fencing materials and tree saplings are needed to establish a garden in each of them. If we exceed our fundraising target  the additional money will be put towards these gardens and forests.     If you are able to help fund this work in the longer term  please get in touch by contacting Caspar through the link below.       More on the San    The San people of the Kalahari are the last trace of our deep ancestry  our oldest cousins who never left Africa. Their territories span Botswana  Namibia and South Africa. In the last few centuries the nomadic lives these people led have been dramatically transformed through waves of colonialism and marginalisation that has put pressures on their land  and many are now settled in villages or only semi-nomadic.        Amongst the San are some of the best trackers and hunters in the world. Men and women can still walk into the bush with their digging sticks and come out with forage hides laden with food. However  their shrinking territory and the fact that they are settled in villages  means living off foraging and hunting alone is not enough. Money  necessary to supplement limited hunting and foraging  is hard to come by. The main sources of income are searching in the desert for the Devil’s Claw plant and tourism. With COVID19  it will be a long time before tourism returns to the Kalahari.     About us    We are a group of people passionate about supporting the Ju'/hoansi as many of us have spent time with them through the Old Way and / or Wildwise over the last few years. There is so much we can learn from a culture as old as humanity itself and we would love to support the people who shared so much with us. Your kindness means the world to us  thank you.    The Kalahari Action Group    ",False
" Mobile Soup Kitchen Needs Help as vandals strike ","Colden Common, South East England, United Kingdom",https://uk.gofundme.com/f/mobile-soup-kitchen-needs-help-as-vandals-strike,520,500,,2020-05-03,,,0,,"Mobile Soup Kitchen needs your help after vandals attack.    Vandals have targeted the home and vehicles of the founders of a mobile soup kitchen which have been serving the #Homeless  #SofaSurfers  those in temp accommodation  hostels and the #RoughSleepers in #Southampton. The community based project started by these 2 just over 5 years ago has built a strong team of #volunteers who go out and source donations  cook and prepare meals to help support around 50 people a day.       During the #Covid19 #Lockdown although we aren't allowed out on the streets  we are still preparing food and supplying the temp accommodation that the #roughsleepers are staying in during lockdown. Additionally food parcels have been distributed to those who needs it.    That said  we now cannot do anything since the tyres were slashed on the van and their own car. Additionally windows and doors were smashed on their car and the house windows had rocks thrown through them. The cook was also injured in this attack.     As a community based project  we are not a registered charity due to the small amount we raise financially. Most of our support comes from product donations. However we have been recognised by The #HighSheriffofHampshire and #RadianHousing for the work we do.       Funds raised will go towards new tyres and the insurance as no doubt it will increase next year. Any extra raised will all go towards the running if the soup kitchen. All funds raised  100% we recieve go to feeding the homeless. No volunteers or the founders are paid. We have no overheads except the van running costs and electricity to prepare the meals  everything else is covered by the volunteers and the donations of food.  ",False
" Give a family in need a deposit for their home ","Bournemouth, South West England, United Kingdom",https://uk.gofundme.com/f/give-a-family-in-need-a-deposit-for-their-home,2690,1000,,2019-01-10,,,0,,"Whilst browsing through Facebook I saw a post from 'Hope for food ' a great charity that help Bournemouths homeless. Amongst other things they organise regular soup kitchens. At tonight's soup kitchen a mother and her two children   both still in their school uniform attended . They are currently staying in a B&B through no fault of their own . They are not on benefits so they are without money  and out of options. Please   if you can donate anything . We can work together to get her a deposit for a home for her family.    I have two children asleep upstairs.  Safe  used to their familiar surroundings. Only having to worry about whether they ll have shreddies or porridge for breakfast in the morning. Not whether they will eat  not wondering what all those weird noises are at the bedsit. Let's do this and help them .    It's hard being a mum   and that's when you have everything you need. Imagine this.    We ve got your back lady :)   https://www.hopeforfood.org.uk/",False
" Jo Jo's Amazing send off ","Preston, Yorkshire and the Humber, United Kingdom",https://uk.gofundme.com/f/jo-jos-amazing-send-off,775,1000,,2020-12-30,,,0,,"This has been created to give our very own Pink Sparkly  Unicorn Princess Jo Jo the best send off that we can.  Jo was a larger than life character  she had sometimes in her life struggled with some demons but for the last 3 years had fought them and was on top of the world. Jo had a magical way with people and who ever she met loved our Unicorn Princess.. in recent times Jo had been a regular volunteer with various soup kitchens and homeless projects in Hull and was adored by all.. she was always so full of life and there was always good fun and laughter with jo around which lifted services users no end of times..  Then late on Sunday night early Monday morning our Beautiful Jo Jo was gone.. she took her last breath and went  somewhere were the unicorns dance and she could be free...  So here I am hoping to give our JO JO UNICORN PRINCESS the Beautiful send off she truly deserves...  Thank You for taking the time to read this....  Sarah x",False
" Gillingham Street Angels ","Gillingham, South East England, United Kingdom",https://uk.gofundme.com/f/1p4otdcgg0,2200,5000,,2019-07-16,,,0,,"Hello we run 3 soup kitchens in Gillingham and Rochester   we also supply food to families in need in the medway area   we are currently setting up new projects to help with growing a sustainable food source for our soup kitchens and assisting in supplying 2 local schools with food for there breakfast clubs   feel free to look at our website thestreet-angels.org   we are a registered charity 1184311   we are getting busier by the week and looking for donations to assist in the running costs and to buy new equipment for these projects   appreciate your time in reading this ",False
" 7 days Challenge – PPE and Shelter & Soup Kitchen","Fulwood, North West England, United Kingdom",https://uk.gofundme.com/f/7-days-PPE-and-and-Shelter-Soup-Kitchen,1055,500,,2020-03-29,,,0,,"7 days Challenge – Raising money for PPE and Shelter & Soup Kitchen.    It’s always been a passion of mine to raise money for a good cause and now might be a good opportunity to getting PPE equipment for our medical staff and care workers in the NHS. Also  I have heard stories about many working class parents who have lost their jobs during the recent pandemic and now have no means of buying food to support their families. I would like to raise money for ‘Shelter’ and ‘Soup Kitchens’ as it will benefit those directly.    So  I have set myself up for a 7 days challenge.  I will do a 2 mile run every day in different locations around Preston and Blackpool. I know  2 miles isn’t very far but as my knees are damaged from playing competitive badminton for nearly 35 years it will be a challenge for me. I will take photos along the route and snap shots of my location on google maps.    You can decide how your donation will be spent:-    Option 1: PPE for the medical and care workers  Option 2: Shelter and Soup Kitchen.    I can’t beat Captain Thomas Moore’s amazing achievement  I too applaud and thank him for the effort plus to those who support him  but I certainly will give it my best!",False
