Title,Location,Link,Raised,Target,MostRecentDonation,Created,Organization,OrganizationDetails,DonationCount,Donations,Story,Complete
" The Heywood Soup Kitchen ","Heywood, North West England, United Kingdom",https://uk.gofundme.com/f/the-heywood-soup-kitchen,1289,2000,,2020-04-21,,,0,,"As you all know Brian Perkins at the Heywood Public House has been running a free soup kitchen where he has been feeding and delivering up to 500 meals a day all out of his own pocket. Due to the fact that this might be pretty long term  we are gonna need some help to buy food/ containers to keep this up. we know the good people of Heywood would like to help and get behind Brian. Any donation would be greatly accepted :)",False
" Help Keep Our Soup Kitchen Going During Covid19 ","Mansfield, East Midlands, United Kingdom",https://uk.gofundme.com/f/MSKCovid19,170,2000,,2020-03-30,,,0,,"Our soup kitchen has been running since 2015 with the backing of our amazing supporters  you have all been with us through thick and thin and we thank you! During this uncertain time we are all unaware of where we are going to be in coming weeks and months  but through this period of lockdown a few have asked if they can donate or do something to raise money for Mansfield Soup Kitchen and the homeless  some just want to give a little  others want to shave their hair off! We appreciate that not everyone is able to donate at the minute  but if we can all share far and wide and support each other we can still make a difference. Thank you",False
" Fuel those Wheels! ","Cowes, South East England, United Kingdom",https://uk.gofundme.com/f/fuel-those-wheels,1010,1200,,2020-04-02,,,0,,"Trevor  from the Pop Up Soup Kitchen is receiving free daily supplies from supermarkets and has at least 4 kitchens cooking meals continuously. These are being frozen in readiness.     It is anticipated that in the next weeks  the crisis is going to deepen and the vulnerable  be they financially  medically or in other ways struggling  will need urgent food deliveries.    I asked Trevor how I could help and he told me that  aside from everything else  the fuel bill to deliver the meals will be at least £200 per week.    Please contribute so that Trevor and all the people dedicating their time to preparing nutritious meals can deliver to everyone who is in need!",False
" Feed the Galapagos ","Kidsgrove, West Midlands, United Kingdom",https://uk.gofundme.com/f/feed-the-galapagos,660,10000,,2020-05-22,,,0,," Alimenta a Galapagos (Feed the Galapagos) (desplazar hacia abajo para la version en español) A high resoution video with subtitles can be found on Youtube here: https://www.youtube.com/watch?v=2svtTXxhg4A&t=2s What will we do with the money? We are providing food parcels for those individuals who are most in need  to help keep children fed and parents in good health through these hard times. Food and water will be sourced from local fishermen  farms  and markets on the island. This will ensure that your money stays in circulation on the island so it can carry on helping families across Galapagos. Originally  we planned to open a soup kitchen but the donations were not big enough to allow for this to happen so we changed your approach to ensure that food Parcels could be sent immediately to those families and individuals with the greatest need. We are now working with support groups and communities on the island to identify who has the greatest need of this support. What is in the food parcels? Rice Sugar Potatoes Onions Flour Salt Lentils Noodles Cans of tuna Can of sardines Oil Margarine Chocolate casing Why do we need your help? My name is Kat Palmer and I live in England. I was in Galapagos throughout February and March as the Coronavirus pandemic hit. We were evacuated from the islands on one of the last planes to leave the islands on 16th March and behind us we left a community in turmoil. Whilst I was in Galapagos I made friends with some of the locals  and when I asked them if they were OK their response brought tears to my eyes. ""we are terrified  we feel so helpless""  they said ""There is no work. How do we feed our children?"". It was a shock to find out that the cost of food and water on the islands was double the price it would be on the mainland. In England we can just take water from the tap but in Galapagos the water is not drinkable so they have to buy bottled water. They have no choice  and as savings are used up each mouth full of water becomes very precious. I had to do something to help them and so with the help of my friend Patricio in Galapagos (I call him Pato) we came up with an idea to use crowdfunding on GoFundMe to help carry the islanders through these hard times. As Coronavirus has swept the globe Ecuador's port city of Guayaquil (the gateway to the Galapagos Islands) has been one of the hardest hit places in South America. All tourism has ceased to these magical islands where Charles Darwin came up with his theory of evolution. No tourists are able to visit the islands and with no end to these restrictions in sight  The Galapagos Islands are now suffering catastrophic economic damage as lockdown has halted all tourism. For 90% of resident’s tourism was their only source of income and now they have been left with nothing. (see pictures) Before Coronavirus After Coronavirus Your money will provide vital food to the residents of Galapagos so families can stay healthy until their economy recovers enough for them to rebuild their livelihood once more. Locals are struggling to make ends meet; with no income they have no money to buy food and families are going hungry. ¿Qué haremos con el dinero? Estamos proporcionando paquetes de alimentos para aquellas personas que más lo necesitan  para ayudar a mantener a los niños alimentados y a los padres con buena salud en estos tiempos difíciles. Los alimentos y el agua se obtendrán de los pescadores  grangeros  y mercados locales de la isla. Esto asegurará que su dinero permanezca en circulación en la isla para que pueda seguir ayudando a las familias en Galápagos. Originalmente  planeamos abrir un comedor de beneficencia  pero las donaciones no fueron lo suficientemente grandes como para permitir que esto suceda  por lo que cambiamos su enfoque para garantizar que los paquetes de alimentos se puedan enviar de inmediato a aquellas familias e individuos con mayor necesidad. Ahora estamos trabajando con grupos de apoyo y comunidades en la isla para identificar quién tiene la mayor necesidad de este apoyo. Contenido de los paquetes de comida: Arroz Azúcar Papas Cebollas Harina sal Lentejas Tallarines Latas de atún Lata de sardinas Aceite Margarina Chocolate",False
" Give Joan hope and a safe home! ","Stirling, Scotland, United Kingdom",https://uk.gofundme.com/f/help-get-my-sister-a-home,1578,1500,,2018-03-03,,,0,,"My sister Joan had a stroke in 2015 and is paralysed on her entire right side. She has also lost a good part of her short term memory. Joan is confined to a wheelchair as she can not walk on her own. She has a caregiver who comes daily to care for her.     Sadly Joan has just been forced into homelessness and is temporarily living in a motel in Kelso  Washington. This happened just after Christmas because she was short rent money but didn’t want to ask for help as it was Christmastime. Sadly she was evicted and didn’t realise the implications and the cruelness the landlord would show them. Now she will have great difficulties finding a landlord that will accept her because that eviction is on her record.     My nephew Joshua  who has learning difficulties  also lives with my sister. Joshua takes care of his mom at night when her caregiver is not able to be there. He also has a job at the local McDonalds that he's very proud of as it's so hard for him to get a job with his difficulties. Unfortunately  because Joshua is an adult  he was made to be on the lease for the apartment as well. This means unfortunately that the eviction is on his record too.     Joshua’s young son  my great nephew Oliver  lives with them as well. He’s a bright kid that is the star football player for his school. Oliver helps look after his grandma too and he just adores her.     The three of them are sharing a handicap room and sadly the boys are sleeping on the floor.     Becoming homeless  let alone my sisters stroke  has affected them all something terrible and they are stuck! They are good people who’ve never drank  smoked or been anywhere near drugs.   My sister and nephews are the kind of people who would give you the shirt off their backs.     My sister was a stay at home grandma. She’s raised my great nephew Oliver when he was abandoned by his mother at 3 months old.   Joan used to make cookies and bake all the time and boy could she crochet! Her blankets and scarves were so beautiful!   She also used to volunteer at a local church who ran a soup kitchen. That came to an end when she fell off a pallet in 2014 whilst volunteering and broke her hip! Only a few months after this she had her stroke. Joan has had a horrible run of luck and I just want to turn it around for her and really show her how much everyone cares!     My sister receives very little help from the state and doesn’t get housing just because she’s a disabled stroke victim as most would assume. My great nephew is obviously a minor but the government doesn’t provide quick assistance for this reason either unfortunately.     They have applied to the local housing authority for subsidised housing but the waiting list is two years! Things are so different in the USA compared to the UK. The government WILL NOT help them!     We have exhausted all efforts  called all the shelters and spoken to the local churches. It seems so many people are in this position in the USA that no one has the ability to help!     Please help raise money for Joan and my sweet nephews to have a safe place to stay for the time being. The money will be going towards keeping them in the handicap room for now so my sister can be comfortable and close to her caregiver. Any additional money will be saved for a deposit for an appropriate home for them and any essentials they require.     If anyone knows of a landlord in Kelso or Longview that is willing to help them please let me know. We really need a miracle to happen! With your support and spreading the word hopefully we can find something for them soon!     Anything you can give now will be much appreciated. Even £5! Please share with everyone you know! Thank you all so much in advance!",False
" Brixton on Trial ","London, Greater London, United Kingdom",https://uk.gofundme.com/f/2rxu3m4,2306,2000,,2016-10-19,,,0,,"Pro-bono project ‘Lawyers in the Soup Kitchen’ operates weekly at Brixton Soup Kitchen each Thursday evening between 6pm- 8:30pm.    Our organisation is run by 12 student lawyers  mainly from marginalised groups whom volunteer each week to assist members of the public in their legal queries and problems.    We have been operating since 2014 and have no funding. All our resources come out of our own pockets and all of our time is free.    We are currently looking for some fuding to help us launch a project called ‘Brixton on Trial’  which will launch next summer (date to be confirmed).    The aim of this project is to raise awareness of the following issues which affect our community:    1) Legal Aid Cuts and the work of LISK project    2) Youth Crime and Violence in the Brixton/ Lambeth areas    3) The connections between poverty and crime    4) Encouraging students from disadvantaged backgrounds to pursue careers in law.    We wish to include local ethnic minority lawyers  businesses  students from local secondary schools and members of the public in a mock criminal trial dealing with the above issues.    The trial itself will seek to educate participants on both the processes and procedures of stop and search and a criminal investigation and trial.    We would be most greatful for all donations made towards helping us launch this programme next summer.     Many Thanks    Twanieka Alcindor- Founder   Lawyers In the Soup Kitchen",False
" Wild Volunteers Land Rover ","Chatham, South East England, United Kingdom",https://uk.gofundme.com/f/5qbbs80,2800,-1,,2018-06-26,,,0,,"Wild Volunteers Land Rover The Wild Volunteers have been lucky enough to be presented with a fantastic deal  from a very generous friend. We have been offered a Pre- Owned Land Rover in very good condition for a very reasonable price of R50 000 (£3 000) For those who don’t know  a vehicle like this even second hand does not usually go for less than £7-8 000. The current owner (selling to us) has discounted the rest as a donation to a worthy cause  on condition we can raise the rest of the funds. The vehicle will be held for 21 days (3 weeks) for us. Our current vehicle has done us very well and has allowed us to carry out all the research on Ukuwela conservancy and the surrounding properties as well as animal relocations  land expansions  plastic removal and much more. Sadly  it is at its end and will not last much longer so it is time for a new wild volunteer vehicle to drive the future of our conservation work. What it means to buy this vehicle: • Fuel consumption is almost half. • The maintenance cost is low. • We can get to the local schools for educational days and projects. • We can get to the soup kitchen on a Saturday to feed the foster children. • It means we can go on a snake call out to rescue snakes from people’s houses and help to educate the community. • We can go on animal call outs for injured and orphaned animals. • We can get animals to and from the local vets if needed. • We can release the animals when they are strong enough or wild enough on Ukuwela conservancy. • We can carry out our field research to help protect the animals on Ukuwela and the surrounding properties • We can take equipment to build and maintain pre-release enclosures and make sure that it is safe and suitable for the animals. These points are all important and mean much in the conservation world. With just a small donation you can help us continue all our hard work. We appreciate any and all donations and we will keep you updated on our social media pages with all of our rehabilitation projects and research as we go to show you where your funding is going and how much your donation means to our group of young conservationists. All donors will quaify for a 40% discounbted stay at Umkhumbi Lodge where they will have the opotunity of spending time with the team in the field. www.umkhumbilodge.co.za All donors will also have their name on the vehicle once the branding has been done  corporates welcome….! ",False
" no one deserves to be homeless and helpless ","Wigan, North West England, United Kingdom",https://uk.gofundme.com/f/no-one-deserves-to-be-homeless-and-helpless,380,2000,,2020-02-24,,,0,,"I want to raise money for multiple homeless charities across the UK. In order too keep soup kitchens running  food banks fully stocked. Warm winter clothing and sleeping bags. A safe place for them to come and receive support and socialise with others. With this money it allows charities to provide more equipment and and give people in need the quality of life they deserve. I haven’t chosen one charity in particular as I couldn’t possible decide which one. I will be doing as much volunteer work as possible. Funding is stretched and we are running out of resources. These people are physically dying or suffering with mental illnesses and if we can donate a tiny amount it makes a difference. Try and imagine if it was you in this position. Please share this message that these charities are STRUGGLING and doing their absolute best!",False
" Donations needed to feed homeless & vulnerable","London, Greater London, United Kingdom",https://uk.gofundme.com/f/donations-needed-to-feed-homeless-people,1235,-1,,2020-07-14,,,0,,,False
" Achieve the Soup Kitchen Dream ","Sunderland, North East England, United Kingdom",https://uk.gofundme.com/f/Soup-Kitchen-Needs-Your-Help,574,5000,,2020-07-16,"Sunderland Community Soup Kitchen","Registered charityDonations eligible for Gift Aid.",0,,"Sunderland Community Soup Kitchen have been supporting local people combat Hunger Poverty since we opened July 2019. Until lockdown we gave out 300+ portions of food to hungry people7 days a week in Hendon in Sunderland. We now deliver to homes during the Covid 19 Pandemic.    We work from a church and its too small to work effectively  so have recently rented larger premise  great location to meet the needs of many people in the city. The refit has been quoted at around £25k to put a commercial kitchen into the building  very high sowe appealed to local tradespeople who have kindly offered their services to reduce the set up costs.   This fundraiser is for cooking equipment  materials and physical things we need to buy. We hope you will support our much needed work here in Sunderland. The charity pays no wages  all money raised will be put into makinga purpose built kitchen and counter service as we want dignity and especially children to think they are simply coming to a take away. Previously people queued in all weathers for food assistance and this had to change.    Please help us achieve the Dream.  Thank You x ",False
" A cause I care about needs help ","Chelmsford, East of England, United Kingdom",https://uk.gofundme.com/f/44w3b-a-cause-i-care-about-needs-help,845,500,,2020-11-12,"Friends of Essex & London Homeless","Registered charityDonations eligible for Gift Aid.",0,,"Do you want to join me in making a difference? I'm raising money in aid of Friends of Essex & London Homeless and every donation will help. Thank you in advance for your contribution to this cause that means so much to me.    More information about Friends of Essex & London Homeless: We are a Homeless Charity (charity number 1178366) who run soup kitchen each week in Charing Cross(London) and also in Grays Essex. We also look after anyone living on the streets or in poverty if they are bought to our attention",False
" FCC Bedford Church Building ","Clapham, East of England, United Kingdom",https://uk.gofundme.com/f/fcc-bedford-church-building,2130,50000,,2016-11-28,,,0,,"After many years of renting properties for places of worship and our various Social Action Initiatives  Faith Community Church and our Charity Arm  Faith Community Project (1111208) of our own accord  successfully raised the finances to purchase  what is formally known as St Martins Church Hall  in Clapham Road  Bedford and now begin the task of renovating it for 21st Century use.      The building is situated immediately west of this historic town centre  within the historic town of Bedford; well known for being the home to the likes of preacher and writer of the acclaimed book ‘Pilgrims Progress’  John Bunyan  Edward the Elder’s first known castle fortress and Barony of Bedford.     The building is located on the A6 (Clapham Rd) which is easy to get to regardless of which route into Bedford you are taking. The building is placed between St Martins Church and Livingstone School as well as being a short and enjoyable walks to the beautiful Bedford Park.    Use of the Building    The intention for the building is primarily to be used as a place of worship for ‘all nations’ within the community of Bedford. F.C.C will also play host to a number of community initiatives such as a children’s and Youth activity centre  Meet & Chat Coffee Mornings  Soup Kitchen  OAP’s luncheon activity day  educational activities as well as a Performing Arts initiative. Once complete  the F.C.C building will stand as a beacon in Clapham road Bedford  bringing a fresh look to this area of Bedford.    How far have we come?    St Martins Church  after being unable to keep up with the maintenance of this building  eventually sold it to the council  which planned to turn it into a pre-school in coalition with Livingstone Primary School  which is its neighbouring building to its right. After promised money from government to improve schools were withdrawn  the council had no choice but to put the church hall back on the property market.    Being on the market for two years  we made some inquiries and after much debate about the condition of the property and its value  we managed to decrease the asking price from £250 000 to £70 000. We had managed to raise £82 000 and we were able to buy the property in 2013 cash for £70 000. At the end of 2015 we finally received planning permission for the refurbishment  partial rebuilding and extension of the old St Martin’s Church Hall  to create a significantly new  multipurpose community centre.      The official plans can be seen at the Borough Councils Planning Portal here:     http://edrms.bedford.gov.uk/PlanningBrowse.aspx?id=seZayNzlK66rbT8o9SOTWQ%3d%3d    Since obtaining Planning Permission  we have focussed on...    1. Raising as much funds as possible (£53 000 to date)    2. Putting a design team together  this consists of an Architect  Quantity Surveyor  Structural Engineer  Electrical & Mechanical Engineer and a Principle Designer (CDM) (as well as having integral input from all energy and power supply companies. This team alone will cost £16k circa.     3. Obtaining 4 builders quotes all ranging from between £500k to £1.5million    4. Writing to Funding Organisations  Churches and Individual Donors.     The design team are working hard to have the “Working Constructions Drawing” (Building Regs Plan) completed by Christmas 2016 to tender in order to Start work within the first quarter of 2017.    Among the core services we offer our community  we also aim to provide a range of high quality and cost effective services to the local community  with the potential to develop new services in response to the changing needs of the community. The many types of skill sets available through FCC affiliation as well as the many needs those skills sets aims to reach on a weekly basis  leaves us with no choice but to build upon what we already have  bringing what we do using four different location  under one roof.    Another part of our project that we are excited about involves working in partnership with Bedford Borough  local doctor surgeries and community services to pilot a volunteering ‘Community Health Champion’ service. Active ‘Health Champion’ models in action combined with the spiritual and emotional support churches offer across the UK have proven to be very successful; our aim is once the project has matured and gained the local communities trust  we will run a 24 hours support service for the emotional and mental needs of beneficiaries at the time their crisis occurs. Crisis can happen at any time  in the same way an individual with a broken leg or a heart attack shouldn't have to wait to see a doctor during office hours  those with emotional and mental crisis should have the same opportunities.     Mental and emotional health should have the same amount of care  thought and urgency  as physical health. As our building sits in one of the lowest deprived areas in the country  we aim to notably promote this unique service in this particular LSOAs (Lower Layer Super Output Area) which is among the 0-20% most deprived areas in Bedford and Kempston town.     Time banking’ (TB)  a way for people from all walks of life to ‘deposit’ their time in the TB by giving practical help and support to others  being able to ‘withdraw’ their time when they need something done themselves. TB promotes social inclusion and empowers individuals by making members feel valued  enabling them to share their skills with others learning new skills themselves.    Partnerships and effective community involvement is vital to ensure our project services and activities are a success. Involving local residents  particularly disadvantaged and vulnerable communities  in helping to design and deliver our projects and services will help build confidence  ownership and a sense of community. We are in the process of consulting with local council and professional organisations  such as TB UK regarding planning  implementation and sustaining our community service as well as contacting other similar projects to share and learn from their experience.     How can you get help?    With your help we can complete the renovations needed to establish the vision of Faith Community Church. FCC endeavours to contribute to meeting the needs of its community as well as foreign missions  but can only do this with your help.     We sincerely hope you will consider us for funding as we endeavour to impact our community long term.    Yours faithfully    Daniel Brown     Senior Pastor & Head Chair    On behalf all FTM Trustees    Faith Community Church    Bedford & Cambridge    Tel: 01[phone redacted]25    Mob:07[phone redacted]86      2016: Building  Growing & Establishing Victoriously            ",False
