Title,Location,Link,Raised,Target,MostRecentDonation,Created,Organization,OrganizationDetails,DonationCount,Donations,Description,Complete
" Soup kitchen funds ","Cambuslang, Scotland, United Kingdom",https://www.gofundme.com/f/soup-kitchen-funds,0,1000,,2021-09-13,,,0,,"Our soup kitchen can’t function without the help of our followers we really do appreciate all the help sadly our funds will be taking a hit soon as we have our van   Tax  Insurance   M.O.T  Coming up and this is a big expense   We are hoping that with everyone’s help we can do what we can to make this as easy as posssible money wise ",True
" Hounslow Soup Kitchen ","Hounslow, Greater London, United Kingdom",https://www.gofundme.com/f/hounslowsk,10000,2569,2021-08-19,2018-10-10,,,71,"2021-08-19 20/2021-08-17 20/2021-08-17 50/2021-08-16 25/2021-08-16 30/2021-08-15 10/2021-08-15 10/2021-08-15 20/2021-08-15 10/2021-08-14 10/2021-08-06 20/2021-08-06 20/2021-08-05 50/2021-08-04 25/2021-08-04 10/2021-08-04 40/2021-08-03 20/2021-08-03 50/2021-07-28 20/2021-07-21 20/2021-07-21 15/2021-07-20 5/2021-07-19 20/2021-07-14 5/2021-07-13 100/2021-07-13 20/2021-07-13 20/2021-04-25 20/2021-03-12 15/2021-02-26 10/2021-02-21 40/2021-02-04 50/2021-01-04 50/2020-12-23 10/2020-11-28 10/2020-11-12 50/2020-10-25 10/2020-08-28 20/2020-08-22 100/2020-08-04 225/2020-07-13 30/2020-06-18 300/2020-06-17 10/2020-06-17 5/2020-06-17 20/2020-05-30 250/2020-05-17 150/2020-05-15 10/2020-05-13 10/2020-05-12 10/2020-05-10 60/2020-05-02 20/2020-04-22 25/2020-04-19 50/2020-03-16 20/2020-03-16 20/2020-02-28 70/2020-02-28 10/2020-02-21 10/2020-02-12 20/2020-02-12 25/2020-02-10 25/2020-02-09 25/2020-02-09 10/2020-02-09 10/2019-07-12 20/2019-05-18 30/2018-11-14 10/2018-11-01 20/2018-10-24 10/2018-10-10 9","Hounslow Soup Kitchen combats food poverty in Hounslow  serving some of the boroughs most vulnerable and isolated.    We are a dynamic charity that has morphed over the years according to the need. We began by serving the homeless with daily end-of-produce food from restaurants in Central Hounslow  but since COVID-19 our scope has increased to include anyone facing food poverty across the borough.    Please have a look at our website for more about us at www.hounslowsoupkitchen.com where you can also find videos about our previous work.    Your funds will help us buy food and travel to deliver nutritious meals to those who need it most. Thank you once again and please don’t hesitate to get in touch via email at [email redacted]    Quddous Ahmed  Founder and Chair ",False
" HELP EXPAND OUR SOUP KITCHEN ","London, Greater London, United Kingdom",https://www.gofundme.com/f/humdingers-soup-kitchen-expansion,15000,569,2021-09-03,2021-03-16,,,17,"2021-09-03 20/2021-07-28 5/2021-07-27 15/2021-07-10 30/2021-07-03 5/2021-06-25 10/2021-06-21 44/2021-05-13 20/2021-05-11 150/2021-05-11 10/2021-05-11 50/2021-04-28 10/2021-03-31 100/2021-03-28 10/2021-03-23 50/2021-03-17 20/2021-03-16 20","Our sustainable Soup Kitchen is a community place for people needing support and food for themselves and their families. Whether homeless or in desperate need  Humdingers is here to weekly provide hot meals in a warm and friendly environment to everyone that needs it. Our goal is to make a big difference in the lives of hundreds giving them the support they need.      Since beginning of 2020  we have distributed over 100 000 meals either during food collection or working with other local community organisations for drop offs in London. During the Covid-19 pandemic last year  Humdingers was providing 800 meals a week for the vulnerable and over 500 meals a day to the NHS front line workers  unfortunately this figure has increased this year to 1 000 meals a week. A figure that shouldn’t be the reality  but it is.       As a result of the ongoing Coronavirus pandemic  we have had an influx of people needing additional support. So  in 2021 we are expanding our Soup Kitchen facilities to a new site in Hornsey (picture below)  which is a huge project for us to financially take on alone  but we recognise the importance of being able to continue providing that much needed support to the vulnerable members of the community.       We have received a colossal amount of recognition for Humdingers Soup Kitchen  with the owner Rob Hunningher receiving a British Empire Medal  in The Queens Honours list October 2020. However  we need your help. The impact of Covid-19 has left a disastrous financial impression on us all  but most of all for those who were already on the edge and are not able to provide meals for themselves or their loved ones. From as little to as much as you can give  please donate so we are able to continue providing free meals for those in need and supporting the members of our community that vitally need our help.     Join us in making a difference transforming entire communities for generations to come!      https://www.hackneygazette.co.uk/news/robert-hunningher-given-british-empire-medal-6538608    https://www.standard.co.uk/news/uk/nhs-staff-forgotten-covid-crisis-b900278.html    https://thebookofman.com/mind/masculinity/men-of-the-year/    ",False
" Ammy’s Soup Kitchen ","Preston, North West England, United Kingdom",https://www.gofundme.com/f/21zhltsuc0,1000,192,2021-07-22,2020-06-29,,,12,"2021-07-22 10/2021-02-16 10/2021-02-16 10/2021-02-07 7/2021-02-06 20/2021-01-14 10/2021-01-14 20/2021-01-14 20/2020-07-02 50/2020-07-01 20/2020-06-30 5/2020-06-29 10","Ammy’s Soup kitchen was founded in Preston  2016 and is still going strong 4 years later! We started on the Preston Market in Town  providing 50-100 hot meals and food parcels for free to the homeless  less fortunate and anyone in need every sunday and not to forget every Christmas! During the Covid 19 Lockdown  we have been providing over 250/300 hot meals and food parcels weekly to key workers such as the Fire and Ambulance service  Whitburn Hotel where the homeless are currently residing  Mill Bank Wellbeing Centre  Emmaus  Iceland The Food Warehouse staff  Tesco staff and anyone else in need of a meal. It’s been a pleasure to do this since day one & it takes a lot of time and preparation to put things in place as we also run a business & have family members who work full time. The charity is funded from our own pockets & kind donations by the community! Thank you to all of those who have donated and supported us! If anyone could contribute  however small or big towards this great cause and to help us continue doing this  it would be much appreciated! ❤️ Please check our Facebook page @Ammyssoupkitchen",False
" Kindness Homeless Street Team Glasgow ","Glasgow, Scotland, United Kingdom",https://www.gofundme.com/f/kindness-homeless-street-team-glasgow,100000,89919,2021-08-28,2020-01-03,,,1000,"2021-08-28 25/2021-08-27 10/2021-08-27 20/2021-08-27 10/2021-08-22 20/2021-08-21 100/2021-08-21 10/2021-08-21 15/2021-08-17 20/2021-08-11 5/2021-08-03 30/2021-07-13 250/2021-07-01 30/2021-07-01 40/2021-06-29 10/2021-06-26 100/2021-06-25 10/2021-06-25 20/2021-06-25 10/2021-06-25 10/2021-06-25 20/2021-06-25 10/2021-06-25 20/2021-06-11 20/2021-05-17 10/2021-05-16 60/2021-05-02 20/2021-04-30 50/2021-04-27 65/2021-04-23 100/2021-04-15 10/2021-04-15 20/2021-04-14 10/2021-04-14 30/2021-04-14 50/2021-04-14 25/2021-04-12 50/2021-04-10 25/2021-04-10 25/2021-04-09 20/2021-04-08 50/2021-04-05 10/2021-04-01 10/2021-03-31 100/2021-03-23 20/2021-03-12 150/2021-03-09 10/2021-03-09 5/2021-03-09 5/2021-03-08 20/2021-03-08 10/2021-03-07 30/2021-03-03 1500/2021-03-01 30/2021-02-27 10/2021-02-26 10/2021-02-24 5/2021-02-24 40/2021-02-24 100/2021-02-22 20/2021-02-22 40/2021-02-21 5/2021-02-21 20/2021-02-21 500/2021-02-20 20/2021-02-20 45/2021-02-20 9/2021-02-19 40/2021-02-19 100/2021-02-18 20/2021-02-18 40/2021-02-18 30/2021-02-17 50/2021-02-17 126/2021-02-17 20/2021-02-17 30/2021-02-17 20/2021-02-16 20/2021-02-16 10/2021-02-16 50/2021-02-16 30/2021-02-16 20/2021-02-16 20/2021-02-15 100/2021-02-15 20/2021-02-15 20/2021-02-15 1000/2021-02-15 10/2021-02-15 10/2021-02-15 25/2021-02-15 20/2021-02-15 10/2021-02-15 100/2021-02-15 100/2021-02-15 20/2021-02-15 30/2021-02-15 10/2021-02-15 20/2021-02-14 20/2021-02-14 100/2021-02-14 20/2021-02-14 20/2021-02-14 20/2021-02-14 20/2021-02-14 10/2021-02-14 45/2021-02-14 20/2021-02-14 20/2021-02-14 20/2021-02-14 20/2021-02-14 10/2021-02-14 30/2021-02-14 20/2021-02-14 5/2021-02-14 20/2021-02-14 30/2021-02-14 10/2021-02-14 60/2021-02-14 20/2021-02-14 20/2021-02-14 50/2021-02-14 20/2021-02-14 10/2021-02-14 20/2021-02-14 10/2021-02-14 20/2021-02-14 20/2021-02-13 20/2021-02-13 10/2021-02-13 20/2021-02-13 20/2021-02-13 20/2021-02-13 5/2021-02-13 20/2021-02-13 20/2021-02-13 50/2021-02-13 45/2021-02-13 10/2021-02-13 20/2021-02-13 20/2021-02-13 50/2021-02-13 100/2021-02-13 10/2021-02-13 180/2021-02-13 20/2021-02-13 30/2021-02-13 25/2021-02-13 30/2021-02-13 20/2021-02-13 10/2021-02-13 20/2021-02-13 10/2021-02-13 20/2021-02-13 200/2021-02-13 20/2021-02-13 10/2021-02-13 25/2021-02-13 10/2021-02-13 30/2021-02-13 30/2021-02-13 15/2021-02-13 6/2021-02-13 50/2021-02-13 15/2021-02-13 10/2021-02-13 20/2021-02-13 100/2021-02-13 50/2021-02-13 10/2021-02-13 25/2021-02-13 50/2021-02-13 25/2021-02-13 100/2021-02-13 20/2021-02-13 10/2021-02-13 50/2021-02-13 25/2021-02-13 20/2021-02-13 50/2021-02-13 30/2021-02-13 10/2021-02-13 100/2021-02-13 10/2021-02-13 500/2021-02-13 50/2021-02-13 100/2021-02-13 100/2021-02-13 50/2021-02-13 30/2021-02-13 25/2021-02-13 10/2021-02-13 10/2021-02-13 20/2021-02-13 20/2021-02-13 20/2021-02-13 20/2021-02-13 15/2021-02-13 15/2021-02-13 20/2021-02-13 100/2021-02-13 10/2021-02-13 10/2021-02-13 20/2021-02-13 10/2021-02-13 500/2021-02-13 50/2021-02-13 50/2021-02-13 20/2021-02-13 50/2021-02-13 25/2021-02-13 30/2021-02-13 20/2021-02-13 10/2021-02-13 20/2021-02-13 50/2021-02-13 10/2021-02-13 10/2021-02-13 10/2021-02-13 10/2021-02-13 20/2021-02-13 5/2021-02-13 20/2021-02-13 10/2021-02-13 10/2021-02-13 20/2021-02-13 20/2021-02-13 5/2021-02-13 10/2021-02-13 10/2021-02-13 10/2021-02-13 5/2021-02-13 50/2021-02-13 15/2021-02-13 100/2021-02-13 50/2021-02-13 10/2021-02-13 10/2021-02-13 100/2021-02-12 10/2021-02-12 50/2021-02-12 50/2021-02-12 20/2021-02-12 20/2021-02-12 75/2021-02-12 100/2021-02-12 10/2021-02-12 50/2021-02-12 100/2021-02-12 30/2021-02-12 50/2021-02-12 50/2021-02-12 50/2021-02-12 25/2021-02-12 20/2021-02-12 10/2021-02-12 10/2021-02-12 20/2021-02-12 50/2021-02-12 10/2021-02-12 10/2021-02-12 10/2021-02-12 50/2021-02-12 10/2021-02-12 5/2021-02-12 50/2021-02-12 50/2021-02-12 10/2021-02-12 50/2021-02-12 10/2021-02-12 40/2021-02-12 10/2021-02-12 20/2021-02-12 10/2021-02-12 50/2021-02-12 15/2021-02-12 45/2021-02-12 5/2021-02-12 20/2021-02-12 50/2021-02-12 20/2021-02-12 20/2021-02-12 50/2021-02-12 10/2021-02-12 20/2021-02-12 5/2021-02-12 30/2021-02-12 20/2021-02-12 20/2021-02-12 5/2021-02-12 20/2021-02-12 5/2021-02-12 100/2021-02-12 30/2021-02-12 50/2021-02-12 5/2021-02-12 30/2021-02-12 20/2021-02-12 5/2021-02-12 30/2021-02-12 10/2021-02-12 20/2021-02-12 5/2021-02-12 10/2021-02-12 20/2021-02-12 10/2021-02-12 25/2021-02-12 5/2021-02-12 10/2021-02-12 10/2021-02-12 10/2021-02-12 25/2021-02-12 25/2021-02-12 30/2021-02-12 30/2021-02-12 10/2021-02-12 20/2021-02-12 20/2021-02-12 10/2021-02-12 50/2021-02-12 20/2021-02-12 10/2021-02-12 10/2021-02-12 20/2021-02-12 30/2021-02-12 10/2021-02-12 10/2021-02-12 20/2021-02-12 20/2021-02-12 20/2021-02-12 20/2021-02-12 40/2021-02-12 50/2021-02-12 10/2021-02-12 10/2021-02-12 20/2021-02-12 30/2021-02-12 20/2021-02-12 30/2021-02-12 20/2021-02-12 20/2021-02-12 50/2021-02-12 50/2021-02-12 20/2021-02-12 20/2021-02-12 45/2021-02-12 50/2021-02-12 50/2021-02-12 20/2021-02-12 20/2021-02-12 20/2021-02-12 10/2021-02-12 10/2021-02-12 50/2021-02-12 25/2021-02-12 30/2021-02-12 10/2021-02-12 20/2021-02-12 30/2021-02-12 10/2021-02-12 100/2021-02-12 20/2021-02-12 5/2021-02-12 40/2021-02-12 20/2021-02-12 25/2021-02-12 50/2021-02-12 25/2021-02-12 50/2021-02-12 10/2021-02-12 20/2021-02-12 10/2021-02-12 15/2021-02-12 20/2021-02-12 10/2021-02-12 30/2021-02-12 30/2021-02-12 15/2021-02-12 200/2021-02-12 50/2021-02-12 20/2021-02-12 20/2021-02-12 10/2021-02-12 35/2021-02-12 20/2021-02-12 50/2021-02-12 10/2021-02-12 10/2021-02-12 10/2021-02-12 50/2021-02-12 10/2021-02-12 10/2021-02-12 5/2021-02-12 30/2021-02-12 20/2021-02-12 100/2021-02-12 25/2021-02-12 40/2021-02-12 10/2021-02-12 10/2021-02-12 30/2021-02-12 20/2021-02-12 30/2021-02-12 20/2021-02-12 15/2021-02-12 10/2021-02-12 20/2021-02-12 20/2021-02-12 30/2021-02-12 45/2021-02-12 10/2021-02-12 20/2021-02-12 10/2021-02-12 20/2021-02-12 50/2021-02-12 10/2021-02-12 25/2021-02-12 10/2021-02-12 20/2021-02-12 10/2021-02-12 15/2021-02-12 40/2021-02-12 10/2021-02-12 10/2021-02-12 40/2021-02-12 40/2021-02-12 25/2021-02-12 20/2021-02-12 20/2021-02-12 15/2021-02-12 100/2021-02-12 30/2021-02-12 15/2021-02-12 5/2021-02-12 10/2021-02-12 50/2021-02-12 10/2021-02-12 50/2021-02-12 20/2021-02-12 10/2021-02-12 50/2021-02-12 100/2021-02-12 20/2021-02-12 100/2021-02-12 20/2021-02-12 20/2021-02-12 9/2021-02-12 100/2021-02-12 50/2021-02-12 5/2021-02-12 20/2021-02-12 100/2021-02-12 5/2021-02-12 10/2021-02-12 9/2021-02-12 10/2021-02-12 15/2021-02-12 20/2021-02-12 25/2021-02-12 20/2021-02-12 20/2021-02-12 15/2021-02-12 10/2021-02-12 100/2021-02-12 10/2021-02-12 10/2021-02-12 20/2021-02-12 40/2021-02-11 20/2021-02-11 20/2021-02-11 10/2021-02-11 20/2021-02-11 20/2021-02-11 30/2021-02-11 10/2021-02-11 20/2021-02-11 10/2021-02-11 10/2021-02-11 20/2021-02-11 10/2021-02-11 10/2021-02-11 15/2021-02-11 50/2021-02-11 50/2021-02-11 10/2021-02-11 10/2021-02-11 40/2021-02-11 25/2021-02-11 25/2021-02-11 10/2021-02-11 20/2021-02-11 5/2021-02-11 5/2021-02-11 20/2021-02-11 10/2021-02-11 30/2021-02-11 20/2021-02-11 15/2021-02-11 20/2021-02-11 5/2021-02-11 10/2021-02-11 30/2021-02-11 40/2021-02-11 10/2021-02-11 20/2021-02-11 20/2021-02-11 10/2021-02-11 15/2021-02-11 25/2021-02-11 10/2021-02-11 20/2021-02-11 10/2021-02-11 50/2021-02-11 10/2021-02-11 20/2021-02-11 20/2021-02-11 25/2021-02-11 5/2021-02-11 10/2021-02-11 20/2021-02-11 20/2021-02-11 100/2021-02-11 20/2021-02-11 10/2021-02-11 5/2021-02-11 45/2021-02-11 10/2021-02-11 20/2021-02-11 50/2021-02-11 25/2021-02-11 10/2021-02-11 10/2021-02-11 20/2021-02-11 100/2021-02-11 10/2021-02-11 98/2021-02-11 50/2021-02-11 15/2021-02-11 10/2021-02-11 10/2021-02-11 9/2021-02-11 10/2021-02-11 10/2021-02-11 10/2021-02-11 40/2021-02-11 20/2021-02-11 20/2021-02-11 20/2021-02-11 20/2021-02-11 15/2021-02-11 50/2021-02-11 20/2021-02-11 20/2021-02-11 20/2021-02-11 30/2021-02-11 20/2021-02-11 9/2021-02-11 20/2021-02-11 30/2021-02-11 40/2021-02-11 20/2021-02-11 10/2021-02-11 20/2021-02-11 20/2021-02-11 10/2021-02-11 100/2021-02-11 20/2021-02-11 10/2021-02-11 15/2021-02-11 20/2021-02-11 40/2021-02-11 20/2021-02-11 20/2021-02-11 20/2021-02-11 30/2021-02-11 10/2021-02-11 50/2021-02-11 20/2021-02-11 20/2021-02-11 10/2021-02-11 50/2021-02-11 20/2021-02-11 15/2021-02-11 10/2021-02-11 20/2021-02-11 10/2021-02-11 20/2021-02-11 20/2021-02-11 10/2021-02-11 10/2021-02-11 10/2021-02-11 20/2021-02-11 5/2021-02-11 20/2021-02-11 75/2021-02-11 20/2021-02-11 10/2021-02-11 15/2021-02-11 150/2021-02-11 5/2021-02-11 10/2021-02-11 20/2021-02-11 20/2021-02-11 10/2021-02-11 20/2021-02-11 20/2021-02-11 10/2021-02-11 10/2021-02-11 50/2021-02-11 20/2021-02-11 5/2021-02-11 10/2021-02-11 10/2021-02-11 20/2021-02-11 20/2021-02-11 100/2021-02-11 5/2021-02-11 30/2021-02-11 10/2021-02-11 20/2021-02-11 10/2021-02-11 10/2021-02-11 10/2021-02-11 10/2021-02-11 5/2021-02-11 25/2021-02-11 5/2021-02-11 10/2021-02-11 20/2021-02-11 10/2021-02-11 50/2021-02-11 25/2021-02-11 5/2021-02-11 10/2021-02-11 20/2021-02-11 25/2021-02-11 20/2021-02-11 30/2021-02-11 5/2021-02-11 5/2021-02-11 25/2021-02-11 100/2021-02-11 10/2021-02-11 10/2021-02-11 5/2021-02-11 10/2021-02-11 10/2021-02-11 20/2021-02-11 50/2021-02-11 20/2021-02-11 10/2021-02-11 20/2021-02-11 20/2021-02-11 10/2021-02-11 10/2021-02-11 40/2021-02-11 20/2021-02-11 10/2021-02-11 10/2021-02-11 20/2021-02-11 50/2021-02-11 20/2021-02-11 21/2021-02-11 20/2021-02-11 10/2021-02-11 25/2021-02-11 30/2021-02-11 20/2021-02-11 10/2021-02-11 10/2021-02-11 20/2021-02-11 10/2021-02-11 40/2021-02-11 20/2021-02-11 10/2021-02-11 50/2021-02-11 10/2021-02-11 20/2021-02-11 20/2021-02-11 10/2021-02-11 25/2021-02-11 30/2021-02-11 20/2021-02-11 10/2021-02-11 20/2021-02-11 20/2021-02-11 20/2021-02-11 50/2021-02-11 25/2021-02-11 10/2021-02-11 10/2021-02-11 50/2021-02-11 10/2021-02-11 40/2021-02-11 50/2021-02-11 10/2021-02-11 50/2021-02-11 20/2021-02-11 10/2021-02-11 20/2021-02-11 20/2021-02-11 20/2021-02-11 20/2021-02-11 100/2021-02-11 15/2021-02-11 20/2021-02-11 15/2021-02-11 10/2021-02-11 20/2021-02-11 150/2021-02-11 10/2021-02-11 20/2021-02-11 10/2021-02-11 15/2021-02-11 25/2021-02-11 20/2021-02-11 20/2021-02-11 5/2021-02-11 10/2021-02-11 10/2021-02-11 10/2021-02-11 25/2021-02-11 10/2021-02-11 10/2021-02-11 50/2021-02-11 10/2021-02-11 20/2021-02-11 10/2021-02-11 40/2021-02-11 9/2021-02-11 20/2021-02-11 10/2021-02-11 10/2021-02-11 20/2021-02-11 10/2021-02-11 10/2021-02-11 20/2021-02-11 25/2021-02-11 20/2021-02-11 50/2021-02-11 10/2021-02-11 18/2021-02-11 9/2021-02-11 20/2021-02-11 20/2021-02-11 10/2021-02-11 40/2021-02-11 20/2021-02-11 5/2021-02-11 15/2021-02-11 10/2021-02-11 10/2021-02-11 25/2021-02-11 50/2021-02-11 20/2021-02-11 20/2021-02-11 10/2021-02-11 20/2021-02-11 10/2021-02-11 30/2021-02-11 50/2021-02-11 20/2021-02-11 20/2021-02-11 50/2021-02-11 20/2021-02-11 20/2021-02-11 20/2021-02-11 10/2021-02-11 10/2021-02-11 10/2021-02-11 10/2021-02-11 10/2021-02-11 49/2021-02-11 10/2021-02-11 20/2021-02-11 5/2021-02-11 9/2021-02-11 20/2021-02-11 30/2021-02-11 20/2021-02-11 30/2021-02-11 100/2021-02-11 20/2021-02-11 5/2021-02-11 50/2021-02-11 20/2021-02-11 15/2021-02-11 50/2021-02-11 15/2021-02-11 20/2021-02-11 5/2021-02-11 10/2021-02-11 50/2021-02-11 30/2021-02-11 20/2021-02-11 40/2021-02-11 10/2021-02-11 20/2021-02-11 20/2021-02-11 10/2021-02-11 35/2021-02-11 10/2021-02-11 11/2021-02-11 20/2021-02-11 20/2021-02-11 20/2021-02-11 10/2021-02-11 10/2021-02-11 10/2021-02-11 20/2021-02-11 10/2021-02-11 10/2021-02-11 13/2021-02-11 10/2021-02-11 10/2021-02-11 20/2021-02-11 10/2021-02-11 10/2021-02-11 10/2021-02-11 20/2021-02-11 10/2021-02-11 10/2021-02-11 5/2021-02-11 30/2021-02-11 50/2021-02-11 15/2021-02-11 5/2021-02-11 100/2021-02-11 10/2021-02-11 20/2021-02-11 20/2021-02-11 10/2021-02-11 10/2021-02-11 5/2021-02-11 20/2021-02-11 20/2021-02-11 40/2021-02-11 5/2021-02-11 10/2021-02-11 10/2021-02-11 15/2021-02-11 20/2021-02-11 20/2021-02-11 20/2021-02-11 50/2021-02-11 22/2021-02-11 100/2021-02-11 5/2021-02-11 20/2021-02-11 10/2021-02-11 5/2021-02-11 10/2021-02-11 5/2021-02-11 10/2021-02-11 5/2021-02-11 20/2021-02-11 10/2021-02-11 10/2021-02-11 10/2021-02-11 10/2021-02-11 10/2021-02-11 100/2021-02-11 14/2021-02-11 10/2021-02-11 500/2021-02-11 5/2021-02-11 10/2021-02-11 5/2021-02-11 20/2021-02-11 20/2021-02-11 25/2021-02-11 50/2021-02-11 10/2021-02-11 10/2021-02-11 15/2021-02-11 30/2021-02-11 20/2021-02-11 50/2021-02-11 20/2021-02-11 10/2021-02-11 20/2021-02-11 10/2021-02-11 10/2021-02-11 40/2021-02-11 20/2021-02-11 100/2021-02-11 25/2021-02-11 20/2021-02-11 10/2021-02-11 50/2021-02-11 30/2021-02-11 100/2021-02-11 25/2021-02-11 10/2021-02-11 100/2021-02-11 20/2021-02-11 10/2021-02-11 10/2021-02-11 20/2021-02-11 85/2021-02-11 20/2021-02-11 20/2021-02-11 20/2021-02-11 10/2021-02-11 20/2021-02-11 20/2021-02-11 10/2021-02-11 10/2021-02-11 20/2021-02-11 5/2021-02-11 40/2021-02-11 20/2021-02-11 40/2021-02-11 10/2021-02-11 40/2021-02-11 20/2021-02-11 10/2021-02-11 30/2021-02-11 10/2021-02-11 30/2021-02-11 5/2021-02-11 10/2021-02-11 10/2021-02-11 50/2021-02-11 100/2021-02-11 10/2021-02-11 50/2021-02-11 5/2021-02-11 20/2021-02-11 50/2021-02-11 20/2021-02-11 10/2021-02-11 20/2021-02-11 20/2021-02-11 10/2021-02-11 20/2021-02-11 100/2021-02-11 10/2021-02-11 50/2021-02-11 20/2021-02-11 10/2021-02-11 50/2021-02-11 33/2021-02-11 50/2021-02-11 10/2021-02-11 20/2021-02-11 5/2021-02-11 100/2021-02-11 20/2021-02-11 20/2021-02-11 25/2021-02-11 20/2021-02-11 15/2021-02-11 15/2021-02-11 20/2021-02-11 10/2021-02-11 5/2021-02-11 10/2021-02-11 20/2021-02-11 40/2021-02-11 35/2021-02-11 5/2021-02-11 100/2021-02-11 5/2021-02-11 5/2021-02-11 25/2021-02-11 20/2021-02-11 10/2021-02-11 20/2021-02-11 20/2021-02-11 20/2021-02-11 10/2021-02-11 10/2021-02-11 10/2021-02-11 25/2021-02-11 20/2021-02-11 50/2021-02-11 50/2021-02-11 10/2021-02-11 50/2021-02-11 10/2021-02-11 25/2021-02-11 100/2021-02-11 95/2021-02-11 50/2021-02-11 10/2021-02-11 150/2021-02-11 10/2021-02-11 20/2021-02-11 50/2021-02-11 20/2021-02-11 20/2021-02-11 20/2021-02-11 10/2021-02-11 10/2021-02-11 20/2021-02-11 30/2021-02-11 20/2021-02-11 100/2021-02-11 15/2021-02-11 10"," Kindness Homeless Street Team is a community group which supports Glasgow's homeless and vulnerable people. We provide food  clothing  toiletries and emotional support to our friends on the street. With the help of you all  we have been able to purchase two vehicles to support our soup kitchen and second hand furniture to our recently housed friends. We have also secured our donation centre at 417-419 London Road and paid for our years lease upfront. Our soup kitchen operates from George Square four evenings per week. Sunday  Monday Wednesday and Friday from 7pm. Food parcels are available from here as well as hot food  cold food  toiletries  towels  clothing and footwear. We support up to 150 people per outing. Our donation centre at 417-419 London Road is opened six days per week. 11-2 everyday except a Thursday. We provide food parcels from here. Thank you so much for your ongoing support  as a community group we rely solely on fundraising without this our services wouldn’t be possible. If you want to get involved please email us at [email redacted] ",False
" Raise The Roof Hull Homeless continued support ","Bransholme, Yorkshire and the Humber, United Kingdom",https://www.gofundme.com/f/raise-the-roof-hull-homeless-continued-support1,10000,6720,2021-09-01,2019-03-19,,,168,"2021-09-01 20/2021-09-01 5/2021-09-01 250/2021-09-01 50/2021-09-01 50/2021-07-16 50/2021-05-15 210/2021-05-13 5/2021-04-10 100/2021-03-02 10/2021-02-26 5/2021-02-21 30/2021-02-18 20/2021-02-16 10/2021-02-15 50/2021-02-14 5/2021-02-14 20/2021-02-14 10/2021-02-14 22/2021-02-14 25/2021-02-14 20/2021-02-11 30/2021-02-07 100/2021-01-24 10/2021-01-19 20/2021-01-18 50/2021-01-16 10/2020-12-24 20/2020-12-24 30/2020-12-23 10/2020-12-23 50/2020-12-23 25/2020-12-23 20/2020-12-22 20/2020-12-21 5/2020-12-21 10/2020-12-19 20/2020-12-18 10/2020-12-17 20/2020-12-16 20/2020-12-12 5/2020-12-08 10/2020-12-08 50/2020-12-06 20/2020-12-01 50/2020-11-28 10/2020-11-28 10/2020-11-26 50/2020-11-24 5/2020-11-21 10/2020-11-20 20/2020-11-20 30/2020-11-20 5/2020-11-20 5/2020-11-20 10/2020-11-20 5/2020-11-16 100/2020-10-13 5/2020-09-01 10/2020-08-18 20/2020-08-18 50/2020-08-02 100/2020-06-21 20/2020-05-16 10/2020-05-05 100/2020-04-27 500/2020-04-21 20/2020-04-13 20/2020-04-03 10/2020-04-03 50/2020-04-02 20/2020-03-30 15/2020-03-30 50/2020-03-30 10/2020-03-29 50/2020-03-27 50/2020-03-18 500/2020-03-10 10/2020-03-10 25/2020-03-08 15/2020-03-06 22/2020-02-26 25/2020-02-24 160/2020-02-23 10/2020-02-23 10/2020-02-23 10/2020-02-23 10/2020-02-23 10/2020-02-22 10/2020-02-21 100/2020-02-21 100/2020-02-21 50/2020-02-20 50/2020-02-20 100/2020-02-20 50/2020-02-20 20/2020-02-20 10/2020-02-20 20/2020-02-20 5/2020-02-20 250/2020-02-20 20/2020-02-20 10/2020-02-19 10/2020-02-19 10/2020-02-19 10/2020-02-19 5/2020-02-19 5/2020-02-19 5/2020-02-19 5/2020-02-19 10/2020-02-19 100/2020-02-19 5/2020-02-19 50/2020-02-19 10/2020-02-19 10/2020-02-19 5/2020-02-19 20/2020-02-19 50/2020-02-11 20/2020-01-02 30/2020-01-01 30/2019-12-23 50/2019-12-23 100/2019-12-21 5/2019-12-21 20/2019-12-20 20/2019-12-20 50/2019-12-20 20/2019-12-19 20/2019-12-18 20/2019-12-18 5/2019-12-18 25/2019-12-17 25/2019-12-17 10/2019-12-17 10/2019-12-17 5/2019-12-17 6/2019-12-17 200/2019-12-17 20/2019-12-15 10/2019-12-14 5/2019-12-10 50/2019-12-10 20/2019-12-07 150/2019-12-07 10/2019-12-05 30/2019-12-04 10/2019-11-28 200/2019-11-23 50/2019-11-23 50/2019-11-12 50/2019-11-09 10/2019-10-31 10/2019-10-30 10/2019-10-28 10/2019-10-25 100/2019-10-16 25/2019-10-16 20/2019-10-10 25/2019-10-10 20/2019-09-30 10/2019-08-31 25/2019-06-04 50/2019-06-03 100/2019-06-03 50/2019-06-03 10/2019-06-03 5/2019-04-04 50","Raise the roof is a non profit community organisation doing our best to look after the homeless and prevent people becoming homeless.  We run Wakey Wakey cafe 52 Beverley road which provides     Free breakfast for rough sleepers in the morning and free tea  coffee  advice  activities and support throughout the day.    A food club for people on low income to purchase food at a much lower price  proofs of benefits or low income must be given.    Indoor Soup kitchens on certain nights.    We have also put rough sleepers up in hotels at Xmas for the past 2 years.    All money donated will go towards helping the above things happen and keep them going.    You can't just take someone from the street surrounded by people  put them in a room with just 4 walls and expect them to get on with it. We believe the best way to raise a roof is by giving support and gaining the trust to help people adjust when they get in a property.  doing this we have helped over 100 people off the street and into accommodation over the past 2 years.  Thank you ❤️",False
