Title,Location,Link,Raised,Target,MostRecentDonation,Created,Organization,OrganizationDetails,DonationCount,Donations,Description,Complete
" Brixton Soup Kitchen to help vulnerable people ","London, Greater London, United Kingdom",https://www.gofundme.com/f/brixton-soup-kitchen-to-help-vulnerable-people,0,100000,,2021-01-12,"Charity Donation","Registered nonprofitDonations eligible for Gift Aid.",0,,"Brixton Soup Kitchen  founded in 2013 by Solomon Smith and Mahamed Hashi  has become a bastion of community support in the Brixton area  serving free meals twice a day as well as providing a clothing bank  a food bank  free to use computers with internet  and legal advice. The kitchen has become a safe refuge for those in need as well as a place for the community and friends to gather.      However  as the kitchen has grown alongside awareness of its presence so have the demands that come with running it. Currently the kitchen is staffed entirely by volunteers (including the founder Solomon Smith  who is also a volunteer) who can not dedicate the growing time required to keep everything running smoothly and it is challenging with our tiny resources to meet the needs of our vulnerable service users.      That is why we are launching our new campaign to raise enough money to provide food for the winter season  our busiest season and to support with our operations costs as well as make essential repairs to the kitchen. It is so important to have a constant presence in the kitchen and we feel a manager will help us achieve that. Approximately £12 000 of this funding campaign will also be spent on much needed repairs with a portion being saved for contingency costs. We believe that if we were to raise enough money to pay for a manager for one year they will assist in us providing the kitchen with a steadier source of income that will then pay for their presence in the years following.      Not only will it help the all the hard working staff at the kitchen but will also massively benefit the service users  providing them with a person they know they can talk to if they have any problems or suggestions.      We need your help and support - that is why we ask so please donate whatever you can and know that you're money will go towards building a sustainable foundation for the future of the kitchen. Please donate generously.      Thank you so much for supporting Brixton Soup kitchen      Donate directly to Brixton Soup Kitchen    Bank name:  Barclays    Sort code:  231486    Account number:  08714527    Beneficiary name:  MD MILAN SHEIKH      ",True
" Abertay Football Club run to 100k ","University of Abertay, Scotland, United Kingdom",https://www.gofundme.com/f/csy4x5-abertay-football-club-run-to-100k,5000,5454,2020-08-14,2020-04-29,,,371,"2020-08-14 100/2020-07-03 10/2020-07-02 10/2020-06-30 10/2020-06-30 5/2020-06-30 5/2020-06-30 10/2020-06-30 10/2020-06-30 50/2020-06-30 10/2020-06-30 10/2020-06-30 5/2020-06-30 10/2020-06-30 10/2020-06-30 20/2020-06-30 10/2020-06-30 15/2020-06-29 10/2020-06-29 15/2020-06-29 25/2020-06-27 20/2020-06-27 5/2020-06-26 40/2020-06-24 10/2020-06-23 9/2020-06-21 10/2020-06-21 10/2020-06-21 50/2020-06-21 25/2020-06-18 20/2020-06-18 20/2020-06-18 5/2020-06-18 10/2020-06-18 30/2020-06-17 10/2020-06-16 10/2020-06-16 20/2020-06-16 25/2020-06-16 40/2020-06-15 20/2020-06-15 10/2020-06-14 20/2020-06-13 10/2020-06-13 20/2020-06-13 15/2020-06-11 5/2020-06-09 10/2020-06-07 5/2020-06-07 20/2020-06-07 30/2020-06-06 20/2020-06-06 20/2020-06-06 5/2020-06-06 10/2020-06-06 5/2020-06-04 10/2020-06-04 20/2020-06-04 10/2020-06-04 20/2020-06-01 20/2020-06-01 30/2020-05-31 50/2020-05-30 10/2020-05-28 10/2020-05-28 10/2020-05-28 10/2020-05-27 30/2020-05-27 30/2020-05-26 9/2020-05-25 10/2020-05-24 50/2020-05-23 20/2020-05-22 10/2020-05-21 5/2020-05-20 10/2020-05-20 25/2020-05-19 30/2020-05-19 10/2020-05-17 10/2020-05-17 10/2020-05-17 10/2020-05-16 10/2020-05-16 20/2020-05-15 10/2020-05-15 10/2020-05-15 10/2020-05-15 10/2020-05-15 15/2020-05-13 30/2020-05-13 5/2020-05-13 10/2020-05-12 5/2020-05-12 10/2020-05-12 15/2020-05-11 20/2020-05-11 10/2020-05-10 10/2020-05-10 10/2020-05-10 10/2020-05-10 20/2020-05-10 25/2020-05-09 10/2020-05-09 10/2020-05-09 10/2020-05-09 25/2020-05-09 20/2020-05-09 10/2020-05-09 10/2020-05-09 30/2020-05-08 20/2020-05-08 10/2020-05-08 5/2020-05-08 5/2020-05-08 20/2020-05-08 10/2020-05-08 10/2020-05-08 100/2020-05-08 9/2020-05-08 10/2020-05-07 10/2020-05-07 10/2020-05-07 20/2020-05-07 20/2020-05-07 10/2020-05-07 20/2020-05-06 15/2020-05-06 20/2020-05-06 10/2020-05-06 40/2020-05-06 30/2020-05-06 20/2020-05-05 20/2020-05-05 30/2020-05-05 20/2020-05-05 10/2020-05-05 20/2020-05-05 5/2020-05-05 10/2020-05-04 20/2020-05-04 10/2020-05-04 20/2020-05-04 10/2020-05-04 10/2020-05-03 10/2020-05-03 10/2020-05-03 50/2020-05-03 20/2020-05-03 10/2020-05-03 5/2020-05-03 5/2020-05-03 10/2020-05-02 10/2020-05-02 10/2020-05-02 10/2020-05-02 20/2020-05-02 5/2020-05-02 20/2020-05-02 10/2020-05-02 10/2020-05-02 10/2020-05-02 10/2020-05-02 10/2020-05-02 10/2020-05-02 10/2020-05-02 10/2020-05-02 10/2020-05-02 30/2020-05-02 20/2020-05-02 10/2020-05-01 20/2020-05-01 15/2020-05-01 5/2020-05-01 45/2020-05-01 5/2020-05-01 10/2020-05-01 25/2020-05-01 17/2020-05-01 5/2020-05-01 15/2020-05-01 10/2020-05-01 25/2020-05-01 25/2020-05-01 5/2020-05-01 25/2020-05-01 10/2020-05-01 10/2020-05-01 10/2020-05-01 15/2020-05-01 10/2020-05-01 5/2020-05-01 10/2020-05-01 10/2020-05-01 20/2020-05-01 10/2020-05-01 10/2020-05-01 100/2020-05-01 10/2020-05-01 10/2020-05-01 10/2020-05-01 10/2020-05-01 10/2020-05-01 5/2020-05-01 20/2020-05-01 20/2020-05-01 20/2020-05-01 10/2020-05-01 20/2020-05-01 10/2020-05-01 10/2020-05-01 20/2020-05-01 10/2020-05-01 10/2020-05-01 5/2020-05-01 5/2020-05-01 5/2020-05-01 20/2020-05-01 5/2020-05-01 10/2020-05-01 19/2020-05-01 15/2020-05-01 10/2020-05-01 10/2020-05-01 10/2020-05-01 10/2020-05-01 50/2020-05-01 20/2020-05-01 10/2020-05-01 10/2020-05-01 30/2020-05-01 10/2020-05-01 5/2020-04-30 20/2020-04-30 7/2020-04-30 25/2020-04-30 5/2020-04-30 5/2020-04-30 50/2020-04-30 5/2020-04-30 30/2020-04-30 20/2020-04-30 10/2020-04-30 25/2020-04-30 10/2020-04-30 5/2020-04-30 10/2020-04-30 10/2020-04-30 5/2020-04-30 5/2020-04-30 10/2020-04-30 10/2020-04-30 5/2020-04-30 5/2020-04-30 10/2020-04-30 5/2020-04-30 5/2020-04-30 5/2020-04-30 20/2020-04-30 25/2020-04-30 10/2020-04-30 15/2020-04-30 10/2020-04-30 10/2020-04-30 10/2020-04-30 10/2020-04-30 10/2020-04-30 9/2020-04-30 5/2020-04-30 5/2020-04-30 5/2020-04-30 10/2020-04-30 20/2020-04-30 5/2020-04-30 15/2020-04-30 10/2020-04-30 10/2020-04-30 10/2020-04-30 5/2020-04-29 10/2020-04-29 20/2020-04-29 10/2020-04-29 10/2020-04-29 20/2020-04-29 20/2020-04-29 10/2020-04-29 20/2020-04-29 20/2020-04-29 30/2020-04-29 20/2020-04-29 10/2020-04-29 5/2020-04-29 5/2020-04-29 15/2020-04-29 20/2020-04-29 10/2020-04-29 5/2020-04-29 5/2020-04-29 10/2020-04-29 5/2020-04-29 5/2020-04-29 20/2020-04-29 5/2020-04-29 5/2020-04-29 20/2020-04-29 20/2020-04-29 10/2020-04-29 5/2020-04-29 15/2020-04-29 20/2020-04-29 10/2020-04-29 50/2020-04-29 5/2020-04-29 20/2020-04-29 20/2020-04-29 100/2020-04-29 20/2020-04-29 10/2020-04-29 10/2020-04-29 10/2020-04-29 25/2020-04-29 10/2020-04-29 10/2020-04-29 5/2020-04-29 10/2020-04-29 10/2020-04-29 20/2020-04-29 5/2020-04-29 10/2020-04-29 20/2020-04-29 10/2020-04-29 25/2020-04-29 10/2020-04-29 20/2020-04-29 30/2020-04-29 10/2020-04-29 5/2020-04-29 10/2020-04-29 5/2020-04-29 10/2020-04-29 5/2020-04-29 10/2020-04-29 5/2020-04-29 10/2020-04-29 5/2020-04-29 10/2020-04-29 10/2020-04-29 5/2020-04-29 10/2020-04-29 10/2020-04-29 5/2020-04-29 5/2020-04-29 10/2020-04-29 5/2020-04-29 10/2020-04-29 5/2020-04-29 10/2020-04-29 30/2020-04-29 5/2020-04-29 10/2020-04-29 5/2020-04-29 20/2020-04-29 10/2020-04-29 5/2020-04-29 30/2020-04-29 20/2020-04-29 5/2020-04-29 5/2020-04-29 10/2020-04-29 10/2020-04-29 5/2020-04-29 5/2020-04-29 5","Abertay Football Club (Current and Former players) are attempting to run 100k each throughout May/June in order to raise funds for 2 local charities within Dundee. Eagles Wings Trust and Feeling Strong MHC.    Eagles Wings Trust run a mobile soup kitchen four evenings a week on Bell Street Dundee. Around 20-35 men and women use the soupkitchen each night. Many come to talk and have someone to listen to them. They serve soup  sandwiches  cereal  hot drinks  biscuits and fruit. This charity is very close to us all as we often pass by whilst around the university.     Feeling Strong MHC are an organisation who exist to make sure that every young person in Dundee who has experienced a mental health or wellbeing challenge is supported to reach their full potential. They deliver projects  services and campaigns in the community to tackle stigma  build confidence  develop resources  create networks and most importantly support the positive recovery journey of young people.    About us :    Abertay Football Club have 4 teams consisting of Men's 1st  2nd  3rd teams and Women's team also. We are very proud to have both Men's and Women's 1st teams in 1A - the highest division within Scottish university football. Our Men's 1st team had an amazing season this year  defying the odds again placing 2nd in 1A only to narrowly lose out on the title to the University of Edinburgh.    Any donations are greatly appreciated.    TTID.",False
" Islay Resilience Fund ","Bruichladdich, Scotland, United Kingdom",https://www.gofundme.com/f/islay-resilience-fund,15000,11052,2021-01-20,2020-03-26,,,238,"2021-01-20 100/2020-12-03 22/2020-10-05 200/2020-09-24 30/2020-06-28 250/2020-06-12 25/2020-06-10 20/2020-06-09 60/2020-06-08 10/2020-06-04 20/2020-06-03 250/2020-06-03 5/2020-06-03 10/2020-06-03 25/2020-06-03 25/2020-06-03 155/2020-05-31 20/2020-05-30 20/2020-05-29 5/2020-05-28 40/2020-05-28 100/2020-05-27 50/2020-05-27 30/2020-05-27 20/2020-05-27 10/2020-05-26 5/2020-05-24 5/2020-05-23 100/2020-05-05 250/2020-05-04 5/2020-05-04 60/2020-05-01 28/2020-04-29 10/2020-04-28 5/2020-04-27 5/2020-04-26 5/2020-04-26 5/2020-04-26 5/2020-04-26 5/2020-04-26 5/2020-04-25 20/2020-04-25 5/2020-04-24 5/2020-04-24 5/2020-04-23 5/2020-04-22 10/2020-04-22 15/2020-04-22 5/2020-04-21 5/2020-04-21 5/2020-04-21 10/2020-04-21 5/2020-04-21 20/2020-04-21 10/2020-04-21 5/2020-04-21 5/2020-04-20 5/2020-04-20 10/2020-04-20 20/2020-04-19 5/2020-04-19 20/2020-04-19 5/2020-04-19 10/2020-04-19 50/2020-04-19 10/2020-04-19 5/2020-04-19 5/2020-04-19 5/2020-04-19 5/2020-04-19 5/2020-04-19 10/2020-04-19 5/2020-04-19 10/2020-04-19 20/2020-04-19 5/2020-04-19 5/2020-04-19 5/2020-04-19 10/2020-04-19 10/2020-04-19 10/2020-04-18 5/2020-04-18 100/2020-04-18 50/2020-04-18 5/2020-04-18 5/2020-04-18 5/2020-04-18 5/2020-04-18 100/2020-04-18 10/2020-04-18 10/2020-04-17 10/2020-04-17 5/2020-04-17 5/2020-04-17 5/2020-04-17 20/2020-04-17 5/2020-04-17 5/2020-04-17 5/2020-04-17 5/2020-04-17 5/2020-04-17 10/2020-04-16 5/2020-04-16 10/2020-04-16 50/2020-04-16 5/2020-04-16 50/2020-04-16 5/2020-04-16 5/2020-04-16 5/2020-04-16 5/2020-04-16 5/2020-04-16 10/2020-04-16 5/2020-04-16 5/2020-04-16 5/2020-04-16 5/2020-04-16 5/2020-04-16 30/2020-04-16 100/2020-04-16 10/2020-04-16 100/2020-04-15 10/2020-04-15 5/2020-04-15 10/2020-04-15 5/2020-04-15 20/2020-04-15 30/2020-04-15 50/2020-04-15 25/2020-04-14 100/2020-04-14 20/2020-04-13 50/2020-04-12 30/2020-04-10 150/2020-04-09 50/2020-04-08 25/2020-04-07 20/2020-04-06 50/2020-04-06 100/2020-04-06 200/2020-04-06 100/2020-04-06 250/2020-04-05 250/2020-04-05 250/2020-04-05 10/2020-04-05 30/2020-04-05 50/2020-04-05 20/2020-04-05 30/2020-04-05 30/2020-04-05 50/2020-04-05 30/2020-04-05 50/2020-04-05 100/2020-04-05 20/2020-04-05 20/2020-04-05 50/2020-04-04 50/2020-04-04 30/2020-04-04 50/2020-04-04 100/2020-04-03 20/2020-04-03 100/2020-04-03 20/2020-04-03 25/2020-04-03 100/2020-04-03 100/2020-04-03 20/2020-04-03 20/2020-04-03 20/2020-04-03 50/2020-04-02 600/2020-04-02 20/2020-04-02 100/2020-04-02 20/2020-04-02 50/2020-04-02 10/2020-04-02 17/2020-04-02 10/2020-04-02 50/2020-04-02 10/2020-04-02 10/2020-04-02 20/2020-03-31 10/2020-03-31 15/2020-03-30 100/2020-03-30 40/2020-03-29 50/2020-03-29 20/2020-03-29 100/2020-03-29 50/2020-03-28 100/2020-03-28 10/2020-03-28 10/2020-03-28 30/2020-03-28 250/2020-03-28 100/2020-03-28 50/2020-03-28 20/2020-03-28 30/2020-03-27 100/2020-03-27 20/2020-03-27 45/2020-03-27 50/2020-03-27 30/2020-03-27 1000/2020-03-27 30/2020-03-27 30/2020-03-27 50/2020-03-27 50/2020-03-27 25/2020-03-27 45/2020-03-27 100/2020-03-27 30/2020-03-27 50/2020-03-27 100/2020-03-27 30/2020-03-27 20/2020-03-27 100/2020-03-27 10/2020-03-27 20/2020-03-27 100/2020-03-27 100/2020-03-27 20/2020-03-26 20/2020-03-26 20/2020-03-26 20/2020-03-26 30/2020-03-26 50/2020-03-26 50/2020-03-26 20/2020-03-26 500/2020-03-26 20/2020-03-26 20/2020-03-26 20/2020-03-26 20/2020-03-26 20/2020-03-26 10","1.  Islay is a remote island of the West coast of Scotland with a population of 3500 people. The Covid-19 virus has hit island life hard with local businesses small and large having to close. The vulnerable and elderly are following Government guidelines meaning they are isolated in their homes . But  Islay is a strong community and we have over 80 volunteers that are helping to keep people’s physical and mental health strong by telephone befriending  collecting shopping  medicines and being a point of contact. Our newly formed resilience group coordinates the volunteers across the island reaching even the most remotest crofts and houses.        2.    We need a fund to:  Put fuel into the community bus  cover volunteer expenses  supply hand gel and gloves to our volunteers and eventually all households  and to cover admin and printing expenses. As the effects of the lock down persist  then we would like to provide people with a welfare box of essential items including food  kindling and toiletries.   Islay doesn't have access to mainland services so this fund is vital for us to get through the next few months.     3.    We visualise these funds being used in the immediate future for equipment to help the volunteers help the isolated but in the future weeks  we will need the fund to sustain the service and add a possible soup kitchen to enable the isolated to have two hot meals a day.    4.    The community of Islay  as we always do  has shown an excellent community spirit and will continue to pull together to ensure their neighbours who are isolated have everything they need to survive through this pandemic. Islay is resilient and will endeavour to push the barriers to make sure we will be open again for business as usual as soon as we can. This financial support will enable the immediate support of equipment  volunteers costs to be cover  offering hot meals to people at this hard time.    5.    You will be able to measure this through the huge smile and massive ‘socially distanced’ hug which comes through  helping a neighbour  friend or family member who is isolating and cant access their normal routine due to the pandemic. The number of volunteers is increasing every day  people as they have become unable to work have shown great support to help people who cannot leave their house. We will be forever in debt to the massive amount of generosity of time and supplies (physical and financially) from people and businesses. We hope we can open our doors to you all again very soon! Thank you in advance.    GC",False
" 100km in 100 Days Swim Challenge ","East Herrington, North East England, United Kingdom",https://www.gofundme.com/f/w6q25-100km-in-100-Days-Swim-Challenge,6000,6507,2021-03-15,2020-11-23,"Sunderland Community Soup Kitchen","Registered nonprofitDonations eligible for Gift Aid.",297,"2021-03-15 10/2021-03-09 50/2021-03-09 20/2021-03-08 10/2021-03-07 20/2021-03-07 5/2021-03-07 10/2021-03-07 10/2021-03-07 10/2021-03-07 10/2021-03-07 10/2021-03-07 10/2021-03-07 5/2021-03-07 10/2021-03-06 20/2021-03-06 20/2021-03-06 10/2021-03-06 10/2021-03-06 10/2021-03-06 10/2021-03-06 10/2021-03-06 100/2021-03-06 25/2021-03-06 10/2021-03-06 10/2021-03-06 240/2021-03-06 10/2021-03-06 5/2021-03-06 20/2021-03-06 20/2021-03-06 20/2021-03-05 100/2021-03-05 50/2021-03-05 10/2021-03-05 10/2021-03-05 5/2021-03-05 50/2021-03-05 10/2021-03-05 10/2021-03-05 5/2021-03-05 5/2021-03-05 30/2021-03-05 20/2021-03-05 25/2021-03-04 22/2021-03-04 10/2021-03-04 10/2021-03-04 20/2021-03-04 10/2021-03-04 10/2021-03-04 10/2021-03-04 10/2021-03-04 10/2021-03-04 18/2021-03-04 200/2021-03-04 10/2021-03-03 10/2021-03-03 50/2021-03-03 20/2021-03-03 100/2021-03-03 10/2021-03-03 10/2021-03-03 10/2021-03-03 15/2021-03-03 10/2021-03-03 5/2021-03-03 10/2021-03-03 20/2021-03-03 50/2021-03-03 20/2021-03-03 50/2021-03-03 20/2021-03-03 20/2021-03-03 20/2021-03-03 5/2021-03-03 10/2021-03-03 10/2021-03-03 10/2021-03-03 9/2021-03-03 30/2021-03-03 5/2021-03-03 10/2021-03-03 20/2021-03-03 10/2021-03-03 20/2021-03-03 20/2021-03-03 10/2021-03-03 5/2021-03-03 5/2021-03-03 5/2021-03-03 20/2021-03-03 30/2021-03-03 10/2021-03-03 20/2021-03-03 10/2021-03-03 20/2021-03-03 20/2021-03-03 10/2021-03-03 10/2021-03-03 5/2021-03-03 10/2021-03-03 5/2021-03-03 10/2021-03-02 10/2021-03-02 10/2021-03-02 20/2021-03-02 10/2021-03-02 20/2021-03-01 10/2021-02-28 5/2021-02-28 25/2021-02-28 5/2021-02-28 20/2021-02-27 10/2021-02-27 5/2021-02-27 10/2021-02-26 100/2021-02-26 5/2021-02-25 10/2021-02-25 20/2021-02-25 50/2021-02-25 10/2021-02-24 20/2021-02-23 155/2021-02-22 10/2021-02-21 10/2021-02-20 10/2021-02-20 10/2021-02-18 15/2021-02-18 10/2021-02-18 20/2021-02-18 20/2021-02-17 10/2021-02-17 10/2021-02-16 60/2021-02-16 20/2021-02-16 10/2021-02-16 20/2021-02-16 20/2021-02-16 10/2021-02-16 33/2021-02-16 5/2021-02-16 10/2021-02-16 5/2021-02-16 10/2021-02-16 5/2021-02-16 5/2021-02-16 505/2021-02-16 10/2021-02-15 10/2021-02-08 10/2021-02-08 50/2021-02-06 10/2021-02-06 5/2021-02-05 20/2021-01-31 10/2021-01-29 10/2021-01-27 10/2021-01-27 10/2021-01-27 25/2021-01-27 30/2021-01-27 36/2021-01-27 5/2021-01-26 5/2021-01-26 10/2021-01-26 10/2021-01-26 14/2021-01-26 10/2021-01-25 10/2021-01-25 5/2021-01-23 10/2021-01-23 10/2021-01-23 15/2021-01-22 20/2021-01-19 10/2021-01-19 10/2021-01-18 10/2021-01-16 10/2021-01-16 50/2021-01-16 10/2021-01-16 10/2021-01-15 10/2021-01-15 10/2021-01-15 50/2021-01-15 10/2021-01-15 10/2021-01-15 10/2021-01-14 50/2021-01-14 30/2021-01-11 10/2021-01-11 10/2021-01-10 10/2021-01-10 5/2021-01-09 10/2021-01-08 100/2021-01-07 5/2021-01-06 10/2021-01-04 10/2021-01-04 20/2021-01-03 8/2021-01-03 25/2021-01-03 10/2021-01-01 100/2020-12-29 10/2020-12-29 5/2020-12-27 14/2020-12-25 10/2020-12-24 50/2020-12-23 15/2020-12-23 18/2020-12-23 10/2020-12-22 40/2020-12-21 5/2020-12-20 20/2020-12-20 20/2020-12-20 10/2020-12-20 20/2020-12-19 20/2020-12-16 5/2020-12-16 20/2020-12-15 10/2020-12-15 10/2020-12-14 20/2020-12-13 10/2020-12-13 5/2020-12-12 10/2020-12-12 10/2020-12-11 10/2020-12-11 10/2020-12-11 10/2020-12-11 10/2020-12-11 20/2020-12-11 50/2020-12-11 5/2020-12-11 10/2020-12-10 30/2020-12-10 20/2020-12-09 20/2020-12-08 10/2020-12-07 5/2020-12-07 10/2020-12-06 20/2020-12-06 15/2020-12-06 10/2020-12-06 10/2020-12-05 30/2020-12-05 20/2020-12-04 20/2020-12-04 10/2020-12-03 10/2020-12-03 10/2020-12-03 20/2020-12-02 10/2020-12-01 25/2020-11-30 10/2020-11-29 10/2020-11-29 10/2020-11-28 25/2020-11-28 10/2020-11-28 20/2020-11-27 5/2020-11-27 10/2020-11-27 10/2020-11-27 10/2020-11-26 40/2020-11-26 10/2020-11-25 10/2020-11-25 5/2020-11-25 50/2020-11-25 100/2020-11-25 100/2020-11-25 20/2020-11-25 40/2020-11-25 20/2020-11-25 5/2020-11-25 20/2020-11-24 100/2020-11-24 20/2020-11-24 50/2020-11-24 20/2020-11-24 10/2020-11-24 20/2020-11-24 100/2020-11-24 20/2020-11-24 15/2020-11-24 10/2020-11-24 20/2020-11-24 50/2020-11-24 20/2020-11-24 5/2020-11-24 10/2020-11-24 10/2020-11-24 20/2020-11-23 50/2020-11-23 10/2020-11-23 10/2020-11-23 10","  100km in 100 days    Leroy here! As many of you know I absolutely love swimming in the sea.     So I've set myself a challenge to swim 100km in 100 days off the Roker & Seaburn coast. No wetsuit  no excuses!     Whatever the conditions I will swim everyday from 28th November 2020 until 7th March 2021 in water temperatures as low as 4'c    I will be documenting my journey on Instagram - Instagram name is 100daychallengeswimscsk if you'd like to follow and share.     How can you help? As part of this challenge I've also set myself the target of raising £1000 in aid of Sunderland Community Soup Kitchen.    Sunderland Community Soup Kitchen is a voluntary charity set up to combat hunger poverty - providing hot meals  free of charge to the homeless and the hungry every evening in Sunderland. They also provide food assistance  everyday essentials and clothing.    Thank you in advance for your contribution to this cause that means so much to me and those who use it.",False
