Title,Location,Link,Raised,Target,MostRecentDonation,Created,Organization,OrganizationDetails,DonationCount,Donations,Description,Complete
" Tent City Fire Aid ","Bristol, South West England, United Kingdom",https://www.gofundme.com/f/tent-city-fire-aid,1000,2247,2017-09-19,2017-09-11,,,120,"2017-09-19 10/2017-09-19 5/2017-09-18 5/2017-09-17 5/2017-09-17 15/2017-09-16 10/2017-09-16 25/2017-09-16 10/2017-09-16 10/2017-09-16 5/2017-09-16 10/2017-09-16 5/2017-09-15 10/2017-09-15 25/2017-09-15 10/2017-09-15 10/2017-09-15 10/2017-09-15 5/2017-09-15 25/2017-09-14 7/2017-09-14 20/2017-09-14 5/2017-09-14 10/2017-09-14 10/2017-09-14 5/2017-09-14 5/2017-09-14 5/2017-09-14 50/2017-09-14 10/2017-09-14 20/2017-09-14 300/2017-09-14 10/2017-09-14 10/2017-09-14 50/2017-09-14 10/2017-09-14 5/2017-09-14 5/2017-09-14 10/2017-09-14 300/2017-09-14 50/2017-09-14 20/2017-09-14 10/2017-09-14 10/2017-09-14 5/2017-09-14 5/2017-09-14 10/2017-09-14 10/2017-09-14 10/2017-09-14 10/2017-09-14 10/2017-09-14 5/2017-09-14 25/2017-09-14 10/2017-09-14 15/2017-09-14 5/2017-09-14 10/2017-09-14 10/2017-09-14 10/2017-09-14 5/2017-09-14 20/2017-09-14 5/2017-09-14 10/2017-09-14 5/2017-09-14 10/2017-09-14 10/2017-09-14 10/2017-09-14 10/2017-09-14 5/2017-09-14 10/2017-09-14 25/2017-09-14 10/2017-09-14 5/2017-09-14 15/2017-09-14 50/2017-09-14 10/2017-09-14 20/2017-09-14 10/2017-09-14 10/2017-09-14 30/2017-09-14 20/2017-09-14 10/2017-09-14 30/2017-09-14 10/2017-09-14 20/2017-09-14 10/2017-09-14 50/2017-09-14 20/2017-09-14 5/2017-09-14 10/2017-09-14 20/2017-09-14 20/2017-09-14 10/2017-09-14 20/2017-09-14 10/2017-09-14 20/2017-09-14 20/2017-09-14 10/2017-09-14 10/2017-09-14 10/2017-09-14 10/2017-09-14 5/2017-09-14 20/2017-09-14 5/2017-09-14 10/2017-09-13 20/2017-09-13 5/2017-09-13 5/2017-09-13 20/2017-09-13 50/2017-09-13 20/2017-09-13 20/2017-09-13 10/2017-09-13 10/2017-09-13 20/2017-09-13 20/2017-09-13 20/2017-09-13 10/2017-09-13 20/2017-09-13 10/2017-09-13 20","On Saturday the 9th of September the residents of Tent City attended the Wild Goose soup kitchen. When they returned to their homes they found an arsonist had set fire to multiple tents at different locations  destroying not only their belongings but their only place to sleep.     Bristol Housing Action Movement has a long history of working with Tent City; recently installing a solar panel and helping the residents set up an allotment. We are raising funds to help with the support  relocation and medical care of the group.    With winter a few months away it is very important that we provide the duty of care that Bristol City Council will not  the closer we get to our goal the quicker this can happen.    Thanks in advance from all at BHAM and Tent City      ",False
" Monkey Bizzness Hockley's Super Santa Appeal ","Hockley, East of England, United Kingdom",https://www.gofundme.com/f/mbhockleylunches,10000,2811,2020-11-21,2020-10-23,,,136,"2020-11-21 10/2020-11-21 5/2020-10-30 10/2020-10-28 10/2020-10-27 10/2020-10-27 20/2020-10-27 10/2020-10-26 10/2020-10-26 25/2020-10-25 9/2020-10-25 10/2020-10-25 10/2020-10-25 25/2020-10-25 50/2020-10-25 5/2020-10-25 10/2020-10-25 5/2020-10-24 25/2020-10-24 15/2020-10-24 5/2020-10-24 10/2020-10-24 10/2020-10-24 10/2020-10-24 10/2020-10-24 925/2020-10-24 5/2020-10-24 10/2020-10-24 10/2020-10-24 10/2020-10-24 10/2020-10-24 25/2020-10-24 10/2020-10-24 10/2020-10-24 10/2020-10-24 10/2020-10-24 10/2020-10-24 10/2020-10-24 10/2020-10-24 10/2020-10-24 20/2020-10-24 10/2020-10-24 10/2020-10-24 20/2020-10-24 5/2020-10-24 10/2020-10-24 5/2020-10-24 19/2020-10-24 15/2020-10-24 25/2020-10-24 5/2020-10-24 10/2020-10-24 5/2020-10-24 40/2020-10-24 10/2020-10-24 20/2020-10-24 10/2020-10-24 10/2020-10-24 20/2020-10-24 20/2020-10-24 10/2020-10-24 10/2020-10-24 10/2020-10-24 5/2020-10-24 20/2020-10-24 5/2020-10-24 10/2020-10-24 10/2020-10-24 10/2020-10-24 5/2020-10-24 20/2020-10-24 100/2020-10-24 15/2020-10-24 10/2020-10-24 20/2020-10-24 5/2020-10-24 10/2020-10-24 10/2020-10-24 5/2020-10-24 10/2020-10-24 10/2020-10-24 10/2020-10-24 10/2020-10-24 20/2020-10-24 10/2020-10-24 10/2020-10-24 10/2020-10-23 10/2020-10-23 20/2020-10-23 10/2020-10-23 5/2020-10-23 5/2020-10-23 10/2020-10-23 5/2020-10-23 5/2020-10-23 5/2020-10-23 25/2020-10-23 5/2020-10-23 10/2020-10-23 10/2020-10-23 10/2020-10-23 15/2020-10-23 50/2020-10-23 10/2020-10-23 20/2020-10-23 20/2020-10-23 10/2020-10-23 15/2020-10-23 20/2020-10-23 25/2020-10-23 10/2020-10-23 10/2020-10-23 30/2020-10-23 15/2020-10-23 10/2020-10-23 10/2020-10-23 20/2020-10-23 20/2020-10-23 5/2020-10-23 10/2020-10-23 20/2020-10-23 10/2020-10-23 10/2020-10-23 18/2020-10-23 10/2020-10-23 10/2020-10-23 10/2020-10-23 10/2020-10-23 5/2020-10-23 10/2020-10-23 50/2020-10-23 25/2020-10-23 10/2020-10-23 50/2020-10-23 10/2020-10-23 20/2020-10-23 10","Thanks for visiting and supporting Monkey Bizzness Hockley's Super Santa Appeal!    This campaign started as an October 2020 half-term project to supply 1000 packed lunches to vulnerable children in South Essex  and we raised nearly £1 800 on top of what we needed to get these lunches made. Because of the government's recent announcement that they are going to increase funding for the provision of 'free school meals' over the school holidays (well done Marcus Rashford!)  we have decided to use the additional money and hopefully loads more to make sure that lots of children in Essex have gifts to open on Christmas morning.    Like many hospitality businesses in England  we are closed until December 2nd 2020 and we're going to be brutally honest - financially we are struggling. However  across the UK the pandemic has led to many  many families struggling as well. While we are trying our hardest to stay afloat  a heartbreaking number of parents are going into Winter juggling keeping their children fed and their homes warm. You don't need to be an expert economist to realise that even a small amount of festive magic could be out of reach for many.    This is why we want to help  and we are going to do this in a Covid-friendly manner. We are working with a number of local organisations who already have the facilities in place to safely get the gifts to those who really need them  including One Love Soup Kitchen in Southend and Lennox Children's Cancer Fund who work with Essex families with children who are in and out of hospital receiving cancer treatment. This list of partner groups will expand in the weeks ahead.    Our Facebook Page  Our Website    *** This fundraising page is being maintained by Simon Harris on behalf of Monkey Bizzness Hockley  with all donations being distributed directly to local organisations who are working to make Christmas as magical as possible for local families who need help.",False
" Continuous support for Homeless ","Hull, Yorkshire and the Humber, United Kingdom",https://www.gofundme.com/f/continuous-support-for-homeless,10000,3402,2019-03-26,2017-06-05,,,77,"2019-03-26 20/2019-01-30 10/2019-01-07 10/2018-12-30 100/2018-12-23 10/2018-12-23 20/2018-12-21 20/2018-12-10 50/2018-12-05 10/2018-09-17 10/2018-06-17 10/2018-06-12 10/2018-06-10 5/2018-06-03 100/2018-06-01 5/2018-05-31 10/2018-05-31 10/2018-05-31 5/2018-05-31 20/2018-05-13 93/2018-04-24 5/2018-04-02 50/2018-03-20 93/2018-02-07 133/2017-12-25 40/2017-12-23 20/2017-12-23 5/2017-12-20 20/2017-12-20 1000/2017-12-12 100/2017-12-03 140/2017-10-28 10/2017-10-27 45/2017-10-27 45/2017-10-26 35/2017-10-25 35/2017-10-25 42/2017-10-25 45/2017-10-25 41/2017-10-08 100/2017-09-30 10/2017-09-10 10/2017-09-10 9/2017-09-10 5/2017-08-29 20/2017-08-27 20/2017-08-27 10/2017-08-27 10/2017-08-23 5/2017-08-23 10/2017-08-21 30/2017-08-21 30/2017-08-21 31/2017-08-20 25/2017-08-20 35/2017-08-09 20/2017-08-09 10/2017-08-02 30/2017-07-25 10/2017-07-24 55/2017-07-24 65/2017-07-24 50/2017-07-24 45/2017-07-24 55/2017-07-24 30/2017-07-22 10/2017-07-11 40/2017-06-29 15/2017-06-19 5/2017-06-19 20/2017-06-18 25/2017-06-16 20/2017-06-15 5/2017-06-14 5/2017-06-10 35/2017-06-08 50/2017-06-06 10","Project Hotdog stated in March 2016 with a budget of £5.00  we fed 40 people hotdogs.   We now hold 2 soup kitchens a week on a Monday and Saturday 7-9pm in Queens Gardens  Hull. and supply 4 other kitchens.    In the first 12 months we provided approximatly:  24000 Hot meals  5000 Pack ups  3750 Litres of hot drinks  500 Sleeping bags  Thousands of £££'s of Toiletries.    In our first year  we attended 17 funerals of friends and service users  this would have been more if it had not been for our wonderful volunteers.  We helped house 8 people and aim to continue this.  This page is for our fundraising and donations.  Any ammount can make a difference and potentially help save a life.",False
" Homeless Support Group: Glasgow ","Glasgow, Scotland, United Kingdom",https://www.gofundme.com/f/homeless-support-group-glasgow,6000,990,2021-03-25,2021-01-13,,,47,"2021-03-25 55/2021-01-28 40/2021-01-23 5/2021-01-23 20/2021-01-22 20/2021-01-21 40/2021-01-20 20/2021-01-18 100/2021-01-18 100/2021-01-17 20/2021-01-16 20/2021-01-16 20/2021-01-16 10/2021-01-16 20/2021-01-15 10/2021-01-15 20/2021-01-15 20/2021-01-15 20/2021-01-15 20/2021-01-15 20/2021-01-15 20/2021-01-15 30/2021-01-15 10/2021-01-15 10/2021-01-14 5/2021-01-14 10/2021-01-14 20/2021-01-14 5/2021-01-14 50/2021-01-14 5/2021-01-14 10/2021-01-14 20/2021-01-14 20/2021-01-14 10/2021-01-14 20/2021-01-13 20/2021-01-13 10/2021-01-13 10/2021-01-13 20/2021-01-13 10/2021-01-13 10/2021-01-13 10/2021-01-13 10/2021-01-13 20/2021-01-13 10/2021-01-13 10/2021-01-13 5","2020… A horrendous year for many on different levels. Job Losses  Financial Impact  Mental Health  Isolation and for many Homelessness.    For the past couple of year  I’ve said I’d go out and do my little bit to help those less fortunate during Christmas and this year being the horror show that it was I decided no excuses  it’s getting done. I took to Amazon  purchased items such as Hats  Gloves  Socks and some other little essentials and made up 20 care packages coupled with some packed lunches  nothing extravagant… sandwiches  chocolate  some fruit and a few other bits and bobs.    The difference that made to people who were out on the street  sleeping rough  homeless  in temporary Accomodation or who have a house but are out begging to try and make enough to get their heat and electricity on for a day. I have seen these people. I have spoken to these people.    I knew after doing it I was hooked  not for the good feeling it gives you when you help others (just being honest…it does) but for the simple fact that there are a group of vulnerable people within the homeless and rough sleeping community who do not use the services of organisations such as soup kitchens for one reason or another. They vary but I am not there to judge. A lot of rough sleepers do not want to be hooked to substances and drink so going to a location with 100+ individuals who they may know  have history with and could tempt them isn’t a great idea  so they avoid it and are deprived of the support and network of a lot of amazing people.    So  where do my friends and I come into this?    We go into the City Centre 3 times a week (if we can) sometimes its two. We look for people who are begging or out sleeping rough and engage with them  try to understand their situation and then we provide them with a food parcel  a warm drink  and the most important thing of all our time. We chat to them.    Ideally  we aim to help around 10 people per night  we have around 6-7 regular people we go to visit  and we just know where they will be.    We are currently funding everything ourselves weekly but would love to be in a position where we have a fund there to help mitigate the cost of the food and consumables. I’ve roughly calculated that approx. £6k allows us to do this for the full year at a basic level as we are doing.    This is where I hope you can come in to help. Even sharing this will be a huge help but should you be able to donate anything (and I mean anything... 50p…£1 anything then it would be greatly appreciated.    I am also happy to hear from anyone who may have items they no longer need such as Jackets  Trousers  Socks  Hats  Gloves  Scarves  Sleeping Bags  Rucksacks  Boots.... I am happy to come and collect items from anyone who has anything they feel would be ideal to donate. I believe there is a contact organiser function on this page.    We are not an organisation; we are not a charity we are just a few people who understand there is a group of vulnerable people within a larger group of vulnerable people and we just wish to play our little part alongside all the other fantastic people out there.    Thanks for reading     Brian",False
" Sponsored Cycle and Mountain Walk ","Belfast, Northern Ireland, United Kingdom",https://www.gofundme.com/f/sponsored-cycle-and-mountain-walk,500,1205,2020-11-09,2020-10-15,,,66,"2020-11-09 5/2020-11-08 10/2020-11-08 20/2020-11-08 20/2020-11-07 30/2020-11-07 10/2020-11-07 15/2020-11-07 10/2020-11-06 20/2020-11-05 5/2020-11-05 20/2020-11-05 10/2020-11-05 10/2020-11-05 10/2020-11-04 10/2020-11-04 50/2020-11-04 20/2020-11-04 20/2020-11-03 100/2020-11-02 10/2020-11-02 20/2020-10-31 15/2020-10-31 10/2020-10-31 20/2020-10-31 50/2020-10-29 20/2020-10-29 10/2020-10-29 20/2020-10-29 20/2020-10-29 10/2020-10-29 20/2020-10-29 5/2020-10-26 20/2020-10-22 20/2020-10-22 10/2020-10-22 10/2020-10-22 20/2020-10-21 30/2020-10-21 10/2020-10-20 20/2020-10-19 10/2020-10-19 20/2020-10-19 10/2020-10-19 5/2020-10-19 10/2020-10-18 20/2020-10-18 20/2020-10-17 10/2020-10-17 30/2020-10-17 20/2020-10-16 10/2020-10-15 20/2020-10-15 15/2020-10-15 20/2020-10-15 15/2020-10-15 10/2020-10-15 10/2020-10-15 10/2020-10-15 20/2020-10-15 20/2020-10-15 20/2020-10-15 20/2020-10-15 25/2020-10-15 40/2020-10-15 20/2020-10-15 10","Hey guys  I am taking part in a sponsored cycle from Belfast to Newcastle in County Down then we are climbing Slieve Donard. This is in Aid of ""The People's Kitchen"" a soup kitchen in Belfast. They work tirelessly week in and week out to provide food for the vulnerable of Belfast. Any donation would be much appreciated.  Seán https://www.facebook.com/peopleskitchenbelfast/",False
" NOTHING BUT LOVE ","Hartlepool, North East England, United Kingdom",https://www.gofundme.com/f/wpd8yu-nothing-but-love,2000,2700,2018-12-23,2018-12-02,,,31,"2018-12-23 10/2018-12-23 10/2018-12-23 10/2018-12-21 30/2018-12-21 30/2018-12-18 20/2018-12-17 20/2018-12-16 500/2018-12-14 50/2018-12-14 20/2018-12-14 41/2018-12-14 50/2018-12-13 10/2018-12-13 150/2018-12-13 5/2018-12-13 20/2018-12-13 10/2018-12-12 20/2018-12-12 30/2018-12-12 50/2018-12-11 20/2018-12-07 9/2018-12-04 10/2018-12-03 10/2018-12-03 10/2018-12-02 10/2018-12-02 500/2018-12-02 1000/2018-12-02 10/2018-12-02 10/2018-12-02 25","So what exactly is the campaign I hear you ask? We are aiming to raise £2000 in a short period of just two weeks to ensure that each and every family in Hartlepool who are in need of a little help at Christmas receive a Christmas gift. Can you imagine  as you sit at home this evening surrounded by your Children who have probably already written their Christmas lists and sent them off to Santa not receiving a single gift on Christmas morning? Unfortunately this is a reality for families in our home town but YOU can change that by making a donation. I am going to be working very closely with Childrens Services at Hartlepool Borough Council to ensure that we target families that are most in need. I may be slightly ambitious here but the hope is the target will be smashed and and any funds left over will be given to the local soup kitchen and food bank in their 'leaner' months of January and February.    A local business man who wants to remain completely anonymous came up with the idea of 'The Nothing But Love' campaign. Wanting to give something back for absolutely zero in return he wanted to give a £1000 of his own cash to go to local families who are in genuine need but without any 'thanks' or shouting from the rooftops just wanting to do a selfless  good dead. The idea of the 'Nothing But Love' Campaign was born.    So of course want to donate  right? Well  here is the catch - You give COMPLETELY ANONYMOUSLY. That's right  you get absolutely nothing in return other than the warm glow inside of knowing you have done a truly brilliant thing. We ask that if you donate to the page you just pop your initials in rather than your name. We like to think of it as people helping people. We are hoping that local business people will look to donate very generously. If you are unable to donate if you could share the Facebook page with anyone who you think may be able to support that would be very much appreciated.    Thank you for taking the time to read and please help me spread the word to ensure we make it the best Christmas we can for everyone in our local community.    Janine    #nbl #givingforgivingsake #ifyouknowyouknow",False
" Give Joan hope and a safe home! ","Stirling, Scotland, United Kingdom",https://www.gofundme.com/f/help-get-my-sister-a-home,1500,1578,2018-04-18,2018-03-03,,,52,"2018-04-18 10/2018-03-28 10/2018-03-23 71/2018-03-19 10/2018-03-18 20/2018-03-16 10/2018-03-16 72/2018-03-14 50/2018-03-13 30/2018-03-13 60/2018-03-10 80/2018-03-08 25/2018-03-08 20/2018-03-07 18/2018-03-07 10/2018-03-07 50/2018-03-07 10/2018-03-07 20/2018-03-07 20/2018-03-06 15/2018-03-06 20/2018-03-06 10/2018-03-06 150/2018-03-06 20/2018-03-06 50/2018-03-06 20/2018-03-06 10/2018-03-06 10/2018-03-06 15/2018-03-05 15/2018-03-05 10/2018-03-05 20/2018-03-05 20/2018-03-05 20/2018-03-05 9/2018-03-05 20/2018-03-05 72/2018-03-05 10/2018-03-05 50/2018-03-05 20/2018-03-04 100/2018-03-04 10/2018-03-04 10/2018-03-04 20/2018-03-04 21/2018-03-04 50/2018-03-04 10/2018-03-04 100/2018-03-04 45/2018-03-04 10/2018-03-04 10/2018-03-03 10","My sister Joan had a stroke in 2015 and is paralysed on her entire right side. She has also lost a good part of her short term memory. Joan is confined to a wheelchair as she can not walk on her own. She has a caregiver who comes daily to care for her.     Sadly Joan has just been forced into homelessness and is temporarily living in a motel in Kelso  Washington. This happened just after Christmas because she was short rent money but didn’t want to ask for help as it was Christmastime. Sadly she was evicted and didn’t realise the implications and the cruelness the landlord would show them. Now she will have great difficulties finding a landlord that will accept her because that eviction is on her record.     My nephew Joshua  who has learning difficulties  also lives with my sister. Joshua takes care of his mom at night when her caregiver is not able to be there. He also has a job at the local McDonalds that he's very proud of as it's so hard for him to get a job with his difficulties. Unfortunately  because Joshua is an adult  he was made to be on the lease for the apartment as well. This means unfortunately that the eviction is on his record too.     Joshua’s young son  my great nephew Oliver  lives with them as well. He’s a bright kid that is the star football player for his school. Oliver helps look after his grandma too and he just adores her.     The three of them are sharing a handicap room and sadly the boys are sleeping on the floor.     Becoming homeless  let alone my sisters stroke  has affected them all something terrible and they are stuck! They are good people who’ve never drank  smoked or been anywhere near drugs.   My sister and nephews are the kind of people who would give you the shirt off their backs.     My sister was a stay at home grandma. She’s raised my great nephew Oliver when he was abandoned by his mother at 3 months old.   Joan used to make cookies and bake all the time and boy could she crochet! Her blankets and scarves were so beautiful!   She also used to volunteer at a local church who ran a soup kitchen. That came to an end when she fell off a pallet in 2014 whilst volunteering and broke her hip! Only a few months after this she had her stroke. Joan has had a horrible run of luck and I just want to turn it around for her and really show her how much everyone cares!     My sister receives very little help from the state and doesn’t get housing just because she’s a disabled stroke victim as most would assume. My great nephew is obviously a minor but the government doesn’t provide quick assistance for this reason either unfortunately.     They have applied to the local housing authority for subsidised housing but the waiting list is two years! Things are so different in the USA compared to the UK. The government WILL NOT help them!     We have exhausted all efforts  called all the shelters and spoken to the local churches. It seems so many people are in this position in the USA that no one has the ability to help!     Please help raise money for Joan and my sweet nephews to have a safe place to stay for the time being. The money will be going towards keeping them in the handicap room for now so my sister can be comfortable and close to her caregiver. Any additional money will be saved for a deposit for an appropriate home for them and any essentials they require.     If anyone knows of a landlord in Kelso or Longview that is willing to help them please let me know. We really need a miracle to happen! With your support and spreading the word hopefully we can find something for them soon!     Anything you can give now will be much appreciated. Even £5! Please share with everyone you know! Thank you all so much in advance!",False
" Jo Jo's Amazing send off ","Preston, Yorkshire and the Humber, United Kingdom",https://www.gofundme.com/f/jo-jos-amazing-send-off,1000,775,2021-02-01,2020-12-30,,,26,"2021-02-01 15/2021-01-29 100/2021-01-23 10/2021-01-16 10/2021-01-12 50/2021-01-04 25/2021-01-04 200/2021-01-03 20/2021-01-02 20/2021-01-01 20/2020-12-31 5/2020-12-31 20/2020-12-31 20/2020-12-31 20/2020-12-31 10/2020-12-30 10/2020-12-30 10/2020-12-30 10/2020-12-30 10/2020-12-30 100/2020-12-30 20/2020-12-30 20/2020-12-30 20/2020-12-30 10/2020-12-30 10/2020-12-30 10","This has been created to give our very own Pink Sparkly  Unicorn Princess Jo Jo the best send off that we can.  Jo was a larger than life character  she had sometimes in her life struggled with some demons but for the last 3 years had fought them and was on top of the world. Jo had a magical way with people and who ever she met loved our Unicorn Princess.. in recent times Jo had been a regular volunteer with various soup kitchens and homeless projects in Hull and was adored by all.. she was always so full of life and there was always good fun and laughter with jo around which lifted services users no end of times..  Then late on Sunday night early Monday morning our Beautiful Jo Jo was gone.. she took her last breath and went  somewhere were the unicorns dance and she could be free...  So here I am hoping to give our JO JO UNICORN PRINCESS the Beautiful send off she truly deserves...  Thank You for taking the time to read this....  Sarah x",False
" Help me raise money for supplies! ","London, Greater London, United Kingdom",https://www.gofundme.com/f/ptc2zq-help-me-raise-money-for-supplies,500,869,2021-01-06,2020-12-16,,,46,"2021-01-06 10/2021-01-03 20/2020-12-30 20/2020-12-29 20/2020-12-28 20/2020-12-25 49/2020-12-24 50/2020-12-23 20/2020-12-22 20/2020-12-22 20/2020-12-22 100/2020-12-22 20/2020-12-22 10/2020-12-21 50/2020-12-21 20/2020-12-21 5/2020-12-21 15/2020-12-20 40/2020-12-18 10/2020-12-18 30/2020-12-18 10/2020-12-18 10/2020-12-18 20/2020-12-18 10/2020-12-18 20/2020-12-17 10/2020-12-17 5/2020-12-17 10/2020-12-17 10/2020-12-17 10/2020-12-17 40/2020-12-16 10/2020-12-16 5/2020-12-16 20/2020-12-16 5/2020-12-16 5/2020-12-16 5/2020-12-16 15/2020-12-16 20/2020-12-16 15/2020-12-16 10/2020-12-16 10/2020-12-16 10/2020-12-16 10/2020-12-16 15/2020-12-16 10","Hi everyone     My name is Mohammed (or Usman depending on when we met)  its getting pretty cold these days and one thing my wife Venicia and I have wanted to do for a while now is help those less fortunate.    All across London  there are people who won't have a warm meal at any point over the next few weeks because as usual  shops and restaurants shut down and people will have to rely on soup kitchens  food banks and any other resources available to them.    I'd like to collect funds to be able to cook and deliver meals to those who live on the streets and with your help I'll be able to do so. I will be using a commercial kitchen and premises to prepare a variety of soups  sandwiches and nibbles. Don't worry I have my food hygiene certificate handy :-)    I've been lucky to be provided access to a commercial kitchen where I can cook in large batches of food. With this I'll deliver everything I can to various food banks  soup kitchens and charities across London.    Any money raised will be used to purchase the ingredients needed for the meals  and any left over money will be used to create kits that would contain items such as hats  socks  scarves and personal hygiene items.    If you can't donate money  then maybe you select a few pieces of clothes that don't fit (Thanks lockdown!)? and even if you don't then sharing this would also help!    Happy holidays and stay safe.",False
