Title,Location,Link,Raised,Target,MostRecentDonation,Created,Organization,OrganizationDetails,DonationCount,Donations,Description,Complete
" SUNDERLAND SOUP KITCHEN & FOODBANK FUNDRAISER 2019","Sunderland, North East England, United Kingdom",https://www.gofundme.com/f/christmas-foodbank-amp-homeless-shelter-fundraiser,18000,19550,2021-02-05,2019-12-02,,,798,"2021-02-05 20/2020-12-23 30/2020-12-19 100/2020-12-18 300/2020-12-17 50/2020-12-17 10/2020-12-17 50/2020-12-11 10/2020-12-09 10/2019-12-24 10/2019-12-23 40/2019-12-22 20/2019-12-21 25/2019-12-21 10/2019-12-19 124/2019-12-18 10/2019-12-18 20/2019-12-17 20/2019-12-16 10/2019-12-16 16/2019-12-15 100/2019-12-13 20/2019-12-13 10/2019-12-13 10/2019-12-12 5/2019-12-12 10/2019-12-12 10/2019-12-12 5/2019-12-12 5/2019-12-12 10/2019-12-12 20/2019-12-12 10/2019-12-12 10/2019-12-12 20/2019-12-12 100/2019-12-12 10/2019-12-12 10/2019-12-12 40/2019-12-12 10/2019-12-12 10/2019-12-11 25/2019-12-11 20/2019-12-11 5/2019-12-11 20/2019-12-11 20/2019-12-11 5/2019-12-11 25/2019-12-11 10/2019-12-11 20/2019-12-11 30/2019-12-11 25/2019-12-11 10/2019-12-11 10/2019-12-11 10/2019-12-11 5/2019-12-11 65/2019-12-11 10/2019-12-11 25/2019-12-11 100/2019-12-11 100/2019-12-11 50/2019-12-11 5/2019-12-11 200/2019-12-11 10/2019-12-11 10/2019-12-11 50/2019-12-11 10/2019-12-11 10/2019-12-11 5/2019-12-11 50/2019-12-11 20/2019-12-11 10/2019-12-11 50/2019-12-11 10/2019-12-11 20/2019-12-11 20/2019-12-11 10/2019-12-11 10/2019-12-11 15/2019-12-11 20/2019-12-11 15/2019-12-11 10/2019-12-11 10/2019-12-11 25/2019-12-11 10/2019-12-11 20/2019-12-11 5/2019-12-11 10/2019-12-11 100/2019-12-11 20/2019-12-10 20/2019-12-10 11/2019-12-10 50/2019-12-10 10/2019-12-10 20/2019-12-10 20/2019-12-10 20/2019-12-10 20/2019-12-10 20/2019-12-10 5/2019-12-10 20/2019-12-10 10/2019-12-10 20/2019-12-10 17/2019-12-10 5/2019-12-10 10/2019-12-10 5/2019-12-09 10/2019-12-09 20/2019-12-09 10/2019-12-09 20/2019-12-09 20/2019-12-09 110/2019-12-09 15/2019-12-09 50/2019-12-09 60/2019-12-09 10/2019-12-09 5/2019-12-09 5/2019-12-09 10/2019-12-09 5/2019-12-09 100/2019-12-09 10/2019-12-09 20/2019-12-08 10/2019-12-08 20/2019-12-08 20/2019-12-08 20/2019-12-08 27/2019-12-08 10/2019-12-08 20/2019-12-08 9/2019-12-08 30/2019-12-08 10/2019-12-08 25/2019-12-08 20/2019-12-08 20/2019-12-08 10/2019-12-08 10/2019-12-08 5/2019-12-08 20/2019-12-08 15/2019-12-07 5/2019-12-07 20/2019-12-07 20/2019-12-07 10/2019-12-07 10/2019-12-07 10/2019-12-07 10/2019-12-07 100/2019-12-07 5/2019-12-07 50/2019-12-07 5/2019-12-07 11/2019-12-07 20/2019-12-07 10/2019-12-07 5/2019-12-07 10/2019-12-07 10/2019-12-07 10/2019-12-07 5/2019-12-07 10/2019-12-07 20/2019-12-07 5/2019-12-07 100/2019-12-07 100/2019-12-07 20/2019-12-07 5/2019-12-07 20/2019-12-07 100/2019-12-07 5/2019-12-07 5/2019-12-06 5/2019-12-06 10/2019-12-06 10/2019-12-06 50/2019-12-06 5/2019-12-06 10/2019-12-06 5/2019-12-06 5/2019-12-06 5/2019-12-06 10/2019-12-06 10/2019-12-06 20/2019-12-06 10/2019-12-06 10/2019-12-06 20/2019-12-06 25/2019-12-06 10/2019-12-06 20/2019-12-06 20/2019-12-06 45/2019-12-06 5/2019-12-06 110/2019-12-06 19/2019-12-06 10/2019-12-06 10/2019-12-06 5/2019-12-06 10/2019-12-06 10/2019-12-06 10/2019-12-06 50/2019-12-06 10/2019-12-06 20/2019-12-06 5/2019-12-06 10/2019-12-06 10/2019-12-06 10/2019-12-06 5/2019-12-06 5/2019-12-06 10/2019-12-06 10/2019-12-06 25/2019-12-06 10/2019-12-06 10/2019-12-06 5/2019-12-06 100/2019-12-06 251/2019-12-06 20/2019-12-06 10/2019-12-06 10/2019-12-06 10/2019-12-06 50/2019-12-06 5/2019-12-06 250/2019-12-06 50/2019-12-06 30/2019-12-06 10/2019-12-06 10/2019-12-06 20/2019-12-06 10/2019-12-06 5/2019-12-06 30/2019-12-06 10/2019-12-06 10/2019-12-06 10/2019-12-06 100/2019-12-06 10/2019-12-06 20/2019-12-06 20/2019-12-06 10/2019-12-06 50/2019-12-06 10/2019-12-06 10/2019-12-06 20/2019-12-06 10/2019-12-06 10/2019-12-06 10/2019-12-06 5/2019-12-06 50/2019-12-06 10/2019-12-06 5/2019-12-06 5/2019-12-06 10/2019-12-06 20/2019-12-06 5/2019-12-06 15/2019-12-06 5/2019-12-06 10/2019-12-06 25/2019-12-06 100/2019-12-06 100/2019-12-06 20/2019-12-06 10/2019-12-06 10/2019-12-06 25/2019-12-06 20/2019-12-06 20/2019-12-06 100/2019-12-06 20/2019-12-06 25/2019-12-06 20/2019-12-06 15/2019-12-06 10/2019-12-05 20/2019-12-05 25/2019-12-05 9/2019-12-05 50/2019-12-05 5/2019-12-05 15/2019-12-05 10/2019-12-05 20/2019-12-05 50/2019-12-05 25/2019-12-05 10/2019-12-05 20/2019-12-05 10/2019-12-05 10/2019-12-05 5/2019-12-05 10/2019-12-05 5/2019-12-05 15/2019-12-05 10/2019-12-05 10/2019-12-05 10/2019-12-05 5/2019-12-05 5/2019-12-05 100/2019-12-05 20/2019-12-05 20/2019-12-05 10/2019-12-05 50/2019-12-05 10/2019-12-05 10/2019-12-05 300/2019-12-05 5/2019-12-05 5/2019-12-05 30/2019-12-05 5/2019-12-05 50/2019-12-05 5/2019-12-05 20/2019-12-05 10/2019-12-05 5/2019-12-05 5/2019-12-05 10/2019-12-05 10/2019-12-05 20/2019-12-05 10/2019-12-05 10/2019-12-05 5/2019-12-05 5/2019-12-05 20/2019-12-05 10/2019-12-05 10/2019-12-05 10/2019-12-05 20/2019-12-05 30/2019-12-05 25/2019-12-05 10/2019-12-05 10/2019-12-05 5/2019-12-05 10/2019-12-05 10/2019-12-05 100/2019-12-05 20/2019-12-05 5/2019-12-05 5/2019-12-05 10/2019-12-05 5/2019-12-05 5/2019-12-05 10/2019-12-05 60/2019-12-05 20/2019-12-05 25/2019-12-05 20/2019-12-05 10/2019-12-05 15/2019-12-05 25/2019-12-05 120/2019-12-05 5/2019-12-05 10/2019-12-05 10/2019-12-05 25/2019-12-05 10/2019-12-05 20/2019-12-05 500/2019-12-05 10/2019-12-05 100/2019-12-05 18/2019-12-05 10/2019-12-05 10/2019-12-05 5/2019-12-05 10/2019-12-05 20/2019-12-05 13/2019-12-05 10/2019-12-05 15/2019-12-05 10/2019-12-05 10/2019-12-05 19/2019-12-05 20/2019-12-05 20/2019-12-05 10/2019-12-05 20/2019-12-05 10/2019-12-05 10/2019-12-05 10/2019-12-05 10/2019-12-05 10/2019-12-05 20/2019-12-05 20/2019-12-05 10/2019-12-05 10/2019-12-05 20/2019-12-05 50/2019-12-05 10/2019-12-05 10/2019-12-05 20/2019-12-05 5/2019-12-05 15/2019-12-05 10/2019-12-05 10/2019-12-05 30/2019-12-05 10/2019-12-05 10/2019-12-05 20/2019-12-05 10/2019-12-05 10/2019-12-05 27/2019-12-05 10/2019-12-05 10/2019-12-05 10/2019-12-05 10/2019-12-05 9/2019-12-05 5/2019-12-05 20/2019-12-05 25/2019-12-04 10/2019-12-04 20/2019-12-04 20/2019-12-04 20/2019-12-04 10/2019-12-04 10/2019-12-04 5/2019-12-04 10/2019-12-04 5/2019-12-04 10/2019-12-04 5/2019-12-04 10/2019-12-04 5/2019-12-04 5/2019-12-04 5/2019-12-04 500/2019-12-04 5/2019-12-04 5/2019-12-04 10/2019-12-04 20/2019-12-04 20/2019-12-04 30/2019-12-04 10/2019-12-04 10/2019-12-04 25/2019-12-04 5/2019-12-04 5/2019-12-04 10/2019-12-04 5/2019-12-04 5/2019-12-04 9/2019-12-04 10/2019-12-04 20/2019-12-04 25/2019-12-04 10/2019-12-04 20/2019-12-04 15/2019-12-04 30/2019-12-04 100/2019-12-04 500/2019-12-04 1000/2019-12-04 10/2019-12-04 5/2019-12-04 60/2019-12-04 200/2019-12-04 10/2019-12-04 20/2019-12-04 25/2019-12-04 10/2019-12-04 20/2019-12-04 10/2019-12-04 10/2019-12-04 20/2019-12-04 10/2019-12-04 15/2019-12-04 10/2019-12-04 20/2019-12-04 10/2019-12-04 5/2019-12-04 10/2019-12-04 9/2019-12-04 20/2019-12-04 20/2019-12-04 50/2019-12-04 10/2019-12-04 10/2019-12-04 20/2019-12-04 50/2019-12-04 10/2019-12-03 10/2019-12-03 10/2019-12-03 10/2019-12-03 20/2019-12-03 10/2019-12-03 10/2019-12-03 15/2019-12-03 10/2019-12-03 20/2019-12-03 5/2019-12-03 5/2019-12-03 5/2019-12-03 10/2019-12-03 10/2019-12-03 5/2019-12-03 10/2019-12-03 10/2019-12-03 5/2019-12-03 10/2019-12-03 10/2019-12-03 5/2019-12-03 10/2019-12-03 10/2019-12-03 20/2019-12-03 25/2019-12-03 10/2019-12-03 10/2019-12-03 10/2019-12-03 25/2019-12-03 18/2019-12-03 5/2019-12-03 10/2019-12-03 10/2019-12-03 20/2019-12-03 100/2019-12-03 10/2019-12-03 5/2019-12-03 20/2019-12-03 5/2019-12-03 10/2019-12-03 5/2019-12-03 10/2019-12-03 50/2019-12-03 50/2019-12-03 5/2019-12-03 20/2019-12-03 10/2019-12-03 10/2019-12-03 20/2019-12-03 5/2019-12-03 5/2019-12-03 5/2019-12-03 20/2019-12-03 5/2019-12-03 20/2019-12-03 18/2019-12-03 14/2019-12-03 5/2019-12-03 10/2019-12-03 10/2019-12-03 30/2019-12-03 10/2019-12-03 20/2019-12-03 5/2019-12-03 10/2019-12-03 100/2019-12-03 17/2019-12-03 5/2019-12-03 20/2019-12-03 100/2019-12-03 20/2019-12-03 20/2019-12-03 5/2019-12-03 5/2019-12-03 50/2019-12-03 10/2019-12-03 5/2019-12-03 10/2019-12-03 50/2019-12-03 10/2019-12-03 20/2019-12-03 20/2019-12-03 30/2019-12-03 20/2019-12-03 10/2019-12-03 20/2019-12-03 50/2019-12-03 10/2019-12-03 18/2019-12-03 50/2019-12-03 10/2019-12-03 10/2019-12-03 15/2019-12-03 10/2019-12-03 10/2019-12-03 10/2019-12-03 10/2019-12-03 10/2019-12-03 20/2019-12-03 5/2019-12-03 5/2019-12-03 10/2019-12-03 10/2019-12-03 20/2019-12-03 15/2019-12-03 18/2019-12-03 10/2019-12-03 100/2019-12-03 10/2019-12-03 10/2019-12-03 10/2019-12-03 10/2019-12-03 5/2019-12-03 5/2019-12-03 10/2019-12-03 10/2019-12-03 5/2019-12-03 25/2019-12-03 10/2019-12-03 5/2019-12-03 20/2019-12-03 25/2019-12-02 100/2019-12-02 10/2019-12-02 20/2019-12-02 30/2019-12-02 5/2019-12-02 25/2019-12-02 50/2019-12-02 100/2019-12-02 10/2019-12-02 20/2019-12-02 50/2019-12-02 10/2019-12-02 10/2019-12-02 10/2019-12-02 20/2019-12-02 10/2019-12-02 10/2019-12-02 5/2019-12-02 5/2019-12-02 10/2019-12-02 20/2019-12-02 20/2019-12-02 5/2019-12-02 5/2019-12-02 5/2019-12-02 10/2019-12-02 10/2019-12-02 40/2019-12-02 20/2019-12-02 20/2019-12-02 10/2019-12-02 7/2019-12-02 5/2019-12-02 9/2019-12-02 10/2019-12-02 10/2019-12-02 20/2019-12-02 5/2019-12-02 5/2019-12-02 10/2019-12-02 50/2019-12-02 10/2019-12-02 20/2019-12-02 10/2019-12-02 5/2019-12-02 20/2019-12-02 20/2019-12-02 10/2019-12-02 10/2019-12-02 20/2019-12-02 10/2019-12-02 20/2019-12-02 18/2019-12-02 20/2019-12-02 10/2019-12-02 5/2019-12-02 50/2019-12-02 5/2019-12-02 5/2019-12-02 25/2019-12-02 10/2019-12-02 10/2019-12-02 5/2019-12-02 10/2019-12-02 10/2019-12-02 25/2019-12-02 10/2019-12-02 10/2019-12-02 5/2019-12-02 50/2019-12-02 5/2019-12-02 20/2019-12-02 5/2019-12-02 10/2019-12-02 5/2019-12-02 10/2019-12-02 10/2019-12-02 20/2019-12-02 20/2019-12-02 10/2019-12-02 10/2019-12-02 10/2019-12-02 20/2019-12-02 20/2019-12-02 20/2019-12-02 5/2019-12-02 20/2019-12-02 50/2019-12-02 5/2019-12-02 10/2019-12-02 10/2019-12-02 10/2019-12-02 25/2019-12-02 50/2019-12-02 10/2019-12-02 10/2019-12-02 20/2019-12-02 20/2019-12-02 10/2019-12-02 20/2019-12-02 10/2019-12-02 20/2019-12-02 5/2019-12-02 10/2019-12-02 30/2019-12-02 1000/2019-12-02 5/2019-12-02 100/2019-12-02 10/2019-12-02 10/2019-12-02 5/2019-12-02 10/2019-12-02 10/2019-12-02 10/2019-12-02 20/2019-12-02 5/2019-12-02 20/2019-12-02 10/2019-12-02 10/2019-12-02 20/2019-12-02 25/2019-12-02 5/2019-12-02 10/2019-12-02 10/2019-12-02 10/2019-12-02 10/2019-12-02 10/2019-12-02 10/2019-12-02 5/2019-12-02 50/2019-12-02 6/2019-12-02 10/2019-12-02 10/2019-12-02 20/2019-12-02 20/2019-12-02 50/2019-12-02 5/2019-12-02 30/2019-12-02 20/2019-12-02 5/2019-12-02 5/2019-12-02 10/2019-12-02 5/2019-12-02 20/2019-12-02 20/2019-12-02 10/2019-12-02 10/2019-12-02 10/2019-12-02 20/2019-12-02 25/2019-12-02 20/2019-12-02 25/2019-12-02 5/2019-12-02 5/2019-12-02 100/2019-12-02 20/2019-12-02 10/2019-12-02 5/2019-12-02 20/2019-12-02 5/2019-12-02 5/2019-12-02 10/2019-12-02 10/2019-12-02 10/2019-12-02 20/2019-12-02 14/2019-12-02 10/2019-12-02 5/2019-12-02 10/2019-12-02 5/2019-12-02 20/2019-12-02 20/2019-12-02 5/2019-12-02 10/2019-12-02 5/2019-12-02 10/2019-12-02 10/2019-12-02 5/2019-12-02 10/2019-12-02 50/2019-12-02 5/2019-12-02 15/2019-12-02 5/2019-12-02 10/2019-12-02 10/2019-12-02 20/2019-12-02 5/2019-12-02 10/2019-12-02 5/2019-12-02 5/2019-12-02 5/2019-12-02 5/2019-12-02 25/2019-12-02 100/2019-12-02 5/2019-12-02 10/2019-12-02 10/2019-12-02 5/2019-12-02 5","Christmas is one of the toughest times of the year for lots of people. Whilst many families over-indulge during the festive period  others struggle to put even the most basic meal on the table to feed their family - a harrowing reality of where Britain is at in 2019.    At the heart of Football is community  and at the heart of community are good people willing to dedicate their time and money to supporting those in need. No one wants to rely on food banks or soup kitchens to feed their children  but while we may feel powerless to fight the institution that has caused his hardship  we can fight to bring a modicum of security to the most vulnerable by giving a few spare coins or an hour of our time over to a cause like this. Where people would otherwise face malnourishment  food banks are the flickering flame of a beacon in an otherwise dark night.    The people at the Sunderland Foodbank and the Sunderland Community Soup Kitchen do an amazing job of ensuring that families and homeless people all over Wearside don’t go without - but unless people assist with their kind donations  none of it is possible.    Whatever you can give  it all helps.    - We have chosen this year to support the Sunderland Community Soup Kitchen and the Sunderland Foodbank  with all donations going to the two organisations. Please give generously - support your local community at this difficult time.    - On Wednesday 11th of December we will proceed with distributing the funds to the two charities  who will use the money this Christmas to feed the hungry and homeless in Sunderland. Sunderland Community Soup Kitchen feed people seven days a week and will now be able to buy pallets of fresh produce to cook with  whilst the foodbank will be able to use the money to produce emergency three day food parcels.  ",False
" Calais Soup Kitchen ","Epsom, South East England, United Kingdom",https://www.gofundme.com/f/soup-kitchenCalais,6000,6125,2016-03-01,2015-10-05,,,104,"2016-03-01 200/2016-03-01 70/2016-03-01 30/2016-03-01 30/2016-02-27 50/2016-02-26 30/2016-02-26 20/2016-02-26 10/2016-02-26 10/2016-02-26 10/2016-02-26 10/2016-02-26 10/2016-02-26 10/2016-02-26 10/2016-02-26 20/2016-02-26 10/2016-02-26 10/2016-02-26 20/2016-02-25 10/2016-02-25 20/2016-02-25 10/2016-02-25 40/2016-02-25 25/2016-02-25 20/2016-02-25 150/2016-02-25 10/2016-02-25 20/2016-02-25 10/2016-02-25 10/2016-02-25 50/2016-02-01 20/2016-01-26 20/2015-12-24 250/2015-12-24 1000/2015-12-13 20/2015-12-12 20/2015-12-10 10/2015-12-10 50/2015-12-10 50/2015-12-09 10/2015-12-08 10/2015-12-08 10/2015-12-08 50/2015-12-07 50/2015-12-07 10/2015-12-07 30/2015-12-07 10/2015-12-07 30/2015-12-07 10/2015-12-06 20/2015-12-06 40/2015-12-06 20/2015-12-06 20/2015-12-05 20/2015-12-05 20/2015-12-05 20/2015-12-04 15/2015-12-03 50/2015-11-30 20/2015-11-30 30/2015-11-30 255/2015-11-24 60/2015-11-19 250/2015-11-19 20/2015-11-19 30/2015-11-17 500/2015-11-13 30/2015-11-13 10/2015-11-13 100/2015-11-12 216/2015-11-11 10/2015-11-10 20/2015-11-09 50/2015-11-08 25/2015-11-07 10/2015-11-07 200/2015-11-07 145/2015-11-07 100/2015-11-07 10/2015-11-07 30/2015-11-07 20/2015-11-07 10/2015-11-04 20/2015-11-03 49/2015-11-03 50/2015-11-02 225/2015-11-01 20/2015-10-27 20/2015-10-24 100/2015-10-23 10/2015-10-23 50/2015-10-23 30/2015-10-22 10/2015-10-22 50/2015-10-19 60/2015-10-19 30/2015-10-19 100/2015-10-18 20/2015-10-18 100/2015-10-17 50/2015-10-14 80/2015-10-13 50/2015-10-13 10/2015-10-13 20","  We are planning on visiting the Calais 'Jungle' where upwards of 4000 people are living in a desperate situation and offer a soup kitchen on the 5th December 2015.    With all that is happening in the news about the refugee situation in Calais we feel stirred  like many  to respond in some way. Some of us have already visited the site where people are living in a a difficult conditions. It’s a big  complex situation and we simply want to reach out to other human beings and do the little we can. Lots of little jigsaw pieces add up to a bigger picture!    So our ‘jigsaw’ piece is a soup kitchen.    We will be travelling to the ‘Jungle’ in Calais on Saturday 5th December to serve soup and bread to as many as we can. Advice is 'come with plenty' so we are aiming for a 1000 portions.  We have a large  simple  mobile kitchen that we have used for other outdoor events that we will take with us then set up a few gazebos and serve.   We have 18 and counting volunteers and and we are networking with people on the ground in Calais to make sure this helps  not hinders  operations there.     our costs involve:-    *the hire of a van to transport the kitchen and food    *the food itself    *disposable cups with lids    Please join with us in making this possible. Not everyone can physically go but with your donations we can all do something to help.  THANK YOU",False
" 100km for Sunderland Soup Kitchen ","Shiney Row, North East England, United Kingdom",https://www.gofundme.com/f/100km-for-sunderland-soup-kitchen,900,1110,2021-02-02,2020-12-30,"Sunderland Community Soup Kitchen","Registered nonprofitDonations eligible for Gift Aid.",79,"2021-02-02 5/2021-01-31 10/2021-01-30 10/2021-01-29 10/2021-01-29 10/2021-01-29 10/2021-01-29 20/2021-01-29 10/2021-01-29 5/2021-01-29 20/2021-01-29 10/2021-01-29 5/2021-01-29 45/2021-01-29 15/2021-01-29 30/2021-01-29 10/2021-01-28 15/2021-01-28 20/2021-01-28 10/2021-01-28 10/2021-01-28 10/2021-01-28 20/2021-01-28 20/2021-01-27 20/2021-01-27 10/2021-01-27 20/2021-01-26 10/2021-01-26 25/2021-01-25 10/2021-01-25 10/2021-01-25 5/2021-01-23 20/2021-01-18 10/2021-01-13 10/2021-01-10 20/2021-01-08 5/2021-01-08 20/2021-01-08 10/2021-01-08 10/2021-01-08 10/2021-01-06 10/2021-01-05 5/2021-01-05 10/2021-01-05 10/2021-01-03 20/2021-01-03 5/2021-01-03 20/2021-01-03 20/2021-01-03 20/2021-01-03 11/2021-01-03 10/2021-01-03 5/2021-01-02 9/2021-01-02 5/2021-01-01 10/2021-01-01 10/2021-01-01 10/2021-01-01 10/2021-01-01 5/2021-01-01 10/2021-01-01 30/2021-01-01 50/2021-01-01 30/2020-12-31 10/2020-12-31 10/2020-12-31 10/2020-12-31 20/2020-12-31 10/2020-12-31 20/2020-12-31 5/2020-12-31 20/2020-12-31 10/2020-12-31 10/2020-12-31 20/2020-12-31 5/2020-12-31 20/2020-12-30 20/2020-12-30 20/2020-12-30 20","Do you want to join Herrington FC in making a difference? Some players from our men’s team  Daniel McKenry  Harry McMullen  Glenn Urwin  Matty Rowan  Ewan Price and Jack Flasby are raising money in aid of Sunderland Community Soup Kitchen by each running 100km over the month of January.     Every donation will help. Thank you in advance for your contribution to this cause that means so much to us.    More information about Sunderland Community Soup Kitchen: We provide hot meals  free of charge to the homeless and the hungry every every evening from 6 to 7 o'clock in Sunderland  no questions asked. In addition we provide food  support  everyday essentials  and in partnership with our local Shelter shop clothing  free of charge. ",False
" Lost in Brixtons campaign for Brixton Soup Kitchen ","London, Greater London, United Kingdom",https://www.gofundme.com/f/lost-in-brixtons-campaign-for-brixton-soup-kitchen,1000,3743,2021-04-09,2020-05-26,"Brixton Soup Kitchen","Registered nonprofitDonations eligible for Gift Aid.",179,"2021-04-09 73/2020-07-28 10/2020-07-27 10/2020-07-26 10/2020-07-25 10/2020-07-24 10/2020-07-10 100/2020-07-06 20/2020-07-03 100/2020-06-29 131/2020-06-28 25/2020-06-27 50/2020-06-27 20/2020-06-24 96/2020-06-22 10/2020-06-21 500/2020-06-19 20/2020-06-16 5/2020-06-14 40/2020-06-12 15/2020-06-11 15/2020-06-09 18/2020-06-08 5/2020-06-07 10/2020-06-07 10/2020-06-06 20/2020-06-06 15/2020-06-05 10/2020-06-05 15/2020-06-05 20/2020-06-05 50/2020-06-05 20/2020-06-05 30/2020-06-04 10/2020-06-04 10/2020-06-04 10/2020-06-04 10/2020-06-04 10/2020-06-04 10/2020-06-04 50/2020-06-04 20/2020-06-04 20/2020-06-04 50/2020-06-04 10/2020-06-03 20/2020-06-03 10/2020-06-03 10/2020-06-03 10/2020-06-03 15/2020-06-03 10/2020-06-03 10/2020-06-03 5/2020-06-03 10/2020-06-03 20/2020-06-03 5/2020-06-03 20/2020-06-03 10/2020-06-03 30/2020-06-03 5/2020-06-03 5/2020-06-03 5/2020-06-03 5/2020-06-03 20/2020-06-03 15/2020-06-03 10/2020-06-03 20/2020-06-03 10/2020-06-03 5/2020-06-03 20/2020-06-03 5/2020-06-02 10/2020-06-02 10/2020-06-02 5/2020-06-02 20/2020-06-02 5/2020-06-02 20/2020-06-02 10/2020-06-02 5/2020-06-02 20/2020-06-02 10/2020-06-02 15/2020-06-02 20/2020-06-02 10/2020-06-02 20/2020-06-02 5/2020-06-02 5/2020-06-02 10/2020-06-02 15/2020-06-02 5/2020-06-02 5/2020-06-02 10/2020-06-02 5/2020-06-02 20/2020-06-02 10/2020-06-02 50/2020-06-02 15/2020-06-02 5/2020-06-02 40/2020-06-02 15/2020-06-02 30/2020-06-02 5/2020-06-02 40/2020-06-02 5/2020-06-02 15/2020-06-02 25/2020-06-02 5/2020-06-02 20/2020-06-02 20/2020-06-02 25/2020-06-02 20/2020-06-02 15/2020-06-01 5/2020-06-01 5/2020-06-01 10/2020-05-31 10/2020-05-31 30/2020-05-31 5/2020-05-30 5/2020-05-30 20/2020-05-30 150/2020-05-30 20/2020-05-30 15/2020-05-30 5/2020-05-30 10/2020-05-30 5/2020-05-30 10/2020-05-30 5/2020-05-30 10/2020-05-30 10/2020-05-30 10/2020-05-30 15/2020-05-30 5/2020-05-30 50/2020-05-30 15/2020-05-30 5/2020-05-30 10/2020-05-30 20/2020-05-30 10/2020-05-30 15/2020-05-29 5/2020-05-29 30/2020-05-29 5/2020-05-29 5/2020-05-29 5/2020-05-29 5/2020-05-29 5/2020-05-29 5/2020-05-29 50/2020-05-29 5/2020-05-29 5/2020-05-29 5/2020-05-29 20/2020-05-29 25/2020-05-29 20/2020-05-29 50/2020-05-29 10/2020-05-29 10/2020-05-29 20/2020-05-29 5/2020-05-29 15/2020-05-29 20/2020-05-29 30/2020-05-29 25/2020-05-29 10/2020-05-29 10/2020-05-29 20/2020-05-29 10/2020-05-29 20/2020-05-28 10/2020-05-28 10/2020-05-28 5/2020-05-27 10/2020-05-27 20/2020-05-27 20/2020-05-27 20/2020-05-26 30/2020-05-26 10/2020-05-26 20/2020-05-26 20","Brixton Soup Kitchen is community space for homeless people or people in desperate need. The Soup Kitchen provide hot meals and warm clothes  drink and companionship in a warm and friendly environment on a weekly basis. Since 2013 we have served over 125 000 meals either eaten on site or distributed during food drop offs and outreach sessions around London and the UK.    Unfortunately for us the service was designed to maximise social contact for those most vulnerable in our communities who were feeling lonely  isolated and invisible. As a result of the current pandemic we have had to move away from that model and adapt it so as to limit social contact while still providing the basic essentials. This has meant that instead of having the centre open and serving hot food on site  we now have built up a database of vulnerable people (through both old and new referrals) and have been delivering both hot food  non perishables  freezer food  food packs and other essentials to those most affected by the current emergency. All our volunteers take precautions including wearing PPE and leaving parcels on the doorsteps",False
" Brixton on Trial ","London, Greater London, United Kingdom",https://www.gofundme.com/f/2rxu3m4,2000,2306,2018-05-20,2016-10-19,,,37,"2018-05-20 30/2018-01-29 25/2017-12-11 10/2017-12-10 10/2017-06-03 20/2017-05-31 20/2017-05-29 20/2017-05-27 400/2017-05-26 100/2017-05-26 418/2017-05-26 50/2017-05-25 100/2017-05-23 100/2017-05-22 25/2017-05-22 5/2017-05-22 15/2017-05-19 10/2017-05-19 55/2017-05-17 70/2017-05-17 300/2017-05-04 10/2017-03-26 13/2017-03-11 30/2017-02-02 10/2017-01-24 10/2016-11-18 12/2016-11-17 50/2016-11-16 268/2016-11-12 5/2016-11-09 10/2016-11-05 50/2016-10-27 10/2016-10-21 5/2016-10-21 5/2016-10-20 20/2016-10-20 10/2016-10-20 5","Pro-bono project ‘Lawyers in the Soup Kitchen’ operates weekly at Brixton Soup Kitchen each Thursday evening between 6pm- 8:30pm.    Our organisation is run by 12 student lawyers  mainly from marginalised groups whom volunteer each week to assist members of the public in their legal queries and problems.    We have been operating since 2014 and have no funding. All our resources come out of our own pockets and all of our time is free.    We are currently looking for some fuding to help us launch a project called ‘Brixton on Trial’  which will launch next summer (date to be confirmed).    The aim of this project is to raise awareness of the following issues which affect our community:    1) Legal Aid Cuts and the work of LISK project    2) Youth Crime and Violence in the Brixton/ Lambeth areas    3) The connections between poverty and crime    4) Encouraging students from disadvantaged backgrounds to pursue careers in law.    We wish to include local ethnic minority lawyers  businesses  students from local secondary schools and members of the public in a mock criminal trial dealing with the above issues.    The trial itself will seek to educate participants on both the processes and procedures of stop and search and a criminal investigation and trial.    We would be most greatful for all donations made towards helping us launch this programme next summer.     Many Thanks    Twanieka Alcindor- Founder   Lawyers In the Soup Kitchen",False
