Title,Location,Link,Raised,Target,MostRecentDonation,Created,Organization,OrganizationDetails,DonationCount,Donations,Description,Complete
" Nobody Should Be Hungry - The Deli Group ","Newton-Le-Willows, North West England, United Kingdom",https://www.gofundme.com/f/nobody-should-be-hungry-the-deli-group,1000,285,2019-12-16,2019-11-17,,,16,"2019-12-16 10/2019-12-09 10/2019-12-05 50/2019-12-05 10/2019-12-05 10/2019-12-05 10/2019-11-30 20/2019-11-18 20/2019-11-18 20/2019-11-17 20/2019-11-17 20/2019-11-17 40/2019-11-17 10/2019-11-17 20/2019-11-17 5/2019-11-17 10","No Questions. No Judgement. Nobody Should be Hungry.      The Deli Group have launched our Christmas Campaign - www.nobodyshouldbehungry.co.uk - offering FREE Christmas Dinners for those in need across the St Helens and Newton-Le-Willows areas.     We're funding this ourselves as much as we are able to  working in conjunction with many of our key suppliers  however lots of incredibly kind and generous customers  friends and neighbours have asked about contributing so that we can help even more people.    We've always been clear that we're not a charity  and we were reluctant to become involved with handling donations as it's so easy for good intentions to be misconstrued or misinterpreted where money is concerned. Having said that  we realise that there is only so much we can do with our own limited resources and the goodwill of our suppliers  so having taken some advice we've set up this GoFundMe page as a means to transparently collect any contributions which you wonderful people may like to make towards this initiative.    To keep things as transparent and open as possible  we've also opened an entirely separate  ring fenced bank account - and we will regularly share details of any contributions and expenditure both here and via our Dentons Deli and Newton Deli social media accounts.    As we've no idea what the cost of providing these meals will be until all bookings are confirmed  it's difficult to set a budget or to stop accepting contributions once the cost has been met  therefore again to keep things open and to ensure that nobody benefits unfairly from the generosity of others  we've decided to donate any surplus to St Helens Foodbank  and again we will share details of this publicly.    Thank you all so very much for your help and support. By working together  we can make such a difference to the lives of those locally who may otherwise be hungry this Christmas.           Please see below details of the campaign -     For many years we’ve not sent Christmas cards or gifts outside of our immediate family  instead giving a donation either of money or our time to charity  to help those in need.    This year  we’ve decided to try to do our bit in ensuring that nobody living locally has to go hungry. Whatever the reasons  and putting politics and judgement aside  far too many people - both adults and children - are going without the food they need to live  which is totally unacceptable when so many have far more than they need. We may not have a lot ourselves  but what little we have we’d like to share to hopefully make things a little easier for others.    So  The Deli Group are pleased to announce the launch of our “Nobody Should Be Hungry” campaign - www.nobodyshouldbehungry.co.uk    If you’re finding things a struggle  or you know somebody who is  we’d like to invite you to book a FREE Christmas Dinner  which will be freshly prepared and delivered on Monday 23rd December between 4pm and 8pm. All meals will be delivered hot and ready to eat  or can be safely kept and re-heated on Christmas Day.    Book online now at www.nobodyshouldbehungry.co.uk - we’re going to work with our suppliers to provide as many meals as we can  but places will be limited both by availability and the time it will take to prepare and deliver so many meals  therefore please book early to avoid disappointment.    Both adult and child sized portions are available  along with the option to collect from our Newton Deli shop or for the meals to be delivered to you at home.    No Questions  No Judgement. NOBODY should EVER be hungry.    Love from Viv  Marc and all of the Deli Group team. x x",False
" Donate your Commute! ","London, Greater London, United Kingdom",https://www.gofundme.com/f/donate-your-commute,1000,619,,2020-03-20,"The Trussell Trust","Registered nonprofitDonations eligible for Gift Aid.",0,,"Donate your commute to help support people at this time    1.3 million food bank parcels were handed out by The Trussell Trust in emergency situations last year. At this time  demand is increasing and services are struggling to fund and source the products necessary. The knock on impact of unfulfilled and precarious contracts  long universal credit delays and food hoarding mean that demand is likely to continue.    This is a period of uncertainty for all of us  but what is certain is the need for community action to support those most vulnerable to both the direct and indirect effects of COVID  which is exacerbating existing patterns of social marginalisation.    To those who are in the privileged position of having secure employment  those who can work from home safely  and those who are able to donate at this time  I encourage you to think creatively about how you can provide support to those most affected  both inside and outside of your own social networks. Make contact with old friends  look out for colleagues  and stay at home where possible. This is a time for solidarity and support.    Donate as you can  or for guidance:  £12 2 post work pints   £15 5 days x 2 bus journeys  £21 7 days x 2 bus journeys   £24 5 days x 2 tube journey   £30 5 days x 2 tube journeys + pint   £37 7 days x 2 tube journeys (+40p)  £42 7 days x 2 tube journeys + pint   £48 10 days x 2 tube journeys  £56 10 days x 2 tube journeys + pint     (Tube = 2.40; Bus = 1.50; Pint = £6)    More information about The Trussell Trust: The Trussell Trust  in conjunction with local communities  develops and runs sustainable projects in the UK tackling poverty and exclusion. Through the UK Foodbank Network and Community Enterprises we work with marginalised people in need  providing practical care and support. www.trusselltrust.org.    ",False
" THE FOODBANK @ YEOVIL COMMUNITY CHURCH ","Sherborne, South West England, United Kingdom",https://www.gofundme.com/f/the-foodbank-yeovil-community-church,1000,1482,2020-04-01,2020-03-21,"YEOVIL CHRISTIAN SUPPORT TRUST","Registered nonprofitDonations eligible for Gift Aid.",13,"2020-04-01 50/2020-03-28 10/2020-03-28 50/2020-03-27 20/2020-03-27 200/2020-03-26 1000/2020-03-26 50/2020-03-26 20/2020-03-23 40/2020-03-22 10/2020-03-21 15/2020-03-21 12/2020-03-21 5","Have YOU seen or used the Yeovil Food Bank based at Yeovil Community Church? I hope you haven't. But many  many see it often  and the need is growing whilst donations are shrinking. Demand over the last couple of weeks has tripled help has not. Can you donate just five pounds to help this crisis? My name is Andy and having lived on the streets  I know what it's like to be hungry and to struggle. I can in some small way understand the fear and worry people would face without this resource. As someone often in the church building  I see first-hand people (often not the ones we 'picture' in our minds)  but everyday hard-working families  people like us  who just need a helping hand. SO I went to Tesco to buy some food for us hoping to donate some too. But there was no food to give so I thought I could give my donation in financial terms - thus allowing Yeovil Christian Support Trust to top up their own surplus and use my gift as they require. Perhaps you would consider doing the same. Could you spare a fiver to help top up the food bank and other groups the Lords larder helps. The church link is https://yeovilcommunitychurch.co.uk and the charity is www.ycstyeovil.org.uk and ALL donations will go directly to them... helping provide food parcels and support all manner of clients in OUR town.   Because who knows in this day and age  when we may need it ourselves. Thank You. I've set the target but would love to see that broken - plus I'm happy to accept silly challenges for money!! Or to rope others in to help with this!!   Andy Robinson - for Yeovil Community (and the community church).  ",False
" Raising money for Guatemala ","Horley, South East England, United Kingdom",https://www.gofundme.com/f/mt26d-raising-money-for-guatemala,1500,1155,2020-07-30,2020-06-24,,,26,"2020-07-30 20/2020-07-23 20/2020-07-20 10/2020-07-11 10/2020-07-10 100/2020-07-10 200/2020-07-10 5/2020-07-10 250/2020-07-06 10/2020-07-02 20/2020-07-02 10/2020-07-02 25/2020-07-02 20/2020-07-02 20/2020-07-02 10/2020-07-01 100/2020-06-29 50/2020-06-28 100/2020-06-28 50/2020-06-28 20/2020-06-27 20/2020-06-26 15/2020-06-25 25/2020-06-25 25/2020-06-25 10/2020-06-25 10","FINANCIAL UPDATE – 15th November 2020    Thank you to everyone who has supported this cause so generously. Through this site as well as other private donations  we raised a total of £2 215 (Q 22 747 Guatemalan Quetzales). Amazing!!!    It is time I reported back more fully on how your generous contributions are being spent.    So far  from this money  we have spent 8566 Quetzales (roughly £834) on medical examinations  care  medication and journeys. Details of these expenses can be seen below. During the process of working with the family  several issues have come to light  mostly the extreme poverty in which they have been living. Their home  which is made of sheets of corrugated iron  is very poorly constructed. It is covered in a sheet of plastic which offers insufficient protection from the weather  continually subjecting the house (and its contents) to damage from rain and flooding. The family also has no access to clean water  which has resulted in poor health  parasites and stomach infections. With regards to the operations we believed were necessary  it turns out that only Alex  the older boy  needs surgery. Alex has  however  chosen to wait until the pandemic lessens because the public hospitals continue to prioritise COVID-19 patients and it is deemed unsafe for non COVID patients. The good news is that the medical examinations showed us that the surgery appears not to be as urgent as previously believed. We will  therefore  wait until there is more capacity in the hospitals to treat non-COVID patients. It has also been agreed by the hospital  that when it does take place  the surgery can be performed without cost. We  therefore  have £1 382 to aid the family in other ways. After much discussion with the family and careful consideration  we have decided to spend your donations as follows. I hope you will support the proposal:-    Asociación Vida will be supporting the family to make improvements to their home  in particular to the roof. The estimated cost for these improvements is £563. They will also install an electric water pump system to enable them to access clean water at the push of a button (cost: £205). Doña Felipa has  unfortunately  accrued some debts as a result of their struggle to survive  and are being hounded constantly to repay the debts. We have agreed to pay off their debts which amount to £390. To help the family to avoid the need for any loans in the future  we have offered to give them £146 in order to help the mother start up an embroidery business. We are also spending £78 on necessary medical care. Asociación Vida are committed to supporting this family as they get back on their feet. As soon as Alex feels that he is happy to go ahead with the surgery  and if it is still deemed necessary  Asociación Vida will support him in journeys to the hospital and so on.    Details of the expenses and budget for the next stage of support can be found below. I know the destination of your donations has changed somewhat  but I hope that you will agree that it will go a long way in helping the family. Photos to follow in due course.    EXPENSES FAMILIA COCON TOMIN  01-Jul Examinations + journeys Q 635.00 £61.80   02-Jul Examinations + journeys Q 875.00 £85.20   03-Jul Examinations + journeys Q 2 400.00 £233.60   24-Jul Examinations + journeys Q 1 416.00 £137.90   30-Jul Examinations + journeys Q 940.00 £91.50   10-Aug Examinations + journeys Q 300.00 £29.20    Administrative costs Q 2 000.00 £194.70   TOTAL Q 8 566.00 £834.20    Remaining balance Q 14 181.00 £1 382.00 (rounded up)        Proposal for family of Doña Felipa Tomin    Cancellation of housing debt Q 4 000.00 £390  credit Banco Azteca     Electric water pump and installation Q 2 100.00 £205    Home improvements Q 5 781.00 £563  2 sheets of corrugated iron Q 3 000.00   wood Q 1 600.00   nails  wire and other accessories Q 281.00   labour costs Q 900.00     medical attention Q 800.00 £78  vitamins and medical examinations    Economic entrepreneur fund Q 1 500.00 £146  money capital for embroidery business    TOTAL Q14 181.00 £1 382    ----------------------------------------------------------------------------    * PLEASE SCROLL DOWN FOR LATEST UPDATES    24th June 2020    As some of you may know  a while back I lived in Guatemala for a year working as a volunteer with the NGO  Asociación Vida*. As well as running a medical centre  they work with some of the poorest communities to improve health  nutrition and living conditions. Patzún  where I lived has a lot of poverty and now  with the current pandemic  this situation has only worsened. As in the UK  people have been unwell or died from the virus and many people have found themselves unable to work - only in Guatemala there is no furlough scheme  no NHS  no foodbank and no benefits of any kind. If a household has absolutely no food  they are draping a white flag out of their home (or just holding it up in the street if they are homeless) and the village will do what they can to share their food.    Through friends of mine living in Patzún  I have recently been introduced to a widow  named Doña Filipa. She lives in a home made of corrugated iron with her three sons  Alex (17 years)  Edy (14) and Jonatan (11). The elder two boys used to help their mother with living costs by doing whatever work they could – manual work  selling ice-creams and so on. However  a month ago (on 6th May)  the sons were out collecting wood for their mother when they slipped and fell 25 metres down a ravine  resulting in one boy having a serious hip and rib injury and the other boy with broken legs. They are bed-ridden and both urgently need medical attention and operations. However  as there is no NHS in Guatemala  they would need to pay the hospital £2000 for this to take place  which is simply not possible.     We have already managed to raise some of this amount  but I wondered if  by sharing their story here  some of my lovely friends might be willing to contribute a small amount towards helping this family out. The money will be sent to Asociación Vida*  who will oversee any support we can offer this family – ideally enabling the sons to receive all the medical attention they need. Any help would be wonderful. If you want more detail about this  please message me – I just didn’t want to write too much on here. Thank you    *Asociación Vida is a registered charity  partnered by Tearfund UK.       Update: 3rd July 2020    I am so grateful to report that we have already raised over £500 towards this cause. Thank you so much for your generosity. The last few days have been spent taking the boys to the clinic in Patzún for some medical checks - and also to the hospital in Chimaltenango for X-rays and consultations with an orthopaedic specialist. The outcome of this visit is that Edy  the younger of the boys  needs an operation to correct the bones that have started to set in the wrong position since the accident took place two months ago. This operation is going to cost 20 000 Quetzales (about £2 085). The elder boy  Alex  will have an MRI scan on his back tomorrow (4th July) and from there a decision will be made about the treatment required. If you are in a position to give anything... we'd be so grateful. If you are not in a position to give financially  we would so value your prayers for these boys. Thank you so much xx      Update: 16th July    Thank you so much for your all your donations. We have all been blown away by your generosity :o)    We are still awaiting an appointment with the neuro specialist (re-scheduled for this Friday) to discuss the findings from Alex’s MRI scan. It is feared he may have serious spinal injuries  which could lead to paralysis. However  due to the COVID 19 outbreak  travelling to the capital for these appointments  amidst the government restrictions  is not proving to be easy at all.    If you are the praying type  please pray that nothing prevents this appointment with the specialist from taking place this Friday. Give thanks for all the money that has been donated and pray that it will be sufficient for both boys to receive the operations and treatment they need.    Thank you so much!      Update: 25th July    Thank you so much to everyone who has donated to this cause. Your generosity has been overwhelming.    Since my last update  the pandemic in Guatemala has worsened as confirmed cases of COVID-19 increase daily alongside the number of deaths caused by the virus. The Government’s very strict lockdown measures have also made it difficult for the boys to be taken to their hospital appointments in the capital  with police issuing fines to people who travel even for medical purposes. Nevertheless  both boys have finally received the results from their X-rays and MRI scans  which were able to take place thanks to your donations. Alex requires the most urgent surgery  as his spinal injuries could easily lead to paralysis. We await news from the hospital about when this can take place. Unfortunately  the Roosevelt hospital  where the procedure will happen  is rampant with COVID-19  with many members of staff and patients having died from the virus. This is obviously of great concern to the family  who  therefore remain somewhat nervous about their upcoming treatment.    If you are the praying type  please pray that the operations will take place soon – and for protection  healing and restoration for the whole family. Amazingly  we should have some surplus money from your donations  so Asociación Vida are making plans to offer further support to this family as well as to others who are also in great need. Please pray for wisdom for them as they seek to best meet the needs of their community at this very pressing time.    Matiox Chawe! (“Thank you so much” in Cakchiquel – the family’s indigenous language)",False
" Four Seasons's campaign for BEDFORD FOODBANK ","Bedford, East of England, United Kingdom",https://www.gofundme.com/f/four-seasons039s-campaign-for-bedford-foodbank,50,260,2020-11-01,2020-10-24,,,17,"2020-11-01 20/2020-10-31 20/2020-10-30 10/2020-10-27 10/2020-10-27 25/2020-10-24 20/2020-10-24 25/2020-10-24 10/2020-10-24 10/2020-10-24 20/2020-10-24 25/2020-10-24 5/2020-10-24 10/2020-10-24 10/2020-10-24 10/2020-10-24 10/2020-10-24 20","After the tremendous response to us offering lunches to eligible children during half term I was asked if kind hearted people could 'pay a few boxes forward""? I very much welcomed this idea but would love to support an extra charity as an additional way of giving back   Do you want to join me in making a difference?   Here at Four Seasons cafe we are raising extra money in aid of BEDFORD FOODBANK and every donation will help. Thank you in advance for your contribution to this cause that means so much to us.  We are very fortunate to have been to see behind the scenes of these charities and how hard they work and I can imagine in this current climate there will be more families needing that little bit of extra help so we would love to be able to support them in anyway we can.     #bedfordkindness  #supportlocal  #givingback",False
" Foodbank support for vulnerable,low income people. ","London, Greater London, United Kingdom",https://www.gofundme.com/f/foodbank-support-for-vulnerablelow-income-people,2000,105,2020-03-31,2020-03-24,,,6,"2020-03-31 10/2020-03-29 50/2020-03-24 10/2020-03-24 10/2020-03-24 5/2020-03-24 20","I'm the director of Operation shutdown organisation CIC.. we support and work with bereaved families  who have lost children to knife crime. We also support young people at risk of offending and we divert them from committing crime. In light of the covid-19 pandemic. Alot of low-income families in the community have reached out to me  they're struggling to feed their children. As they are on low or no income. Local food banks have ran out of food. So me and my team  are appealing for support to buy food vouchers for these people and have food delivered to the disabled and those in self-isolation.   mothers need medicine nappies  wipes  baby milk. Aswell as hot meals and a basic breakfast which they just dont have for their children.    Universal credit takes weeks to come through.. so there is no immediate access to government funds. I have been informed the elderly are starving because they have no family to check in on them and are paralyzed to walk anywhere. We will have food delivered to them..        Let rally together and help those that need it. Nobody should have to starve and be alone in this awful time.    Many thanks in advance for any support you may give.",False
" Dance Cardio Fundraiser ","London, Greater London, United Kingdom",https://www.gofundme.com/f/dance-cardio-fundraiser,100,456,2020-05-21,2020-04-24,"The Trussell Trust","Registered nonprofitDonations eligible for Gift Aid.",40,"2020-05-21 25/2020-05-11 5/2020-04-29 10/2020-04-28 5/2020-04-27 10/2020-04-27 10/2020-04-26 10/2020-04-26 15/2020-04-26 10/2020-04-25 10/2020-04-25 10/2020-04-25 10/2020-04-25 10/2020-04-25 10/2020-04-25 20/2020-04-25 5/2020-04-25 10/2020-04-25 10/2020-04-25 10/2020-04-25 20/2020-04-25 15/2020-04-25 10/2020-04-25 20/2020-04-25 10/2020-04-25 10/2020-04-25 15/2020-04-25 5/2020-04-25 20/2020-04-25 6/2020-04-25 10/2020-04-25 10/2020-04-25 10/2020-04-25 5/2020-04-25 20/2020-04-25 10/2020-04-25 10/2020-04-25 20/2020-04-25 5/2020-04-25 10/2020-04-24 10","Do you want to join me in making a difference? I'm raising money in aid of The Trussell Trust and every donation will help. Thank you in advance for your contribution to this cause that means so much to me.    More information about The Trussell Trust: The Trussell Trust  in conjunction with local communities  develops and runs sustainable projects in the UK tackling poverty and exclusion. Through the UK Foodbank Network and Community Enterprises we work with marginalised people in real need  providing practical care and support.     As the coronavirus pandemic unfolds in the UK  our main priority is ensuring the safety of everyone who comes to a food bank – whether it’s someone needing help  someone volunteering their time  or someone making a donation.  www.trusselltrust.org.",False
" SAVE SALFORD'S FOOD BANKS ","Stockport, North West England, United Kingdom",https://www.gofundme.com/f/save-salford039s-food-banks,150,135,2019-12-18,2019-12-13,,,10,"2019-12-18 20/2019-12-13 20/2019-12-13 15/2019-12-13 10/2019-12-13 10/2019-12-13 15/2019-12-13 25/2019-12-13 5/2019-12-13 5/2019-12-13 10","Hi everyone. If you're devastated by the election result  now is the time for action.     I've arranged a collection for Salford food bank. After facing closure and threat to their current premises earlier this year  they are currently in a precarious situation  and would benefit from the stability of additional donations. If you have any spare cash to donate  even £1 can go a long way.    The City of Salford currently have 4 foodbanks in Swinton  Eccles  Mocha Parade (central Salford) and Salford Quays. These centres are vital for the poorest people in our city - one neighbourhood  near Salford Crescent station  sees more than 50% of families with children living under the poverty line.     According to the centre  hope is not lost  but more needs to be done: ""A volunteer team are in the process of implementing a short-term fundraising strategy to make sure Salford Foodbank can remain open beyond March 2020  and work is underway to develop a longer-term strategy in the new year.""     Let's not give up the good fight.     Ours is a politics of love and compassion!",False
" Raising Funds for Bromley Borough Foodbank ","Orpington, Greater London, United Kingdom",https://www.gofundme.com/f/wpfy2m-kundana039s-campaign-for-bromley-borough-foodbank,1101,-1,2020-09-10,2020-08-18,,,64,"2020-09-10 20/2020-09-06 20/2020-09-02 10/2020-09-01 5/2020-09-01 20/2020-08-31 25/2020-08-30 30/2020-08-29 20/2020-08-29 40/2020-08-29 10/2020-08-28 20/2020-08-26 9/2020-08-24 5/2020-08-23 25/2020-08-23 10/2020-08-23 30/2020-08-21 20/2020-08-20 10/2020-08-20 20/2020-08-20 50/2020-08-20 10/2020-08-19 15/2020-08-19 20/2020-08-19 10/2020-08-19 20/2020-08-19 10/2020-08-19 20/2020-08-19 5/2020-08-19 20/2020-08-19 20/2020-08-19 10/2020-08-19 5/2020-08-19 25/2020-08-19 20/2020-08-19 20/2020-08-19 15/2020-08-19 20/2020-08-19 20/2020-08-19 10/2020-08-19 10/2020-08-19 10/2020-08-19 20/2020-08-19 20/2020-08-19 25/2020-08-19 25/2020-08-19 20/2020-08-19 15/2020-08-19 10/2020-08-19 10/2020-08-19 20/2020-08-19 35/2020-08-19 5/2020-08-19 25/2020-08-19 20/2020-08-19 10/2020-08-19 7/2020-08-19 10/2020-08-19 20/2020-08-19 10/2020-08-19 15/2020-08-19 20/2020-08-19 10/2020-08-19 10/2020-08-19 25",,True
