Title,Location,Link,Raised,Target,MostRecentDonation,Created,Organization,OrganizationDetails,DonationCount,Donations,Description,Complete
" Team 24 Hour Run ","Fraserburgh, Scotland, United Kingdom",https://www.gofundme.com/f/team-24-hour-run,4565,-1,2020-06-15,2020-06-08,,,244,"2020-06-15 10/2020-06-15 20/2020-06-14 50/2020-06-14 30/2020-06-14 10/2020-06-14 10/2020-06-14 10/2020-06-14 20/2020-06-14 10/2020-06-14 10/2020-06-14 20/2020-06-14 10/2020-06-14 10/2020-06-14 20/2020-06-14 10/2020-06-14 20/2020-06-14 20/2020-06-14 50/2020-06-14 10/2020-06-14 20/2020-06-14 5/2020-06-14 10/2020-06-13 10/2020-06-13 7/2020-06-13 20/2020-06-13 20/2020-06-13 10/2020-06-13 10/2020-06-13 10/2020-06-13 10/2020-06-13 20/2020-06-13 10/2020-06-13 10/2020-06-13 30/2020-06-13 10/2020-06-13 20/2020-06-13 10/2020-06-13 20/2020-06-13 10/2020-06-13 10/2020-06-13 5/2020-06-13 10/2020-06-13 30/2020-06-13 10/2020-06-13 20/2020-06-13 10/2020-06-13 10/2020-06-13 20/2020-06-13 20/2020-06-13 10/2020-06-13 10/2020-06-13 20/2020-06-13 20/2020-06-13 20/2020-06-13 20/2020-06-13 10/2020-06-13 20/2020-06-13 20/2020-06-13 20/2020-06-13 10/2020-06-13 20/2020-06-13 20/2020-06-13 10/2020-06-13 20/2020-06-13 20/2020-06-13 30/2020-06-13 5/2020-06-13 20/2020-06-13 23/2020-06-13 20/2020-06-12 10/2020-06-12 10/2020-06-12 100/2020-06-12 20/2020-06-12 10/2020-06-12 20/2020-06-12 20/2020-06-12 20/2020-06-12 50/2020-06-12 50/2020-06-12 10/2020-06-12 10/2020-06-12 10/2020-06-12 14/2020-06-12 10/2020-06-12 16/2020-06-12 20/2020-06-12 6/2020-06-12 20/2020-06-12 10/2020-06-12 10/2020-06-12 10/2020-06-12 20/2020-06-12 20/2020-06-12 10/2020-06-12 20/2020-06-12 20/2020-06-12 20/2020-06-12 10/2020-06-12 5/2020-06-12 10/2020-06-12 10/2020-06-12 10/2020-06-12 10/2020-06-12 10/2020-06-12 10/2020-06-12 10/2020-06-12 10/2020-06-12 20/2020-06-12 10/2020-06-12 10/2020-06-12 20/2020-06-12 20/2020-06-12 20/2020-06-12 20/2020-06-12 10/2020-06-12 20/2020-06-12 30/2020-06-12 20/2020-06-12 10/2020-06-12 20/2020-06-12 30/2020-06-12 30/2020-06-12 10/2020-06-12 10/2020-06-12 10/2020-06-12 20/2020-06-12 10/2020-06-12 10/2020-06-12 20/2020-06-12 10/2020-06-12 20/2020-06-12 20/2020-06-12 20/2020-06-12 10/2020-06-12 10/2020-06-12 20/2020-06-12 50/2020-06-12 25/2020-06-12 10/2020-06-12 50/2020-06-12 10/2020-06-12 10/2020-06-12 30/2020-06-12 40/2020-06-12 10/2020-06-12 10/2020-06-11 40/2020-06-11 10/2020-06-11 10/2020-06-11 10/2020-06-11 10/2020-06-11 24/2020-06-11 10/2020-06-11 5/2020-06-11 15/2020-06-11 10/2020-06-11 10/2020-06-11 10/2020-06-11 10/2020-06-11 20/2020-06-11 50/2020-06-11 10/2020-06-11 20/2020-06-11 10/2020-06-11 10/2020-06-11 50/2020-06-11 30/2020-06-11 10/2020-06-11 10/2020-06-11 10/2020-06-11 10/2020-06-10 20/2020-06-10 20/2020-06-10 10/2020-06-10 10/2020-06-10 15/2020-06-10 20/2020-06-10 20/2020-06-10 20/2020-06-10 20/2020-06-10 5/2020-06-10 10/2020-06-10 10/2020-06-10 10/2020-06-10 10/2020-06-10 20/2020-06-09 10/2020-06-09 10/2020-06-09 50/2020-06-09 20/2020-06-09 25/2020-06-09 30/2020-06-09 50/2020-06-09 30/2020-06-09 20/2020-06-09 20/2020-06-09 10/2020-06-09 20/2020-06-09 10/2020-06-09 10/2020-06-09 20/2020-06-09 10/2020-06-09 10/2020-06-09 20/2020-06-09 150/2020-06-09 20/2020-06-09 10/2020-06-09 10/2020-06-09 10/2020-06-09 50/2020-06-09 20/2020-06-09 5/2020-06-09 30/2020-06-09 10/2020-06-09 50/2020-06-09 50/2020-06-09 10/2020-06-09 20/2020-06-08 10/2020-06-08 30/2020-06-08 50/2020-06-08 20/2020-06-08 20/2020-06-08 20/2020-06-08 10/2020-06-08 20/2020-06-08 10/2020-06-08 20/2020-06-08 20/2020-06-08 10/2020-06-08 50/2020-06-08 10/2020-06-08 10/2020-06-08 10/2020-06-08 50/2020-06-08 10/2020-06-08 20/2020-06-08 10/2020-06-08 40/2020-06-08 40/2020-06-08 50/2020-06-08 20/2020-06-08 20","  Weʼre raising £500 to Help raise funds for the Salvation Army Foodbank in Fraserburgh by taking on the Locos 24 Team Challenge.    Starting on Friday at 7am players and staff at Fraserburgh United will be raising funds to support a local charity. We will be taking on the Locos24 Team Challenge. Everyone will run for 1 hour and the distances recorded using the Strava app. The “running order” for the event will be posted on the clubs Facebook page.    Any contributions would be much appreciated - Wish us luck!    All donations will be passed on to Salvation Army Foodbank in Fraserburgh.",True
" Omnis Highway Solutions Double Ironman ","Scunthorpe, Yorkshire and the Humber, United Kingdom",https://www.gofundme.com/f/omnis-highway-solutions-double-ironman,1000,1683,2020-12-13,2020-11-17,"The Trussell Trust","Registered nonprofitDonations eligible for Gift Aid.",102,"2020-12-13 10/2020-12-13 5/2020-12-13 20/2020-12-13 20/2020-12-13 10/2020-12-13 10/2020-12-13 10/2020-12-13 20/2020-12-13 10/2020-12-13 10/2020-12-13 20/2020-12-13 10/2020-12-13 10/2020-12-13 20/2020-12-13 10/2020-12-13 10/2020-12-13 10/2020-12-13 9/2020-12-13 10/2020-12-13 10/2020-12-12 5/2020-12-12 10/2020-12-12 10/2020-12-12 5/2020-12-12 10/2020-12-12 20/2020-12-12 10/2020-12-12 10/2020-12-12 20/2020-12-12 10/2020-12-12 20/2020-12-11 20/2020-12-11 50/2020-12-11 20/2020-12-11 20/2020-12-11 20/2020-12-11 10/2020-12-11 5/2020-12-10 20/2020-12-10 20/2020-12-10 20/2020-12-10 20/2020-12-10 5/2020-12-10 20/2020-12-10 5/2020-12-10 25/2020-12-10 150/2020-12-10 10/2020-12-10 10/2020-12-10 5/2020-12-10 10/2020-12-10 5/2020-12-10 5/2020-12-10 5/2020-12-10 10/2020-12-10 10/2020-12-10 10/2020-12-10 10/2020-12-10 20/2020-12-10 10/2020-12-10 5/2020-12-10 10/2020-12-10 20/2020-12-10 10/2020-12-10 25/2020-12-10 25/2020-12-10 20/2020-12-09 10/2020-12-09 20/2020-12-09 9/2020-12-09 20/2020-12-09 5/2020-12-08 5/2020-12-08 10/2020-12-08 20/2020-12-08 20/2020-12-08 50/2020-12-08 50/2020-12-07 20/2020-12-07 10/2020-12-07 15/2020-12-06 20/2020-12-06 25/2020-12-06 30/2020-12-06 20/2020-12-06 30/2020-12-04 10/2020-12-03 10/2020-11-24 20/2020-11-22 20/2020-11-20 5/2020-11-19 20/2020-11-19 10/2020-11-19 20/2020-11-17 10/2020-11-17 10/2020-11-17 20/2020-11-17 20/2020-11-17 10/2020-11-17 50/2020-11-17 10/2020-11-17 10","Omnis Highway Solutions will be collectively completing a double Iron man Triathlon to raise funds for The Trussell Trust.     This year has been difficult for everyone  and it has put so much pressure on Charities that provide essential support to families suffering every day. This Christmas  we wanted to give back to those who are struggling over the festive period with a lack of food and shelter.    Will you join us in making a difference? We are raising money in aid of The Trussell Trust and every donation will help. Thank you in advance for your contribution to this cause that means so much!    More information about The Trussell Trust: The Trussell Trust  in conjunction with local communities  develops and runs sustainable projects in the UK tackling poverty and exclusion. Through the UK Foodbank Network and Community Enterprises we work with marginalised people in real need  providing practical care and support. www.trusselltrust.org.",False
" UK Publishing support for The Trussell Trust ","London, Greater London, United Kingdom",https://www.gofundme.com/f/uk-publishing-support-for-the-trussell-trust,11570,-1,2019-12-23,2019-12-17,"The Trussell Trust","Registered nonprofitDonations eligible for Gift Aid.",412,"2019-12-23 25/2019-12-23 20/2019-12-23 25/2019-12-23 20/2019-12-23 100/2019-12-23 300/2019-12-23 30/2019-12-23 10/2019-12-22 10/2019-12-22 10/2019-12-22 20/2019-12-21 40/2019-12-21 10/2019-12-21 10/2019-12-21 10/2019-12-21 30/2019-12-21 100/2019-12-21 10/2019-12-21 10/2019-12-21 100/2019-12-20 5/2019-12-20 20/2019-12-20 5/2019-12-20 50/2019-12-20 5/2019-12-20 30/2019-12-20 20/2019-12-20 20/2019-12-20 20/2019-12-20 100/2019-12-20 100/2019-12-20 60/2019-12-20 30/2019-12-20 10/2019-12-20 10/2019-12-20 25/2019-12-20 10/2019-12-20 250/2019-12-20 10/2019-12-20 20/2019-12-20 10/2019-12-20 20/2019-12-20 10/2019-12-20 50/2019-12-20 20/2019-12-19 20/2019-12-19 10/2019-12-19 10/2019-12-19 10/2019-12-19 5/2019-12-19 10/2019-12-19 25/2019-12-19 10/2019-12-19 100/2019-12-19 10/2019-12-19 25/2019-12-19 5/2019-12-19 20/2019-12-19 22/2019-12-19 10/2019-12-19 25/2019-12-19 10/2019-12-19 30/2019-12-19 20/2019-12-19 50/2019-12-19 20/2019-12-19 20/2019-12-19 30/2019-12-19 20/2019-12-19 20/2019-12-19 20/2019-12-19 5/2019-12-19 15/2019-12-19 20/2019-12-19 5/2019-12-19 35/2019-12-19 20/2019-12-19 20/2019-12-19 20/2019-12-19 10/2019-12-19 20/2019-12-19 20/2019-12-19 10/2019-12-19 10/2019-12-19 20/2019-12-19 10/2019-12-19 20/2019-12-19 25/2019-12-19 10/2019-12-19 20/2019-12-19 130/2019-12-19 10/2019-12-19 15/2019-12-19 10/2019-12-19 9/2019-12-19 5/2019-12-19 6/2019-12-19 5/2019-12-19 20/2019-12-19 10/2019-12-19 10/2019-12-19 5/2019-12-19 18/2019-12-19 5/2019-12-19 20/2019-12-19 30/2019-12-19 20/2019-12-19 10/2019-12-19 20/2019-12-19 10/2019-12-19 10/2019-12-19 20/2019-12-19 20/2019-12-19 20/2019-12-19 10/2019-12-19 10/2019-12-19 20/2019-12-19 10/2019-12-19 10/2019-12-19 100/2019-12-19 20/2019-12-19 10/2019-12-19 20/2019-12-19 5/2019-12-19 5/2019-12-19 50/2019-12-19 10/2019-12-19 10/2019-12-19 10/2019-12-19 20/2019-12-18 10/2019-12-18 10/2019-12-18 10/2019-12-18 10/2019-12-18 10/2019-12-18 5/2019-12-18 10/2019-12-18 15/2019-12-18 20/2019-12-18 10/2019-12-18 10/2019-12-18 15/2019-12-18 10/2019-12-18 10/2019-12-18 20/2019-12-18 20/2019-12-18 5/2019-12-18 25/2019-12-18 25/2019-12-18 20/2019-12-18 40/2019-12-18 5/2019-12-18 10/2019-12-18 6/2019-12-18 20/2019-12-18 15/2019-12-18 25/2019-12-18 10/2019-12-18 25/2019-12-18 20/2019-12-18 20/2019-12-18 10/2019-12-18 15/2019-12-18 10/2019-12-18 5/2019-12-18 100/2019-12-18 20/2019-12-18 5/2019-12-18 20/2019-12-18 10/2019-12-18 20/2019-12-18 20/2019-12-18 20/2019-12-18 10/2019-12-18 20/2019-12-18 20/2019-12-18 20/2019-12-18 20/2019-12-18 10/2019-12-18 10/2019-12-18 10/2019-12-18 30/2019-12-18 50/2019-12-18 20/2019-12-18 30/2019-12-18 50/2019-12-18 100/2019-12-18 20/2019-12-18 50/2019-12-18 10/2019-12-18 100/2019-12-18 20/2019-12-18 10/2019-12-18 25/2019-12-18 30/2019-12-18 20/2019-12-18 10/2019-12-18 50/2019-12-18 20/2019-12-18 40/2019-12-18 10/2019-12-18 50/2019-12-18 10/2019-12-18 50/2019-12-18 20/2019-12-18 10/2019-12-18 20/2019-12-18 15/2019-12-18 35/2019-12-18 100/2019-12-18 20/2019-12-18 70/2019-12-18 50/2019-12-18 40/2019-12-18 5/2019-12-18 20/2019-12-18 10/2019-12-18 25/2019-12-18 20/2019-12-18 10/2019-12-18 15/2019-12-18 20/2019-12-18 20/2019-12-18 15/2019-12-18 20/2019-12-18 25/2019-12-18 27/2019-12-18 20/2019-12-18 20/2019-12-18 15/2019-12-18 20/2019-12-18 30/2019-12-18 20/2019-12-18 25/2019-12-18 15/2019-12-18 10/2019-12-18 10/2019-12-18 25/2019-12-18 10/2019-12-18 5/2019-12-18 25/2019-12-18 10/2019-12-18 50/2019-12-17 25/2019-12-17 20/2019-12-17 5/2019-12-17 5/2019-12-17 15/2019-12-17 10/2019-12-17 50/2019-12-17 20/2019-12-17 10/2019-12-17 10/2019-12-17 50/2019-12-17 10/2019-12-17 25/2019-12-17 10/2019-12-17 20/2019-12-17 30/2019-12-17 7/2019-12-17 20/2019-12-17 10/2019-12-17 30/2019-12-17 5/2019-12-17 30/2019-12-17 50/2019-12-17 25/2019-12-17 20/2019-12-17 20/2019-12-17 10/2019-12-17 10/2019-12-17 100/2019-12-17 50/2019-12-17 30/2019-12-17 100/2019-12-17 5/2019-12-17 10/2019-12-17 15/2019-12-17 15/2019-12-17 50/2019-12-17 15/2019-12-17 20/2019-12-17 25/2019-12-17 25/2019-12-17 20/2019-12-17 25/2019-12-17 30/2019-12-17 25/2019-12-17 20/2019-12-17 30/2019-12-17 25/2019-12-17 100/2019-12-17 50/2019-12-17 20/2019-12-17 10/2019-12-17 20/2019-12-17 10/2019-12-17 200/2019-12-17 10/2019-12-17 20/2019-12-17 100/2019-12-17 20/2019-12-17 25/2019-12-17 20/2019-12-17 50/2019-12-17 10/2019-12-17 20/2019-12-17 10/2019-12-17 25/2019-12-17 50/2019-12-17 30/2019-12-17 20/2019-12-17 50/2019-12-17 15/2019-12-17 20/2019-12-17 15/2019-12-17 50/2019-12-17 25/2019-12-17 50/2019-12-17 10/2019-12-17 15/2019-12-17 50/2019-12-17 50/2019-12-17 20/2019-12-17 20/2019-12-17 20/2019-12-17 25/2019-12-17 10/2019-12-17 20/2019-12-17 50/2019-12-17 50/2019-12-17 25/2019-12-17 15/2019-12-17 20/2019-12-17 20/2019-12-17 50/2019-12-17 20/2019-12-17 25/2019-12-17 20/2019-12-17 30/2019-12-17 15/2019-12-17 10/2019-12-17 30/2019-12-17 30/2019-12-17 10/2019-12-17 10/2019-12-17 10/2019-12-17 25/2019-12-17 20/2019-12-17 20/2019-12-17 20/2019-12-17 20/2019-12-17 20/2019-12-17 10/2019-12-17 20/2019-12-17 20/2019-12-17 400/2019-12-17 20/2019-12-17 10/2019-12-17 10/2019-12-17 50/2019-12-17 20/2019-12-17 30/2019-12-17 10/2019-12-17 50/2019-12-17 20/2019-12-17 15/2019-12-17 20/2019-12-17 15/2019-12-17 20/2019-12-17 30/2019-12-17 50/2019-12-17 20/2019-12-17 10/2019-12-17 20/2019-12-17 20/2019-12-17 50/2019-12-17 25/2019-12-17 20/2019-12-17 15/2019-12-17 100/2019-12-17 10/2019-12-17 20/2019-12-17 100/2019-12-17 20/2019-12-17 20/2019-12-17 50/2019-12-17 300/2019-12-17 10/2019-12-17 10/2019-12-17 50/2019-12-17 250/2019-12-17 20/2019-12-17 10/2019-12-17 20/2019-12-17 10/2019-12-17 20/2019-12-17 20/2019-12-17 50/2019-12-17 20/2019-12-17 20/2019-12-17 5/2019-12-17 20/2019-12-17 200/2019-12-17 30/2019-12-17 10/2019-12-17 20/2019-12-17 40/2019-12-17 20/2019-12-17 20/2019-12-17 20/2019-12-17 20","People from across the UK publishing industry  from editors  booksellers and authors  to publicists  agents and designers  are donating money to go towards helping the acute crisis in poverty and hunger amongst the least well off in the country.    We live in a nation where more than 14 million people are living in poverty – including 4.5 million children. The Trussell Trust has given out over 1.6 million packs of food supplies in the past year alone. Food Banks are not just a place to pick up essential sustenance  with cuts to community centres and frontline services they have also become mini-welfare and advice centres.    We're aiming to raise £5000 before Christmas 2019  which will go to the Trussell Trust. Your donation will directly help those most in need of support. It is vital that those working in publishing come together as a community and take action.    It is important to help those in greatest need but solutions must also be found to the reasons people find themselves in need of food banks.    The Trussell Trust’s CEO Emma Revie has indicated that the benefits system has been driving a rise in foodbank use– the charity released their State of Hunger 2019 report in November.    “This is the busiest six months we’ve ever seen – more people than ever before are being forced to foodbanks’ doors ” said Revie. “Our benefits system is supposed to protect us all from being swept into poverty  but currently thousands of women  men and children are not receiving sufficient protection from destitution. This is not right. But we know this situation can be fixed – our benefits system could be the key to unlocking people from poverty. We need to put money back into the pockets of people who most need our support. It’s in our power as a country to end the need for foodbanks. This can change.”        Thank you for your support.        Kit Caless & Kish Widyaratna     ---    Stats and quote from:  https://www.trusselltrust.org/what-we-do/  https://www.bigissue.com/latest/trussell-trust-foodbanks-deal-with-steepest-rise-in-demand-yet/    More information about The Trussell Trust: The Trussell Trust  in conjunction with local communities  develops and runs sustainable projects in the UK tackling poverty and exclusion. Through the UK Foodbank Network and Community Enterprises we work with marginalised people in real need  providing practical care and support. www.trusselltrust.org.",True
" Fund the North to Free the North ","Warrington, North West England, United Kingdom",https://www.gofundme.com/f/fund-the-north-to-free-the-north,2500,2099,2020-11-30,2020-11-15,,,144,"2020-11-30 5/2020-11-30 10/2020-11-30 25/2020-11-30 29/2020-11-30 10/2020-11-30 10/2020-11-30 10/2020-11-30 35/2020-11-30 10/2020-11-29 5/2020-11-29 20/2020-11-29 20/2020-11-29 20/2020-11-28 5/2020-11-28 20/2020-11-28 5/2020-11-28 10/2020-11-28 5/2020-11-27 10/2020-11-27 10/2020-11-27 5/2020-11-27 30/2020-11-27 10/2020-11-27 5/2020-11-26 5/2020-11-26 20/2020-11-26 13/2020-11-26 5/2020-11-26 100/2020-11-26 5/2020-11-26 16/2020-11-25 10/2020-11-25 5/2020-11-25 20/2020-11-24 5/2020-11-24 11/2020-11-24 5/2020-11-23 10/2020-11-23 10/2020-11-22 20/2020-11-22 20/2020-11-22 20/2020-11-22 5/2020-11-22 10/2020-11-21 25/2020-11-21 20/2020-11-20 10/2020-11-20 10/2020-11-20 10/2020-11-20 25/2020-11-20 5/2020-11-20 5/2020-11-20 10/2020-11-20 10/2020-11-20 5/2020-11-19 10/2020-11-19 5/2020-11-19 10/2020-11-19 50/2020-11-19 50/2020-11-19 20/2020-11-19 5/2020-11-19 5/2020-11-19 10/2020-11-19 5/2020-11-19 10/2020-11-19 10/2020-11-18 15/2020-11-18 10/2020-11-18 10/2020-11-18 10/2020-11-18 10/2020-11-18 20/2020-11-18 10/2020-11-18 20/2020-11-18 20/2020-11-18 10/2020-11-18 15/2020-11-18 10/2020-11-18 15/2020-11-18 10/2020-11-18 15/2020-11-18 10/2020-11-18 10/2020-11-17 5/2020-11-17 10/2020-11-17 5/2020-11-17 20/2020-11-17 10/2020-11-17 5/2020-11-17 10/2020-11-17 5/2020-11-17 5/2020-11-17 10/2020-11-17 10/2020-11-17 10/2020-11-17 10/2020-11-17 20/2020-11-17 10/2020-11-16 50/2020-11-16 10/2020-11-16 20/2020-11-16 20/2020-11-16 5/2020-11-16 5/2020-11-16 10/2020-11-16 20/2020-11-16 50/2020-11-16 40/2020-11-15 10/2020-11-15 10/2020-11-15 10/2020-11-15 10/2020-11-15 25/2020-11-15 10/2020-11-15 50/2020-11-15 10/2020-11-15 10/2020-11-15 5/2020-11-15 10/2020-11-15 20/2020-11-15 5/2020-11-15 5/2020-11-15 5/2020-11-15 10/2020-11-15 10/2020-11-15 5/2020-11-15 5/2020-11-15 100/2020-11-15 10/2020-11-15 20/2020-11-15 5/2020-11-15 5/2020-11-15 5/2020-11-15 60/2020-11-15 5/2020-11-15 10/2020-11-15 10/2020-11-15 5/2020-11-15 10/2020-11-15 50/2020-11-15 5/2020-11-15 10/2020-11-15 5","The Northern Independence Party is a grassroots movement campaigning for a referendum on an Independent Northern England. Our party no longer trusts in the ‘generosity’ of Westminster to bridge the centuries old North-South divide. This tried and tested approach is destined to fail. The centrality of London  with its capacity to gobble-up all of this country’s assets  is built into the very fabric of the ‘United Kingdom.’ Infrastructure  people  resources  opportunities: all filter south by design. We believe  then  that only through a referendum – with a resounding ‘yes’ – will we solve  once and for all  that vast array of economic and social disparities that split this island in two. We have over 200 active volunteers using a free Slack workspace. But we have hundreds more signed up and waiting to join. Our next obstacle to overcome is to invest in a membership system and organisational tools so we can become sustainable and begin organising activities leading up to us challenging council seats in the local elections of 2021.     We are a transparent party run by ordinary Northerners. We have no secret donors or other means of generating an income. Our spend to date on the movement was £1.19 to register a domain name. But we have reached the point where we cannot go any further without incurring some additional expenses. We need: A Membership System Banking costs Zoom Professional A Virtual Business Workspace    You can read more about our party here: https://www.redpepper.org.uk/the-case-for-northern-independence/    Or follow us on Twitter @FreeNorthNow    --    This is a difficult time for many so you shouldn't feel bad if you aren't in a position to contribute financially right now. We're grateful to have your support. If you're finding things difficult yourself  you can find help through Citizens Advice  your local council  the Trussell Trust  or through the links we've gathered below.    https://www.trusselltrust.org/get-help/find-a-foodbank/    https://england.shelter.org.uk/get_help    https://www.citizensadvice.org.uk/benefits/help-if-on-a-low-income/using-a-food-bank/    https://www.stepchange.org/debt-info/emergency-funding.aspx    https://www.ageuk.org.uk/information-advice/money-legal/benefits-entitlements/how-to-get-help-with-urgent-or-one-off-expenses/",False
" FAMILY CHRISTMAS DINNER HAMPERS FUNDRAISER ","Thurlstone, Yorkshire and the Humber, United Kingdom",https://www.gofundme.com/f/family-christmas-dinner-hampers-fundraiser,1500,2576,2020-12-13,2020-10-28,,,106,"2020-12-13 40/2020-12-12 20/2020-12-12 30/2020-12-12 30/2020-12-11 20/2020-12-11 10/2020-12-11 30/2020-12-11 20/2020-12-11 30/2020-12-11 10/2020-12-11 50/2020-12-10 100/2020-12-10 20/2020-12-10 20/2020-12-10 5/2020-12-10 10/2020-12-10 21/2020-12-10 10/2020-12-10 10/2020-12-10 15/2020-12-07 30/2020-12-07 30/2020-12-06 20/2020-12-03 15/2020-11-28 100/2020-11-27 20/2020-11-27 15/2020-11-27 10/2020-11-27 20/2020-11-26 20/2020-11-26 10/2020-11-25 10/2020-11-25 15/2020-11-24 10/2020-11-22 25/2020-11-22 100/2020-11-21 40/2020-11-21 10/2020-11-20 50/2020-11-20 5/2020-11-20 10/2020-11-20 50/2020-11-20 100/2020-11-20 10/2020-11-20 10/2020-11-20 10/2020-11-19 20/2020-11-18 20/2020-11-18 20/2020-11-16 10/2020-11-15 20/2020-11-15 20/2020-11-13 20/2020-11-13 20/2020-11-12 20/2020-11-12 20/2020-11-12 20/2020-11-12 15/2020-11-12 20/2020-11-12 20/2020-11-10 20/2020-11-10 25/2020-11-10 20/2020-11-10 15/2020-11-10 5/2020-11-10 35/2020-11-10 30/2020-11-09 35/2020-11-09 30/2020-11-09 40/2020-11-09 10/2020-11-09 10/2020-11-09 40/2020-11-09 25/2020-11-09 20/2020-11-09 10/2020-11-09 20/2020-11-09 15/2020-11-07 70/2020-11-05 25/2020-11-02 10/2020-11-01 20/2020-11-01 20/2020-11-01 20/2020-11-01 25/2020-11-01 30/2020-11-01 30/2020-10-30 20/2020-10-30 15/2020-10-30 20/2020-10-30 10/2020-10-29 30/2020-10-29 10/2020-10-29 20/2020-10-29 20/2020-10-29 30/2020-10-29 25/2020-10-29 10/2020-10-29 20/2020-10-29 30/2020-10-29 40/2020-10-29 10/2020-10-29 20/2020-10-29 20/2020-10-29 20/2020-10-29 40","Christmas can be financially difficult enough at the best of times  but in these difficult times we are presently living in  I'd like to donate Christmas dinner hampers to families in need in our area  and to our local foodbank in the week before Christmas.     Many extremely lovely and generous people have offered to donate actual food  but many have said they'd prefer to donate financially to support the cause.     Hence  I'm opening this fundraiser  (with full transparency on request ) in order to facilitate these generous peoples offers of financial support.",False
" Walk not talk ","Dungannon, Northern Ireland, United Kingdom",https://www.gofundme.com/f/walk-not-talk,250,4649,2020-12-13,2020-11-16,,,146,"2020-12-13 10/2020-12-13 20/2020-12-13 20/2020-12-13 10/2020-12-13 10/2020-12-13 20/2020-12-13 20/2020-12-12 20/2020-12-12 10/2020-12-12 10/2020-12-11 20/2020-12-11 10/2020-12-11 10/2020-12-11 30/2020-12-11 10/2020-12-11 20/2020-12-11 10/2020-12-10 20/2020-12-10 10/2020-12-09 20/2020-12-09 10/2020-12-09 20/2020-12-09 30/2020-12-08 50/2020-12-07 10/2020-12-07 20/2020-12-07 20/2020-12-06 50/2020-12-06 10/2020-12-06 20/2020-12-05 10/2020-12-05 20/2020-12-05 10/2020-12-05 10/2020-12-05 20/2020-12-05 10/2020-12-04 20/2020-12-04 20/2020-12-04 50/2020-12-04 20/2020-12-04 20/2020-12-04 20/2020-12-04 15/2020-12-04 5/2020-12-03 20/2020-12-02 200/2020-12-02 20/2020-11-30 20/2020-11-30 10/2020-11-30 100/2020-11-30 1000/2020-11-29 10/2020-11-29 20/2020-11-29 20/2020-11-29 10/2020-11-29 20/2020-11-28 20/2020-11-28 20/2020-11-28 30/2020-11-28 30/2020-11-27 10/2020-11-27 15/2020-11-27 20/2020-11-27 10/2020-11-27 20/2020-11-27 10/2020-11-27 10/2020-11-27 10/2020-11-27 20/2020-11-27 10/2020-11-27 25/2020-11-27 20/2020-11-26 10/2020-11-26 50/2020-11-25 20/2020-11-25 5/2020-11-25 20/2020-11-24 100/2020-11-24 20/2020-11-23 10/2020-11-22 30/2020-11-22 15/2020-11-22 50/2020-11-22 10/2020-11-22 10/2020-11-22 50/2020-11-21 10/2020-11-21 15/2020-11-21 20/2020-11-21 20/2020-11-21 20/2020-11-21 50/2020-11-21 30/2020-11-21 5/2020-11-21 20/2020-11-20 20/2020-11-20 50/2020-11-20 40/2020-11-20 10/2020-11-20 20/2020-11-20 10/2020-11-20 20/2020-11-20 20/2020-11-20 10/2020-11-20 50/2020-11-20 5/2020-11-19 25/2020-11-19 20/2020-11-19 10/2020-11-19 20/2020-11-19 10/2020-11-19 5/2020-11-19 10/2020-11-19 10/2020-11-19 30/2020-11-19 5/2020-11-19 20/2020-11-19 20/2020-11-19 20/2020-11-18 10/2020-11-18 10/2020-11-18 40/2020-11-18 10/2020-11-18 20/2020-11-18 20/2020-11-18 10/2020-11-18 19/2020-11-18 30/2020-11-18 30/2020-11-17 10/2020-11-17 20/2020-11-17 20/2020-11-17 10/2020-11-17 500/2020-11-17 20/2020-11-17 20/2020-11-17 10/2020-11-17 10/2020-11-17 10/2020-11-17 100/2020-11-17 10/2020-11-17 10/2020-11-17 50/2020-11-17 10/2020-11-16 30/2020-11-16 30","So have been talking about how we can take Christmas for granted and how it isn’t the case for some. So have decided I’m going to walk instead of talk about it. My plan is to walk 5km everyday up to Sunday 20th December and give any donations made to St Vincent de Paul and Coalisland Community Foodbank. Together we can add a little sparkle to someone else’s Christmas.",False
