Title,Location,Link,Raised,Target,MostRecentDonation,Created,Organization,OrganizationDetails,DonationCount,Donations,Description,Complete
" Romney Marsh Morris for Shepway Food Bank at Xmas ","Ashford, South East England, United Kingdom",https://www.gofundme.com/f/romney-marsh-morris-for-shepway-food-bank-at-xmas,360,462,2019-12-15,2019-12-05,,,16,"2019-12-15 93/2019-12-15 20/2019-12-14 30/2019-12-14 39/2019-12-14 20/2019-12-14 20/2019-12-12 10/2019-12-07 45/2019-12-06 25/2019-12-06 20/2019-12-06 40/2019-12-06 20/2019-12-06 20/2019-12-06 20/2019-12-06 20/2019-12-06 20","This year the Romney Marsh Morris have been collecting money for their chosen annual charity - The Shepway Food Bank. We are £364 away from raising £1000 to support the local community foodbank which is straining under the pressure of more and more users. We will be making donations rather than sending Christmas cards to eachother. Will you do something for your community this Christmas?",False
" Alchemy Aid ","Braintree, East of England, United Kingdom",https://www.gofundme.com/f/ddnv8m-alchemy-aid,1750,1070,2020-12-02,2020-11-03,,,42,"2020-12-02 10/2020-12-01 10/2020-11-29 75/2020-11-23 10/2020-11-23 10/2020-11-23 5/2020-11-20 20/2020-11-19 30/2020-11-19 10/2020-11-18 12/2020-11-18 20/2020-11-18 5/2020-11-18 20/2020-11-18 25/2020-11-17 5/2020-11-17 5/2020-11-17 20/2020-11-17 40/2020-11-17 86/2020-11-16 10/2020-11-16 17/2020-11-16 5/2020-11-16 10/2020-11-16 34/2020-11-16 10/2020-11-13 11/2020-11-13 5/2020-11-13 5/2020-11-13 20/2020-11-13 80/2020-11-12 30/2020-11-12 10/2020-11-11 65/2020-11-09 20/2020-11-08 20/2020-11-03 20/2020-11-03 10/2020-11-03 50/2020-11-03 20/2020-11-03 100/2020-11-03 50/2020-11-03 50","Following the events of 2020 and the resulting increasing hardship faced by many  Alchemy has decided to help raise money and awareness for vulnerable people in need of shelter  food  basic items and mental health support in the UK.    We aim to raise at least £1 750 by mid-December  to be distributed across local food banks and charities supporting both children and adults across the UK.    Please can you help us to meet and exceed our target?     We would greatly appreciate your help in supporting us as we try to make a difference!    If you would like to get involved and help us to fundraise or donate  please do get in touch…    Thank you for your help and support    Take care and stay safe     Alchemy    #alchemyaid #foodbanks #community #children #hunger #marcusrashford #foodbank #donate #donations #charity #fundraising #food #community #giveback #support #schoolmeals #basicnecessities",False
" A gift for Kelly’s children xxx ","Pontypridd, Wales, United Kingdom",https://www.gofundme.com/f/x2rvn-kelly,1000,1530,2020-10-31,2020-10-08,,,92,"2020-10-31 10/2020-10-23 80/2020-10-21 10/2020-10-21 10/2020-10-20 25/2020-10-19 5/2020-10-18 10/2020-10-18 10/2020-10-17 10/2020-10-17 10/2020-10-16 10/2020-10-15 10/2020-10-14 10/2020-10-14 20/2020-10-14 30/2020-10-14 20/2020-10-13 10/2020-10-13 20/2020-10-13 10/2020-10-12 20/2020-10-12 10/2020-10-12 50/2020-10-12 10/2020-10-11 15/2020-10-11 10/2020-10-11 10/2020-10-11 20/2020-10-11 10/2020-10-11 20/2020-10-11 10/2020-10-11 10/2020-10-10 5/2020-10-10 5/2020-10-10 20/2020-10-10 10/2020-10-10 5/2020-10-10 10/2020-10-10 20/2020-10-10 10/2020-10-10 10/2020-10-10 10/2020-10-10 20/2020-10-10 10/2020-10-10 20/2020-10-10 20/2020-10-10 50/2020-10-10 20/2020-10-10 10/2020-10-10 10/2020-10-10 10/2020-10-10 10/2020-10-09 10/2020-10-09 50/2020-10-09 10/2020-10-09 20/2020-10-09 10/2020-10-09 10/2020-10-09 10/2020-10-09 50/2020-10-09 10/2020-10-09 20/2020-10-09 10/2020-10-09 10/2020-10-09 20/2020-10-09 50/2020-10-09 20/2020-10-09 40/2020-10-09 20/2020-10-09 30/2020-10-09 10/2020-10-09 10/2020-10-09 40/2020-10-09 10/2020-10-09 20/2020-10-09 10/2020-10-09 10/2020-10-09 10/2020-10-09 10/2020-10-09 10/2020-10-09 20/2020-10-09 10/2020-10-09 10/2020-10-09 10/2020-10-09 10/2020-10-09 10/2020-10-09 20/2020-10-09 10/2020-10-09 10/2020-10-09 10/2020-10-09 20/2020-10-09 20/2020-10-09 30","On Tuesday 6th of October we lost beautiful Kelly Griffiths from our community  she will be truly missed by many of us.  Kelly’s family have been left devastated & heartbroken from the loss of a gentle  kind  crazy  friendly  fun loving lady.   Everyone knew her for her fantastic crazy laugh which would cheer anyone up after hearing it. I personally knew her for her kindness  always giving to help people in need  such as the homeless & the foodbank.      We all feel helpless because there’s nothing we can do or say to help ease the pain that Kelly’s children & family have in their hearts.    If anyone would like to help give some support for Kelly’s children  I’ve set up this Gofundme page.    Any money kindly given will be entrusted into their Bamp’s bank account  and will be used for things they may need in the future.   Thank you all  stay safe     Natalie xx ",False
" Let's Help the NHS One Scone at a Time! ","Edinburgh, Scotland, United Kingdom",https://www.gofundme.com/f/let039s-help-the-nhs-one-scone-at-a-time,250,225,2020-03-26,2020-03-23,,,11,"2020-03-26 5/2020-03-24 10/2020-03-24 100/2020-03-23 20/2020-03-23 20/2020-03-23 5/2020-03-23 10/2020-03-23 20/2020-03-23 15/2020-03-23 10/2020-03-23 10","Hello there.    My name is Stan Intihar and I am a high school English teacher (and part-time illustrator) here in Edinburgh.    As the situation here (and around the world) worsens  the level of suffering for the patients AND the medical staff trying to help them will become increasingly obvious.    For years I have been involved in the Parent Council Cafes at the schools of both of our children and I have become *moderately* adept at baking scones (insert cheezy smile emoji).    Having 3 asthma sufferers in our family  we have received excellent care from the NHS over the years. Now I plan to show some thanks by setting up a wee ""Scone Stall"" at the exit of the Royal Infirmary at Little France. Upon the presentation of an i.d. badge  the holder will be entitled to a scone (plain  w/ butter  w/butter & jam and gluten-free  if there's enough demand). I will also be asking these staff members what kind of provisions/items would be helpful from a roadside stall. I hope the stall will then expand and develop so that we can show these people that we are behind them.    I will be in need of flour  butter  milk etc.    In addition  I am trying to raise awareness of the situation by designing a number of stickers which will be given away for free. As with the scones  I am only interested in covering my costs. This whole operation is NOT FOR PROFIT. If this is of interest  please check out my web site for updates:     www.stinkdesigns.com    And  depending on the response  I will donate any surplus funds to the Trussell Trust Foodbank.    And...if you want to become directly involved  please get in touch via my website.    If you've read this far. Thank you.    The NHS needs us. Let's show them some love.    Cheers   Stan.",False
" Emergency food parcels - Bevendean & Moulsecoomb","Brighton, South East England, United Kingdom",https://www.gofundme.com/f/emergency-food-bevendean-amp-moulsecoomb-food-bank,2500,770,2020-07-11,2020-05-06,,,38,"2020-07-11 5/2020-07-11 5/2020-07-10 10/2020-07-04 30/2020-07-04 10/2020-07-04 5/2020-07-04 30/2020-07-04 10/2020-07-03 20/2020-06-21 40/2020-06-10 5/2020-06-10 10/2020-05-30 20/2020-05-23 10/2020-05-21 50/2020-05-20 20/2020-05-19 20/2020-05-19 15/2020-05-19 20/2020-05-19 50/2020-05-17 50/2020-05-16 10/2020-05-16 50/2020-05-16 20/2020-05-15 20/2020-05-15 5/2020-05-08 20/2020-05-08 5/2020-05-08 5/2020-05-08 65/2020-05-08 30/2020-05-08 20/2020-05-08 20/2020-05-08 20/2020-05-08 10/2020-05-08 5/2020-05-08 20/2020-05-08 10","We are the Bevendean Foodbank  Coffee Morning & Advice Drop-in  which usually runs weekly drop-in sessions on a Wednesday. Since the outbreak of Covid-19  we have drastically changed the way we are working. We have switched to delivery-only food parcels in Moulsecoomb & Bevendean  and have seen an increase in demand from the first week. With more than 50 households now on our delivery list  we are in constant need of food donations. Many kind people  organisations and businesses have supported us  but to make sure we are able to continue delivering to an ever-increasing amount of households in our area  we are now seeking more support to be able to buy in food and items we desperately need but not always get through donations. We know the need won't end when the outbreak and lockdown is over  and any funding will help us bridge to a way back to our drop-in sessions. We expect that even when the Food bank can open its doors again  and people can come out to socialise and get advice and support in person  the world will still look different  so we want to be prepared for this transition period. Your support is very much appreciated by community we support and the many fantastic volunteers we are supported by. THANK YOU from all of us at the Bevendean Foodbank Committee.    More information about our work can be found here: https://www.facebook.com/FoodbankandAdviceinBevendean/",False
" Food for Fife - Fitness fundraiser by James Yule ","Saint Andrews, Scotland, United Kingdom",https://www.gofundme.com/f/food-for-fife,1000,1225,2020-06-06,2020-04-19,,,68,"2020-06-06 30/2020-05-29 5/2020-05-28 20/2020-05-28 20/2020-05-26 10/2020-05-24 20/2020-05-22 10/2020-05-21 10/2020-05-20 15/2020-05-20 10/2020-05-14 15/2020-05-14 20/2020-05-14 10/2020-05-13 20/2020-05-13 20/2020-05-13 20/2020-05-13 10/2020-05-11 10/2020-05-11 20/2020-05-10 5/2020-05-10 10/2020-05-10 10/2020-05-09 10/2020-05-09 10/2020-05-09 10/2020-05-09 30/2020-05-08 20/2020-05-08 25/2020-05-08 10/2020-05-07 20/2020-05-03 20/2020-05-02 10/2020-05-02 30/2020-05-01 10/2020-05-01 10/2020-05-01 5/2020-04-29 5/2020-04-26 30/2020-04-24 10/2020-04-24 10/2020-04-24 50/2020-04-24 10/2020-04-24 40/2020-04-24 20/2020-04-24 10/2020-04-24 5/2020-04-23 10/2020-04-23 50/2020-04-23 25/2020-04-23 20/2020-04-23 10/2020-04-23 50/2020-04-23 10/2020-04-22 10/2020-04-22 30/2020-04-22 10/2020-04-22 20/2020-04-21 40/2020-04-21 20/2020-04-20 50/2020-04-20 20/2020-04-20 10/2020-04-20 20/2020-04-20 10/2020-04-20 30/2020-04-20 10/2020-04-20 20/2020-04-20 20","Who and What?    My Dad  James Yule  recently turned 81 and  being on housebound lockdown for 12 weeks  he decided to do Couch to 5k on the back garden path.    (When my friends heard about Major Tom’s 100 laps for NHS  they thought it was my Dad!) Why?  Someone  BP  from a group he’s on  posted on the group page that - even though James didn’t ask for it - BP wants to sponsor him to complete his challenge  and he offered a donation to a charity of James’s choice!    This gave James his altruistic idea - That if people would like to encourage him to do it  by way of sponsorship  and other people can benefit from what he’s doing  then why would he get in the way of such generosity?!    As food and basic health needs are so fundamental/crucial for the people in the world who are most struggling  he would like the raised monies to go to the local food bank and/or care needs in the community.  St. Andrews Foodbank says:    “Those we serve may have lost their job  had a family split up  be victims of domestic violence  or had benefits delayed or suspended. In desperate times we are able to meet their immediate need for food.”  May we extend our human kindness to them.    How?  So  to make it easier for you to give  if you feel inclined  I’ve set up this page.    I will post updates between now and the end of May  by which he hopes to be able to complete a 5km run  actually running  for the half hour that the programme builds runners up to (and do the remainder by whichever means)!    What makes this a challenge  you might ask?   Doesn’t James do the Parkrun?    Indeed  James has done the Parkrun  before  and consistently since my Mum died  a year ago today  20th April.    He also has angina  a heart condition which makes running that bit more challenging for his body. So he will be doing it gradually/sustainably.    His mind/heart  whilst keeping it fit and agile - as well as desiring to support other people in the community to be well and healthy - is determined. How can you help?    With the challenge food banks face in receiving food from their usual sources (church congregations  supermarkets etc)  you giving money to this cause will ensure food banks are stocked  and people who need the support they offer can still access it.    Thank you for your generous support and donations.    Amitaśūrī  and James    ",False
" Paul's fundraiser for High Street Community Hub ","Beeston, East Midlands, United Kingdom",https://www.gofundme.com/f/paul039s-fundraiser-for-high-street-community-hub,1000,1142,2020-06-04,2020-05-17,,,49,"2020-06-04 10/2020-06-01 15/2020-05-31 5/2020-05-30 20/2020-05-30 10/2020-05-30 15/2020-05-30 20/2020-05-30 20/2020-05-30 10/2020-05-29 20/2020-05-29 5/2020-05-29 20/2020-05-29 5/2020-05-29 5/2020-05-29 5/2020-05-29 10/2020-05-29 10/2020-05-29 10/2020-05-29 10/2020-05-29 10/2020-05-29 5/2020-05-29 6/2020-05-29 5/2020-05-29 30/2020-05-29 10/2020-05-29 20/2020-05-29 61/2020-05-29 10/2020-05-29 10/2020-05-29 25/2020-05-29 20/2020-05-29 100/2020-05-29 10/2020-05-29 20/2020-05-28 50/2020-05-28 5/2020-05-28 20/2020-05-28 135/2020-05-28 20/2020-05-28 20/2020-05-27 10/2020-05-26 50/2020-05-23 25/2020-05-23 30/2020-05-22 10/2020-05-22 160/2020-05-21 10/2020-05-17 10/2020-05-17 20","Since 2015 We Shall Overcome organisers and performers have helped put together more than 1100 gigs raising an estimated £500 000 of cash  food  clothing and bedding for those hardest hit by austerity. I'm proud to have played a small part in helping to organise a few of these fundraising gigs over the last few years. Whilst we cannot arrange any performances in venues at the moment the movement continues virtually and I have arranged an online get together on Friday 29th May to celebrate my birthday. Money raised will go towards the High Street Community Hub foodbank. As well as volunteering there I have been extremely grateful to them for accepting referrals from the Beeston Chilwell Area Mutual Aid Group that I helped to set up. It is no exaggeration to say that people in need would be going hungry without their ongoing efforts of solidarity.     I feel truly blessed to have so many talented friends who have agreed to perform for this fundraiser in collaboration with WSO Nottingham and hopefully raise some much needed funding for the fabulous work being undertaken here in Broxtowe by the High Street Community Hub. Please join me for the evening of Friday 29th May  invite friends and donate if you are able. The live performances and videos will be shared in a private Facebook Group that you need to join via the following link - https://www.facebook.com/groups/2648510692141215/    IF YOU HAVE ANY PROBLEM ACCESSING THE EVENT PLEASE EMAIL OR PHONE - [email redacted] / 07501453628.   Thanks.✊❤ #SolidarityNotCharity #WeShallOvercome",False
" Little Learners goes running.... ","Corby, East Midlands, United Kingdom",https://www.gofundme.com/f/little-learners-goes-running,200,635,2020-12-10,2020-11-10,,,39,"2020-12-10 30/2020-12-08 5/2020-12-07 110/2020-12-06 15/2020-12-05 10/2020-12-05 15/2020-12-05 20/2020-12-05 10/2020-12-05 10/2020-12-05 10/2020-12-05 20/2020-12-05 5/2020-12-04 10/2020-12-04 5/2020-12-04 20/2020-12-04 25/2020-12-04 10/2020-12-03 20/2020-12-03 20/2020-12-02 15/2020-12-02 20/2020-12-02 10/2020-12-01 30/2020-12-01 10/2020-12-01 10/2020-11-30 15/2020-11-30 10/2020-11-30 20/2020-11-24 5/2020-11-21 10/2020-11-21 10/2020-11-20 20/2020-11-20 10/2020-11-20 10/2020-11-19 10/2020-11-19 10/2020-11-19 15/2020-11-12 10/2020-11-10 15","Little Learners Corby    As a team we've recently been discussing how to give back and support our local community in more ways. Life has been so different and we want to make a positive impact for everyone involved.     On Saturday December 5th  many of our staff team will be completing a sponsored run/jog/walk to raise money for Corby Food Bank. This is a cause so close to our hearts as we know how much their support is needed by so many in our local community. We're collecting donations of food just outside nursery  but would love to help as much as we can. We will also be sharing information of how to access the foodbank on our nursery notice board too.     We'll keep you up to date with our progress and location of our sponsored run. Due to lockdown this may be together or separate  we're not sure yet (but it will be socially distanced). We'll let you know as soon as we do!    Will it be a battle of the teams? We just don't know... you tell us!    We'll be announcing our competing staff on facebook shortly!      If you are in a position to support our staff team we would really appreciate it :)",False
" Nexus Studios: Supporting Hackney Foodbank ","Nexus Productions Ltd, Greater London, United Kingdom",https://www.gofundme.com/f/nexus-studios-hackney-foodbank,1000,1140,2020-04-27,2020-04-03,"THE HACKNEY FOODBANK","Registered nonprofitDonations eligible for Gift Aid.",61,"2020-04-27 25/2020-04-27 20/2020-04-27 20/2020-04-27 20/2020-04-27 20/2020-04-27 25/2020-04-27 10/2020-04-27 20/2020-04-24 10/2020-04-21 150/2020-04-21 20/2020-04-21 10/2020-04-21 20/2020-04-21 20/2020-04-21 10/2020-04-16 20/2020-04-15 10/2020-04-14 20/2020-04-14 25/2020-04-14 20/2020-04-14 5/2020-04-14 50/2020-04-11 30/2020-04-09 10/2020-04-09 50/2020-04-07 30/2020-04-06 50/2020-04-06 10/2020-04-06 20/2020-04-06 10/2020-04-06 10/2020-04-06 20/2020-04-06 10/2020-04-06 10/2020-04-06 20/2020-04-06 10/2020-04-06 10/2020-04-05 15/2020-04-03 20/2020-04-03 10/2020-04-03 10/2020-04-03 10/2020-04-03 20/2020-04-03 10/2020-04-03 10/2020-04-03 10/2020-04-03 10/2020-04-03 20/2020-04-03 10/2020-04-03 10/2020-04-03 20/2020-04-03 10/2020-04-03 10/2020-04-03 20/2020-04-03 10/2020-04-03 10/2020-04-03 10/2020-04-03 10/2020-04-03 5/2020-04-03 10/2020-04-03 10","We believe as a company that now more than ever  Foodbanks need our help and support through these difficult times.     With an increase in the number of people out of jobs due to COVID-19  there has been a higher demand and pressure put on food banks to supply to the vulnerable  elderly and poor families.     Emma Revie  the chief executive of the Trussell Trust  the UK’s largest network of foodbanks said “It’s really concerning...We are anticipating a significant increase in users as more people are unable to work.”    Based in Shoreditch London  we will be supporting our local Hackney Foodbank. At this time  we also incentivise anyone willing to do more for their communities and help people in this pandemic.     Check out other notable fundraisers below    Donate a ride for the NHS (Addison Lee)   https://www.gofundme.com/f/donate-a-ride-for-the-nhs    Frontline Medical Support to NHS  https://www.gofundme.com/f/frontline-medical-support    Helping hands (Beauty Banks)   https://www.gofundme.com/f/helpinghands-for-covid19      Thank you for your generosity.     Stay safe    Nexus Studios",False
" Bradford NHS and Bradford foodbank ","Menston, Yorkshire and the Humber, United Kingdom",https://www.gofundme.com/f/bradford-nhs-and-bradford-foodbank,5000,6665,2020-05-02,2020-04-16,,,100,"2020-05-02 15/2020-05-01 30/2020-05-01 90/2020-05-01 15/2020-05-01 15/2020-05-01 50/2020-04-30 15/2020-04-30 15/2020-04-30 10/2020-04-30 10/2020-04-30 15/2020-04-30 15/2020-04-30 15/2020-04-30 15/2020-04-29 30/2020-04-29 15/2020-04-29 15/2020-04-29 15/2020-04-28 15/2020-04-28 15/2020-04-28 15/2020-04-27 75/2020-04-27 15/2020-04-27 30/2020-04-27 15/2020-04-27 20/2020-04-26 15/2020-04-26 15/2020-04-25 30/2020-04-25 20/2020-04-25 15/2020-04-25 5/2020-04-25 20/2020-04-25 20/2020-04-25 30/2020-04-24 15/2020-04-24 15/2020-04-24 20/2020-04-24 500/2020-04-24 15/2020-04-24 15/2020-04-24 30/2020-04-24 15/2020-04-24 15/2020-04-24 15/2020-04-24 15/2020-04-24 30/2020-04-24 15/2020-04-24 15/2020-04-24 15/2020-04-24 15/2020-04-24 5/2020-04-24 10/2020-04-24 30/2020-04-24 5/2020-04-24 15/2020-04-24 15/2020-04-24 15/2020-04-24 15/2020-04-24 15/2020-04-23 45/2020-04-23 15/2020-04-23 15/2020-04-23 15/2020-04-23 15/2020-04-23 15/2020-04-23 110/2020-04-23 15/2020-04-23 15/2020-04-23 15/2020-04-23 15/2020-04-23 15/2020-04-23 15/2020-04-23 30/2020-04-22 20/2020-04-22 15/2020-04-22 15/2020-04-22 15/2020-04-22 15/2020-04-22 15/2020-04-22 15/2020-04-22 20/2020-04-22 15/2020-04-22 15/2020-04-22 15/2020-04-22 15/2020-04-21 15/2020-04-21 30/2020-04-21 15/2020-04-21 15/2020-04-21 15/2020-04-21 30/2020-04-21 15/2020-04-21 15/2020-04-21 15/2020-04-21 15/2020-04-21 90/2020-04-21 15/2020-04-21 15/2020-04-21 10","Hi I’m raising money by donating my Chelsea Cesc Fabregas and my own Bradford jersey from the FA cup shock when Bradford beat Chelsea at Stamford Bridge on 24/01/15. I have been keeping these two jerseys to one day get framed and put them up on my wall. They mean a lot to me as anyone who knows football will know the magnitude of “that” game. During lockdown I made a decision to put them to a good cause and raise money for people who really need it most. I will always have the memories and with help from everyone we can hopefully raise a nice amount. Please donate or purchase a ticket. We can all play a little part so all donations are welcome but to enter its £15 for one ticket. No limit on tickets purchased.     Stay safe and healthy    Thank you    Billy xxx",False
" Imagine - a city without hunger. ","Liverpool, North West England, United Kingdom",https://www.gofundme.com/f/imagine-a-city-without-hunger,1000,2873,,2020-10-22,,,0,,"We are Veggie Republic Liverpool a vegan restaurant  in the city centre  on watching the Cambridge family in dispatches ""growing up poor"" it broke our hearts and left us wondering what could we do to help the kids in poverty in our city? We thought lets get some sort of pizza and treat night delivery going on a Friday night for some families  however we are with the current restrictions finding it tough to stay afloat too and estimate we could probably only feed 6 or 7 families ourselves every week  but we know there's alot more poverty striken families than that  so with that in mind we thought if we can call on the amazing generosity and support of our amazing city  customers  friends and family to donate something  anything to help give these kids something to look forward to on a Friday night other than a foodbank meal we would be so grateful. We will put our chefs to work to make the food fresh and have delivery drivers delivering across the city to put a little smile on children's faces who would normally go without these things that we all take for granted. As Liverpool is renowned looking after their own lets make this happen! We will commit every week to this scheme .... and we will be working with various local charities who have vulnerable families on there books .... All funds raised will go towards ingredients only not our utility costs or petrol costs we will cover that as well as 7 families ourselves every week     Thank you for your support    Veggie Republic",False
" Netheredge and Sharrow foodbank ","Sheffield, Yorkshire and the Humber, United Kingdom",https://www.gofundme.com/f/25dg09do1c,5000,1616,,2020-10-03,,,0,,"Hello everyone we at Thalassaemia South Yorkshire are fundraising to continue our initiative of providing a food pack to vulnerable people in and around South Yorkshire who we have been supporting since Covid19 pandemic that hit us all in March 2020. This support started when there was no halal food support in the local area of Sharrow and Netheredge and people were struggling to buy basic food for themselves. Due to a gap in the area and a desperate need TSY collaborated with few others to collectively reach out to the most vulnerable including single parents  elderly  self isolating and hardship such as loss of income. All our work is voluntary and since March kind donations from local community has assisted us in making sure no one struggled alone. We are running low on cash donations to purchase food to continue this vital support and are reaching out to anyone who can support us by using this link and donating whatever little they can towards the Netheredge and Sharrow foodbank project. Due to the level of need and referrals coming in since the start of this halal foodbank  we have called it Netheredge and Sharrow foodbank to avoid any barriers to any non-muslim vulnerable that maybe in need of this support. We would be very grateful for your support towards this cause and request you to please share widely amongst your contacts. For further information on TSY and the Netheredge and Sharrow foodbank please feel free to contact:- Nighat Basharat (Founding Director) on 07988033534/[email redacted]",False
" SMOOVE & TURRELL’S CHRISTMAS FOODBANK COLLECTION","Gateshead, North East England, United Kingdom",https://www.gofundme.com/f/smoove-amp-turrells-christmas-foodbank-collection,1000,724,2020-01-13,2019-12-18,"GATESHEAD FOODBANK","Registered nonprofitDonations eligible for Gift Aid.",26,"2020-01-13 200/2019-12-27 20/2019-12-26 100/2019-12-26 10/2019-12-26 20/2019-12-26 5/2019-12-26 5/2019-12-26 9/2019-12-26 5/2019-12-26 30/2019-12-23 10/2019-12-23 10/2019-12-23 20/2019-12-22 20/2019-12-22 40/2019-12-22 10/2019-12-21 10/2019-12-21 10/2019-12-21 10/2019-12-21 100/2019-12-21 10/2019-12-21 10/2019-12-21 30/2019-12-21 10/2019-12-21 10/2019-12-21 10","We hope you’re enjoying the live stream. We are raising money for GATESHEAD FOODBANK and every donation will help. Its going to be a tough few years for everyone so let’s help those out that are most in need! Xxxx",False
