CharityAddress,CharityAreaOfBenefit,CharityAreaOfOperation,CharityId,CharityName,Complete,Created,Description,DonationCount,DonationDetailCount,Donations,Link,MostRecentDonation,Raised,Target,Title
,,,1155442,"Stow Park Community Centre",False,2020-04-23,"<p><span><b>We at Stow Park are committed to keeping our food bank open during the current crisis. Our food bank is normally funded by renting rooms at our centre (up to £2000 per month) which is closed following Government instructions. To allow us to continue feeding those in need please give what you can.</b></span><br><span><br></span></p><p><span>Donating through JustGiving is simple, fast and totally secure. Your details are safe with JustGiving - they'll never sell them on or send unwanted emails. Once you donate, they'll send your money directly to the charity. So it's the most efficient way to donate - saving time and cutting costs for the charity.</span><br></p>",41,41,"2020-10-03 120/2020-08-17 50/2020-06-15 60/2020-06-04 30/2020-05-19 60/2020-05-10 20/2020-05-07 100/2020-05-06 50/2020-05-02 100/2020-05-01 30/2020-04-30 100/2020-04-28 100/2020-04-28 10/2020-04-28 50/2020-04-27 30/2020-04-27 100/2020-04-27 20/2020-04-25 30/2020-04-25 20/2020-04-25 100/2020-04-24 20/2020-04-24 20/2020-04-24 50/2020-04-23 20/2020-04-23 20/2020-04-23 20/2020-04-23 30/2020-04-23 50/2020-04-23 10/2020-04-23 10",https://www.justgiving.com/spccfoodbank,2020-10-19,2176,5000,"Stow Park Community Food Bank"
,,,1110522,"The Trussell Trust",False,2020-07-25,"<p></p><p>March 2020! Life paused! The country went in full LOCKDOWN! But inside our homes and in the outside world, life carried on. Normal people became extraordinary and developed heroic qualities. These short stories are of those real people, living a real life but in very unusual times when they suddenly found themselves faced with an unknown and invisible enemy.</p><p><span>Initially unsure, of how to continue with any normality but then finding an inspirational role for themselves. It is those people who became the inspiration for the me and the idea of the book originated. ‘Stirring Inspirational stories’ is sectioned into 2 parts.</span><br></p><p><span>The first part of the book is an anthology of short stories written during the days of the lockdown. I have written life stories of people that I was inspired by during this time. I feel that I did not need to search for them too far or wide. They were people around me : friends, neighbours, and family. These extraordinary people showed courage and selfless service, or they experimented and got creative in their kitchens or gardens.  These real-life stories will certainly inspire you as we face the realities of the new normal.</span><br></p><p><span>The second part of the book contains a range of recipes that were tried and tested in their kitchens during these times. I was compelled to include these mouth-watering dishes in this book. The recipes, consist of a fusion of contributors’ cultural experiences and varied cooking styles and ingredients.</span><br></p><p><span>Now sit back... read stories of real people, and be inspired. Do not forget to take a break. Bake a cake and try other fanciful recipes from the tried and tested list. I hope you will be absorbed in double consumption: where inspired compassion stirs culinary delights!</span><br></p><p><span>I've decided to dedicate all funds (Amazon have to charge for me to publish on their platform) raised for my eBook to The Trussell Trust. This is because during the lockdown,</span><span>&nbsp;food banks in this network provided more than 1.6 million emergency food parcels to people in crisis and they continue to provide this exceptional service . More than half a million of these went to children. It’s not right that people can’t afford the basics. With each free download of the book, I am hoping you would kindly donate £10 to the trust so they can continue with their mission of feeding people.</span><br></p><p><span>With your help, we can end the need for food banks. As a nation, we expect no one should be left hungry or destitute. Illness, disability, family breakdown or the loss of a job can happen to any of us. With your help #ThisCanChange</span></p><p><span>You can download the book from:<br>https://www.amazon.co.uk/dp/B08DMDGQFT<br></span></p><p><span>Thank you to all those who contributed to the book. Together we can help people in need.</span><br></p><p><span>Simmi Arora</span><br></p>",17,17,"2020-10-03 20/2020-08-24 100/2020-08-18 30/2020-08-16 20/2020-08-13 20/2020-08-11 20/2020-08-09 30/2020-08-05 20/2020-08-04 20/2020-08-03 20/2020-08-02 100/2020-08-01 30",https://www.justgiving.com/StirringLockdownStories,2020-10-03,506,1000,"My EBook supporting Food Banks"
,,,223366,"Charles Thompson's Mission",False,2018-06-19,"<p></p><p>Here at Carpenters, as part of our corporate social responsibility activity, we have been working with our staff to introduce food<span> collection points in all six of our offices across the UK, including three of our offices based in Merseyside.</span></p><p><span></span></p><p>Once the donations have come in, we then distribute foodbank items to fans Supporting Foodbanks, <span>a joint initiative between Everton (Est. 1878) and Liverpool (Spirit of Shankly) fan clubs and the Charles Thompson Mission in Birkenhead, just two of the wonderful volunteer organisations in the region who are working hard to supply basic provisions to those in need.</span></p><p><span></span></p><p><span>Since we started the initiative in September 2017, we have seen many people want to help but are unsure how so we have set up this page for those who wish to donate but we will also include any donations we might receive.</span></p><p></p>",0,0,,https://www.justgiving.com/Carpenters-foodbank,,1928,3000,"Carpenters's company food bank page"
,,,"214779 and in Scotland SC009359","The Salvation Army",False,2020-04-06,"<p><span>﻿</span>Horsham Salvation Army is collecting donations to buy food for vulnerable people across Horsham District and the surrounding area who are struggling to provide even the most basic necessities for themselves and/or their families.</p><p>The Salvation Army is a Christian Church &amp; registered Charity working in 130 countries worldwide and is one of the largest and most diverse providers of social welfare in the world. In the UK and Republic of Ireland this work includes more than 800 Salvation Army social service centres and community churches. We provide unconditional friendship, support and very practical help to people in crisis and need and work with children, homeless people, all adult victims of modern slavery and those dealing with drug and/or alcohol addiction.</p>",35,35,"2020-11-05 20/2020-10-30 50/2020-10-15 20/2020-09-03 10/2020-07-01 85/2020-06-29 85/2020-06-18 50/2020-06-13 30/2020-06-07 5/2020-06-07 5/2020-06-07 80/2020-06-02 30/2020-05-30 100/2020-05-26 30/2020-05-22 500/2020-05-12 50/2020-05-05 5/2020-04-28 30/2020-04-22 30/2020-04-13 10/2020-04-13 50/2020-04-11 30/2020-04-10 50/2020-04-09 100/2020-04-08 100/2020-04-08 12/2020-04-08 100/2020-04-07 100",https://www.justgiving.com/Horsham-SA1,2020-11-05,2057,2500,"Horsham Salvation Army food bank"
,,,133179546,"Food Bank For New York City",False,2020-03-31,"<p></p><p>Natilik are dedicating the next few months to raise money for Food Bank for New York City. During this difficult time the Food bank is taking important steps to ensure that vulnerable New Yorkers who may be quarantined, along with those impacted by the economic downturn, are being supported and provided with emergency food</p><p><br></p><p><br></p><p></p>",22,22,"2020-04-30 20/2020-04-28 15/2020-04-27 30/2020-04-27 25/2020-04-27 10/2020-04-26 25/2020-04-25 20/2020-04-25 15/2020-04-24 25/2020-04-24 25/2020-04-24 50/2020-04-24 20/2020-04-24 20/2020-04-24 50/2020-04-24 15/2020-04-24 20/2020-04-24 20/2020-04-24 5/2020-04-24 15/2020-04-23 20",https://www.justgiving.com/Natilik-Foodbank-NYC,2020-04-30,549,500,"Natilik's Food Bank for NYC Support"
,,,1110522,"The Trussell Trust",False,2016-09-27,"<p>Welcome to our JustGiving page.</p><p>Over a month ago, our campaign to stop the draconian practices of HMRC and Concentrix went into overdrive and we succeed in the contract not being renewed.</p><p>We have dedicated this last month to helping support families when food banks were at their limit!</p><p>As more and more people are getting the money back that they deserve, we thought a great way to give back would be to start a just giving page for the Trussel Trust.</p><p>Most of the people affected probably thought they would never need to visit a food bank to feed their families and we know how much they rely on these donations to keep them stocked up.</p><p>Please support our fundraising campaign and give what you can!&nbsp;</p><p>Lots of love, the Concentrix Mums Admin Team xxx</p>",5,0,,https://www.justgiving.com/Concentrix-Mums,,47,2000,"Concentrix Mums - Food Bank Drive"
,,,1110522,"The Trussell Trust",False,2020-04-29,"<p><span>HSDC exists to realise the ambitions of our community - raising aspirations, enabling achievement, fulfilling dreams. By 2025, we will be the first choice FE college for students, staff and employers in Hampshire - fully equipping our communities for work and life. Part of this includes HSDC supporting our communities through this time where Coronavirus is having a hugely negative economic and social impact, preventing many vulnerable people from buying the basic items they need.</span></p><p>HSDC is proud to join forces with London &amp; South East  Education Group to support the FE Food Bank Friday initiative.<br><br>With more staff and students working and studying remotely and staying home, we have joined this fundraising campaign to support food banks and help ensure they can continue looking after our communities, despite social distancing.<br><br>We're raising money for the Trussell Trust, a national charity which supports more than 1,200 food bank centres across the country including several right here in Hampshire..<br><br>We are asking our amazing staff and college communities to help us by consider donating what they can to ensure we all can come through this crisis. Together, we are stronger.<br><br>Thank you so much for your support. Safe safe and stay well.<br></p><p><span>Last year, food banks in our network provided more than 1.6 million emergency food parcels to people in crisis. More than half a million of these went to children. It’s not right that people can’t afford the basics. With your help, we can help end the need for food banks.As a nation, we expect no one should be left hungry or destitute. Illness, disability, family breakdown or the loss of a job can happen to any of us. With your help #ThisCanChange</span></p>",8,8,"2020-05-22 10/2020-05-17 15/2020-05-15 15/2020-05-14 50/2020-05-07 30",https://www.justgiving.com/HSDCFBF,2020-05-22,200,1000,"FE Food bank Friday @ HSDC"
,,,1110522,"The Trussell Trust",False,2020-03-26,"<p><span></span></p><p><span><b>THE FOOD BANK SHOW on PRIMAL LIVING</b></span></p><p><span>Every morning at 10am, we will be broadcasting live The Food Bank Show on Youtube providing food and health advice. I will be joined by doctors, medical experts and chefs, many of whom contributed to my latest health book FAT and Furious. Together - we will be taking your questions from around the country and additionally during the shows we will video link to food banks across the UK and discover new ways we can all help offer support.&nbsp;</span></p><p><span>With fast food chains closed, we want to seize this opportunity to reshape the eating habits of our nation and improve everyone’s health and whilst we are doing this together -&nbsp; help feed those most in need during this crisis. Join my family and I , as we put on a truly interactive show and please encourage everyone you care and love to join us too.</span></p><p><span>We are going live as of Monday 30</span><span><sup>th</sup></span><span> of March and continue every single day until at the very least, schools reopen</span><br><span></span></p><p><span>Right now, our health has never been more important. #TheFoodBankShow&nbsp;</span></p><p><span></span></p><p><span><br></span></p><p><span>Last year, food banks in our network provided more than 1.6 million emergency food parcels to people in crisis. More than half a million of these went to children. It’s not right that people can’t afford the basics. With your help, we can help end the need for food banks.As a nation, we expect no one should be left hungry or destitute. Illness, disability, family breakdown or the loss of a job can happen to any of us. With your help #ThisCanChange</span><br></p>",136,136,"2020-07-25 11/2020-05-17 20/2020-05-15 100/2020-05-14 35/2020-05-12 30/2020-05-12 30/2020-05-12 4/2020-05-12 5/2020-05-04 65/2020-05-04 20/2020-05-03 10/2020-05-02 30/2020-05-02 10/2020-05-02 100/2020-05-01 100/2020-04-30 10/2020-04-30 20/2020-04-30 20/2020-04-29 20/2020-04-29 10/2020-04-29 10/2020-04-28 50/2020-04-27 30/2020-04-25 50/2020-04-24 20/2020-04-23 30/2020-04-23 30/2020-04-22 5000/2020-04-21 10/2020-04-21 50/2020-04-20 30/2020-04-20 20/2020-04-20 50/2020-04-20 10/2020-04-20 20/2020-04-19 30/2020-04-18 50/2020-04-16 20/2020-04-16 20/2020-04-16 50/2020-04-16 100/2020-04-15 30/2020-04-15 100/2020-04-15 10/2020-04-15 30/2020-04-14 50/2020-04-13 30/2020-04-12 100/2020-04-12 50/2020-04-11 100/2020-04-11 200/2020-04-11 500/2020-04-11 100/2020-04-11 200/2020-04-10 30/2020-04-10 30/2020-04-09 30/2020-04-09 50/2020-04-09 30/2020-04-09 300/2020-04-09 200/2020-04-08 30/2020-04-07 20/2020-04-07 100/2020-04-06 30/2020-04-05 25/2020-04-05 50/2020-04-04 20/2020-04-03 400/2020-04-03 100/2020-04-03 250/2020-04-03 20/2020-04-02 30/2020-04-02 100/2020-04-02 10/2020-04-02 30/2020-04-01 10/2020-04-01 20/2020-04-01 50/2020-03-31 20/2020-03-31 750/2020-03-31 101/2020-03-31 20/2020-03-31 20/2020-03-30 100/2020-03-30 100/2020-03-30 20/2020-03-30 100/2020-03-30 100/2020-03-30 10/2020-03-30 30/2020-03-30 30/2020-03-30 5/2020-03-30 100/2020-03-30 20/2020-03-30 50/2020-03-30 30/2020-03-30 100/2020-03-29 20/2020-03-29 10/2020-03-29 20/2020-03-29 50/2020-03-29 20/2020-03-29 20/2020-03-29 20/2020-03-29 20/2020-03-29 10/2020-03-29 50/2020-03-29 20/2020-03-29 30/2020-03-29 20/2020-03-28 5000/2020-03-27 800/2020-03-27 200",https://www.justgiving.com/PrimalLiving,2020-07-25,30306,100000,"Steve Bennett's The Food Bank Show"
,,,1181773,"Skipton Baptist Church",False,2020-01-05,"<p>Skipton Food Bank gives over 25 tonnes of food a year to people in crisis across Craven. We work by referral through local agencies and feed over 80 people a week. We are a very small charity - part of Skipton Baptist Church - and are run by volunteers, with a part-time paid manager.&nbsp;</p>",29,29,"2020-10-21 14/2020-10-12 20/2020-10-10 5/2020-10-09 10/2020-10-09 20/2020-10-09 20/2020-10-09 10/2020-10-09 10/2020-09-30 20/2020-09-29 30/2020-09-29 10/2020-08-03 50/2020-05-24 10/2020-05-14 50/2020-04-19 10/2020-04-19 20/2020-04-19 20/2020-03-31 10/2020-03-31 20/2020-03-31 20/2020-03-31 50/2020-03-22 30/2020-03-13 20/2020-01-22 20/2020-01-07 20/2020-01-05 10",https://www.justgiving.com/Laura-Jackson2020,2020-10-21,644,500,"Skipton Food Bank Emergency Appeal"
,,,1152387,"Colchester Foodbank",False,2020-04-06,"<p></p><p>With the success of the previous livestream that raised over £150 for Colchester's local charity ""Musicians Supporting The Homeless"", Fraser Morgan and Billy Spires are back this Friday for another session on the decking, this time in aid of Colchester Food Bank.</p><p></p>",4,4,"2020-04-10 10/2020-04-10 50/2020-04-10 20",https://www.justgiving.com/colchesterfoodbanklivestream,2020-04-10,355,300,"Livestream in Aid of Colchester Food Bank"
,,,SC044944,"EdinburghNE foodbank",False,2020-06-16,"<p>Thanks for taking the time to visit my JustGiving page.</p><p>I’m fortunate enough to be still working during the COVID-19 emergency. I haven’t had much time or energy to give back to others, so I’ll be donating to the EdinburghNE Foodbank instead. &nbsp;If you were planning on getting me something for my birthday (you were, weren’t you!?!) please donate to this cause instead. If you’ve got a steady income coming in, donate to this cause. If you’ve been looking for a way to give back, donate to this cause.</p><p><span>Donating through JustGiving is simple, fast and totally secure. Your details are safe with JustGiving - they'll never sell them on or send unwanted emails. Once you donate, they'll send your money directly to the charity. So it's the most efficient way to donate - saving time and cutting costs for the charity.</span></p><p><span>Thank you.</span></p>",4,4,"2020-06-27 30/2020-06-16 10/2020-06-16 100",https://www.justgiving.com/Marie-Fie,2020-06-27,170,200,"Maria's Birthday food bank donation"
,,,1110522,"The Trussell Trust",False,2020-10-23,"Last year, food banks in our network provided more than 1.6 million emergency food parcels to people in crisis. More than half a million of these went to children. It’s not right that people can’t afford the basics. With your help, we can help end the need for food banks.

As a nation, we expect no one should be left hungry or destitute. Illness, disability, family breakdown or the loss of a job can happen to any of us. With your help #ThisCanChange",2,2,"2020-10-23 20",https://www.justgiving.com/Lizzie-Murphy4,2020-10-23,30,1250,"Lizzie's Helping food banks across the UK "
,,,1110522,"The Trussell Trust",False,2020-10-09,"<p>Last year, food banks in our network provided more than 1.6 million emergency food parcels to people in crisis. More than half a million of these went to children. It’s not right that people can’t afford the basics. With your help, we can help end the need for food banks. As a nation, we expect no one should be left hungry or destitute. Illness, disability, family breakdown or the loss of a job can happen to any of us. With your help #ThisCanChange</p><p>At Barking Abbey School, we decided as a class to raise money and food for food banks across the U.K. We came together because we feel as though the government does not do enough to support food banks and the people who rely on them. Many food banks are undersupplied, therefore they have to send families away empty handed.&nbsp;</p><p>Any support and donations would be highly appreciated, at a time like this during the coronavirus pandemic. Let's try to help as many families possible!</p><p><br></p><p><br></p>",2,2,"2020-10-15 3",https://www.justgiving.com/N-Bawla,2020-10-15,6,250,"Year 11 Barking Abbey - Food Bank Funding"
,,,SC002223,"Instant Neighbour Aberdeen",False,2016-11-27,"<p>Thanks for taking the time to visit my JustGiving page.</p><p>Donating through JustGiving is simple, fast and totally secure. Your details are safe with JustGiving - they'll never sell them on or send unwanted emails. Once you donate, they'll send your money directly to the charity. So it's the most efficient way to donate - saving time and cutting costs for the charity.</p>",2,0,,https://www.justgiving.com/tracey-mcmillan,,171,250,"Tracey's Swishing event to raise funds for food bank"
,,,1110522,"The Trussell Trust",False,2020-04-20,"<p>My name is Aimee Ormesher and I am a Liverpool based Personal Trainer who is offering free daily LIVE workouts on social media to raise money for the Trussell Trust Foodbank network, which provides emergency assistance to families and vulnerable people living in food poverty.&nbsp;</p><p><span>Last year, the trust provided more than 1.6 million emergency food parcels to people in crisis. More than half a million of these went to children. It’s not right that people can’t afford the basics. &nbsp;No one should be left hungry or destitute.&nbsp;</span><span>Illness, disability, family breakdown or the loss of a job can happen to any of us.&nbsp;</span></p><p><span>I would like to encourage anyone who is able to make a donation to do so as it will make a big difference to the Trussell Trust’s foodbank networks in Liverpool and Merseyside.</span></p><p>I am truly grateful for your support. xx</p>",223,223,"2020-06-23 17/2020-06-16 5/2020-06-16 2/2020-06-16 10/2020-06-08 5/2020-06-08 5/2020-06-08 10/2020-06-08 20/2020-06-05 5/2020-06-05 5/2020-06-04 5/2020-06-04 10/2020-06-03 2/2020-06-03 5/2020-06-01 10/2020-05-29 5/2020-05-29 10/2020-05-28 5/2020-05-28 5/2020-05-26 10/2020-05-26 10/2020-05-26 10/2020-05-26 2/2020-05-26 2/2020-05-26 4/2020-05-26 10/2020-05-25 20/2020-05-25 5/2020-05-25 10/2020-05-25 10/2020-05-25 10/2020-05-25 10/2020-05-25 5/2020-05-25 20/2020-05-25 5/2020-05-25 5/2020-05-25 20/2020-05-25 10/2020-05-25 10/2020-05-25 10/2020-05-25 5/2020-05-25 20/2020-05-25 10/2020-05-25 5/2020-05-25 5/2020-05-25 5/2020-05-25 4/2020-05-25 5/2020-05-25 10/2020-05-25 4/2020-05-25 10/2020-05-25 5/2020-05-25 10/2020-05-25 10/2020-05-25 30/2020-05-25 10/2020-05-25 4/2020-05-19 5/2020-05-18 10/2020-05-18 10/2020-05-18 4/2020-05-18 25/2020-05-15 5/2020-05-15 10/2020-05-14 5/2020-05-13 10/2020-05-13 20/2020-05-13 20/2020-05-12 10/2020-05-11 5/2020-05-11 10/2020-05-07 30/2020-05-07 20/2020-05-06 5/2020-05-06 20/2020-05-06 5/2020-05-06 10/2020-05-06 20/2020-05-04 10/2020-05-03 10/2020-05-02 20/2020-05-02 10/2020-05-01 20/2020-05-01 15/2020-05-01 30/2020-05-01 10/2020-05-01 10/2020-05-01 5/2020-05-01 5/2020-05-01 5/2020-05-01 20/2020-05-01 20/2020-05-01 10/2020-04-30 20/2020-04-30 10/2020-04-30 5/2020-04-30 5/2020-04-30 10/2020-04-30 10/2020-04-30 6/2020-04-30 10/2020-04-30 5/2020-04-30 5/2020-04-30 20/2020-04-29 20/2020-04-29 5/2020-04-29 5/2020-04-29 5/2020-04-29 10/2020-04-29 5/2020-04-29 5/2020-04-28 30/2020-04-28 5/2020-04-28 2/2020-04-28 5/2020-04-28 5/2020-04-28 10/2020-04-28 5/2020-04-28 5/2020-04-28 20/2020-04-28 10/2020-04-28 20/2020-04-28 20/2020-04-28 10/2020-04-28 20/2020-04-28 25/2020-04-28 5/2020-04-28 10/2020-04-28 10/2020-04-28 3/2020-04-28 5/2020-04-28 5/2020-04-28 5/2020-04-28 10/2020-04-28 5/2020-04-28 5/2020-04-28 5/2020-04-28 5/2020-04-28 5/2020-04-28 5/2020-04-28 5/2020-04-27 10/2020-04-27 5/2020-04-27 10/2020-04-27 5/2020-04-27 2/2020-04-27 5/2020-04-27 5/2020-04-27 10/2020-04-25 10/2020-04-25 20/2020-04-24 10/2020-04-24 20/2020-04-24 10/2020-04-24 5/2020-04-24 5/2020-04-24 5/2020-04-24 10/2020-04-24 5/2020-04-23 20/2020-04-23 3/2020-04-23 5/2020-04-23 5/2020-04-22 5/2020-04-22 5/2020-04-22 10/2020-04-22 10/2020-04-22 20/2020-04-22 10/2020-04-22 10/2020-04-22 5/2020-04-22 5/2020-04-22 5/2020-04-22 10/2020-04-21 10/2020-04-21 4/2020-04-21 10/2020-04-21 10/2020-04-21 10/2020-04-21 10/2020-04-21 10/2020-04-21 10/2020-04-21 5/2020-04-21 5/2020-04-21 10/2020-04-21 5/2020-04-21 10/2020-04-21 10/2020-04-21 10/2020-04-21 10/2020-04-21 5/2020-04-21 5/2020-04-21 9/2020-04-21 10/2020-04-21 5/2020-04-21 10/2020-04-21 5/2020-04-21 20/2020-04-21 5/2020-04-21 4/2020-04-21 4/2020-04-21 5/2020-04-21 5/2020-04-21 10/2020-04-21 2/2020-04-20 10/2020-04-20 5",https://www.justgiving.com/Aimee-Ormesher,2020-06-23,2000,1000,"I am raising money to help The Trussel Trust keep their vital services running to support people in crisis"
,,,"214779 and in Scotland SC009359","The Salvation Army",False,2020-04-20,"The last few months have seen immense suffering and hardship from storms and flooding. However the outbreak of the Coronavirus has quite literally changed everyones lives and turned society upside down.
However, The Salvation Army is resolute and strong and just as we did in the Spanish Flu pandemic, and during the bombing and the Blitz we will carry on, doing what we can to support people and communities  in the ways that we can, within the Government guidelines.
In true Salvation Army Spirit, our greatest strength is our flexible, responsive local presence. Right now, each of our 650 corps and community centres will know exactly what the most effective things are to do. We are not just responding to the virus impact in one or two ways, but dozens and dozens of different ways, from food banks to counselling, from supporting NHS isolation units to checking up on people who are living alone
Please give what you can to enable us to help as many people as possible!",18,18,"2020-06-21 100/2020-05-07 10/2020-05-07 10/2020-05-05 10/2020-05-04 10/2020-05-01 10/2020-05-01 20/2020-04-22 20/2020-04-22 30/2020-04-21 10/2020-04-21 20/2020-04-20 50/2020-04-20 30/2020-04-20 5/2020-04-20 10/2020-04-20 5/2020-04-20 10",https://www.justgiving.com/Morriston-SalvationArmy,2020-06-21,370,2000,"Morriston's Morriston Salvation Army Food Bank"
