CharityAddress,CharityAreaOfBenefit,CharityAreaOfOperation,CharityId,CharityName,Complete,Created,Description,DonationCount,DonationDetailCount,Donations,Link,MostRecentDonation,Raised,Target,Title
,,,1173202,"Fallowfield & Withington Foodbank",True,2020-11-14,"<p>I am taking part in NCS and we are aiming to raise some money and awareness for food banks around Manchester.</p>",1,1,"2020-11-14 10",https://www.justgiving.com/ncs-food-bank,2020-11-14,10,70,"NCS food bank support"
,,,1110522,"The Trussell Trust",False,2019-11-28,"<div></div><div dir=""auto"">This festive season we’re building on the successes of the previous two years and raising money for the Trussell Trust — a brilliant charity that helps thousands of people in the UK feed their families in times of crisis via foodbanks. Last year, the Trussell Trust network gave out over 1.6 million three-day emergency food supplies to people in need, that’s a 19% increase on the previous financial year.</div><div dir=""auto""><br></div><div dir=""auto"">When we started raising money for the Trussell Trust in 2017, 13 million people were living below the poverty line. Two years on, this number has grown to 14 million. People are going hungry every day for a range of reasons, from benefit delays (due to a drastically underfunded switch to universal basic income) to receiving an unexpected bill on a low income. This number is growing for a multitude of reasons but the responsibility lies in the same place each time. Our current government is failing us.</div><div dir=""auto""><br></div><div dir=""auto"">Winter is always the busiest period for foodbanks, so we’d like your help to raise as much cash as possible. A tin of beans costs as little as 30p, so any donation you make however small or large will really help!</div><div dir=""auto""><br></div><div dir=""auto"">We wish that each year we wouldn't need to fundraise for this cause, it shouldn’t be down to the Trussell Trust (and many other similar organisations), there should be a system that supports and cares for people.</div><div dir=""auto""><br></div><div dir=""auto"">Please share this on all of your social platforms to help us achieve our goal. Then, on December the 12th please vote for a change — the right are failing us all, but most importantly, they're failing those who are in need of a social care system that works.</div><div dir=""auto""><br></div><div dir=""auto"">Thank you, we couldn’t do this without you!</div><div><br></div><div><div><div><div><font color=""#3a3a3a""></font></div></div></div></div>",74,74,"2020-10-25 15/2020-01-11 10/2019-12-24 15/2019-12-19 7/2019-12-19 10/2019-12-17 30/2019-12-16 10/2019-12-14 25/2019-12-14 20/2019-12-14 20/2019-12-14 20/2019-12-14 10/2019-12-13 20/2019-12-13 20/2019-12-12 10/2019-12-12 50/2019-12-11 20/2019-12-11 20/2019-12-11 20/2019-12-11 10/2019-12-10 10/2019-12-10 50/2019-12-10 10/2019-12-10 20/2019-12-10 20/2019-12-10 30/2019-12-09 20/2019-12-09 20/2019-12-07 20/2019-12-07 10/2019-12-06 25/2019-12-05 10/2019-12-05 5/2019-12-05 20/2019-12-03 20/2019-12-03 20/2019-12-03 5/2019-12-03 20/2019-12-02 25/2019-12-02 10/2019-12-01 20/2019-12-01 10/2019-11-30 15/2019-11-29 25/2019-11-29 10/2019-11-29 20/2019-11-29 40/2019-11-29 100/2019-11-29 10/2019-11-29 10/2019-11-29 20/2019-11-29 50/2019-11-29 10/2019-11-29 15/2019-11-29 20/2019-11-29 20/2019-11-29 20/2019-11-29 10/2019-11-29 20/2019-11-28 15/2019-11-28 30/2019-11-28 10/2019-11-28 10/2019-11-28 50",https://www.justgiving.com/Foodbank2019,2020-10-25,1522,1500,"Festive Food Bank Fundraiser 2019"
,,,103325,"FareShare Northern Ireland ( Project of Council for the Homeless NI)",True,2020-11-12,"<p><span>Its that time of the year again, christmas is fast approaching and the food banks need help. This year has been especially difficult with the ongoing pandemic impacting on the physical, financial and mental wellbeing of the community. Fareshare Mallusk is a local charity which relies on the hard work of volunteers to distribute food to the most vulnerable in society and is close to the heart of the Mater Emergency Department. Help us make christmas a little better for those who need it.</span><br></p>",11,11,"2020-11-15 20/2020-11-15 20/2020-11-15 20/2020-11-15 20/2020-11-15 20/2020-11-15 25/2020-11-15 10/2020-11-15 10/2020-11-12 10/2020-11-12 20/2020-11-12 30",https://www.justgiving.com/Serena-Lewis2,2020-11-15,205,1500,"FareShare NI Food bank"
,,,1110522,"The Trussell Trust",True,2020-11-14,"Last year, food banks in our network provided more than 1.6 million emergency food parcels to people in crisis. More than half a million of these went to children. It’s not right that people can’t afford the basics. With your help, we can help end the need for food banks.

As a nation, we expect no one should be left hungry or destitute. Illness, disability, family breakdown or the loss of a job can happen to any of us. With your help #ThisCanChange",0,0,,https://www.justgiving.com/Sadio666,,0,1050,"Josh's Food bank charity "
,,,1110522,"The Trussell Trust",True,2020-11-13,"Last year, food banks in our network provided more than 1.6 million emergency food parcels to people in crisis. More than half a million of these went to children. It’s not right that people can’t afford the basics. With your help, we can help end the need for food banks.

As a nation, we expect no one should be left hungry or destitute. Illness, disability, family breakdown or the loss of a job can happen to any of us. With your help #ThisCanChange",0,0,,https://www.justgiving.com/food-bank,,0,500,"Raising money for the Trussell Trust"
,,,1170815,"Mental Health UK",True,2020-10-16,"<p>Thanks for taking the time to visit my JustGiving page.</p><p>Donating through JustGiving is simple, fast and totally secure. Your details are safe with JustGiving - they'll never sell them on or send unwanted emails. Once you donate, they'll send your money directly to the charity. So it's the most efficient way to donate - saving time and cutting costs for the charity.</p>",0,0,,https://www.justgiving.com/My-January-Pledge,,0,1150,"Commercial Banking "
,,,1110522,"The Trussell Trust",False,2020-11-11,"<p>This winter,<b> every nine seconds </b>in the UK, someone in crisis is expected to need an emergency food parcel from a local food bank, <b>a 61% increase</b> on last year.&nbsp;</p><p>However, lockdown and restrictions have meant that food donations have declined, placing extra pressure on these important services.&nbsp;</p><p>We want to help fund local food banks and the emergency food parcels they provide, so we've set up this fundraising page to enable us all to give what we can to this vital cause; every penny counts.&nbsp;</p><p><span>#ThisCanChange</span><br></p>",43,43,"2020-11-13 10/2020-11-13 1000/2020-11-13 50/2020-11-13 20/2020-11-13 50/2020-11-13 15/2020-11-13 10/2020-11-13 10/2020-11-13 5/2020-11-13 10/2020-11-13 10/2020-11-13 10/2020-11-13 20/2020-11-13 10/2020-11-13 10/2020-11-13 10/2020-11-13 10/2020-11-13 30/2020-11-13 10/2020-11-13 50/2020-11-13 100/2020-11-13 30/2020-11-13 10/2020-11-13 10/2020-11-13 10/2020-11-13 30/2020-11-13 30/2020-11-13 20/2020-11-13 20/2020-11-13 10/2020-11-13 10/2020-11-13 20/2020-11-13 10/2020-11-13 20/2020-11-13 30/2020-11-13 10/2020-11-13 25/2020-11-13 50/2020-11-12 20",https://www.justgiving.com/making-water-count-for-foodbanks,2020-11-13,1885,2000,"Making a difference for food banks"
,,,1119653,"Portsmouth Foodbank",True,2020-11-09,"<p><span>Thanks for taking the time to visit our JustGiving page.</span><br><span><br></span></p><p><span>For our Christmas charity activity this year, we will be collecting donations for our local food bank in Portsmouth. The pandemic has hit many people hard financially, leading to food banks struggling to cope with the new demand. We think this is the best possible way that we can give back to the community this Christmas, and ask for any donations big or small.</span><br></p><p>Donating through JustGiving is simple, fast and totally secure. Your details are safe with JustGiving - they'll never sell them on or send unwanted emails. Once you donate, they'll send your money directly to the charity. So it's the most efficient way to donate - saving time and cutting costs for the charity.</p>",0,0,,https://www.justgiving.com/Apollo-Fire-Detectors1,,0,200,"Apollo Fire's Christmas Food Bank Donations Appeal"
,,,1104771,SMT,False,2020-11-08,"Save the Mothers Trust (SMT) jointly with Bradford Central Lions Club launched its Food Bank in March 2014 to provide food and support to those less fortunate and in need. The Food Bank is located at the SMT head office in Bradford, West Yorkshire. Since the launch of the Food Bank, it has served many individuals as well as families with young children who are suffering extreme hardships due to cut backs in the benefit system. Some of these people have not eaten for several days and have struggled due to the lack of basic amenities such as heating and electricity. We continuously require items to place in food parcels or cash donations to purchase them. We would appreciate your co-operation in achieving our goal to serve the needy, thereby gaining reward from Allah (SWT).
Donate from as little as £5 per month or £30 to provide one food parcel  ",0,0,,https://www.justgiving.com/School-Farmworth-FoodBank,,100,1000,"SMT Food Bank (UK)"
,,,1144831,"Westminster Chapel",True,2020-11-11,"Westminster Foodbank was established in 2011 to help those living in poverty within the Borough. The poverty rate is 30% worse than is typical for London.

We support people on low income, those who have lost their jobs, those who have no recourse to public funds and many more.

We want to make sure everyone is able to have a meal and be able to maintain their dignity. We recognise that food is not the only essential items that individuals need so we provide where possible toiletries, nappies, feminine hygiene products and some household cleaning products.",0,0,,https://www.justgiving.com/Providence-Equity-Westminsterfoodbank,,0,500,"Providence's Christmas Appeal - Westminster Food Bank"
,,,SC000541,"Cornerstone Christian Fellowship",True,2020-11-12,"<p>Thanks for taking the time to visit my JustGiving page.</p><p>Donating through JustGiving is simple, fast and totally secure. Your details are safe with JustGiving - they'll never sell them on or send unwanted emails. Once you donate, they'll send your money directly to the charity. So it's the most efficient way to donate - saving time and cutting costs for the charity.</p>",0,0,,https://www.justgiving.com/Norma-Cowan1,,0,0,"Norma's Bethlehem House of Bread food bank"
,,,"802052 (England, Wales) SC039557 (Scotland)","BBC Children in Need",False,2020-11-04,"Children and young people across the UK are currently facing a multitude of challenges, including illness, poverty, mental health problems, isolation, loneliness and social injustice. Sadly, the coronavirus pandemic has made life even harder for those who were already experiencing difficulties in their lives. This year Toyota and BBC Children in Need are coming together to change the lives of children and young people all across the UK.",22,22,"2020-11-15 5/2020-11-13 10/2020-11-13 5/2020-11-12 5/2020-11-12 2/2020-11-12 2/2020-11-12 5/2020-11-12 5/2020-11-11 3/2020-11-11 5/2020-11-10 5/2020-11-10 5/2020-11-07 5/2020-11-05 5/2020-11-04 5",https://www.justgiving.com/Bank-Hall-Kindergarten,2020-11-15,107,100,"Bank Hall's page"
,,,1110522,"The Trussell Trust",True,2020-11-13,"<p>As you may know, here at Highland Fling we run an annual drive for donations of food and essential items to be donated to our local Trussell Trust food bank, and we are always blown away by the generosity and thoughtfulness of the donations.</p><p>As with many things this year, the Covid-19 pandemic means that we need to do things a little differently. However, the work that the Trussell Trust do remains as vital as ever as many, many people sadly must rely on food banks in what is already a difficult and unpredictable time.</p><p>Under the current Covid-19 guidelines, taking and storing food donations the way we usually do isn't really an option, so instead we have set up this online fundraiser, from which all donations go directly to the Trussell Trust.</p><p>Thank you,<br>The Highland Fling Team</p><p><span>From the Trussell Trust:</span></p><p><span>""Last year, food banks in our network provided more than 1.6 million emergency food parcels to people in crisis. More than half a million of these went to children. It’s not right that people can’t afford the basics. With your help, we can help end the need for food banks. As a nation, we expect no one should be left hungry or destitute. Illness, disability, family breakdown or the loss of a job can happen to any of us. With your help #ThisCanChange""</span><br></p>",0,0,,https://www.justgiving.com/Highland-Fling,,0,200,"Highland Fling Winter Food Bank Appeal 2020"
,,,1110522,"The Trussell Trust",False,2020-11-09,"<p><span></span></p><p><span>We realise that there are some of you eager to help out at your local food banks but struggling to reach out due to Covid-19 restrictions.</span></p><p><span>Here is a way&nbsp;</span><span>for you to add your contribution, no matter your circumstances or where you&nbsp;</span><span>are!</span></p><p><span></span></p><p><span>We&nbsp;</span><span>have set up this dedicated online donations page where you can easily </span><span>make your contribution.</span></p><p></p><p><span>Donations will go direct to the Trussell Trust fund who support a nationwide network of food banks who together provide emergency food; support to people locked in poverty, and campaign for long-term change.</span><span>&nbsp;</span></p><p></p><p></p><p><span>Last</span><span>&nbsp;year, Trussell Trust food banks&nbsp;provided more than 1.6 million emergency food parcels to people in crisis. More than half a million of these went to children. It’s not right that people can’t afford the basics.&nbsp;</span></p><p><span>No one should be left hungry or destitute.</span></p><p><span>Illness, disability, family breakdown or the loss of a job can happen to any of us. #ThisCanChange</span></p><p></p>",19,19,"2020-11-15 30/2020-11-13 20/2020-11-13 100/2020-11-13 20/2020-11-13 20/2020-11-13 20/2020-11-13 20/2020-11-13 20/2020-11-13 20/2020-11-13 20/2020-11-13 10/2020-11-13 30/2020-11-13 20/2020-11-13 20/2020-11-13 30/2020-11-13 20/2020-11-13 20",https://www.justgiving.com/Doosan-Babcock-UK2020,2020-11-15,480,5000,"Doosan Babcock UK-wide Food Bank Fundraiser"
,,,1181267,"The Hygiene Bank",True,2020-11-10,"<p>Welcome to The Hygiene Bank Enniskillen,&nbsp;</p><p>Galvanised by the belief that being clean is not a luxury or a privilege, The Hygiene Bank is a registered, people powered, grassroots charity grounded in community. We collect and re-distribute donated toiletries, hygiene, beauty and personal care items to UK charities, voluntary organisations and schools. These in turn are then given for free to their beneficiaries. Our passion stems from a sense of injustice: it's not right that anyone should face hygiene poverty.&nbsp;</p><p>Your donations will help us setup &amp; establish The Hygiene Bank here in Fermanagh. All donations received will be redistributed within our community to those who need it the most with the help of our community partners. Your donations and support are greatly appreciated. Together we can make a difference in Fermanagh &amp; our local community.&nbsp;</p><p><br></p>",1,1,"2020-11-12 20",https://www.justgiving.com/The-Hygiene-Bank-Enniskillen,2020-11-12,20,500,"The Hygiene Bank Enniskillen"
,,,1110522,"The Trussell Trust",False,2020-10-29,"<p>""Poverty often deprives a person of all spirit and virtue. It is hard for an empty bag to stand upright"" Benjamin Franklin.</p><p>Last year, food banks in the Trussel Trust network provided more than 1.6 million emergency food parcels to people in crisis. More than half a million of these went to children. It’s not right that people can’t afford the basics. With your help, we can help end the need for food banks.As a nation, we expect no one should be left hungry or destitute. Illness, disability, family breakdown or the loss of a job can happen to any of us. With your help #ThisCanChange</p><p>The year one social work students at Anglian Ruskin University will be surviving on food bank rations for one week and will be sharing our experiences with you. To know what poverty feels like, it must be first experienced.</p><p>Please help us raise as much money as possible this year to help combat food poverty in the UK. Every donation, however small is hugely appreciated.&nbsp;</p>",53,53,"2020-11-15 10/2020-11-15 10/2020-11-15 5/2020-11-15 10/2020-11-15 30/2020-11-15 10/2020-11-15 10/2020-11-14 10/2020-11-13 20/2020-11-13 5/2020-11-12 20/2020-11-11 10/2020-11-11 10/2020-11-10 30/2020-11-09 10/2020-11-09 10/2020-11-09 5/2020-11-09 5/2020-11-07 10/2020-11-07 40/2020-11-06 5/2020-11-06 5/2020-11-06 10/2020-11-06 20/2020-11-06 5/2020-11-05 5/2020-11-05 20/2020-11-05 10/2020-11-05 10/2020-11-04 20/2020-11-03 10/2020-11-03 25/2020-11-03 10/2020-11-03 10/2020-11-03 10/2020-11-02 10/2020-11-02 5/2020-11-02 5/2020-11-02 10/2020-11-02 10/2020-11-02 10/2020-11-02 20/2020-11-01 20/2020-11-01 30/2020-11-01 30/2020-11-01 10/2020-11-01 20/2020-11-01 50/2020-11-01 30/2020-11-01 5/2020-11-01 10",https://www.justgiving.com/nomorehungerUK,2020-11-15,735,500,"ARU Year 1 Social Work Students - Food Bank Ration Challenge"
,,,1104771,SMT,False,2020-11-06,"Save the Mothers Trust (SMT) jointly with Bradford Central Lions Club launched its Food Bank in March 2014 to provide food and support to those less fortunate and in need. The Food Bank is located at the SMT head office in Bradford, West Yorkshire. Since the launch of the Food Bank, it has served many individuals as well as families with young children who are suffering extreme hardships due to cut backs in the benefit system. Some of these people have not eaten for several days and have struggled due to the lack of basic amenities such as heating and electricity. We continuously require items to place in food parcels or cash donations to purchase them. We would appreciate your co-operation in achieving our goal to serve the needy, thereby gaining reward from Allah (SWT).
Donate from as little as £5 per month or £30 to provide one food parcel  ",5,5,"2020-11-10 10/2020-11-06 10/2020-11-06 5/2020-11-06 5",https://www.justgiving.com/james-bishop19,2020-11-10,40,1000,"SMT Food Bank (UK)"
,,,801819,Pecan,True,2020-11-11,"<p><span><span>In these difficult times, Seabass Cycles would like to give something back to those in the are who find themselves most in need. Throughout the months of November and December, we will donate 25% from every Lightweight Service to Southwark Food Bank via Pecan; a Peckham charity which seeks to help the most disadvantaged in the community.</span></span></p><p><span><span>If you donʼt need your bike serviced, you can still participate in our crowd funding campaign by purchasing one of our Seabass Cycles T-shirts, water bottles, pin badges or patches from our webstore. We give 10% from every sale!</span></span></p>",0,0,,https://www.justgiving.com/Seabass-Cycles1,,0,1500,"Seabass's Fill The Food Bank"
,,,1110522,"The Trussell Trust",True,2020-10-28,"Last year, food banks in our network provided more than 1.6 million emergency food parcels to people in crisis. More than half a million of these went to children. It’s not right that people can’t afford the basics. With your help, we can help end the need for food banks.

As a nation, we expect no one should be left hungry or destitute. Illness, disability, family breakdown or the loss of a job can happen to any of us. With your help #ThisCanChange",22,22,"2020-11-06 30/2020-11-04 20/2020-11-04 10/2020-11-04 30/2020-10-30 20/2020-10-29 10/2020-10-29 10/2020-10-29 20/2020-10-28 10/2020-10-28 20/2020-10-28 20/2020-10-28 20/2020-10-28 50/2020-10-28 20/2020-10-28 10/2020-10-28 10/2020-10-28 10/2020-10-28 30/2020-10-28 10/2020-10-28 10/2020-10-28 10/2020-10-28 10",https://www.justgiving.com/Lizzie-Halliday,2020-11-06,390,500,"The Trussell Trust"
,,,1145711,"The HSLT",False,2020-10-24,"<p>Thanks for taking the time to visit my JustGiving page.</p><p>Donating through JustGiving is simple, fast and totally secure. Your details are safe with JustGiving - they'll never sell them on or send unwanted emails. Once you donate, they'll send your money directly to the charity. So it's the most efficient way to donate - saving time and cutting costs for the charity.</p>",13,13,"2020-11-14 25/2020-11-14 100/2020-11-12 50/2020-11-10 30/2020-11-10 20/2020-11-09 10/2020-11-09 30/2020-11-02 25/2020-11-02 100/2020-10-31 25/2020-10-31 50",https://www.justgiving.com/Ashikur-Rahman5,2020-11-15,515,5000,"Covid19 Food Bank"
,,,1188494,"Humanity First UK",True,2020-11-03,"<p><b>The Team: </b>Throgmorton, a subsidiary of global financial services firm Apex Group Ltd. delivers financial and administrative outsourcing solutions to clients across a range of industries. Established in 1999, the Throgmorton business has built an outstanding reputation delivering services to alternative asset managers, oil and gas companies, and AIM-listed companies to name a few.</p><p><b>The Cause:</b><span> In the UK there has been a 23% increase in the use of food banks. With the devastating effect of the Coronavirus on peoples jobs and income, the reliance of food banks has become far more evident. Latest figures by Independent Food Aid Network (IFAN) show a 177% increase in the number of people supported with 3-day emergency food parcels compared to May of last year. Humanity First has set up its first UK Food Bank in Mirfield, West Yorkshire. A further roll out of other food banks is expected later this year. With local support they have managed to distribute food parcels to individuals and families as well as other food banks and organisations reaching a large number of people. However, to increase and expand the operation much needed donations required.&nbsp;</span><br></p><p>£25 could feed a family in the UK for a week</p><p>£50 could feed a family in the UK for 2 weeks&nbsp;</p><p>£100 could feed a family in the UK for a month&nbsp;</p><p>Please support our Food Bank effort and donate today!</p>",0,0,,https://www.justgiving.com/ThrogmortonLondon,,0,200,"Throgmorton London - Photography Fundraiser for HF Food Bank Appeal"
,,,1168898,"Harbour Church Portsmouth",True,2020-04-09,"Our Food Bank will be open more frequently over the next few weeks. We will be open at our Gunwharf location from 11am-12noon Monday-Thursday and our usual time of 4-6pm on Thursdays.

We are open for those with Trussell trust food bank vouchers, as well as anybody else who is struggling to access basic food and household items. Alongside being able to access the food bank during our opening hours, people are able to email or call to request a food parcel delivered to their front door.

If you are able, we need donations! Tinned goods, pasta, loo roll, rice, cereal, jarred sauces, UTH milk and more. You can bring in donations during any of our opening hours.

Money that you donate will allow us to keep up our stocks of food and toiletries which are making a huge difference to those in our City who need it.",0,0,,https://www.justgiving.com/Stuart-Madgwick3,,0,0,"Food Bank"
,,,1110522,"The Trussell Trust",True,2020-06-18,"Last year, food banks in our network provided more than 1.6 million emergency food parcels to people in crisis. More than half a million of these went to children. It’s not right that people can’t afford the basics. With your help, we can help end the need for food banks.

As a nation, we expect no one should be left hungry or destitute. Illness, disability, family breakdown or the loss of a job can happen to any of us. With your help #ThisCanChange",2,2,"2020-06-19 50/2020-06-18 210",https://www.justgiving.com/Bridget-Kelly2,2020-06-19,260,1350,"Food banks"
,,,1152387,"Colchester Foodbank",True,2017-10-31,"<p>Thanks for taking the time to visit my JustGiving page.</p><p>Donating through JustGiving is simple, fast and totally secure. Your details are safe with JustGiving - they'll never sell them on or send unwanted emails. Once you donate, they'll send your money directly to the charity. So it's the most efficient way to donate - saving time and cutting costs for the charity.</p>",0,0,,https://www.justgiving.com/Laszlo-Szilagyi,,0,750,"food banking"
,,,1168898,"Harbour Church Portsmouth",True,2020-04-09,"Our Food Bank will be open more frequently over the next few weeks. We will be open at our Gunwharf location from 11am-12noon Monday-Thursday and our usual time of 4-6pm on Thursdays.

We are open for those with Trussell trust food bank vouchers, as well as anybody else who is struggling to access basic food and household items. Alongside being able to access the food bank during our opening hours, people are able to email or call to request a food parcel delivered to their front door.

If you are able, we need donations! Tinned goods, pasta, loo roll, rice, cereal, jarred sauces, UTH milk and more. You can bring in donations during any of our opening hours.

Money that you donate will allow us to keep up our stocks of food and toiletries which are making a huge difference to those in our City who need it.",0,0,,https://www.justgiving.com/Stuart-Madgwick2,,0,0,"Food Bank"
