Title,Location,Link,Raised,Target,MostRecentDonation,Created,Organization,OrganizationDetails,DonationCount,Donations,Description,Complete
"Jacobs well","Gosport, South East England, United Kingdom",https://uk.gofundme.com/f/8u5j7-jacobs-well,2000,1688,,2018-06-09,,,0,,"To those who don’t know me I am Cherish Pottinger the granddaughter of Stuart and Angela and the daughter of lez and Lorraine . My family have dedicated their lives to the he charity my grandparents set up 26 years ago for gosport people   my grandad was told to retire after he had a cardiac arrest 8 years ago but three months later he was back helping people . There is nothing they wouldn’t do to help people . Two days ago a brick was put threw our window and the office was destroyed   three laptops were taken and the donation box   the till was smashed . I want to make it clear this is not Jacobs well asking for help as they never ask for a penny from anybody. It’s me asking for us all as a community to step up and give just a little bit back ! I would love to raise 2 thousand pounds to replace the office equipment but mainly to show my grandparents they are appreciated for all the work they do unnoticed  I promise every single penny raised would be used for the charity so they could help people even more than they do already it would help pay the rent for a month for example easing the pressure at this rubbish time .  my grandad was so devastated when he arrived for work at 8am that horrible morning and I know each of them questioned why they are devoting themselves to this .most of us me included wanted to close the food and not give it out that day   but he was certain that this would not stop us feeding the hungry families in gosport for free . Some people have already been to the charity leaving donations and asking if we had a go fund me . So here it is any help would be lovely and so appreciated . We won’t let a few people stop us helping the families we feed   the people who have lost their homes store their items   the full house of furniture we donate regularly  the clothes we give to people with nothing   we work with the royal British legion to help   Gbc  Salvation Army   women’s refuge   homeless shelters   social services   the list literally goes in and on ❤to all Cherish Pottinger (Jacobs well care centre )",False
"help support our homeless veterans with VICs","Sunderland, North East England, United Kingdom",https://uk.gofundme.com/f/help-buy-a-building-for-vics-sunderland,2500,1389,,2020-09-06,,,0,,"Me and Bobby Robson are doing a challenge in October  for a charity very close to our hearts  and close to many others. As are all charity’s  it’s called Veterans In Crisis Sunderland and it’s a charity which supports the homeless  people with PTSD  mental health issues  family problems and many more. It’s a charity based in Sunderland. The challenge is called the October 300  bit cheesy I know but I couldn’t think of a better name basically what We are going to do is.... run 10 mile a day  everyday for 30 days straight in October  plus the virtual London marathon on the 4th of October. Me and bobby are obviously taking a massive challenge on here  300 mile each which is the equivalent from Sunderland to Southampton !!! ABOUT THE CHARITY Veterans in Crisis (VICS) is a community interest company (CIC) that helps Armed forces veterans in Sunderland We have a 4 story building called the ERV  it has a drop in  emergence accommodation for up to a family of 4 A therapy centre and a podcast studio We help with any problem a veteran may have  Homelessness  employment  training  Social isolation  mental or physical health problems and Drug & alcohol. We work in partnership with all major services in Sunderland and have an armed forces champion in every GP surgery in Sunderland We are fundraising to buy the ERV building as the land lord has put it up for sale.",False
"Our New Venture","Paignton, South West England, United Kingdom",https://uk.gofundme.com/f/cookingwithcody,7500,6255,,2020-09-03,,,0,,"We will never stop working towards our end goal which is to provide a venue to provide cooking workshop facilities for children  families and the homeless of the UK. We want to design and create a double decker bus which will have cooking stations on it with all the distancing that we need. Once we have this bus we can get the help of the homeless and people out of work to help us build it to create a mobile cooking workshop venue which can tour over the UK to every school possible to create a completely new  game changing view on cooking. We will visit homeless shelters and arrange to help teach the homeless to cook and prepare better food so when they get the support they need to get a bedsit or hostel room  they can prepare the food their body needs. We will have the venue open for parties  for school visits  the homeless  for families to learn to cook  for referrals from Social Service to help families  referrals from domestic abuse charities and so much more. Our plan is to help child obesity  life skills through cooking and a whole lot of entertainment and fun.     In the bus we will have a YouTube filming studio where children can even record their own cooking show for YouTube just like we do. Please help us as much as you can so we can get this venture on the road. Thank you so much  Mike  Cody and Lara. xxx ",False
"Help the homeless this christmas!","Hopwas, West Midlands, United Kingdom",https://uk.gofundme.com/f/ywqpt8-help-the-homeless-this-christmas,500,785,,2019-12-16,,,0,,"This Christmas I want to give back to people who need it the most; this time of the year is perfect for bringing people together and helping people who need it. So I'm asking for a small cash donation to buy hats  scarfs   gloves  socks  sleeping bags  bags and sleeps mats for the homeless. Were meeting at 4pm on 20th at the bull in birmingham city centre  this is where we will start and be handing out ""Christmas bags"" to the homeless they will be full of all of the above. Will we will be cooking hot food and giving out pots of this too  thank you so much for reading and every donation is appreciated! ",False
"Legal Cost to support an ex veteran","Broadheath, North West England, United Kingdom",https://uk.gofundme.com/f/legal-cost-to-support-an-ex-veteran,850,-1,,2020-10-01,,,0,,"As you all know I'm struggling a bit at the minute with my house situation I've had free legal advice from a friend but need money to fight my corner initially £500 I've not got anything to my name as my ex already takes most of my money for kids I don't even see I'm asking on Facebook and to all my friends as I haven't got any other option I've got 403 friends on facebook can anyone help me in anyway even if all my friends gave me £1 it would help me to get the ball rolling I feel so ashamed to ask but I promise everyone I will make it upto you somehow  my options have gone and no way will I see my daughter homeless",False
"Keep All-Women Shortlists Female!","Liverpool, North West England, United Kingdom",https://uk.gofundme.com/f/fighting-for-female-representatives,40000,32030,,2018-01-12,,,0,,"Comrades  we are a group of Labour women who want to ensure all-women shortlists (AWS) remain reserved for females and that women's representation in the party increases. We believe that the election of self-identifying transwomen as women's officers and their inclusion on all-women shortlists is reducing and undermining female representation in the Labour party.    We are absolutely committed to trans people  as a marginalised group  living free from discrimination and violence: we need trans representatives  trans councillors and trans MPs in our party. We are socialists and we are egalitarians. However  trans representation must not happen at the expense of female candidates and we are furious that we are having to fight another battle for women's representation  just 100 years after the suffragette victories.    We have been advised that a legal challenge to the Labour party on this could be winnable. The party has recently allowed males to be elected as women's officers and males to be selected over females in all-woman MP candidate selections. This has happened because Labour  in practice  has started to define 'women' by sex AND by self-identification. Labour is now relying on these two antithetical definitions of 'woman' to choose candidates which is the cause of this conflict of interests. We need a resolution.    Self-identification does not define men as women  in law or in fact. Labour conference has neither agreed nor even debated self-id or rule changes to the Labour party's AWS selection process. Women  as a marginalised group  are entitled to AWS under Equality Act 2010 exemptions. Trans people who have had gender reassigment are also  rightly  protected as a group under the act but men who simply self-id as women are not. Only party members can change party rules  not its MPs  not its general secretary and not its paid bureaucrats.    As socialists we understand class analysis and we know the most meaningful way to classify women is by sex. Women are classified as second class citizens because of our biology. None of us can keep our sex a secret and if we could there would be no pay gap and no #MeToo. Whereas no one can tell what another person's gender identity is (if they even have one) just by looking at them. Sex  along with poverty  age  disability and race  is one of the major oppressive hierarchies in the world today. Women's biology has always the basis for our oppression worldwide BY MEN. Feminism is defined as the movement to liberate all women from sex-based oppression.     Self-id also impacts on lesbians and gay men who  by definition  are not homogenderists but homosexuals. Lesbians and gays are currently afforded legal  sex-based protections from discrimination and these are already being diluted by self-id. We believe gender is a manmade  toxic set of stereotypes  used to restrict men and women and we want to see it abolished  not codified into law. We support all gender non-conforming people: be they lesbian  gay or trans. Feminists have always been the vanguard of the fight for people to live their lives in a gender non-conforming way and will continue to do so - but never at the expense of women's rights and representation.    We do not classify people based on a set of gendered ideals by which most will fail: the superficial markers of clothing  hairstyles and make-up... or by body type  weight  or perceived femininity or masculinity. We do not assess people's worth by the way they look or speak - women and men succeed as women and men simply by being. The same is true for girls and boys. All girls are acceptable as girls and all boys are acceptable as boys  however they dress  look or behave. We condemn the medicalisation of pre-pubescent kids who are encouraged to take puberty blockers if they play with the 'wrong' toys or want to wear the 'wrong' clothes. Conservatives see a boy in a dress and want to change the outfit  liberals see the dress as fine but want to change the kid's body. Socialist feminists want kids to be kids and wear what tf they want.    Every penny of the money we raise will go entirely on our legal funds  we will produce all our bank statements  legal bills and legal updates and upload to this site. We want our donors to make the decisions on how to move forward and we will crowdfund direction as well as money. We will follow where you lead  and will keep in regular contact by email  so we can democratically decide how we do this  what we want to achieve  how we go about it and who we employ to act on our behalf.    Your support will mean a great deal to women  it will mean there are people who care  who have not forgotten them. It will mean they are not politically homeless: we stand with them.     Please do not give more than you can really afford  it's not necessary... and don't feel you have to donate - your support and your help in sharing the crowdfunder is enough and IS appreciated.     Any left-over funds will go to fight against self-id  against the medicalisation of children and to keep women's spaces female-only  specifically: women's hospital wards  gyny screening  prisons  domestic violence shelters  changing rooms  saunas  spas  sleeper train carriages  scholarships  quotas and national and international women's sports.    We all know that only the Labour party has the best interests of women at heart. Please help us to overturn the decisions of the party liberals  weather vanes and bureaucrats to prove this is the case. Self-id is a tory manifesto policy for heaven's sakes... which gives us all an idea of just how bad an idea it is.    Your solidarity is appreciated and ours is eternal.    Jennifer James Garston and Halewood CLP  Dr. Viv Pointon Stone CLP  Emma Salmon Bexhill and Battle CLP  Suzanne Weaver Stroud CLP  Pilgrim Tucker Vauxhall CLP  Christine Bayliss Bexhill and Battle CLP  Miranda Yardley Southend West CLP  Samantha Marshall-Cameron. Sheffield Central CLP  Debra Atkinson Chesterfield CLP  Alice Bondi Women's Officer Penrith and the Border CLP  Karen Kruzycka Romford CLP  Avril Moussalli Altrincham & Sale West CLP  Jan Oliver Enfield North CLP  Toni Morris Vauxhall CLP  Jacky Holyoake Halesowen and Rowley Regis CLP  Matesa McKeefery Rossendale and Darwen CLP   Eleanor Hill Cardiff West CLP  Bronwen Davies Cardiff North CLP   Emma Aynsley Cardiff Central CLP  Susan Matthews Dulwich and West Norwood CLP  Catherine Costello Hartlepool CLP  Jessica Budynkiewicz Bournemouth East CLP  Rachel King Moseley and Kings Heath CLP  Claire Jones Leeds North West CLP   Chinzia Ogilvie Portsmouth South CLP   Dinah Stubbs Islington South CLP  Sian Henry Watford CLP   Liz Vickers Winchester CLP  Barbara Ulargiu Bermondsey & Old Southwark CLP  Stacey Charlesworth Hackney North and Stoke Newington CLP  Rebecca Heath Brent CLP  Debra Halliday Huddersfield CLP  Cátia Freitas Esher and Walton CLP  Liz Hemingway Knowsley North CLP  Emma Thomas Hackney South and Shoreditch CLP  Cherry Austin North Herefordshire CLP  Shelley Charlesworth Islington North CLP  Stephanie Shelford Lewisham Deptford CLP  Dr Lesley Semmens Bradford West  Abigail Wyatt St Ives and Penzance CLP  Louise Paine St Ives CLP  Mandy Moore Canterbury CLP  Karen Ingala Smith Walthamstow CLP  Susi Wisniewski Warwick & Leamington CLP   Penny O'Donnell Gedling CLP  Phoebe Alexander Middlesbrough and South East Cleveland CLP   Paula Boulton Corby and East Northants CLP            And Our Male Allies:  Michael Murphy Tiverton & Honiton CLP  Christopher Goldie Bury North CLP  Michael Weaver Stroud CLP  Lee Holland Newport West CLP  Mark Wisniewski Warwick and Leamington CLP  Ken Stringer Telford CLP",False
"Care Packages for Chesterfield’s most Vulnerable","Eckington, East Midlands, United Kingdom",https://uk.gofundme.com/f/care-packages-for-chesterfields-homeless,325,-1,,2020-03-19,,,0,,"As A-level students with a lot of free time on our hands now  we really want to do something to help individuals who are struggling at this difficult time. It is becoming increasingly difficult for those in self isolation and the vulnerable (including the homeless and elderly) to collect shopping  prescriptions and other essential items . Because of this we are aiming to provide around 40 care packages for the most in need in our community. Any monetary donations or donations of essentials (including baby wipes  soap  toothbrushes  toothpaste  feminine hygiene products  snacks  bottled water  socks and blankets) would be greatly appreciated!!! Also if anyone would like to get involved with distributing or helping to create care packages please contact Hannah Court or Tien Miller. It would be great to get as many people involved as possible :). If you know anyone who may be in need of help right now please let us know and we will do what we can to help :).",False
"Raising funds for DAFA to rebuild Beirut","London, Greater London, United Kingdom",https://uk.gofundme.com/f/vital-funds-needed-for-the-people-of-beirut,25000,4175,,2020-10-01,,,0,,"  The explosion that destroyed Beirut  Lebanon on 4th August 2020   was the 4th largest of all time. The Lebanon was already suffering from the Coronavirus Pandemic  gross governmental and institutional corruption for 30 years and was in a state of financial collapse. This bomb has ensured the people of Beirut and the Lebanon suffer even further. Over 200 people died  6 500 are injured and 300 000 people have been left homeless. 85% of the Lebanon's grain supply was destroyed in the explosion  leaving people even more hungry and destitute than before. Hundreds of the beautiful Heritage homes and buildings have been destroyed. Peoples lives have been destroyed  or set back yet again. The Lebanese have suffered for decades under their government and they need our help to restart their lives and rebuild their capital city once again. I have just returned from  17 days  volunteering for the incredible DAFA Campaign  who are helping to feed  clothe  house and rebuild homes and buildings  for the hundreds of thousands of Lebanese that need and deserve our help. If you would like to see what we at DAFA have been doing to help  please visit www.paulayacoubian.com AND PLEASE DO DONATE!!!! THANK YOU! XXX    ",False
"Archie and Leni’s stay in bedroom 24hr challenge!","Horsham, South East England, United Kingdom",https://uk.gofundme.com/f/archie-and-lenis-stay-in-bedroom-24hr-challenge,350,370,,2020-05-11,,,0,,"Archie and Leni have decided to do a sponsored ‘stay in their room for 24 hours’ challenge to raise money for charity. Archie would like to donate his money to the NHS Leni would like his to go to a homeless charity.   If you can spare even just £1  they will be over the moon!! Thank you! ",False
"Homeless man","Annalong, Northern Ireland, United Kingdom",https://uk.gofundme.com/f/krzgkk-homeless-man,355,-1,,2020-08-28,,,0,,"For awhile now iv seen a homeless man in our local community  I was never in the position untill lately to get to know him ""which I have"" he's a nice man and been homeless for some time now!    I want to try and help this man and make living wild a little more easier. While this is not the answer or a fix it will definitely help restore faith in people and help gain trust in others and maybe encourage him to one day live independently. It's the little things that count and help.   He's now been giving a little secure space by a local man so I want to buy things I think will help as iv now a fair idea of what he'll accept and needs.    Loads of people have offered to help in a some way so I thought I'd do a shared way to show support. All items purchased will be pictured and shown when I recieve/buy them.",False
"Corinna Thomas our Queen","Llanbradach, Wales, United Kingdom",https://uk.gofundme.com/f/corinna-thomas-our-queen,1000,334,,2020-10-01,,,0,,"On Tuesday 29th September  our beautiful mum sadly passed away after a short and sudden illness  as a family we are completely heartbroken beyond words.  Due to current restrictions we are limited on the number of people who can attend mums funeral  we have been asked by many about sending flowers  as a family we would appreciate anyone who’s wanting to send flowers to instead make a small donation of any amount you can afford to donate to a charity called Llamau close to mums heart.  Every year mum would make it her mission to help someone in need  someone less fortunate or someone down on their luck.   Last year she met up with a young family before Christmas who were struggling she took them food shopping and toy shopping to ensure they had a Christmas they and the children deserved as a family   the year before she made up boxes of essentials and goodies and handed them out to the homeless on the streets of Cardiff.  she had a massive heart and was truly kind and caring to everyone she met.  she will be forever missed by all who knew her   thank you",False
"50 KM Cycle for The Lebanese Red Cross","London, Greater London, United Kingdom",https://uk.gofundme.com/f/50km-cycle-lebanese-red-cross,5000,3470,,2020-08-05,,,0,,"On the 4th of August Lebanon suffered what some people are calling the 3rd biggest explosion leaving over 100 people dead   4000 injured and over 200 000 people homeless due to the mass destruction.    On Monday the 17th of August our group of four consisting of : Riccardo Perrotta  Lea Semaan  Jacob Kouyoumijan and George Coutya (three of us being Lebanese citizens living in London) will be cycling a 50 Km route around London (including the Lebanese embassy).    The Lebanese Red Cross is where people mobilize to help their neighbors—down the street and across the country. Together  they provide relief to the victims of disasters  collect and supply blood for that in need and help people prevent  prepare for  and respond to emergencies. You can help ensure these probably lifesaving services are always available  and that the Red Cross continues to have the resources  talent and ability to deliver them.    Seeing as GoFundMe do not have the Lebanese Red Cross as a registered charity we will be sending the total amount directly to them and we will post the transfer on this page to keep you all updated and make sure the donations are going straight to the Lebanese Red Cross.        Please Donate what you can as the Lebanese people need your help.",False
"City Retreat 10 Days of Dhul Hijjah","Great Glen, East Midlands, United Kingdom",https://uk.gofundme.com/f/2zu48lk,18000,5830,,2016-11-19,,,0,,"We only need £18 000 more to fully open our centre to the public. Thats just 108 people to give £125 or 216 to give £62.50 each to reach our target  are you one of them? During these amazing days of Dhul Hijjah  you can get incredible rewards  as Rasullah said they are the best days for doing good deeds  better than Ramadhan even. We are running many activities  amongst which we have the winter refugee and homeless feeding & shelter support program  please give without fearing poverty. This money will pay for our centres  allowing Daily prayers  the homeless to sleep over in the city retreat during winter nights  and much more including a Mussallah  circle of knowledge  open mic sessions for our youth & weekly Jumuah.",False
"West Highland Way for Homelessness","Glasgow, Scotland, United Kingdom",https://uk.gofundme.com/f/west-highland-way-for-homelessness,1000,1050,,2020-05-19,,,0,,"Hi folks  thanks for visiting my page.     As many of you will be aware  after experiencing homelessness myself on a few occasions  I have worked in the sector for over ten years now.     In a variety of posts  and with a few different organisations  I have witnessed first hand how difficult it is to offer the best support to the people we work with  with a limited amount of funds.     Traditionally  the social care sector is always the hardest hit when it comes to cuts by local authorities or local government  and very often the people who need our support the most  suffer more through no fault of their own.     On September 28th 2020  I plan to walk the West Highland Way - all 96 miles of it - to raise some much needed funds for some of the most vulnerable people in the country. I plan to dedicate the funds to two main charities in Scotland  two charities who are very close to my heart from a personal and professional perspective...    Simon Community Scotland and the Glasgow Night Shelter.    On the last day  after reaching Fort William  I will also climb Ben Nevis just to complete the task.     I'm asking people in social media circles if they would like to join me - either to raise money for my charities  or for charities close to their own hearts - and I would like to extend this invite to you too.    Now  let's get this straight - I'm no Sir Tom Moore...but let's see what we can do for some of the most stigmatised and discriminated against people in the country.    What do you think? Fancy it?    You will be able to follow my progress on Facebook (Homeless Scotland) or on Twitter (Homeless Scotland/ @Glasgow_Jim)    I'd love it if we could make it a team effort. But I'd equally appreciate any spare coppers you could contribute to my wee cause.    Thanks so much for taking the time to read my plight.    Jim.",False
