Title,Location,Link,Raised,Target,MostRecentDonation,Created,Organization,OrganizationDetails,DonationCount,Donations,Description,Complete
"The Winstons Amen Breakbeat Gesture","Thorpe Waterville, East Midlands, United Kingdom",https://uk.gofundme.com/f/amenbrother,24000,-1,,2015-02-18,,,0,,"The amen breakbeat  possibly the most famous breakbeat and sample of all time!  Everyone knows it  and everyone knows where it came from  so that story does not need to be told again here.  However  what is little known  is that the The Winstons have never received a single penny for its use in the countless music that contains it.  Richard L Spencer  (Lead vocals and sax player) who wrote the arrangement was totally unaware of its cult status until around 1996. It was during that time that he was recovering from a heart attack when he received a phone call from a record label looking to get hold of the masters.This surprised him  has he had not had any dealings with the music industry since 1971  which was when he left the scene to carry on with his life  education and work. During that time he had not received a single penny of royalties from publishing or airplay. Bare in mind that it sold over 1 million copies on the back of the A side ""Color him father"". That could of been a LOT of money!  While recovering from his operation at home  he decided to research the song more and to try to find out why there was a sudden interest in it.  He quickly realised the scale of what had gone on regarding the sampling of the breakbeat  and never returned the call to the record label.    Unfortunately  by this time the statute of limitations had run out  and he was unable to legally persue anyone for using the beat in their music. In this era  there were no copyright laws in place regarding sampling like today. Obviously with the amount that it had been used  it would of been logistically impossible to chase after everyone that had used it  and would of cost untold amounts of money in legal bills too.    All he could do was sit back  be frustrated  and accept what had happened. He gave some interviews at the time  and got on with his life.    Gregory Coleman  the drummer who actually played the beat  also never received any royalties from the sample  he sadly died a broke and homeless man around 2006.    Fast forward to 2011  and the BBC/1Xtra radio station ran a feature on the cult amen breakbeat.  As part of that  DJ and presenter Kutski tracked down Richard L Spencer and recorded a short interview with him. This can be heard on the BBC 1Xtra website here:  http://www.bbc.co.uk/programmes/p00hb618During that interview  Richard reveals his frustrations regarding people sampling his music  and that they got nothing back for it.    He went on to say  he would love for people to ""do the right thing"" and give a little something back for using the beat  and to make it legal.    This is where I came into the story (myself a long term lover of the amen break. I grew up on electro  hiphop  rap  UK breakbeat hardcore  jungle and drum & bass scenes) after hearing the interview that someone had posted in a Facebook jungle music group.  It got me thinking  that no one had actually taken up the challange of trying to fulfill his wishes  so I immediately tasked myself with getting in contact with Richard  which I managed quite quickly. I explained my plan to try to get a donation page up and running  and got his blessings to do so.  All monies raised will be given to him  as the copyright owner of Amen brother.    So here is where all of you come in  if you have ever written or sold any music with the amen break  or even just enjoyed one of the countless hundreds and hundreds of tunes that contain it over various genres and styles of music  please donate towards the good cause of the worldwide music community giving something back to the man behind the legendary breakbeat.    Please be aware  this is in no way a means to try to chase royalties  fees or to pay for sample clearance.  It is nothing more than a gesture of good will and obviously totally voluntary.    Thankyou from myself  and also on behalf of Richard.Update:As the campaign has now become very public  the terms from gofundme say that I have to add some more information to help protect against funding campaigns that are set up as scams  so here is the info required:1. Who you are  I am Martyn Webster  42  A DJ from UK who grew up on music. I started in the mid 80's with electro  hiphop  and rap  this moved on to electronic genres and ultimately the UK breakbeat hardcore scene. At this point in early 1992 I started mixing and buying vinyl.  I played out at many clubs and venues around the area I live  and followed the scene through the famous jungle era and onto drum & bass.   Of course  all of these genres right from the rap tunes of 1986 started to sample and use the amen break. Thus  I became one of the generation who took it under their wing and loved it in all of its mutations.  I hung up my headphones in 2004 and had a break (excuse the pun!) from the DJ scene. Seven years later the yearning to mix again was too much  so I got another pair of Technics and now mix for personal enjoyment at home.  Over the years I have built up a large network of friends and contacts both off and online  along with my youtube channel (www.youtube.com/user/martynwebster) which has a huge following. I set up the channel as a way to share the passion and knowledge of the music scenes I have loved so much. The channel has nearly 4 million views and just under 7 thousand subscribers.2. Where you're from  I am from the UK and have lived here all my life  in and around the Northamptonshire area.    3. Your relationship to the parties you're raising funds for  I am simply a fan and long term lover of the sample that was generated from Richard and The Winstons music (Color me father is also a wonderful tune in its own right  and as a step father myself  I can associate with it)    4. How the funds will be spent (be specific as possible)  As above  all money raised will go to Richard.  Some people have said some should go to the daughter and step-daughter of Gregory Coleman (the drummer).  If we are able to get in contact with them then it is definitely something that could also happen.5. How you intend to get the funds to those in need  Ultimately  the perfect end to this whole campaign would be to have the opportunity to hand deliver a cheque to Richard  and something I would take great pride in doing. With me being in the UK and him in the USA it makes things slightly harder  but not impossible.  If I can scrape together the money for flights it will happen.  Otherwise  I will have to transfer funds via banking.",False
"Help for Emmaus","Kingswood, Yorkshire and the Humber, United Kingdom",https://uk.gofundme.com/f/sally039s-campaign-for-emmaushull,1000,1190,,2020-07-02,Emmaus-hull,"Registered nonprofitDonations eligible for Gift Aid.",0,,"Emmaus Hull and East Riding is a Community Charity providing a bed  board and allowance for people who have experienced Homelessness.  We have arrived on site this morning to the devastating discovery that our office has been burgled. There is substantial damage to the doors  locks and equipment as well as the stolen goods which includes a small safe containing cash and some of our Companions hard earned savings. Our Companions are encouraged to save a small amount each week to plan for their future and move on to independent living.  Any donation will help to make an impact and go towards repairs and replacing savings of our Companions who work tirelessly to keep our Community a safe  happy and healthy place to live.    More information about Emmaus-hull: Emmaus is a solution to homelessness that comes with a challenge. We provide a home  bed  board and a small allowance for people who have experienced homelessness. When a person hits rock bottom  they find their way back  not just through handouts but by the challenge of work and taking responsibility  it really works. The Orchard in Hull is a purpose built Community that will be a home for 30 formerly homeless people. This also includes a Furniture Superstore  and Learning facilities.",False
"Urgent help for disaster stricken #Lebanon","London, Greater London, United Kingdom",https://uk.gofundme.com/f/sahtak-bil-dineh,20000,14634,,2020-06-09,,,0,,"  Sahtak Bil Dineh Appeal update :    A mammoth explosion took place in Beirut this week.    The blasts in Beirut  were pretty devastating  but the important news in all this was that more than 6 000 people were injured  plus 150 killed  dozens still missing to this hour as rescue teams search for them  & hundreds of homes & people’s livelihoods were shattered  rendering nearly 3000 homeless.     As a result  Beirut has been declared a disaster striken city.     With the port -- Lebanon's economical lifeline -- totally destroyed   food shortages will spike & many families will go without.Already  Lebanon was suffering from massive food & fuel shortages  and now it will not be able to import anything. Bleak  darker days for hundreds of thousands of people lie ahead!     This is urgent.     Lebanon needs you now.    Please donate so we can ensure people have a place to stay safe  food to eat & the means to survive & overcome this catastrophe.    Pray for lebanon ...    Your help is more needed than ever     Your donations will help contribute to:    -hospital bills  -small repairs  -Buy basic food items to put together food parcels for many who will have nothing to eat today and in many more days to come.   -Life saving medications for those in need & unable to afford those.We need to help those on the ground with whatever means we can.    Help us help people   we beg you!         ___________________________________      Half the population are living in abject poverty.     People are dying  not from Covid  but from starvation  lack of medication and healthcare.    The economy  currency and banking system have failed. Inflation has been the final blow. Many in work have not been paid for months and others have lost their job and cannot feed their families or pay the rent.     Callers from across Lebanon have been begging for help on the programme “Sahtak Bill Dinyeh ” (your health is worth the world) on Sawt al Ghad radio .    Helped by many charitable people  the programme’s host Dory Nasr has distributed food  medicine and basic necessities.        Now the warehouse is empty.      Lebanese around the world and those sympathetic to the country’s plight can help by donating what they can. Every penny helps  paying for baby milk  food  medicine and housing.    Hala and Dana  two British-Lebanese expats  decided to kickstart this fundraiser to help secure both continuity and replenishment of the food bank. This is a much needed lifeline  without which many families will be doomed with both hunger and displacement.       Le Liban est au bord de l’effondrement total.    La moitié de la population vit dans une pauvreté extrême.    Les gens meurent  non pas de Covid  mais de faim  de manque de médicaments et de soins de santé.    L'économie  la monnaie et le système bancaire ont échoué. L'inflation a été le coup de grâce. Beaucoup d’employés n'ont pas reçu leurs salaires depuis des mois et d'autres ont perdu leur emploi et ne peuvent plus nourrir leurs familles  payer le loyer ou acheter des medicaments vitaux.    Les appelants de part et d’autre du Liban ont imploré l'aide sur l'émission «Sahtak Bill Dinyeh» (votre santé vaut le monde) sur la radio Sawt al Ghad .    Avec l’aide de nombreuses personnes charitables  l’animateur du programme  Dori Nasr  a distribué de la nourriture  des médicaments et des produits de première nécessité.    Maintenant  l'entrepôt est vide.    Les Libanais au monde entier et les sympathisants du sort du pays peuvent aider en donnant ce qu’ils peuvent. Chaque centime aide à payer pour le lait infantile  la nourriture  les médicaments et le logement. ",False
"Help Pam to Continue her Incredible Charity Work","Clawthorpe, North West England, United Kingdom",https://uk.gofundme.com/f/help-pam-continue-her-charity,2500,1260,,2019-10-01,,,0,,"Woollies for the World was founded by Pam Davey in April 2014.  She set up the knitting group in memory of her angel baby  Joshua Luke West  31/10/1983.  At first she concentrated on making items for angel and premature babies but after 6 months the group expanded to include items for the homeless and orphans  etc.     Woolies is a group of ladies who knit for charity. To date we have donated over 400 000 items to projects.  All items are delivered to Pam and then distributed to needy causes.    The items are currently overtaking Pam's home  and so she is unable to function on a social capacity. Pam runs Woolies for free  and has dedicated her life to the group.  However  Pam recently announced that unless she can get money towards storage she is going to have to cut back on the causes she can support.    This has been a huge decision  bringing her a lot of stress. I (Hannah) decided to set up this go fund me to try and get Woolies a premises as soon as possible. Pam would never ask for this help herself  and I can't think of a better cause.    Please help Pam continue to support numerous charities and individuals in desperate need of help. Thank you.",False
"Save our home!","Waltham Chase, South East England, United Kingdom",https://uk.gofundme.com/f/utdarg-save-our-home,10000,2600,,2019-04-02,,,0,,"I am a 23 year old orphan  who's parents died of cancer within a year of each other  I have taken on the care of my 13 year old half-sister. After losing my father my mental health suffered greatly  and mum was my rock in helping me to come out of such a dark place. My sister is the only person I have left  I am scared that if we lose the house then we will be separated and then we will both be alone. We are already scared and to be separate will be terrifying. Due to losing mum we have been left with a lot of big debts  which we cannot pay unless we sell the house  our home. We cannot afford to move out so we are stuck. I couldn't bear to lose our home and make my 12 year old sister homeless and motherless. The funds raised will be used to pay off the debts and the mortgage to keep us in our home. Our family has already been torn apart  and to lose our home would be soul destroying. Please if you can help we would be over the moon  we are desperate  please don't let our tiny family be torn apart.",False
"Supper Collective","York, Yorkshire and the Humber, United Kingdom",https://uk.gofundme.com/f/supper-collective,23056,-1,,2020-03-31,,,0,,"Supper Collective  My Name is Julia Holding and my husband and I own a café in the heart of the Bishopthorpe Rd area of York. When the Covid -19 epidemic hit the UK  our café was forced to close on 21st March 2020  we decided to fight back by doing what we do best. We joined forces with other York chefs  independent businesses  a local councillor and a team of fantastic volunteers to help us organize  create and deliver meals to any in need across York. Our name is Supper Collective.    Mission  Our mission is to prepare and distribute a total of 100 meals per day  60 to anyone isolated or homeless  and approximately 40 to the incredible front line workers at York district hospital.    All involved give their time for free  Your donations are used to cover the cost of ingredients  packaging and delivery. We aim to keep this project going for as long as our community needs it.     In the short term  we have appointed a treasurer (David Morris)  together we will look after the fund and ensure that no one that is volunteering for our Supper Collective is out of pocket for their amazing efforts.    Please give what you can and we will make sure the money is spent on produce that will enable the chefs of Supper Collective to prepare nutritious meals and have them distributed to those in need.",False
"Kane walkers send off fund (funeral)","Birmingham, West Midlands, United Kingdom",https://uk.gofundme.com/f/kane-walkers-send-off-fund-funeral,2000,2060,,2019-01-31,,,0,,"Kane Walker was an amazing strong and caring man through out my his life kane has loved and cherished his family I remember all the good times at my nans every Sunday having dinner he even lived with us on a few occasions he loved to sing and dance me and my sister would always listen and laugh he was always the life of the party he could fill a room with complete happiness with just one smile  with just one word! until the unfortunate passing of our Nan and his mom when contact become a lot less frequent in these years he become homeless and a lot happened to Kane which changed his life and his view on his life he no longer wanted to live he felt alone and like no one could help him out of the dark place he was in I feel the system really failed my cousin they should be more support and services for homeless people out there every homeless person is important and is loved by someone if not by many like my beautiful cousin Kane Walker ❤️❤️    We are arranging our cousins funeral. Kane Walker  we would appreciate any donations no matter how big or small to contribute towards his funeral to make his send off as beautiful and as memorable as we can.    Ellesse&Demi Wilson ",False
"Legal funds","Corsham, South West England, United Kingdom",https://uk.gofundme.com/f/4cnfap-legal-funds,10000,6860,,2018-07-05,,,0,,"I am raising money for a friend who has been turned down for legal aid.     Zoë has lived in her shared ownership flat for 11 years. She initially bought a share in it with a former partner. The relationship broke down due to his extreme violence towards her and he moved out  leaving her to pay the rent on the remaining share for 6 years.     Her former partner is now trying to lay claim to the original share  which is unaffordable for Zoë and would leave her homeless. Legally she is in a strong position  however she is unable to pay for solicitors to fight her case  and she has been turned down for legal aid due to the amount of work involved.     This situation has had a huge impact on Zoë's health  and being able to put the matter to rest would make a massive difference.",False
"Rumi's Xmas","London, Greater London, United Kingdom",https://uk.gofundme.com/f/rumi039s-xmas,3000,2487,,2018-10-12,,,0,,"  ❤️Give the gift of Hope this Xmas❤️    We are holding a cosy event at 'Rumi's Cave' for those who have no home this Christmas.    Our intention is to try to make a difference and give back to those less fortunate.    We have found a space to offer warmth  food  entertainment and love on Christmas Day for the homeless.      Donations of any size will help contribute towards this event.      The money will go directly towards serving a hot breakfast  lunch and dinner  refreshments  hostels & accomodation   sound healing therapy  recovery workshops  folk music performers and dance organizers  toiletries and gift bags containing daily essentials.    Any donation small or large would be greatly appreciated  all of which will go towards making a special day for those in need.       If you would like to get involved and help that would be greatly appreciated too. Just send us a message.      It is so easy to detach yourself from the suffering on the streets around you. Many of those who have ended up homeless have endured a life long struggle of mental illness or have fled a war zone. Instead of receiving love and care these people have been rejected by society and ended up in vulnerable situations.  Therefore even if it is only for day  our aim is to give hope and reassurance that it is never too late.    'Rumi’s Cave' is a non-defined social space open to all to reflect and share.     Inspired by the legacy of Rumi it aims to provide the cultural  social and spiritual foundations; to nurture individuals  revive communities and build bridges in society.    ‘Be a lamp  or a lifeboat  or a ladder. Help someone's soul heal. Walk out of your house like a shepherd.’ Rumi     ❤️Thank You ❤️",False
"Emily & Anabelle","Orpington, Greater London, United Kingdom",https://uk.gofundme.com/f/emily-amp-anabelle,150,945,,2020-05-24,,,0,,"Emily & Anabelle  along with their family  were made homeless last week due to a fire in their building. We would like to raise funds to help the whole family and especially to buy clothes  shoes  toys and activities or anything else that needs replacing for the girls.     With love from the Roos Academy Festival Team ",False
"A cause I care about needs help","Knottingley, Yorkshire and the Humber, United Kingdom",https://uk.gofundme.com/f/am386g-a-cause-i-care-about-needs-help,1000,505,,2020-04-26,"SSAFA, the Armed Forces charity","Registered nonprofitDonations eligible for Gift Aid.",0,,"My name is Michael  a serving soldier of almost 20 years.    Given the current climate  I don't want to take anything away from the amazing job that our NHS are achieving and likewise  the highly motivated charities that support them. The news  papers and social media to name only a few  are dominated by the current global pandemic.     It is my aim to raise awareness and funds for a charity that is currently less publicised than the global pandemic. My chosen charity is SSAFA  more specifically  Homeless Vets. I aim to do this by running 10 km daily for 10 days.     If there are any likeminded individuals that would like to join me in the activity  please feel free  or you can make a contribution if you wish.    For more information about SSAFA  please follow the link below.    https://www.ssafa.org.uk    For more information about my challenge  please feel free to message me.    Thank you for reading my story.    Mike.",False
"Support Khloe & Llewie","Basingstoke, South East England, United Kingdom",https://uk.gofundme.com/f/support-khloe-amp-llewie,2000,1460,,2020-02-23,,,0,,"        This is Khloe & Llewie on their first Christmas in their new home. Shortly after  Storm Dennis hit and left their home under 4ft of water. Like others affected  this has caused imeasurable damage and left them without a home. Llewie has comphrehensive and complex needs as a result of his severe disabilities.      Llewie was born well  but aquired his disabilities and illnesses as a result of complications during what should have been a routine surgery at 6 weeks old. This left him with 80% of his brain damaged and life long implications for both him and his mum. Khloe is a single parent and had to manage his therapies  and medical needs all on her own. Recently  she has support from carers to help with Llewies complex and varying needs.      He has spent his whole life in and out of hospital having surgeries and treatments and needed a safe and clean home to return to. Due to his needs  suitable accomodation options were limited and luckily they found a home that met Llewie's medical and legal requirements  but also provided Khloe with much needed respite.         Overnight  years worth of critical medical and adaptive equipment as well as the majority of their belongings were destroyed by flooding. As medically required  his bedroom was on the ground floor which meant that the most important posessions were lost.         We have now discovered that none of this is covered by their insurance  so we are asking for any contribution to help get them back on their feet.     Thanks to the local fire brigade the house was drained  but is now uninhabitable  and they are homeless.              Any help you can give by sharing of donating would be massively appreciated!!     Imogen & Claudie",False
"Coastal Housing Gas Team Movember Challenge","Birchgrove, Wales, United Kingdom",https://uk.gofundme.com/f/Coastal-Housing-Gas-Team-Movember-Challenge,200,820,,2019-11-03,"THE HILL CHURCH SWANSEA","Registered nonprofitDonations eligible for Gift Aid.",0,,"Hi  thanks for taking the time to look at our movember go fund me page. If you know us  you probably know most of us can't pull off a tash but it's all for charity and that's what counts.     All of us from Coastal Housing's Gas Team are taking part in raising money this November for a charity which is based in Swansea and in need of donations . Instead of raising money for mens mental health and testicular cancer  which are obviously very important charities  we are all growing a moustache to raise money for a local Swansea charity called Matthews House. Their aim is to provide a warm and welcoming building in the heart of Swansea  with the expressed intention of being accessible for the homeless and most vulnerable in Swansea.     Do you want to join us in making a difference? We're raising money in aid of Matthews House (THE HILL CHURCH SWANSEA ) and every donation will help. Thank you in advance for your icontribution to this cause that means so much to us.",False
