Title,Location,Link,Raised,Target,MostRecentDonation,Created,Organization,OrganizationDetails,DonationCount,Donations,Description,Complete
" Mid Essex food support ","Danbury, East of England, United Kingdom",https://www.gofundme.com/f/g973ys,1000,490,2021-12-23,2021-11-11,,,33,"2021-12-23 5/2021-12-23 15/2021-12-22 25/2021-12-22 25/2021-12-22 20/2021-12-22 10/2021-12-22 50/2021-12-21 10/2021-12-21 5/2021-12-21 15/2021-12-21 10/2021-12-21 5/2021-12-20 30/2021-12-20 20/2021-12-19 5/2021-12-19 20/2021-12-18 10/2021-12-18 10/2021-12-18 20/2021-12-14 20/2021-12-14 10/2021-12-02 5/2021-11-30 5/2021-11-27 5/2021-11-25 20/2021-11-21 20/2021-11-19 10/2021-11-14 10/2021-11-13 15/2021-11-13 10/2021-11-13 10/2021-11-12 20/2021-11-12 20","This is a non profit organisation  we run purely on food donations and donations through our go fund me page.   Hello my name is Hayley The last year along side my wonderful volunteers we have been collecting and distributing food parcels in Chelmsford Maldon wickford  billericay  witham  brentwood heybridge and Danbury in Essex. I also offer advise and help for people further away to get the help they need with food parcels  clothing and every day essentials. I have come to realise not not everyone has access to a vehicle and I do  so I have been able to help people in need such as the elderly who are isolating families who can't get to food banks  people and families who are struggling with there benefits and making ends meet. The delivery service is also a door opening to engage in the lonely and vulnerable in the community  also people who want to donate food but have no way of delivering to a food bank. This is a private group and confidentiality means everything if you do not wish to post and ask for help on this page then please inbox me and I will help the best I can. all food and other essentials are currently need for donation which I can pick up. Things needed include *Tinned food and cupboard soup beans custard rice pudding vegetables spaghetti hoops tuna chic pea's fruit Sugar Tea Coffee Bread Rolls *grains pasta rice lentils *cereals all kinds *long life milk *treats Biscuits sweets *Toiletries Toothpaste Soap Shower gel Toilet paper Deodorant *Household items Washing powder/liquid Cleaning materials ",False
" Howden Helpers ""Christmas & Company&quot; Lunch ","Burland, Yorkshire and the Humber, United Kingdom",https://www.gofundme.com/f/howden-helpers-christmas-company-lunch,500,625,2021-12-22,2021-12-13,"Rotary Club of Howden Trust Fund","Registered nonprofitDonations eligible for Gift Aid.",14,"2021-12-22 100/2021-12-20 20/2021-12-20 50/2021-12-20 50/2021-12-19 40/2021-12-16 100/2021-12-16 10/2021-12-15 50/2021-12-13 50/2021-12-13 50/2021-12-13 20/2021-12-13 50/2021-12-13 30/2021-12-13 5","With less that 2 weeks to go we are almost ready to ‘Deck the Shire Hall with boughs of holly’ in readiness for the 3rd Christmas and Company lunch!   We are using money from the Howden Helpers account this year to help fund event itself  but one of the things that has been most satisfying in the past is the amazing amount of money (nearly £2 000) that we have been able to donate to local charities - especially the Mission Trinity Food Bank in Goole.   The fact that your generosity has enabled us to not only fulfil our main function of providing a Christmas lunch  great company and good cheer on Christmas Day but also to support families in real need in a very real way is extremely rewarding.   We have deliberately held off fund raising until we knew wether the event could go ahead - but we would like to try and continue our support for Mission Trinity.   To this end Howden Rotary have very kindly agreed to launch a donation page to raise funds which will be active very soon.   ",False
" Support for Tomi Waziri ","London, Greater London, United Kingdom",https://www.gofundme.com/f/support-for-tomi-waziri,10000,105,2022-02-01,2022-01-24,,,6,"2022-02-01 10/2022-02-01 10/2022-01-29 25/2022-01-26 50/2022-01-24 5/2022-01-24 5","  The Tomi Waziri foundation is dedicated to reigniting hope love and kindness in humanity.   Tomi lost his sight September 2019 to an arm robbery attack on him.He was shot at the face and became blind immediately.Devastated by the bad news when the doctor told him he won’t be able to see again Even almost committing suicide realising the reality of blindness after 27 years of being a sighted person Tomi showed courage and turned his mess to a message He realised he could be a source of hope to millions of people if only he didn’t give up.   Now after a couple of outreach to juvenile homes persons with disabilities and the feed hundred project the organization is launching a food bank dedicated to persons with disabilities and the less privileged in my community here in Nigeria.   The initiative is titled Feed the disabled food bank. The organization plans to launch the food bank project on April 24th 2022.   Your support will be highly appreciated by donating towards the food bank to put a smile on the faces and food on tables of persons with disabilities and the needy here in Nigeria.God bless you as you become an ambassador of love and kindness.   Food stuffs donations like rice  beans  spaghetti  noodles  tomato paste  and the likes will be highly appreciated . For inquiries on how to donate and support     Instagram:   https://instagram.com/tomiwazirifoundation?utm_medium=copy_link    OpenSea : https://opensea.io/assets/matic/0x2953399124f0cbb46d2cbacd8a89cf0599974963/25974020542835949380985582884747750837262786565986079785528810728444674941216/    YouTube: https://youtube.com/playlist?list=PLvfGMvun3MKVlwudILUmXmMblJ_PLKE4q    Please call / WhatsApp : Tel: +2347061766748 For our past event  documentaries and stories watch YouTube link below   Organized by: Tomi Waziri Foundation in collaboration with Grillaz BBQ Bistro Cafe  NOMFRO Technologies &The social park club.      ",False
" HELP A YOUNG FAMILY IN DESPERATE NEED! ","Jedburgh, Scotland, United Kingdom",https://www.gofundme.com/f/fn7mv-help-a-young-family-in-desperate-need,100,30,2021-11-27,2021-11-08,,,3,"2021-11-27 10/2021-11-17 10/2021-11-09 10","Hello everyone. I am trying to raise funds  just a small amount  to help 2 friends who are expecting a baby to get by until their benefits are sorted out!   The young couple in question would help anyone in the best way they could  but they now need just a little bit of help themselves! I am going to keep their names to myself so as to not cause them any embarrassment  not that they should feel any  a lot of us have been in similar situations. I will refer to them as R (female) & A (Male). Due to severe illness  and being 31 weeks pregnant  R is unable to work at present  and A is her carer.   Unfortunately they have hit hard times  getting a little behind with things  and have recently been going without food and heating due to lack of accessible funds. At present they are awaiting benefits decisions which as a lot of people know can sometimes take weeks  even months. They have tried everything to speed things along  have been refused help from the council where they live  citizens advice bureau told them there was nothing they can do but wait  and the food bank only allows a household to visit for supplies 1 a month! They have electricity  but no gas for heating  they have no food in and have been surviving on little bits they have managed to acquire here and there. They have no immediate family that can help either! Needless to say all of the stress is affecting R's health even further  physically and mentally  and is also putting the baby at risk!!   I have loaned them a little personally  until they can afford to repay it  but it wasn't much  they are worrying about that too even though I have told them not to and I'm in no rush  but their situation is worsening day by day!   Please could you find it in your hearts to help them get past this rough patch and back on their feet by donating just a small amount towards helping a wonderful young couple pull through their tough time! I would sincerely appreciate any donation  however small! All moneys will be transferred straight to their account to help them purchase food  gas & other essential items! Thanks",False
" FOODBANK DONATIONS THIS CHRISTMAS ","Warrington, North West England, United Kingdom",https://www.gofundme.com/f/foodbank-donations-this-christmas,0,300,,2021-12-15,,,0,,"This year I want to raise money  to be able to do a big shop to help food banks this Christmas ",True
" Raising money for Leighton Linslade Helpers ","Leighton Buzzard, East of England, United Kingdom",https://www.gofundme.com/f/raising-money-for-leighton-linslade-helpers,0,2000,,2022-02-01,"LEIGHTON LINSLADE HELPERS","Registered nonprofitDonations eligible for Gift Aid.",0,,"You can make a difference by donating today to LEIGHTON LINSLADE HELPERS.   LEIGHTON LINSLADE HELPERS charity 1196332 provide a range of services  from food parcels  community fridge  prescription deliveries  welfare checks  counselling and listening  personal shopping  to many other ways of supporting the community.   Leighton Linslade Helpers is a collective of community volunteers who came together to support their community through the Covid 19 lockdown in their town and surrounding areas. It very quickly grew into an organisation that is continuing to support its community by forming a charity. (1196332)   What started off as an emergency food bank to those in hardship or those shielding  without access to food  has grown into a range of services  from food parcels  community fridge  prescription deliveries  counselling and listening  to many other ways of supporting families  the elderly and the isolated. We are now established in Leighton Buzzard High Street and will continue to support our community  other agencies and wider Bedfordshire.   Our group has been overwhelmed by the generosity of people and business  during this very difficult time for everyone  and we just know that this community spirit will continue. There is still much work to be done to help our community get through this pandemic and to rebuild their lives and lift their spirits  for which so many will be grateful. ",True
" Finedon food and baby bank ","Finedon, East Midlands, United Kingdom",https://www.gofundme.com/f/finedon-food-and-baby-bank,0,500,,2021-12-20,,,0,,"Hi everyone. This fundraiser has no end date. People always ask if they can donate so we created this.     We are in constant need of nappies in all sizes and baby wipes and baby toiletries and pull ups for struggling families s     This way we can withdraw as we need to top up the foodbank and the baby bank.     Thank you all for residing. ",True
" Help Homeless people during Christmas ","Darlington, North East England, United Kingdom",https://www.gofundme.com/f/pc78g-help-homeless-people-during-christmas,0,500,,2021-12-18,,,0,,"I’m helping homeless people find shelter and food banks for christmas so they have supplies   Travelling around the NE to help in need !!!   There are people dying all around England during Christmas because of the harsh and awful environments that they must live within  shortage of food and awful weather causes the homeless population to decrease each year but cry for help of of the average   please help me today support food banks and homeless shelters and reduce this chritmas death .   It would make me so happy if we could reach our goal ready for the harsher weather due to come ",True
" The grinches little helpers ","Wolverhampton, West Midlands, United Kingdom",https://www.gofundme.com/f/the-grinches-little-helpers,0,150,,2021-12-06,,,0,,"Last year the grinches little helpers  Alfie 10  Archie 8  lily 2  and Tegan 16 raised an amazing amount of money to create massive food hampers to donate to local food banks and loads of shoe boxes full of toys for less fortunate children. In total last year we raised £300 at the grinches den. You can check out all the amazing work from the children on their Facebook page @ THE GRINCHES DEN. This year the children have a target of £500. Their chosen food bank this year is the well. However they have also been ask to set up their own food bank at a local community centre. We are currently exploring this opportunity and would like to try and raise as much as possible to be able to have to ability to set up a fully functioning food bank ran by the children to help our local community as we all know how hard times have been throughout the covid-19 pandemic. However if they do not set up a food bank the extra money raise shall be split between a number of local charities. The journey can be followed on their Facebook page. They have also been in the express and star to tell the world about them spreading Christmas magic and kindness around the local communities.",True
" Food packs for Christmas ","London, Greater London, United Kingdom",https://www.gofundme.com/f/food-packs-for-christmas,0,500,,2021-12-06,,,0,,"Alvina’s Food Bank have been helping families and individuals throughout the pandemic. We have provided over 1000 food packs and also during Eid and Christmas which was during the lockdown.   We have  won 3 awards in recognition of our work. We  are now planning to provide Christmas food packs to families and individuals. We know many have lost their job  and not entitled to any welfare benefits. We know people are still struggling.   We would like to provide food packs to families especially those with children and single parents.   Follow us on Facebook: Alvina’s Food Bank We provide culturally oriented and halal food.   We are seeking your support once again  some of us are extremely fortunate that we still have a job and roof over our head.    £25-£30 shopping will last a family for a week. ",True
