Title,Location,Link,Raised,Target,MostRecentDonation,Created,Organization,OrganizationDetails,DonationCount,Donations,Description,Complete
" Support our foodbank and Childrens Appeal ","Everton, North West England, United Kingdom",https://www.gofundme.com/f/support-our-foodbank,35000,33900,2022-02-06,2019-04-02,"Liverpool Six Community Association","Registered nonprofitDonations eligible for Gift Aid.",946,"2022-02-06 10/2022-02-05 20/2022-02-05 20/2022-02-05 100/2022-02-05 100/2022-02-05 5/2022-02-05 20/2022-02-04 20/2022-02-04 25/2022-02-04 14/2022-02-04 20/2022-02-04 20/2022-02-04 20/2022-02-04 20/2022-02-04 20/2022-02-04 50/2022-02-04 20/2022-02-04 25/2022-02-04 50/2022-02-04 5/2022-02-04 20/2022-02-04 15/2022-02-04 10/2022-02-04 50/2022-02-04 10/2022-02-04 50/2022-02-04 20/2022-02-04 10/2022-02-04 10/2022-02-04 25/2022-02-04 20/2022-02-04 20/2022-02-04 20/2022-02-04 10/2022-02-04 250/2022-02-04 5/2022-02-04 51/2022-02-04 25/2022-02-04 10/2022-02-04 5/2022-02-04 100/2022-02-04 5/2022-02-04 20/2022-02-04 10/2022-02-04 20/2022-02-04 100/2022-02-04 10/2022-02-04 15/2022-02-04 10/2022-02-04 10/2022-02-04 20/2022-02-04 20/2022-02-04 100/2022-02-04 10/2022-02-04 10/2022-02-04 50/2022-02-04 10/2022-02-04 50/2022-02-04 20/2022-02-03 20/2022-02-03 25/2022-02-03 20/2022-02-03 15/2022-02-03 10/2022-02-03 10/2022-02-03 100/2022-02-03 10/2022-02-03 10/2022-02-03 5/2022-02-03 20/2022-02-03 5/2022-02-03 5/2022-02-03 5/2022-02-03 25/2022-02-03 10/2022-02-03 25/2022-02-03 50/2022-02-03 20/2022-02-03 30/2022-02-02 20/2022-02-02 25/2022-01-28 25/2022-01-24 30/2022-01-21 50/2022-01-20 25/2022-01-19 20/2022-01-19 5/2022-01-19 10/2022-01-16 20/2022-01-12 20/2022-01-10 50/2022-01-10 15/2022-01-10 25/2022-01-09 100/2022-01-09 20/2021-12-29 10/2021-12-28 25/2021-12-28 10/2021-12-26 20/2021-12-24 20/2021-12-20 20/2021-12-15 20/2021-12-10 30/2021-12-05 75/2021-12-05 25/2021-12-04 75/2021-12-04 155/2021-12-02 100/2021-11-24 90/2021-11-22 35/2021-11-21 40/2021-11-21 45/2021-11-20 25/2021-07-07 30/2021-06-28 20/2021-06-09 20/2021-06-01 20/2021-05-30 240/2021-05-29 60/2021-05-29 20/2021-05-28 20/2021-05-28 10/2021-05-28 20/2021-05-28 5/2021-05-28 10/2021-05-28 5/2021-05-27 10/2021-05-27 10/2021-05-27 5/2021-05-27 15/2021-05-27 20/2021-05-26 25/2021-05-25 10/2021-05-24 20/2021-05-19 30/2021-05-15 30/2021-05-12 30/2021-05-11 15/2021-05-04 23/2021-04-27 5/2021-04-26 16/2021-04-24 10/2021-04-24 30/2021-04-24 20/2021-04-24 10/2021-04-24 10/2021-04-24 20/2021-04-24 20/2021-04-24 30/2021-04-24 10/2021-04-24 25/2021-04-24 10/2021-04-23 30/2021-04-23 20/2021-04-23 10/2021-04-23 10/2021-04-23 70/2021-04-23 10/2021-04-23 40/2021-04-22 10/2021-04-22 10/2021-04-22 20/2021-04-22 20/2021-04-22 11/2021-04-22 30/2021-04-20 10/2021-04-19 10/2021-04-19 10/2021-04-17 15/2021-04-17 20/2021-04-17 30/2021-04-17 10/2021-04-16 10/2021-04-16 30/2021-04-16 25/2021-04-12 28/2021-04-11 20/2021-04-10 22/2021-04-09 20/2021-04-09 35/2021-04-09 25/2021-04-07 35/2021-02-28 100/2021-02-20 5/2021-01-28 25/2021-01-22 200/2021-01-21 20/2021-01-12 100/2021-01-06 250/2020-12-29 50/2020-12-28 30/2020-12-25 25/2020-12-23 20/2020-12-22 10/2020-12-21 20/2020-12-21 75/2020-12-20 100/2020-12-19 20/2020-12-18 50/2020-12-18 25/2020-12-16 10/2020-12-16 40/2020-12-16 10/2020-12-11 20/2020-12-03 70/2020-11-29 5/2020-11-26 10/2020-11-26 10/2020-11-21 10/2020-11-20 10/2020-11-20 25/2020-11-17 10/2020-11-16 200/2020-11-16 11/2020-11-14 50/2020-11-13 28/2020-11-13 6/2020-11-12 20/2020-11-11 5/2020-11-11 16/2020-11-11 64/2020-11-11 75/2020-11-11 5/2020-11-10 30/2020-11-10 5/2020-11-10 5/2020-11-10 10/2020-11-09 15/2020-11-09 5/2020-11-09 5/2020-11-09 5/2020-11-08 30/2020-11-02 30/2020-11-01 30/2020-10-28 7/2020-10-28 20/2020-10-28 50/2020-10-28 20/2020-10-27 10/2020-10-27 10/2020-10-24 100/2020-10-24 5/2020-10-24 20/2020-10-24 25/2020-10-24 20/2020-10-23 50/2020-10-23 18/2020-10-23 10/2020-10-23 30/2020-10-22 30/2020-10-22 20/2020-10-22 15/2020-10-17 5/2020-10-13 10/2020-10-12 500/2020-10-09 25/2020-10-08 45/2020-10-08 25/2020-10-05 20/2020-10-04 50/2020-10-04 10/2020-10-04 50/2020-09-26 175/2020-09-26 20/2020-09-25 40/2020-09-24 5/2020-09-23 20/2020-09-22 20/2020-09-22 20/2020-09-22 25/2020-09-22 20/2020-09-22 30/2020-09-22 30/2020-09-22 5/2020-09-21 10/2020-09-21 10/2020-09-21 20/2020-09-21 20/2020-09-21 25/2020-09-21 50/2020-09-21 150/2020-09-21 10/2020-09-21 20/2020-09-21 20/2020-09-15 1000/2020-09-14 100/2020-09-12 25/2020-09-09 30/2020-09-05 50/2020-09-05 20/2020-09-01 50/2020-09-01 50/2020-09-01 20/2020-08-31 200/2020-08-30 70/2020-08-30 120/2020-08-29 20/2020-08-27 20/2020-08-05 25/2020-07-31 25/2020-07-23 10/2020-07-22 10/2020-07-20 10/2020-07-19 40/2020-07-15 30/2020-07-13 10/2020-07-12 55/2020-07-12 30/2020-07-12 5/2020-07-11 20/2020-07-11 20/2020-07-11 20/2020-07-07 50/2020-06-16 10/2020-06-10 10/2020-06-09 10/2020-06-08 15/2020-06-07 50/2020-06-05 10/2020-06-03 100/2020-06-02 25/2020-06-02 25/2020-06-01 50/2020-06-01 350/2020-06-01 50/2020-06-01 50/2020-06-01 20/2020-06-01 20/2020-06-01 10/2020-06-01 20/2020-06-01 20/2020-05-31 10/2020-05-31 20/2020-05-31 25/2020-05-29 200/2020-05-29 50/2020-05-28 55/2020-05-28 10/2020-05-27 5/2020-05-27 20/2020-05-26 15/2020-05-23 10/2020-05-23 45/2020-05-20 30/2020-05-19 30/2020-05-19 30/2020-05-14 17/2020-05-14 25/2020-05-07 40/2020-05-03 5/2020-04-21 10/2020-04-14 108/2020-04-09 70/2020-04-08 70/2020-04-08 25/2020-04-07 15/2020-03-31 200/2020-03-30 50/2020-03-30 20/2020-03-27 30/2020-03-23 50/2020-03-20 20/2020-03-20 200/2020-03-19 20/2020-03-19 5/2020-03-19 25/2020-03-19 20/2020-03-18 20/2020-03-17 55/2020-03-16 75/2020-03-16 100/2020-03-15 90/2020-03-13 55/2020-03-12 30/2020-03-03 150/2020-02-26 200/2020-01-28 20/2020-01-23 5/2019-12-22 50/2019-12-22 20/2019-12-20 20/2019-12-20 10/2019-12-20 10/2019-12-20 20/2019-12-19 15/2019-12-16 40/2019-12-14 10/2019-12-12 1000/2019-12-11 20/2019-12-11 40/2019-12-05 20/2019-12-04 20/2019-12-03 5/2019-12-03 50/2019-12-03 200/2019-12-03 400/2019-12-02 75/2019-12-02 20/2019-12-01 10/2019-12-01 20/2019-11-28 20/2019-11-28 15/2019-11-28 50/2019-11-27 10/2019-11-27 50/2019-11-27 10/2019-11-26 10/2019-11-26 30/2019-11-26 25/2019-11-25 20/2019-11-25 20/2019-11-25 20/2019-11-25 50/2019-11-25 50/2019-11-24 20/2019-11-24 10/2019-11-24 10/2019-11-24 14/2019-11-24 36/2019-11-24 10/2019-11-24 50/2019-11-24 20/2019-11-24 15/2019-11-24 10/2019-11-24 10/2019-11-24 10/2019-11-24 5/2019-11-24 20/2019-11-24 85/2019-11-24 5/2019-11-24 5/2019-11-24 5/2019-11-24 20/2019-11-24 30/2019-11-23 10/2019-11-23 10/2019-11-23 10/2019-11-23 20/2019-11-23 45/2019-11-23 5/2019-11-23 5/2019-11-23 10/2019-11-23 5/2019-11-23 20/2019-11-23 10/2019-11-22 15/2019-11-22 10/2019-11-22 5/2019-11-22 10/2019-11-22 5/2019-11-22 15/2019-11-22 40/2019-11-22 10/2019-11-22 105/2019-11-22 5/2019-11-22 10/2019-11-21 5/2019-11-21 6/2019-11-21 5/2019-11-21 5/2019-11-21 10/2019-11-21 20/2019-11-21 10/2019-11-21 10/2019-11-21 10/2019-11-21 10/2019-11-21 20/2019-11-21 50/2019-11-21 10/2019-11-21 15/2019-11-21 5/2019-11-21 10/2019-11-21 200/2019-11-21 10/2019-11-21 5/2019-11-21 5/2019-11-21 10/2019-11-21 20/2019-11-21 10/2019-11-21 20/2019-11-21 10/2019-11-21 50/2019-11-21 100/2019-11-21 5/2019-11-21 50/2019-11-21 20/2019-11-21 10/2019-11-21 15/2019-11-21 20/2019-11-21 10/2019-11-21 9/2019-11-21 5/2019-11-21 10/2019-11-21 5/2019-11-21 10/2019-11-21 10/2019-11-21 5/2019-11-21 10/2019-11-21 50/2019-11-21 100/2019-11-21 50/2019-11-21 25/2019-11-21 15/2019-11-21 10/2019-11-20 10/2019-11-20 10/2019-11-20 10/2019-11-20 5/2019-11-20 10/2019-11-20 10/2019-11-20 10/2019-11-20 10/2019-11-20 5/2019-11-20 15/2019-11-20 5/2019-11-20 50/2019-11-20 5/2019-11-20 5/2019-11-20 10/2019-11-20 5/2019-11-20 10/2019-11-20 40/2019-11-20 120/2019-11-20 30/2019-11-20 10/2019-11-20 50/2019-11-20 10/2019-11-20 20/2019-11-20 10/2019-11-20 10/2019-11-20 10/2019-11-20 5/2019-11-20 10/2019-11-20 10/2019-11-20 20/2019-11-20 5/2019-11-20 10/2019-11-20 100/2019-11-20 100/2019-11-20 5/2019-11-20 30/2019-11-20 20/2019-11-20 100/2019-11-20 5/2019-11-20 100/2019-11-20 25/2019-11-20 30/2019-11-20 190/2019-11-20 50/2019-11-20 30/2019-11-20 100/2019-11-20 20/2019-11-20 20/2019-11-20 5/2019-11-20 20/2019-11-19 5/2019-11-19 100/2019-11-19 30/2019-11-19 15/2019-11-19 10/2019-11-19 10/2019-11-19 30/2019-11-19 50/2019-11-19 7/2019-11-19 20/2019-11-19 10/2019-11-19 10/2019-11-19 30/2019-11-19 50/2019-11-19 10/2019-11-19 10/2019-11-19 20/2019-11-19 10/2019-11-19 5/2019-11-19 10/2019-11-19 10/2019-11-19 10/2019-11-19 20/2019-11-19 20/2019-11-19 1000/2019-11-19 10/2019-11-19 20/2019-11-19 25/2019-11-19 20/2019-11-19 10/2019-11-19 20/2019-11-19 10/2019-11-19 10/2019-11-19 5/2019-11-19 5/2019-11-19 20/2019-11-19 10/2019-11-19 10/2019-11-19 5/2019-11-19 20/2019-11-19 10/2019-11-19 20/2019-11-19 10/2019-11-19 25/2019-11-19 5/2019-11-19 10/2019-11-19 10/2019-11-19 50/2019-11-19 20/2019-11-19 30/2019-11-19 15/2019-11-19 20/2019-11-19 20/2019-11-19 5/2019-11-19 10/2019-11-19 25/2019-11-19 20/2019-11-19 20/2019-11-19 18/2019-11-19 50/2019-11-19 15/2019-11-19 10/2019-11-19 100/2019-11-19 20/2019-11-19 13/2019-11-19 20/2019-11-19 20/2019-11-19 20/2019-11-19 20/2019-11-19 20/2019-11-19 20/2019-11-19 20/2019-11-19 50/2019-11-19 10/2019-11-19 10/2019-11-19 5/2019-11-19 15/2019-11-19 10/2019-11-19 20/2019-11-19 20/2019-11-19 20/2019-11-19 20/2019-11-19 20/2019-11-19 50/2019-11-19 20/2019-11-19 380/2019-11-19 20/2019-11-19 20/2019-11-19 25/2019-11-19 20/2019-11-19 25/2019-11-19 100/2019-11-19 15/2019-11-19 20/2019-11-19 20/2019-11-19 10/2019-11-19 10/2019-11-19 25/2019-11-19 25/2019-11-19 15/2019-11-19 20/2019-11-19 100/2019-11-19 5/2019-11-19 500/2019-11-19 30/2019-11-19 20/2019-11-19 10/2019-11-19 50/2019-11-19 20/2019-11-19 10/2019-11-19 5/2019-11-19 5/2019-11-19 20/2019-11-19 10/2019-11-19 10/2019-11-19 20/2019-11-19 5/2019-11-19 5/2019-11-19 20/2019-11-19 50/2019-11-19 5/2019-11-19 5/2019-11-19 20/2019-11-19 10/2019-11-19 10/2019-11-19 5/2019-11-19 20/2019-11-19 5/2019-11-19 25/2019-11-19 20/2019-11-19 50/2019-11-19 10/2019-11-19 30/2019-11-18 5/2019-11-18 100/2019-11-18 5/2019-11-18 20/2019-11-18 20/2019-11-18 20/2019-11-18 10/2019-11-18 6/2019-11-18 10/2019-11-18 50/2019-11-18 10/2019-11-18 10/2019-11-18 10/2019-11-18 10/2019-11-18 100/2019-11-18 5/2019-11-18 10/2019-11-18 17/2019-11-18 5/2019-11-18 5/2019-11-18 20/2019-11-18 20/2019-11-18 10/2019-11-18 10/2019-11-18 10/2019-11-18 8/2019-11-18 10/2019-11-18 20/2019-11-18 30/2019-11-18 5/2019-11-18 5/2019-11-18 9/2019-11-18 20/2019-11-18 9/2019-11-18 10/2019-11-18 20/2019-11-18 50/2019-11-18 100/2019-11-18 50/2019-11-18 5/2019-11-18 10/2019-11-18 15/2019-11-18 10/2019-11-18 10/2019-11-18 20/2019-11-18 10/2019-11-18 9/2019-11-18 20/2019-11-18 10/2019-11-18 20/2019-11-18 25/2019-11-18 5/2019-11-18 20/2019-11-18 10/2019-11-18 19/2019-11-18 5/2019-11-18 10/2019-11-18 5/2019-11-18 10/2019-11-18 100/2019-11-18 10/2019-11-18 5/2019-11-18 10/2019-11-18 10/2019-11-18 20/2019-11-18 10/2019-11-18 10/2019-11-18 10/2019-11-18 20/2019-11-18 10/2019-11-18 10/2019-11-18 5/2019-11-18 10/2019-11-18 15/2019-11-18 20/2019-11-18 10/2019-11-18 50/2019-11-18 5/2019-11-18 10/2019-11-18 20/2019-11-18 10/2019-11-18 15/2019-11-18 20/2019-11-18 20/2019-11-18 500/2019-11-18 10/2019-11-18 5/2019-11-18 10/2019-11-18 5/2019-11-18 5/2019-11-18 20/2019-11-18 20/2019-11-18 30/2019-11-18 10/2019-11-18 20/2019-11-18 10/2019-11-18 25/2019-11-18 10/2019-11-18 15/2019-11-18 20/2019-11-18 20/2019-11-18 10/2019-11-18 10/2019-11-18 10/2019-11-18 10/2019-11-18 20/2019-11-18 100/2019-11-18 10/2019-11-18 10/2019-11-18 10/2019-11-18 10/2019-11-18 10/2019-11-18 10/2019-11-18 20/2019-11-17 20/2019-11-17 10/2019-11-17 5/2019-11-17 20/2019-11-17 20/2019-11-17 30/2019-11-17 10/2019-11-17 30/2019-11-17 10/2019-11-17 10/2019-11-17 45/2019-11-16 30/2019-11-16 10/2019-11-16 120/2019-11-16 10/2019-11-15 30/2019-11-15 250/2019-11-14 10/2019-11-14 15/2019-11-14 10/2019-11-13 15/2019-11-13 50/2019-11-08 45/2019-11-08 45/2019-11-05 5/2019-11-04 70/2019-11-04 80/2019-10-29 30/2019-10-26 10/2019-10-26 50/2019-10-25 55/2019-10-24 20/2019-10-23 200/2019-10-23 50/2019-10-22 1000/2019-10-21 30/2019-10-19 10/2019-10-18 35/2019-10-18 20/2019-10-16 40/2019-10-15 25/2019-10-15 10/2019-10-15 5/2019-10-15 25/2019-10-13 50/2019-10-11 20/2019-10-11 30/2019-10-10 35/2019-10-09 40/2019-10-08 20/2019-10-04 330/2019-10-03 40/2019-10-02 40/2019-09-28 30/2019-09-27 25/2019-09-27 100/2019-09-26 25/2019-09-25 30/2019-09-24 35/2019-09-18 25/2019-09-16 30/2019-09-16 20/2019-09-15 10/2019-09-15 25/2019-09-15 25/2019-09-15 50/2019-09-09 20/2019-09-09 30/2019-09-06 15/2019-09-05 10/2019-08-13 25/2019-08-09 30/2019-07-30 60/2019-07-25 10/2019-07-24 30/2019-07-14 50/2019-07-12 5/2019-07-12 50/2019-07-09 15/2019-07-06 25/2019-06-29 5/2019-06-28 30/2019-06-26 25/2019-06-26 10/2019-06-26 35/2019-06-23 30/2019-06-17 21/2019-06-13 9/2019-06-13 30/2019-06-13 20/2019-06-11 150/2019-06-10 30/2019-06-09 25/2019-06-08 25/2019-06-07 28/2019-06-07 50/2019-06-03 27/2019-06-03 40/2019-06-02 25/2019-05-31 10/2019-05-16 40/2019-05-16 9/2019-05-16 35/2019-05-16 16/2019-05-14 50/2019-05-12 10/2019-05-11 10/2019-05-10 30/2019-05-10 14/2019-05-10 10/2019-05-10 36/2019-05-09 100/2019-05-08 50/2019-05-07 35/2019-05-06 30/2019-05-04 25/2019-05-04 65/2019-05-03 20/2019-05-01 35/2019-04-29 35/2019-04-26 75/2019-04-25 70/2019-04-23 110/2019-04-20 90/2019-04-19 90/2019-04-18 50/2019-04-17 60/2019-04-14 20/2019-04-14 50/2019-04-13 30/2019-04-12 60/2019-04-10 36/2019-04-08 100/2019-04-07 25/2019-04-06 50/2019-04-06 100/2019-04-06 50/2019-04-05 25/2019-04-04 29/2019-04-04 40/2019-04-03 100/2019-04-03 25/2019-04-03 30/2019-04-02 30","Do you want to join me in making a difference? I'm raising money in aid of Liverpool Six Community Association and every donation will help. Thank you in advance for your contribution to this cause that means so much to me.    More information about Liverpool Six Community Association: At our Community Centre we provide advice services  lunch clubs  youth clubs  a foodbank  tea dances  short breaks away for the elderly and children. The children we work with come to the L6 Centre very distressed and hungry. We run a youth club for these disadvantaged children of our community and provide them with a hot meal 3 times a week. We work closely with the local schools and the teachers who refer vulnerable children and families. We also ensure we support families who are deprived at Christmas and Easter     We need funds to keep our 15 Freezers kept on after Liverpool Council stopped our funding. And we want to support 5000 families this Christmas",False
" Fill The Food Bank 2021 !! ","City of Birmingham, West Midlands, United Kingdom",https://www.gofundme.com/f/mcskgz-fill-the-food-bank-2021,400,500,2021-12-14,2021-11-25,,,24,"2021-12-14 10/2021-12-13 50/2021-12-08 30/2021-12-07 40/2021-12-06 50/2021-11-30 5/2021-11-30 15/2021-11-30 10/2021-11-30 50/2021-11-30 10/2021-11-28 50/2021-11-27 10/2021-11-26 15/2021-11-26 20/2021-11-26 10/2021-11-26 10/2021-11-26 20/2021-11-26 10/2021-11-26 20/2021-11-26 5/2021-11-26 5/2021-11-26 5/2021-11-26 30/2021-11-26 20","Hi everyone  you may or may not remember me doing a similar thing last year.   Last year as a group we raised a whopping £3 000 !! Which was a massive increase on 2019. This year we are looking to smash that record again - with your help!!  Mine (and your) contribution last year was £275 which I am so grateful for - but it would be amazing to beat that this year!!    We are just a group of friends who raise money every year in the run up to Christmas to buy food for local food banks around the South Birmingham area.   Now more than ever  your donations and support will mean so much more.  COVID has caused complications and tough situations for everybody  some more than others. Food banks were crying out for food to support local communities last year and this year is no different!!    Any and all donations are hugely appreciated and will go directly to purchasing food and non-perishables requested by the local food banks!!    Thank you for taking the time to read this and thank you in advance for your generous donation - you have made a massive difference!!",False
" Food Bank Christmas Donations ","Southsea, South East England, United Kingdom",https://www.gofundme.com/f/food-bank-christmas-donations,200,375,2021-12-10,2021-11-08,,,17,"2021-12-10 20/2021-12-09 10/2021-12-09 5/2021-12-06 5/2021-12-04 20/2021-12-02 30/2021-11-29 20/2021-11-28 20/2021-11-25 15/2021-11-18 25/2021-11-18 100/2021-11-17 15/2021-11-16 30/2021-11-09 10/2021-11-08 10/2021-11-08 20/2021-11-08 20","Once again as Christmas is close approaching so please take a minute to appreciate what you have. Even though this year has been mad for everyone there is still a lot of people who do not have the support & luxuries that most of us probably take for granted.  Sadly we are still live in a world where people and their families need your support. So again for this Christmas I will be doing a collection for Waterlooville food bank. I will be raising money which will go towards requested gifts for the families or can collect donations of presents/gifts - anything is acceptable!!     If you are in a position to donate anything at all I urge you to do so! It doesn’t have to be much & doesn’t have to be through me  even if over the next couple of weeks you can add a few extra bits to your shopping for your local food bank at a supermarket  anything helps!     So if you have a little extra money to donate this Christmas  I can guarantee there will be someone out there who will really appreciate it!     Please message me if you would like to donate gifts towards this and I’m more than happy to collect any local donations if required!!I will be looking to have donations by the 15th December 2021.",False
" Raise Money For food banks ","Melton Mowbray, East Midlands, United Kingdom",https://www.gofundme.com/f/5p2wg-raise-money-for-food-banks,2500,20,2021-12-30,2021-12-24,,,1,"2021-12-30 20","Hello I'm Andrew  this fundraiser will help keep the local food bank open & running. After the past year -18months has put a strain on family's who are struggling financially to buy food  hopefully the donations will go towards the cost of rent etc so they can keep open to support the family's  any donations will be greatly appreciated many thanks",False
" Wells Vineyard Foodbank Van Appeal ","Wells, South West England, United Kingdom",https://www.gofundme.com/f/foodbank-van-appeal,5000,1208,2022-02-01,2021-11-25,"WELLS VINEYARD CHRISTIAN FELLOWSHIP","Registered nonprofitDonations eligible for Gift Aid.",19,"2022-02-01 50/2022-01-21 50/2022-01-13 20/2022-01-07 150/2021-12-30 20/2021-12-29 30/2021-12-24 20/2021-12-24 50/2021-12-21 500/2021-12-18 15/2021-12-17 25/2021-12-14 30/2021-12-11 10/2021-12-11 10/2021-12-09 15/2021-12-08 50/2021-11-29 13/2021-11-27 50/2021-11-26 100","Our well loved van is coming to the end of its usable life and needs urgently replacing. We use the van each week to collect and deliver donated essential furniture such as beds and cookers to people in need. Without a working van  our ability to help people most in need across Wells and the surrounding villages will be more limited. Demand for help from Wells Vineyard Foodbank & Furniture Storehouse has risen 6-fold during the pandemic. In 2021  over 80 000 meals have been distributed in our area. People are referred by support agencies  GPs and schools and will receive a food box with approximately 4 days worth of food with 3 meals a day plus toiletries.     The Furniture Storehouse recycles donated furniture  stores it and distributes it free upon referral. In 2021  266 items of essential furniture such as beds and white goods were delivered to people in desperate need. Without a working van  we can no longer offer this service. We already have a third of the money we need to buy a van  but need your help to make this happen! You can make a difference by donating today to WELLS VINEYARD CHRISTIAN FELLOWSHIP.   Please note that the TIP at the end is an OPTIONAL DONATION to GoFundMe. If you do not want to leave an additional tip  then please set the amount to £0 by moving the slider tool before completing your donation. ",False
" Support the BIG DOG to help those in need ","Grantham, East Midlands, United Kingdom",https://www.gofundme.com/f/support-the-big-dog-to-help-those-in-need,1000,650,2021-12-28,2021-11-21,,,45,"2021-12-28 10/2021-12-24 20/2021-12-24 20/2021-12-24 20/2021-12-24 20/2021-12-24 10/2021-12-23 20/2021-12-23 10/2021-12-23 50/2021-12-23 10/2021-12-23 10/2021-12-22 10/2021-12-22 5/2021-12-22 5/2021-12-17 5/2021-12-17 15/2021-12-17 20/2021-12-15 20/2021-12-15 5/2021-12-15 25/2021-12-09 20/2021-12-09 15/2021-12-09 10/2021-12-09 10/2021-12-07 10/2021-12-06 5/2021-12-04 25/2021-12-01 10/2021-12-01 5/2021-11-30 20/2021-11-28 50/2021-11-26 10/2021-11-26 10/2021-11-23 15/2021-11-22 20/2021-11-22 10/2021-11-22 10/2021-11-22 10/2021-11-22 5/2021-11-21 10/2021-11-21 10/2021-11-21 20/2021-11-21 20/2021-11-21 5/2021-11-21 5","Hi last year I asked for your help to raise money for the food bank and Grantham Passage well I wanna go again. This time tho this fat boy will be RUNNING 2 to 4 times a week and hopefully finish with a 5k in the Christmas week maybe dressed as Santa for a bubble. Please I know times are hard for everyone but there even harder for some others out there if everyone on my Facebook and Instagram donate £1 I’ll smash my target. If anyone would wants to get involved holla at me      PLEASE PLEASE PLEASE PLEASE PLEASE   HELP ME HELP OTHERS BIG LOVE FROM THE BIG DOG    BE BOLD BE EPIC BE YOU ",False
" Keep our homeless bus shelter open ","Norwich, East of England, United Kingdom",https://www.gofundme.com/f/keep-our-homeless-bus-shelter-open,2000,2308,2021-12-21,2021-11-08,,,55,"2021-12-21 50/2021-12-21 10/2021-12-21 1000/2021-12-21 20/2021-12-21 10/2021-12-06 50/2021-12-01 20/2021-11-29 20/2021-11-28 10/2021-11-20 25/2021-11-18 15/2021-11-17 25/2021-11-16 20/2021-11-15 20/2021-11-15 20/2021-11-15 30/2021-11-15 50/2021-11-15 20/2021-11-14 30/2021-11-14 20/2021-11-14 50/2021-11-14 10/2021-11-14 20/2021-11-14 50/2021-11-14 15/2021-11-14 20/2021-11-14 10/2021-11-13 10/2021-11-13 10/2021-11-13 5/2021-11-13 20/2021-11-13 100/2021-11-13 10/2021-11-13 50/2021-11-13 15/2021-11-13 25/2021-11-13 20/2021-11-13 10/2021-11-13 8/2021-11-13 10/2021-11-13 20/2021-11-13 10/2021-11-13 10/2021-11-13 50/2021-11-13 20/2021-11-13 15/2021-11-13 30/2021-11-13 10/2021-11-13 10/2021-11-13 10/2021-11-09 10/2021-11-09 20/2021-11-08 10/2021-11-08 50/2021-11-08 100","Norwich Homeless Support runs a ten bed converted coach housing the homeless of Norwich.    Just in the last few months we have rehoused 7 people who have come on to the bus and now rehoused in local hostels with one who now has his own room in a shared property and back working full time.     We also run a community food bank which is a vital service for those who need emergency food parcels.     We have proven the bus to work but with winter here our furniture sales have slowed down and we really need some funding in to least cover us for the next few months so we can keep the bus running.     I have put our costs below  all money is spent on keeping our services running.     Unit & storage rent: £500 this is where our bus is parked and also our storage container.   Telephone & internet system: £20 per month. This is for our landline number for people to get in touch with us.  Petrol: £100 a month to help with volunteers cars.   Waste collection: £20 a month   Portaloo: £25 a week plus vat - we need to get one down yard so we have two toilets on site.   Insurance: £110 a month.   Other costs: around £300 monthly this could be things like topping up first aid box  topping up equipment on the bus or carrying out dbs checks.   These are our main costs we need to cover every month just to run if you could please make a donation and share.   You can see what we do on our Facebook page Norwich Homeless Support.       ",False
" Help families & children this Christmas","Gillingham, South East England, United Kingdom",https://www.gofundme.com/f/help-families-children-this-christmas,1000,1455,2021-12-13,2021-11-19,,,41,"2021-12-13 10/2021-12-12 20/2021-12-10 5/2021-12-10 10/2021-12-10 10/2021-12-05 20/2021-12-05 10/2021-12-03 20/2021-12-03 10/2021-12-03 10/2021-12-02 25/2021-12-02 50/2021-12-02 25/2021-12-02 15/2021-12-01 10/2021-12-01 25/2021-12-01 25/2021-12-01 20/2021-11-28 50/2021-11-26 25/2021-11-24 50/2021-11-24 50/2021-11-23 10/2021-11-23 5/2021-11-23 50/2021-11-23 20/2021-11-23 20/2021-11-22 50/2021-11-22 10/2021-11-21 100/2021-11-20 15/2021-11-20 20/2021-11-20 10/2021-11-20 100/2021-11-20 40/2021-11-20 10/2021-11-20 300/2021-11-19 50/2021-11-19 50/2021-11-19 50/2021-11-19 50","Hi all       Last year I raised funds which provided a total of 5 Christmas dinners & over 80 presents to families & children of low income families struggling at Christmas! I am looking at doing more this year!      Christmas should be an amazing time for all & I’m setting this up so we can help as many people as possible again this year!      I am working with Salvation Army for the families & presents & will also be looking at providing 2 meals to choices (domestic abuse housing) and a cash donation to the Medway food bank. Kindly my employer will also be looking at matching any donations (up to 3k).      Any size donation would be a massive help so please give what you can and make Christmas as special for as many as possible",False
