Title,Location,Link,Raised,Target,MostRecentDonation,Created,Organization,OrganizationDetails,DonationCount,Donations,Story,Complete
" 100 miles for the homeless ","Birkenhead, North West England, United Kingdom",https://www.gofundme.com/f/100-miles-for-the-homeless,200,474,2021-04-28,2021-04-12,"Wirral Churches Ark Project","Registered nonprofitDonations eligible for Gift Aid.",30,"2021-04-28 5/2021-04-25 5/2021-04-23 20/2021-04-21 5/2021-04-20 10/2021-04-19 20/2021-04-17 20/2021-04-16 20/2021-04-16 10/2021-04-16 30/2021-04-16 5/2021-04-16 10/2021-04-15 20/2021-04-15 9/2021-04-15 25/2021-04-15 50/2021-04-15 5/2021-04-15 5/2021-04-15 40/2021-04-15 15/2021-04-15 50/2021-04-15 10/2021-04-15 10/2021-04-15 20/2021-04-14 10/2021-04-13 10/2021-04-13 5/2021-04-13 10/2021-04-13 10/2021-04-13 10","Fighting homelessness in Wirral. We run a 27 bed hostel and have 20 move on rooms in houses and studio flats. We provide support and advice to those who are homeless and those in danger of becoming homeless. We help those less fortunate in our society  suffering mental health issues  drug and alcohol problems  showing compassion and practical help. Hi friends  join me in making a difference by supporting a good cause! I'm raising money for Wirral Churches' Ark Project and any donation will help make an impact. Thank you in advance for your contribution to this cause which means so much to me.",False
" Save a homeless cat’s life ","London, Greater London, United Kingdom",https://www.gofundme.com/f/2dgp5dnt0o,1100,870,2021-06-09,2021-05-13,,,24,"2021-06-09 5/2021-06-05 10/2021-05-19 10/2021-05-17 10/2021-05-17 400/2021-05-17 50/2021-05-16 5/2021-05-16 10/2021-05-16 20/2021-05-16 40/2021-05-16 10/2021-05-16 30/2021-05-15 5/2021-05-15 20/2021-05-15 25/2021-05-15 5/2021-05-15 5/2021-05-15 20/2021-05-15 50/2021-05-15 20/2021-05-14 20/2021-05-14 80/2021-05-14 10/2021-05-14 10","Hi everyone    we recently took in a boy cat who’s been roaming in the neighbourhood for years.   We’ve occasionally fed him too as he’s always seemed very hungry when popping around. Our own cat has known him too since he was a kitten  they sometimes hang out together!    This time  though  we decided to keep the homeless cat in as he looked quite poorly. He’s a calm and kind cat and has so much love to give. He’s an old boy  as we found out to our surprise and quickly changed his name from Snow White to Milky.    During a recent visit to the vet we found out that the pimple that he has on his ear is actually a sign of SCC (squamous cell carcinoma)  quite usual for white cats like him. The vet told us that he’s strong for his age 12-13  and that with an operation to move the tumour on the earlob  could enjoy few more happy cat years.   But the operation cost for an uninsured cat is c. £800. That’s a lot of money for us.   This is when we decided to rescue Milky and ask our neighbours  family  friends and the wider community to help us raise the money needed for his operation.   If you’d like to give us a hand in keeping this lovable cat alive  please donate. We are very grateful for any amount and so is Milky too..!",False
" Help Homeless LGBT Couple Rebuild Life ","Edinburgh, Scotland, United Kingdom",https://www.gofundme.com/f/help-a-homeless-lgbt-rebuild-life,4600,1134,2021-06-18,2021-06-02,,,47,"2021-06-18 50/2021-06-14 10/2021-06-14 20/2021-06-10 50/2021-06-09 18/2021-06-08 36/2021-06-05 32/2021-06-05 50/2021-06-05 30/2021-06-04 5/2021-06-04 10/2021-06-04 50/2021-06-04 5/2021-06-04 10/2021-06-04 25/2021-06-04 8/2021-06-04 5/2021-06-04 10/2021-06-04 100/2021-06-04 10/2021-06-04 30/2021-06-04 20/2021-06-04 30/2021-06-04 50/2021-06-04 20/2021-06-04 10/2021-06-04 20/2021-06-04 20/2021-06-04 10/2021-06-04 30/2021-06-04 50/2021-06-04 10/2021-06-04 5/2021-06-04 15/2021-06-04 10/2021-06-03 10/2021-06-03 10/2021-06-03 20/2021-06-03 10/2021-06-03 20/2021-06-03 100/2021-06-03 25/2021-06-03 10/2021-06-03 5/2021-06-03 10/2021-06-03 30/2021-06-03 20","In February 2020  an Edinburgh  UK LGBT couple (J and L) became unintentionally homeless. They have been living in hotels  hostels (they experienced homophobia there which was the reason the local authority moved them somewhere else  yet again ) and they remain in emergency accommodation to this day. In these places  there were no cooking facilities or washing machines- the only 'hot meals' were cheese toasties made using tin-foil and an iron. All this moving around meant work was constantly missed. To say they are down on their luck would be the understatement of the century. When they became homeless  they lost most of their possessions as they could only fit so much in their car as they had nobody else to help them move their items due to issues with family not accepting their relationship . Both of them worked as Care and Support Workers for vulnerable people but unfortunately due to the emotional and mental impact of the situation  as well as the sudden loss of his darling grandmother  L had to stop working. L's grandmother was the only member of his family that supported him and she truly appreciated the couple. Since then L's depression has taken a turn for the worse and he has never been this low  some days he can't even get out of bed. Both J and L already suffer from mental health issues  these have only been amplified by these circumstances. An already dire situation has only got worse as they have just recently lost their car as a result of their financial instability. This has caused a multitude of problems- J would drive around all day to attend his care visits and if any emergency call-outs were required then he could be there at the drop of a hat. Their car was written off in a car crash caused by a driver using their mobile phone. As J now either walks or uses public transport  his hours have been cut as he is now unable to take on so many care visits. Living in temporary accommodation  the local authority have told the couple they may have to wait up to 3 years to be given a permanent home of their own. They have realised waiting this long will only further impact their fragile mental health so they have agreed and come to the conclusion that renting privately would be one of the answers to their problems. This is where the help and generosity of kind strangers come in- they are needing funds for a deposit  first months rent  budget household items  basic clothes and help towards a second-hand car so J can once again attend to his vulnerable clients. They basically need to start re-building from scratch. J suffered a workplace injury that had him off work for 3 weeks  that's a 3 week dent in already limited finances. They have looked around and found essential items at low prices. They need your help to give them a fresh start in life  to give L the confidence and emotional security to work again and to overall give them a better chance at life. The pandemic has shown everyone the importance of having somewhere safe  secure and somewhere to really call home. Any donations would literally change their lives for the better.  We have been featured in an article on Edinburgh Evening News viewed at-   https://www.edinburghnews.scotsman.com/news/people/pride-month-lgbt-scots-on-homophobia-trans-rights-and-what-still-needs-to-change-in-scotland-3269753  There will be an article about them in The Sunday Post on July 18th.   People that feel the need to go out of their way to deliberately upset and distress people need to take a long  hard look at themselves and put themselves in their victims shoes. ",False
" Help Feed The Homeless ","Bromley, Greater London, United Kingdom",https://www.gofundme.com/f/2db3j6ba3c,125,25,2021-05-24,2021-05-09,,,3,"2021-05-24 5/2021-05-24 15/2021-05-11 5","Salam Walaikum  i’m here today to give you guys some news on what i’m here to do  as you may see from the title I am trying help the homeless people before the end of Ramadan as well as during this time of where we have the pandemic making it harder for the homeless to live  eat and sleep. I’ll be raising £175 to be able to buy food  clothing and necessities such as sleeping bags or even pillows and covers. As part of our Deen  is it a good thing to give charity now and again and I feel as if right now is a good time for me to give back to those who are less fortunate than myself and others. Any sort of donation will help and inshallah if anyone is willing to come and help out  you’re more than welcome. Jazakallah to anyone giving the time to read as well as donate to my fundraiser.",False
" Feeding the homeless ","Birmingham, West Midlands, United Kingdom",https://www.gofundme.com/f/e86mz-feeding-the-homeless,250,100,2021-07-02,2021-07-02,,,1,"2021-07-02 100","Cooking for the homeless in brinimgham city ",False
