Title,Location,Link,Raised,Target,MostRecentDonation,Created,Organization,OrganizationDetails,DonationCount,Donations,Story,Complete
"School holidays lunches","Carlton, East Midlands, United Kingdom",https://uk.gofundme.com/f/school-holidays-lunches,245,400,,2020-10-23,,,0,,"As most people are  I am incensed at the government decision not to support children with meals during the school holidays.     I have been lucky enough to be able to provide for my children...but only just. I have had scary moments where I don't know how I am going to buy the next food shop  but I have great family support.     I would like to collaborate with local schools and communities to help feed children during the Christmas holidays. I will be raising money and contacting businesses to ask for their support in providing food parcels for children. Whilst I know food banks do this  there are the middle/grey area children who just miss out due to either not being on the correct benefits or parents earn £10 over the threshold for support...this happened to me.     I was hoping I could work with the schools and communities to identify children and deliver packages to the school for collection or communicate to parents about where they would be able to collect food parcels or supermarket vouchers.    I hope to raise enough money to hand out lunch bags filled with 2 or 3 days worth of lunch for a child in need. Packing a lunch bag with a sandwich  snack  fruit and juice.     Helping to take the pressure off and the stress off parents over the Christmas holidays.    I am contacting community centres to ask for space to hand out the packages but need support in helping purchase the food items.    Every little helps  please help if you can.",False
"Help to Feed Local Family’s","Burnley, North West England, United Kingdom",https://uk.gofundme.com/f/help-the-feed-local-familys,2020,1000,,2020-05-02,,,0,,"Thanks for taking the time to visit my JustGiving page.    My name is Oakley and I am 7 years old  Please help support children and provide them food in my local area during these hard times and help me reach my goal of £1000. Oaks recently heard that family’s local in Burnley and surrounding areas are struggling and without food to feed their children. He didn’t want children to go without food so he wanted to raise some money to buy some food which he will deliver to them.. via the food bank at St Matthews Church Burnley. His challenge that he has set himself is to dribble a football 20 miles in 20 days.. please donate and support these people in need..    Wish me luck     Oakley            ",False
"Sarah Jane Morris","Saint Leonards-on-Sea, South East England, United Kingdom",https://uk.gofundme.com/f/Sarah-Jane-Morris,2834,1000,,2020-04-27,,,0,,"My son Otis Coulter and I  are doing an online concert  to raise money for our local food bank  as so many are without money for food in these desperate times. It is also to help with the total loss of earnings through long term cancellation of six months touring for Sarah Jane. Our special guest for this event is Mike Willis  the wonderful St Leonard’s based singer/ songwriter.  Any contribution no matter how small will be gratefully received.   The concert will go ‘live’ at 6 pm UK time on Wednesday 6 th May 2020. Thankyou  yours in music and love  Sarah Jane ",False
"Cathy's campaign for Grace Food Bank Sheffield","Sheffield, Yorkshire and the Humber, United Kingdom",https://uk.gofundme.com/f/cathy039s-campaign-for-grace-food-bank-sheffield,335,200,,2020-10-31,"Grace Food Bank Sheffield","Registered nonprofitDonations eligible for Gift Aid.",0,,"My sister Esther  my mummy and me are going to give up chocolate and sweeties for November. We want to raise money for food banks to help people who come from a more difficult places. Please would you sponsor us? from Ivy age 8 We’re raising money in aid of Grace Food Bank Sheffield and every donation will help. Thank you in advance for your contribution to this cause that we think is really important especially at the moment.     More information about Grace Food Bank Sheffield: We provide emergency food parcels to families and individuals living in the S8 area of Sheffield (and just beyond) who are experiencing financial crisis.      ",False
"Hot lunches because the Tories suck","Weston-Super-Mare, South West England, United Kingdom",https://uk.gofundme.com/f/hot-lunches-because-the-tories-suck,1125,60,,2020-10-22,,,0,,"I’m attempting to help a little by cooking for disadvantaged families next week during half term. By request I have set up a gofundme to cover ingredient costs. Anything raised above the goal will go to the local food bank.    Original Facebook post below:    Hello! As you may know  this week 322 MPs voted AGAINST a £15 a week food voucher for children in low-income families. If you’re struggling with feeding your kids next week during half term and live in Weston  I’d like to help!    I can’t change the world  but I can cook  and I’d like to offer eight families a free hot lunch on Monday  Tuesday and Wednesday next week. I’ll drop it off between 12pm and 2pm  please message me your address and how many are in your household.     When I was 17 I had a new baby and had just lost my mum. I was in and out of jobs because of my grief and mental health and I struggled to survive on the little help I got. I’ve not had enough money to pay my gas bill before and have had to cook pasta in the microwave to make sure my daughter got lunch  and I firmly believe that poverty isn’t a choice but an unfortunate circumstance  unlike our current government who think that hungry kids are a byproduct of parents simply ‘not being responsible’.     I manage these days and I’d like to pay it forward for all the times someone in the queue behind me paid for my shopping or a friend invited me round their house when I couldn’t afford my heating bill. Please get in touch if you need a helping hand.    Monday:    Pasta and meatballs in a secret five veg sauce     Tuesday:    Sausages  vegetable mash and gravy     Wednesday:    Five bean chilli-non-carne with garlic rice     Everything will be vegan  delicious  and packed with veg. Don’t be ashamed to ask for help. I was for years and I wished I’d reached out sooner ✨",False
"Emergency care packages","London, Greater London, United Kingdom",https://uk.gofundme.com/f/6h6cdw-emergency-care-packages,4675,5000,,2020-04-30,,,0,,"  I am raising money to provide emergency food and care packages to the families of the school where I teach. Though free school meal vouchers are finally being handed out by the DFE  many of the families in my school community have been contacting us requesting help with buying real basics their vouchers won't cover. Basics like nappies  milk  toothpaste and eggs. Local food banks are empty and many have no where to turn. Please give whatever you can. Thank you.",False
"Feeding the kids","Leeds, Yorkshire and the Humber, United Kingdom",https://uk.gofundme.com/f/q2d7y-feeding-the-kids,4331,-1,,2020-04-14,,,0,,"A lot of us are very focused on helping NHS STAFF and key workers  which is great obviously. They’re working their bums off and deserve it!  However  due to the current circumstances there’s a TON of parents who are struggling to the extent that their kids go days without eating (no exaggeration).   Imagine being in such situation where you can only rely on food banks.  So the plan is  I’m basically aiming to feed a school a week via House of Koko & Distrikt Bar Leeds... making hundreds of sarnies (this is why I was asking what kids liked the other day) and doing whatever is required.    Reeshy Kate has already given me a list of schools and has offered to help  but due to social distancing etc  I cant accept any more help other than donations.    Neil's Fresh Fruit  Veg have kindly agreed to donate the bread.    The first school is Brackenedge on the list where they’ll be collecting first thing this Thursday morning.    I'm not sure how much it will cost  but with donations it means I can aim to do this for as long as schools are closed & more if needed.. Thankyou to all.",False
"Shaving my head for charity","Southampton, South East England, United Kingdom",https://uk.gofundme.com/f/nxq6j-shaving-my-head-for-charity,607,1000,,2020-05-04,,,0,,"In this lockdown  I want to do something for charity and the only thing I have to offer right now is my hair (which means a lot to me). If I manage to hit £1000 in donations by July 1st  I will shave my head and split the donations between two charities. During lockdown I've been volunteering and helping deliver shopping to the vulnerable  in doing this I've noticed that food banks have been running low on food and supplies and so I want to donate some of the money to my local food banks. Also  I want to donate some money to a charity that specializes in helping people with brain injuries called Headway. My wife Lorraine has dealt with this charity through her work and it is close to her heart and so we know how much this charity can make difference.",False
"Food Bank Donations & Animal Shelter Donations","Misterton, East Midlands, United Kingdom",https://uk.gofundme.com/f/Amys-Campaign-for-food-bank-and-animal-shelter,340,500,,2020-10-31,,,0,,"Hi Everyone  thank you for taking the time to read this.     With Christmas approaching and the current struggles a lot of people are dealing with due to COVID-19 I would love to be able to do a bit more to help.     We will be completing a food bank shop and an animal shelter shop but would appreciate any help or donations where possible to increase the size of this shop and potentially assist more than one bank/shelter.     In 2019/20 approximately 1.9 million people used a foodbank in the United Kingdom  around 300 thousand more than the previous year. Throughout the provided time period the number of foodbank users has increased in every year  from just under 26 thousand in 2008/09.    Anything you can donate would go a long way. The three current places we have decided to donate to are: 1) Mayflower Sanctuary - Bawtry  2) Bassetlaw Food Bank  3) Salvation Army - Gainsborough. ",False
"Help Out When School's Out","Twyford, South East England, United Kingdom",https://uk.gofundme.com/f/help-out-when-school039s-out,2060,300,,2020-10-26,,,0,,"Following Emma's kind offer to provide meals for families whose children would otherwise go hungry over half term  a number of parents in need of help have been in touch.    No parent should have to go without food so their children can eat - please donate so we can buy supplies for Emma to cook with. She's registered with Help Out When School's Out and any excess funds will be used to support local food banks.    She's shopping and cooking tomorrow to provide meals for Monday  Tuesday and Wednesday. We'll then regroup for the rest of the week.",False
"Supporting UK Food Banks During COVID-19","London, Greater London, United Kingdom",https://uk.gofundme.com/f/supporting-uk-food-banks-during-covid19,377,400,,2020-10-28,"The Trussell Trust","Registered nonprofitDonations eligible for Gift Aid.",0,,"Hi All     During the pandemic I have realised just how priveledged I am. I still have a job  I can afford my bills and most importantly I can still afford to eat. Unfortunately for a lot of families in the UK this is not the case. This time has been a difficult time for us all but I cannot imagine having the extra pressure and worry of not being able to feed myself or my family. For that reason  I was thinking about what I could do to help people that are struggling especially during the COVID-19 pandemic.     I have come across a charity called The Trussell Trust who provide nationwide support to food banks in order to provide emergency food packages to people locked in poverty. Research has shown that there has been a 13% increase in food bank use in the past 6 months and as winter is approaching and restrictions are getting tougher  this is expected to increase further.    I will be doing a sponsored 10km run in London on Sunday 20th December and all of the money I raise  I will be donating to The Trussell Trust. As some of you may know  I have torn my cartilage and ligament in my knee and am still recovering so this will be a challenge for me too!     I kindly ask you to please help me raise some money for this amazing charity and do our bit to end poverty and the use of food banks in the UK. I appreciate now is a difficult time  but no matter how small it is...every little helps!    Thank you!     Shannen",False
"Rebuilding Beirut with Pride","London, Greater London, United Kingdom",https://uk.gofundme.com/f/rebuildingbeirut,22737,30000,,2020-08-06,,,0,,"The UK’s LGBTQ+ community  their allies and the Lebanese Diaspora are coming together to raise funds to rebuild Lebanon's capital Beirut and support all impacted communities.    We are asking you to help us  by donating what you can to this crowdfund  and joining us on 22 August for an evening of pride  performance and love for Beirut  its people and its reconstruction. Rebuilding Beirut with Pride will be hosted at the Bell Pub in Whitechapel  and live-streamed all night for everyone to watch and take part in. From an art auction to a programme of performance  we want to celebrate Arab and queer art and talent and help rebuild our hometown in the process. Click here to buy your tickets for the event.    Where is the money going?    All proceeds will be equally split and donated to the Lebanese Red Cross  Beit El Baraka   Basmeh & Zeitooneh and Embrace Lebanon   as well as two grassroots LGBT+ crowdfunds  detailed below.     Beit El Baraka provide food banks for victims of the disaster  Basmeh & Zeitooneh are responding on the ground to those who have been made homeless  and Embrace Lebanon offers mental health support.     The NGOs were chosen after having direct discussions with several people within Lebanon itself who informed us of which organisations are trustworthy and are not affiliated with government authorities in any way  to ensure the money is directly going to support those in need first and foremost.    We have also identified two crowdfunds that have been strongly recommended to us by many members of Beirut's LGBTQ+ community  in that they are offering on-the-ground and direct support and are being led by trusted community members.     These crowdfunds are Disaster Relief for Lebanese Transgender Community   led by Lebanese trans pioneer Sasha Elijah  and Funds for LGBTQ Victims of Beirut Explosion   led by prominent community member Sandra Melhem.    The total sum raised will be split 6-way between these 6 beneficiaries  and receipts of these donations will be posted here for completely transparency.     Why are we fundraising?     Beirut is a disaster zone. On the 4th of August  the city was rocked by a colossal explosion involving 2 750 tons of ammonium nitrate. To put things in perspective  it is one of the worse urban explosions since Hiroshima and Nagasaki. The blast killed at least 157 people and injured 5 000. Hundreds remain missing. With the force of a 3.5 magnitude earthquake  the explosion's shock wave enveloped Beirut  shattering windows and collapsing old buildings. Lebanon's hospitals - already overrun by coronavirus - are in dire need of support. Meanwhile  around 300 000 people have been displaced from their homes. Two of Beirut's LGBTQ+ hubs  Mar Mikhael and Gemmayze  were only 500m away from the point of detonation. These areas have been utterly devastated and  like many other parts of Beirut  are now uninhabitable.    The blast comes at the worse time for Lebanon  hitting a country already in disaster. Covid-19 exacerbated a pre-existing political and economic crisis  bringing the Lebanese to the brink of collapse. This year has seen thousands of Lebanese lose their lifetime savings and the country's hyper-inflated currency remains in free-fall. One in the three people are unemployed  while amongst Lebanon's poorest  famine is approaching. In short  your donations are needed. They will support those people immediately impacted by the explosion  but also Lebanese communities and families facing economic desolation. Please see below for which NGOs and groups we are donating to.    What's happening on the 22nd?     While we encourage you support us  share this page and ask all your friends to donate throughout the next two weeks  we have an exciting day planned to drum up even more donations! On 22 August there are two events you need to know about:    6:30PM: Art Auction (online)     We will be auctioning a collection of both Arab and Queer art  prints and designs  kindly donated by artists and designers from both the UK and Lebanon. More details to come  including some sneak peaks at some of the pieces! All proceeds will be added to the goal target. This will be an online auction so everyone can take part!     Interested? Put in your details here to keep up to date with the auction so you don't miss out on any information!     Are you an artist who would like to donate a piece to be included in the auction? Let us know here!    8:00PM: Performances (In person & live streamed)    Rebuilding Beirut with Pride will be hosted at the Bell Pub in Whitechapel  and live-streamed all night for everyone to watch. We have a line up of performers showcasing Arab and Queer talent with opportunities and activities to donate to the fund throughout the night. A full programme of the night will be released shortly.     We only have a limited number of 30 tickets for the in-person event and will be following strict social distancing measures  including table service and contactless payment.     But don't worry! We have 500 tickets available for our online live stream  where you can take part in the night.     Click here to buy your tickets for the event .       Who are we?     We are a group of Lebanese expats  friends  allies and activists who want to help however we can in rebuilding our home. We each work in different sectors (NGOs  journalism  fashion  music) and want to bring our passions  networks and resources together to help make real change back home.",False
"Dear Harry Spock charity stream","London, Greater London, United Kingdom",https://uk.gofundme.com/f/dear-harry-spock-charity-stream,700,500,,2020-03-27,"Sufra NW London","Registered nonprofitDonations eligible for Gift Aid.",0,,"We are raising money in aid of Sufra food bank and every donation will help.     Sufra helps people living in extreme poverty and people who are vulnerable  homeless and socially isolated.    They have launched an emergency coronavirus appeal as the donations they rely on to keep the food bank open are dwindling.    They are struggling to buy the food and toiletries they need to help homeless people and families experiencing hunger – many of the essential items they need are out of stock.    Every £10 you give will provide an emergency food parcel to someone in desperate need  while £50 will feed and supply a family of four. This includes nappies  milk and nutritious food for babies – essential needs for a family with children.",False
"Raising money for nhs workers and foodbanks","Sidcup, Greater London, United Kingdom",https://uk.gofundme.com/f/raising-money-for-our-frontline-nhs-workers,13514,2500,,2020-03-23,,,0,,"Raising money for frontline nhs staff for food  accommodation and whatever else needed  and putting back into the community for food banks for families unable to work So lockdown is now upon us all so I thought of a way of raising money for nhs frontline staff and foodbanks for families unable to work  And a way to keep people smiling  So..... nominate a friend to shave there hair ( it’ll grow back by the time we’re out of this sh#t ) They name there price  Check the link to see if they’ve donated And shave it !!!!! Please copy and share and let’s see how much we can raise for this much needed cause and have a barrel of laughs along the way. Before and after pics will make it so much funnier ",False
"Feed the children of Sheffield and beyond.❤️","Halfway, Yorkshire and the Humber, United Kingdom",https://uk.gofundme.com/f/FeedSheffieldChildren,2030,1000,,2020-10-22,,,0,,"Daily  kids go without knowing what their next meal is or when it will come. That purely bothers me so much. I will do everything I can to make a difference while I can  I believe this is not something we should ignore and want to help as many kids/families as I can. I’m a small dent in what I can do but if I can make £200 of difference it’s better than none. The money donated will go towards purchases for food banks  vouchers for supermarkets for people to purchase food & packed lunches. If you want to jump on board and help me  I’m here with open arms as there no real plan  I just know actions need taking and quickly. Let’s get as much as we can to them kids in need. Let’s pull together and make a difference - if you can offer out services which may support this again do approach me! The more the merrier. Clubs  coaches  parents  anyone! Let’s not just leave it for the shopping centre to ask for it in a big trolley with no meaning. Share and let’s try and tackle this head on.❤️ #Sheffield #LetChildrenEat",False
"OWEN ROES SUNRISE TO SUNSET 200KM RUN@MOORLOUGH","Artigarvan, Northern Ireland, United Kingdom",https://uk.gofundme.com/f/owen-roes-sunrise-to-sunset-200km-runmoorlough,21540,2000,,2020-04-17,,,0,,"Hi everyone     The Owen Roes Senior men's team have decided to raise funds for local organisations during the current Covid-19 situation.    Our aim is to have each team member run 5km around Moorlough at staggered set times to adhere to social distancing guidelines from sun rise to sun set on Saturday 2nd May. We hope to run 200km collectively throughout the entire day.    The run will begin at 6am with the first man running the course with the last run scheduled for sunset at around 9pm.    Our Club man Cathal McShane has kindly donated a number of prizes for a raffle. Prizes include:    1) His All Ireland Final jersey from 2018 vs Dublin  2) The boots he wore on the day  3) The Boots he wore vs Meath in which he kicked the equalising point to take it to extra time.    Details of this can be found on Cathal's social media pages and the club social media pages.    We have also received some further generous donations of prizes for the raffle.    James ' The Strabanimal' Gallagher has kindly donated a signed pair of MMA gloves worn at his last fight.    Ronan McNamee (Aghyaran &Tyrone) has kindly donated a Signed Jersey.    Peak Performance Gym Strabane- 1 years Gym Membership      The chosen organisations to which we will be donating to are as follows:    -Strabane Food Bank  -Aware in Strabane  -Dennett interchange meals on wheels  -COVID wards Altnagelvin  -Speech and Language Therapy ICU Altnagelvin    We hope to raise as much money as we possibly can for those in need during this time.    Thank you    Owen Roes Leckpatrick Senior Men's Team",False
