Title,Location,Link,Raised,Target,MostRecentDonation,Created,Organization,OrganizationDetails,DonationCount,Donations,Description,Complete
" Finedon foodbank storage container. ","Finedon, East Midlands, United Kingdom",https://www.gofundme.com/f/finedon-foodbank-storage-container,600,40,2022-02-22,2022-02-21,,,2,"2022-02-22 20/2022-02-22 20","Hi. As you know Finedon foodbank has to leave it’s premises in two weeks at finedin cricket club .     We have found a storage unit available at £172. 00 a month with one months deposit and two months rent upfront.     We are doing this to try and fund the upfront costs.     ",False
" GFTH Cycle from Gloucester to Lands End ","Gloucester, South West England, United Kingdom",https://www.gofundme.com/f/gfth-cycle-from-gloucester-to-lands-end,1000,90,2022-03-06,2022-03-03,,,7,"2022-03-06 10/2022-03-04 10/2022-03-04 20/2022-03-04 20/2022-03-03 10/2022-03-03 10/2022-03-03 10","Hi     My name is Steve Wakefield and I’m involved with an organisation called Gloucester Feed The Hungry (check us out on Facebook).     GFTH was set up just over 5 years ago to provide hot meals  free haircuts  clothing and toiletries to the homeless and vulnerable in our community.    Since then GFTH have set up a full time foodbank and in the past two years have served over 15 000 meals and over 3000 free food parcels to the homeless  vulnerable and those needing a helping hand. Pretty impressive right?!    GFTH have recently started a daily hot food programme with approximately 3500 meals served in the past two months alone.    All this is done with founder Hash Norat holding down a full time job (as well as many of the volunteers too).     We now need your help to raise £10 000 collectively  for us to purchase a food trailer. This will allow us to support more of our homeless and vulnerable in our city but more importantly  all of Gloucestershire.    I am taking part in a fundraising cycle from Gloucester Cathedral to Land's End  to be completed over two days.     Please help us to make our vision a reality  by sponsoring anything you can. Every penny helps!     Your every penny will be supporting our most vulnerable for years to come.     Again  please check us out on Facebook and see all of the great work that we do.     Thank you so much I’m advance.     Steve",False
" Making a difference 2022 ","Great Sankey, North West England, United Kingdom",https://www.gofundme.com/f/making-a-difference-2022,500,50,2022-03-05,2022-02-27,,,3,"2022-03-05 25/2022-03-05 20/2022-02-27 5","The impact Covid has had on so many people is huge leaving people struggling financially and mentally Numbers at foodbanks are increasing day by day  calls to Samaritans total 10000 a day .I class myself lucky that my cupboards are full and that I have family and friends around to talk to but many have no one My walk is for me but many people have asked how they can help so here you go Funds will be split equally between Trussell Trust and Samaritans Thank you for reading  your support last year and your ongoing support   ",False
" The Scouse Fundraiser ","Liverpool, North West England, United Kingdom",https://www.gofundme.com/f/the-scouse-fundraiser,2000,101,2022-02-20,2022-02-02,,,8,"2022-02-20 15/2022-02-13 20/2022-02-10 13/2022-02-10 10/2022-02-10 10/2022-02-10 10/2022-02-09 13/2022-02-09 10","Hi everyone  we are putting on several events and challenges over the next 6 months or so  to try and raise much needed funds for charitable groups in Liverpool who look to alleviate poverty.   For the most part  with any money raised we will be supporting the following organisations:   1. Reaching Out - A homeless outreach community group   2. Aid to All - An independent emergency foodbank   3. Sefton Baby Baskets CIO - A charity supporting new mums and babies   4. Halle Obrien CIC - A CIC who provides children living in financial hardship with extra curricular activities to inspire them   We are running ‘Project Hygiene’ alongside this  and will be supporting the first 3 charitable groups through this initiative. I’m a nutshell  through this initiative we will be providing toiletries and household cleaning items to help alleviate hygiene poverty.   At the moment the event calendar is looking as follows:   Scouse Fundraiser 5-a-side Football Tournament - Sunday 6th March    Climb Mount Snowdon - Saturday 26th March   Yorkshire 3 Peak Challenge - Sunday 16th April  Liverpool Cathedral Abseil - Saturday 16th and 23rd July  ",False
" Howden Helpers ""Christmas & Company&quot; Lunch ","Burland, Yorkshire and the Humber, United Kingdom",https://www.gofundme.com/f/howden-helpers-christmas-company-lunch,500,625,2021-12-22,2021-12-13,"Rotary Club of Howden Trust Fund","Registered nonprofitDonations eligible for Gift Aid.",14,"2021-12-22 100/2021-12-20 20/2021-12-20 50/2021-12-20 50/2021-12-19 40/2021-12-16 100/2021-12-16 10/2021-12-15 50/2021-12-13 50/2021-12-13 50/2021-12-13 20/2021-12-13 50/2021-12-13 30/2021-12-13 5","With less that 2 weeks to go we are almost ready to ‘Deck the Shire Hall with boughs of holly’ in readiness for the 3rd Christmas and Company lunch!   We are using money from the Howden Helpers account this year to help fund event itself  but one of the things that has been most satisfying in the past is the amazing amount of money (nearly £2 000) that we have been able to donate to local charities - especially the Mission Trinity Food Bank in Goole.   The fact that your generosity has enabled us to not only fulfil our main function of providing a Christmas lunch  great company and good cheer on Christmas Day but also to support families in real need in a very real way is extremely rewarding.   We have deliberately held off fund raising until we knew wether the event could go ahead - but we would like to try and continue our support for Mission Trinity.   To this end Howden Rotary have very kindly agreed to launch a donation page to raise funds which will be active very soon.   ",False
" PAYBACK TIME ✊ SIMFIT100 ","Leeds, Yorkshire and the Humber, United Kingdom",https://www.gofundme.com/f/payback-time-simfit100,1000,150,2022-02-22,2022-02-16,,,9,"2022-02-22 20/2022-02-22 10/2022-02-17 20/2022-02-16 10/2022-02-16 20/2022-02-16 20/2022-02-16 20/2022-02-16 20/2022-02-16 10","SIMFIT100 have been a sponsor of Vulnerable Citizen Support C.I.C for around 7/8 months - They have supported us with football kits for our mental health team to equipment to money ❤️ This team are amazing in how they support us !!     Now for SIMFIT100 to undertake the ‘Challenge’ - PAYBACK!!!!! ❤️❤️     Instructors of SIMFIT100 will give ‘CONTROL’ to their clients to give them 5 minutes of pure hell - Anything they can think of - can happen   Are SIMFIT100 up for this challenge………     This will take place:   Sunday 13th March 2022   Temple Newsam  10:15am ❤️    In return this will help VCS carry on with the vital duties they do day to day - it will help provide more food for the food bank - help with fuel costs to cover mental health calls - help with our local mental health classes & equipment to keep them going - ❤️❤️ each week we do around 50-100 food parcels to struggling families and try to assist people who are sleeping rough into suitable accommodation ❤️❤️",False
" Walker with us ","Maidstone, South East England, United Kingdom",https://www.gofundme.com/f/znzxj,2000,160,2022-02-18,2022-01-06,,,7,"2022-02-18 50/2022-01-20 10/2022-01-20 30/2022-01-13 30/2022-01-12 10/2022-01-11 10/2022-01-08 20","Hello     We are an organisation called Walker with us ! We are in the process of registration as a charity.     We want to raise money to provide support and activities for all kinds of people in and around Maidstone. When this charity grows hopefully we can cover other areas also.     The main aim of our charity is so people can get all kinds of support whether it is through a coffee morning or being referred to a food bank we are here to help !     We also use all donations for fun days  events and community activities.   This is a non profit organisation so all donations go to our community!.    So far we have managed to give Christmas presents to over 70 children that were not as fortunate Christmas 2021.   We have also done a 10 mile walk around mote park.   We have loads of events planned for this year but we need more donations to make this happen !     Please donate and join in all the fun we have planned for you :)     Thank you so much for your support   Walker with us team.   Xx",False
" Support for Tomi Waziri ","London, Greater London, United Kingdom",https://www.gofundme.com/f/support-for-tomi-waziri,10000,110,2022-02-13,2022-01-24,,,7,"2022-02-13 5/2022-02-01 10/2022-02-01 10/2022-01-29 25/2022-01-26 50/2022-01-24 5/2022-01-24 5","  The Tomi Waziri foundation is dedicated to reigniting hope love and kindness in humanity.   Tomi lost his sight September 2019 to an arm robbery attack on him.He was shot at the face and became blind immediately.Devastated by the bad news when the doctor told him he won’t be able to see again Even almost committing suicide realising the reality of blindness after 27 years of being a sighted person Tomi showed courage and turned his mess to a message He realised he could be a source of hope to millions of people if only he didn’t give up.   Now after a couple of outreach to juvenile homes persons with disabilities and the feed hundred project the organization is launching a food bank dedicated to persons with disabilities and the less privileged in my community here in Nigeria.   The initiative is titled Feed the disabled food bank. The organization plans to launch the food bank project on April 24th 2022.   Your support will be highly appreciated by donating towards the food bank to put a smile on the faces and food on tables of persons with disabilities and the needy here in Nigeria.God bless you as you become an ambassador of love and kindness.   Food stuffs donations like rice  beans  spaghetti  noodles  tomato paste  and the likes will be highly appreciated . For inquiries on how to donate and support     Instagram:   https://instagram.com/tomiwazirifoundation?utm_medium=copy_link    OpenSea : https://opensea.io/assets/matic/0x2953399124f0cbb46d2cbacd8a89cf0599974963/25974020542835949380985582884747750837262786565986079785528810728444674941216/    YouTube: https://youtube.com/playlist?list=PLvfGMvun3MKVlwudILUmXmMblJ_PLKE4q    Please call / WhatsApp : Tel: +2347061766748 For our past event  documentaries and stories watch YouTube link below   Organized by: Tomi Waziri Foundation in collaboration with Grillaz BBQ Bistro Cafe  NOMFRO Technologies &The social park club.      ",False
" Helping Wolverhampton food banks ","Tipton, West Midlands, United Kingdom",https://www.gofundme.com/f/helping-wolverhampton-food-banks,1000,20,2022-02-23,2022-02-14,,,1,"2022-02-23 20","Hi all  with the cost of living on the rise and it becoming a difficult time for everybody  charities need as much help as they can get. So I want to help raise funds for several good banks in the Wolverhampton area. Not only will they need help paying for everything  but the amount of people that may be forced to use food banks is only set to rise  so to help them be able to provide food for those that need it most  I’m looking to raise as much as I can  even to help in the short term and provide them with a much needed boost. We never know if we might need a food bank at some point in the future and I hope to help so they can continue doing the fantastic work they currently do. ",False
" Raise Money For food banks ","Melton Mowbray, East Midlands, United Kingdom",https://www.gofundme.com/f/5p2wg-raise-money-for-food-banks,2500,20,2021-12-30,2021-12-24,,,1,"2021-12-30 20","Hello I'm Andrew  this fundraiser will help keep the local food bank open & running. After the past year -18months has put a strain on family's who are struggling financially to buy food  hopefully the donations will go towards the cost of rent etc so they can keep open to support the family's  any donations will be greatly appreciated many thanks",False
" FOODBANK DONATIONS THIS CHRISTMAS ","Warrington, North West England, United Kingdom",https://www.gofundme.com/f/foodbank-donations-this-christmas,0,300,,2021-12-15,,,0,,"This year I want to raise money  to be able to do a big shop to help food banks this Christmas ",True
" We need your support more know than we ever did. ","Margate, South East England, United Kingdom",https://www.gofundme.com/f/your-chance-to-help-people-in-your-community,0,5000,,2021-12-28,,,0,,"We have come a long way since June 2020  when we started Margate Independent Foodbank.   We need to thank the Union Methodist Church  Union Row  for all the support they gave us while we were there.   It was a shame we couldn't stay.   Ever since leaving the church we have still kept a look out for the right place  with no luck. In June 2021 we took a different approach and opened the Community Shop in Duck Street  Margate  which is proving popular. The members are able to buy food at subsidised prices.   Also  we still help the most needy in our community with free food or vouchers when needed. We still rely on the wider community for support  as having the shop means we have overheads like rent  electricity  water rates and insurance to pay. It takes a lot of time keeping the shop stocked and open. Without our wonderful volunteers  this would not be possible.     To keep going we need your continued support with donations  in both stock and cash donations.     Please help us carry on our work  which is needed now more than ever.   Thank you from everyone who is involved with Margate Independent Foodbank CIC and MICommunity Shop Margate.   ",True
" Just wanna work! ","Leiston, East of England, United Kingdom",https://www.gofundme.com/f/fndtv4-just-wanna-work,0,3000,,2022-02-21,,,0,,"Hi  I’m currently a full time working single  mum who has fallen on bad times. I have had no option but to come on here as because I work I am entitled to no loans etc via the government. I am going to loose my car if I can’t pay them £3000 in 14 days. with out a car I have no job  currently I have no food and I can’t visit a food bank because they are only open during work time and I can’t get time off I know it’s a lot to ask but I really don’t have any other option    ",True
" Raising money for Leighton Linslade Helpers ","Leighton Buzzard, East of England, United Kingdom",https://www.gofundme.com/f/raising-money-for-leighton-linslade-helpers,0,2000,,2022-02-01,"LEIGHTON LINSLADE HELPERS","Registered nonprofitDonations eligible for Gift Aid.",0,,"You can make a difference by donating today to LEIGHTON LINSLADE HELPERS.   LEIGHTON LINSLADE HELPERS charity 1196332 provide a range of services  from food parcels  community fridge  prescription deliveries  welfare checks  counselling and listening  personal shopping  to many other ways of supporting the community.   Leighton Linslade Helpers is a collective of community volunteers who came together to support their community through the Covid 19 lockdown in their town and surrounding areas. It very quickly grew into an organisation that is continuing to support its community by forming a charity. (1196332)   What started off as an emergency food bank to those in hardship or those shielding  without access to food  has grown into a range of services  from food parcels  community fridge  prescription deliveries  counselling and listening  to many other ways of supporting families  the elderly and the isolated. We are now established in Leighton Buzzard High Street and will continue to support our community  other agencies and wider Bedfordshire.   Our group has been overwhelmed by the generosity of people and business  during this very difficult time for everyone  and we just know that this community spirit will continue. There is still much work to be done to help our community get through this pandemic and to rebuild their lives and lift their spirits  for which so many will be grateful. ",True
" The grinches little helpers ","Wolverhampton, West Midlands, United Kingdom",https://www.gofundme.com/f/the-grinches-little-helpers,0,150,,2021-12-06,,,0,,"Last year the grinches little helpers  Alfie 10  Archie 8  lily 2  and Tegan 16 raised an amazing amount of money to create massive food hampers to donate to local food banks and loads of shoe boxes full of toys for less fortunate children. In total last year we raised £300 at the grinches den. You can check out all the amazing work from the children on their Facebook page @ THE GRINCHES DEN. This year the children have a target of £500. Their chosen food bank this year is the well. However they have also been ask to set up their own food bank at a local community centre. We are currently exploring this opportunity and would like to try and raise as much as possible to be able to have to ability to set up a fully functioning food bank ran by the children to help our local community as we all know how hard times have been throughout the covid-19 pandemic. However if they do not set up a food bank the extra money raise shall be split between a number of local charities. The journey can be followed on their Facebook page. They have also been in the express and star to tell the world about them spreading Christmas magic and kindness around the local communities.",True
" Food packs for Christmas ","London, Greater London, United Kingdom",https://www.gofundme.com/f/food-packs-for-christmas,0,500,,2021-12-06,,,0,,"Alvina’s Food Bank have been helping families and individuals throughout the pandemic. We have provided over 1000 food packs and also during Eid and Christmas which was during the lockdown.   We have  won 3 awards in recognition of our work. We  are now planning to provide Christmas food packs to families and individuals. We know many have lost their job  and not entitled to any welfare benefits. We know people are still struggling.   We would like to provide food packs to families especially those with children and single parents.   Follow us on Facebook: Alvina’s Food Bank We provide culturally oriented and halal food.   We are seeking your support once again  some of us are extremely fortunate that we still have a job and roof over our head.    £25-£30 shopping will last a family for a week. ",True
