Title,Location,Link,Raised,Target,MostRecentDonation,Created,Organization,OrganizationDetails,DonationCount,Donations,Description,Complete
" Nailsea Community Group ","Nailsea, South West England, United Kingdom",https://www.gofundme.com/f/jfeuzf-nailsea-community-group,1500,1452,2022-01-08,2020-11-23,,,35,"2022-01-08 20/2022-01-02 10/2021-10-11 20/2021-10-09 20/2021-07-22 30/2021-03-06 35/2021-03-05 50/2021-02-28 25/2021-02-15 100/2021-02-04 20/2021-01-23 50/2020-12-25 40/2020-12-23 10/2020-12-07 22/2020-12-06 20/2020-12-05 50/2020-12-04 100/2020-12-04 50/2020-12-04 200/2020-11-29 200/2020-11-28 30/2020-11-28 30/2020-11-27 50/2020-11-26 50/2020-11-26 20/2020-11-26 50/2020-11-26 20/2020-11-26 20/2020-11-26 20/2020-11-26 20/2020-11-25 10/2020-11-25 10/2020-11-25 20/2020-11-25 20/2020-11-24 10","The Nailsea Community Group was set up in March 2020 in response to the Covid crisis. Since then the group has gone from strength to strength and has evolved from a Covid-response team to a real Community Group that highlights what an amazing community we have in Nailsea.       We have a process in place to make sure all funds donated to the group are spent on current community projects and future legacy projects which are in the best interest of the residents of Nailsea. Any spending is reviewed and voted on before being approved by the Nailsea Community Group Management Team.      We still have over 170 volunteers who have made over 6 000 shopping deliveries and over 4 000 prescription deliveries. We still support over 30 households with our own emergency Foodbank and our referrals to the Trussell Trust at Southfield Road. We still have 104 active Community Buddies supporting residents every week.      Community Larder - this has been established to stop food from going to waste and is supported by local shops  both independently and through the charities FareShare  Neighbourly  and FoodShare. It has an average of 55 visits a day and is open to all residents and has no impact on our Foodbank stock. #feedbelliesnotbins       Community Food Club - this is open to those who receive benefits. Membership costs £1 per household and entitles members to a weekly bag of store-cupboard items worth over £10 for £3.50.        End Holiday Hunger - When schools are not running we are endeavouring to provide food for every child in Nailsea who receives Free School Meals in term time.      Nailsea Active - this initiative continues to inspire people to stay mentally and physically active and to make the most of our amazing local facilities.        We are very proud to live in Nailsea and would not be able to provide the above without every volunteer along with every resident  business  and organisation that has helped us along the way.      Thank you so much for your continued support.",False
" New Beginnings improving lives CIC ","Liverpool, North West England, United Kingdom",https://www.gofundme.com/f/COVID-19-SUPPORTING-VULNERABLE-FAMILIES,3000,1630,2022-01-01,2020-06-04,,,29,"2022-01-01 50/2021-12-24 30/2021-12-16 50/2021-12-14 170/2021-12-10 100/2021-12-10 50/2021-11-29 100/2021-10-22 20/2021-06-04 10/2021-06-03 20/2021-06-03 30/2021-03-13 105/2021-03-12 50/2021-01-12 50/2021-01-01 25/2020-12-24 25/2020-12-23 200/2020-12-22 100/2020-12-22 30/2020-12-07 25/2020-10-31 50/2020-10-31 50/2020-10-30 50/2020-10-30 20/2020-10-30 100/2020-10-24 50/2020-06-18 10/2020-06-13 10/2020-06-13 50","We run a Food bank via delivery which started in March 2020 when Covid first hit.    Our Filling the gap an emergency covid 19 project was delivering over 200 food parcels across Liverpool  Sefton and Knowsley a week.     We are currently trying to raise money to ensure we can continue with our Foodbank deliveries which is in high demand from professional dealing with people in extreme poverty faced with Mental health and not always able to go to a drop by Foodbank.     As the pandemic continues we are receiving more and more referrals for our social prescribing service. Why do professionals and people turn to NBIL ? Because we ensure we get to the end result  we take on service users who have fallen through the system.     If you are in a financial position to support our Foodbank we kindly ask for a donation either food (preferred) as that takes man hours away from staff or donations through our fund me page.     Please take a look at our social media and look at the great work we do     Facebook New Beginnings improving lives CIC     Twitter @Beginningsi     Instagram newbeginningimprovinglives     "" Live well  be socially connected and improve your mental health""      ",False
" i-teachers Fit 4 Feb ","Manchester, North West England, United Kingdom",https://www.gofundme.com/f/iteachers-fit-4-feb,500,395,2022-02-28,2021-02-01,"The Trussell Trust","Registered nonprofitDonations eligible for Gift Aid.",29,"2022-02-28 20/2022-02-16 20/2021-02-28 30/2021-02-25 25/2021-02-23 15/2021-02-22 10/2021-02-16 10/2021-02-10 10/2021-02-08 5/2021-02-08 5/2021-02-08 5/2021-02-08 10/2021-02-07 10/2021-02-04 5/2021-02-04 10/2021-02-04 20/2021-02-04 20/2021-02-03 10/2021-02-03 10/2021-02-03 10/2021-02-03 30/2021-02-03 20/2021-02-03 20/2021-02-02 15/2021-02-02 10/2021-02-02 10/2021-02-02 10/2021-02-02 10/2021-02-01 10","The i-teachers team are collectively pledging to cover 1 425KM across February in our Fit 4 Feb challenge. Do you want to join us in making a difference? We are raising money in aid of The Trussell Trust and every donation will help. We work with schools nationally  and want to do our bit to help ensure families still have access to food even throughout the current school closures. Thank you in advance for your contribution to this cause.    More information about The Trussell Trust: The Trussell Trust  in conjunction with local communities  develops and runs sustainable projects in the UK tackling poverty and exclusion. Through the UK Foodbank Network and Community Enterprises we work with marginalised people in real need  providing practical care and support. www.trusselltrust.org.    ",False
" Brighton & Hove Cap Debt Centre","Hove, South East England, United Kingdom",https://www.gofundme.com/f/brighton-amp-hove-cap-debt-centre,1000,562,2022-02-05,2020-03-18,"BRIGHTON LIGHT TRUST","Registered nonprofitDonations eligible for Gift Aid.",12,"2022-02-05 10/2021-12-17 25/2021-12-17 20/2021-12-12 6/2021-12-10 40/2021-11-21 6/2021-09-09 175/2021-03-01 125/2020-09-15 50/2020-07-18 50/2020-05-16 50/2020-03-18 5","Brighton Light Trust is the local charity representing Christians Against Poverty (CAP) . Through their service CAP help over 28 000 people across the nation deal with severe anxiety as a result of financial hardship.    Locally our team complete over 350 consultations per year; helping individuals and families budget  pay off debts  improve mental well-being and restore relationships through bespoke personalised programs.    On average 3-5 people go debt free per day through the charity's help. 1 400 are being helped get back into employment (CAP Job Clubs). Over 100 are assisted out of addiction through CAP Release Groups. 12 000 are educated through the UK’s biggest free financial education course CAP Money/Life Skills.    Leading advocates include HRH Prince Charles  Archbishop Justin Welby and TV presenter Martin Lewis (founder of moneysavingexpert.com ). He describes CAP as ""the leading holistic debt advisory service without equal.""    On a local level CAP  through the funding from Brighton Light Trust serve across the city and beyond. From Southwick to Seaford  Lewes and Burgess Hill and occasionally Eastbourne in order to meet demand. Clinics and advice pop ups occur at Foodbanks and Job Centres each week.    All monies donated go towards the cost incurred for servicing debts on client’s behalf; emergency food aid; energy card top ups; bus passes so clients can attend appointments without forgoing meals and the provision of household items such as cookers  microwaves and washing machines.    Please contact us on 01273 732111 for more information or a tour around our offices. If you can  please donate today and help change someone’s life for the better.",False
" The need to feed ","Saint Athan, Wales, United Kingdom",https://www.gofundme.com/f/2cep9nmvc0,5000,50,2021-12-24,2021-04-17,,,5,"2021-12-24 25/2021-05-18 5/2021-04-28 5/2021-04-18 10/2021-04-18 5","We are a Foodbank that covers from Ely To Bridgend! We give food to anyone that needs it via collections from stores! We do this on a daily basis ! We also do homeless runs once a month with food clothing etc ! To top this off we help women who have left refuge or managed to get shelter bike there forever homes ! If people have had a fire we replace there Worldly possessions with the best we can collate ! I work a full time job to sustain this project as we have had many barriers and struggles along the way ! We are a tram of 9 volunteers and 3 trustees working tirelessly to fill in the cracks that people fall  Through within other charity funding ! But the demand of feeding over 500 families a week and the tremendous pressure of need and welcome any contributions what so ever from what has already been a tremendous community spirit ! Every penny helps should you want any more information please don’t hesitate to contact me directly Vicky Louise Lang ",False
" Mind Over Matter-Man v 28 stone tyre ","Kirkham, North West England, United Kingdom",https://www.gofundme.com/f/mindovermattermanvtyre,5000,8555,2021-12-04,2020-05-08,,,353,"2021-12-04 5/2021-12-04 10/2021-12-04 10/2021-12-04 25/2021-12-04 5/2021-12-04 50/2021-12-04 20/2021-12-03 5/2021-12-03 10/2021-12-03 10/2021-12-03 10/2021-12-03 10/2021-12-03 10/2021-12-01 20/2021-11-28 10/2021-11-23 5/2020-12-12 10/2020-12-12 5/2020-12-12 5/2020-12-12 5/2020-12-12 10/2020-12-12 10/2020-12-12 50/2020-12-12 5/2020-12-12 10/2020-12-12 50/2020-12-12 20/2020-11-15 500/2020-11-15 5/2020-11-13 10/2020-07-28 20/2020-07-25 25/2020-07-10 60/2020-07-06 100/2020-07-05 15/2020-07-01 20/2020-06-30 20/2020-06-30 100/2020-06-30 5/2020-06-30 240/2020-06-29 10/2020-06-29 10/2020-06-29 50/2020-06-29 10/2020-06-29 50/2020-06-29 20/2020-06-29 10/2020-06-29 30/2020-06-28 10/2020-06-28 100/2020-06-28 30/2020-06-28 10/2020-06-28 25/2020-06-28 20/2020-06-28 5/2020-06-28 10/2020-06-28 5/2020-06-28 40/2020-06-28 10/2020-06-27 20/2020-06-27 100/2020-06-27 10/2020-06-27 20/2020-06-27 15/2020-06-27 20/2020-06-27 10/2020-06-27 20/2020-06-27 10/2020-06-27 10/2020-06-27 10/2020-06-27 25/2020-06-27 20/2020-06-27 10/2020-06-27 10/2020-06-27 5/2020-06-27 20/2020-06-27 10/2020-06-27 20/2020-06-27 100/2020-06-27 50/2020-06-27 20/2020-06-27 20/2020-06-27 256/2020-06-27 20/2020-06-27 10/2020-06-27 20/2020-06-27 10/2020-06-27 15/2020-06-27 10/2020-06-27 10/2020-06-27 10/2020-06-27 20/2020-06-27 10/2020-06-27 10/2020-06-27 10/2020-06-27 10/2020-06-27 10/2020-06-27 10/2020-06-27 10/2020-06-27 50/2020-06-27 20/2020-06-27 10/2020-06-27 10/2020-06-27 5/2020-06-27 50/2020-06-27 10/2020-06-27 5/2020-06-27 20/2020-06-27 20/2020-06-27 10/2020-06-27 25/2020-06-27 20/2020-06-27 50/2020-06-27 10/2020-06-27 13/2020-06-27 14/2020-06-27 10/2020-06-27 20/2020-06-27 10/2020-06-27 10/2020-06-27 20/2020-06-27 25/2020-06-27 5/2020-06-27 5/2020-06-27 5/2020-06-27 25/2020-06-27 40/2020-06-27 10/2020-06-27 10/2020-06-27 20/2020-06-27 100/2020-06-27 20/2020-06-27 100/2020-06-27 5/2020-06-27 20/2020-06-27 20/2020-06-27 10/2020-06-27 10/2020-06-27 10/2020-06-27 20/2020-06-27 20/2020-06-27 10/2020-06-27 5/2020-06-27 20/2020-06-27 20/2020-06-27 20/2020-06-27 10/2020-06-27 100/2020-06-27 50/2020-06-27 10/2020-06-26 10/2020-06-26 20/2020-06-26 10/2020-06-26 30/2020-06-26 10/2020-06-26 10/2020-06-26 10/2020-06-26 5/2020-06-26 5/2020-06-26 20/2020-06-26 5/2020-06-26 5/2020-06-26 10/2020-06-26 10/2020-06-26 20/2020-06-26 10/2020-06-26 25/2020-06-26 10/2020-06-26 10/2020-06-26 5/2020-06-26 10/2020-06-26 10/2020-06-26 5/2020-06-26 10/2020-06-26 20/2020-06-26 10/2020-06-26 20/2020-06-26 20/2020-06-26 10/2020-06-26 10/2020-06-26 20/2020-06-26 10/2020-06-26 10/2020-06-26 25/2020-06-26 20/2020-06-26 20/2020-06-26 5/2020-06-26 10/2020-06-26 30/2020-06-26 10/2020-06-26 10/2020-06-26 25/2020-06-26 10/2020-06-26 10/2020-06-26 10/2020-06-26 10/2020-06-26 75/2020-06-26 20/2020-06-26 10/2020-06-26 20/2020-06-26 20/2020-06-26 10/2020-06-26 20/2020-06-26 20/2020-06-26 15/2020-06-26 20/2020-06-26 50/2020-06-26 20/2020-06-26 50/2020-06-26 20/2020-06-26 10/2020-06-26 20/2020-06-26 10/2020-06-26 43/2020-06-26 50/2020-06-26 5/2020-06-26 5/2020-06-26 20/2020-06-26 10/2020-06-26 100/2020-06-26 10/2020-06-26 10/2020-06-26 10/2020-06-26 5/2020-06-26 10/2020-06-26 20/2020-06-26 20/2020-06-26 10/2020-06-26 10/2020-06-26 10/2020-06-26 50/2020-06-26 100/2020-06-26 5/2020-06-26 5/2020-06-26 50/2020-06-26 100/2020-06-26 10/2020-06-26 10/2020-06-26 10/2020-06-26 10/2020-06-26 50/2020-06-26 10/2020-06-26 10/2020-06-26 100/2020-06-26 100/2020-06-26 10/2020-06-26 10/2020-06-26 10/2020-06-26 10/2020-06-26 20/2020-06-26 20/2020-06-25 20/2020-06-25 40/2020-06-25 20/2020-06-25 20/2020-06-24 20/2020-06-24 20/2020-06-24 10/2020-06-22 10/2020-06-20 10/2020-06-17 10/2020-06-05 10/2020-05-28 10/2020-05-27 20/2020-05-27 10/2020-05-27 20/2020-05-27 10/2020-05-26 250/2020-05-26 40/2020-05-26 20/2020-05-26 10/2020-05-26 10/2020-05-25 30/2020-05-25 25/2020-05-24 10/2020-05-24 10/2020-05-23 10/2020-05-23 10/2020-05-23 20/2020-05-23 10/2020-05-23 10/2020-05-23 20/2020-05-23 40/2020-05-21 10/2020-05-21 20/2020-05-21 10/2020-05-20 20/2020-05-20 20/2020-05-19 10/2020-05-19 10/2020-05-19 10/2020-05-19 5/2020-05-19 25/2020-05-19 24/2020-05-19 75/2020-05-19 10/2020-05-18 30/2020-05-18 50/2020-05-18 10/2020-05-18 50/2020-05-18 10/2020-05-17 20/2020-05-17 20/2020-05-16 10/2020-05-16 50/2020-05-16 10/2020-05-16 20/2020-05-15 10/2020-05-14 10/2020-05-14 40/2020-05-13 50/2020-05-13 20/2020-05-13 10/2020-05-13 40/2020-05-12 15/2020-05-12 25/2020-05-12 10/2020-05-12 50/2020-05-12 10/2020-05-12 30/2020-05-12 5/2020-05-12 5/2020-05-11 10/2020-05-11 50/2020-05-10 20/2020-05-10 100/2020-05-10 20/2020-05-10 15/2020-05-10 50/2020-05-10 20/2020-05-10 10/2020-05-09 10/2020-05-09 10/2020-05-09 10/2020-05-08 20/2020-05-08 20/2020-05-08 50/2020-05-08 10/2020-05-08 30/2020-05-08 5/2020-05-08 10/2020-05-08 20/2020-05-08 20/2020-05-08 10/2020-05-08 10/2020-05-08 30/2020-05-08 20/2020-05-08 10/2020-05-08 20/2020-05-08 10/2020-05-08 10/2020-05-08 10/2020-05-08 100","WORLD RECORD ATTEMPT!!      24 hour challenge 28 stone tyre v Bill Hodgson.... bring it on!      Thanks for everyones patience while we got this sorted.      I don’t do things by halves and after seeing the country pull together these last few months i've decided to push myself to the edge to raise some much needed money for some causes close to my heart.      1. Kirkham Food Bank: Many homes have and will be hit hard financially due to covid 19  I want to do my bit for the local community that have supported me so well over the years.      2.Clint Grieve : In March a good friend  fellow doorman and boxer was found at the bottom of the stairs and was unable to move. Sadly he is now paralysed from the neck down and is in desperate need of some additional equipment and adaptations at home to help him on the road to recovery. Due to Covid 19 Clint is unable to receive the level of rehabilitation required which will hinder his recovery.      3. Matthew Savage- Grattan      21 month old Matthew Savage - Grattan from Blackpool has recently been diagnosed with Rhabdomyosarcoma  Rhabdomyosarcoma is a type of tissue sarcoma (tumour)  which is only found in fewer than 60 children diagnosed with this rare form of cancer in the UK each year. He is only 21 months old and is being Treated Brilliantly by Manchester Children's Hospital. His family are having to travel to Manchester every week for appointments and have to stay over when Matthew is having his treatments. I want to help contribute to the families expenses during this very challenging time.      I will be splitting the money that I raise equally between these very worthy causes. I will be pushing myself to the limits mentally and physically for 24 hours flipping a 28 stone tyre!! There will be no breaks (accept for toilet ones and the off brew)  I will be monitored and the challenge will be broadcast on my social media pages. There will also be sponsorship opportunities and if you want to come and flip a tyre with me for 30 mins   at a safe distance obviously then you will be more than welcome. 9am Friday 26th th June - 9am Saturday 27th June      Please donate generously:",False
" Comiston, B'stone & F&#039;head - Swap&Sell Fundraiser","Edinburgh, Scotland, United Kingdom",https://www.gofundme.com/f/comiston-b039stone-amp-f039head-people-swapampsell,1000,485,2022-03-06,2020-06-06,,,67,"2022-03-06 5/2022-03-06 5/2022-02-23 10/2022-02-20 10/2022-02-20 10/2022-02-20 5/2022-02-20 10/2022-02-14 5/2022-02-11 5/2022-02-07 5/2022-02-06 5/2022-02-01 5/2022-02-01 5/2022-02-01 5/2022-01-31 5/2022-01-30 5/2022-01-27 10/2022-01-24 5/2022-01-23 5/2022-01-17 5/2022-01-16 5/2022-01-09 5/2022-01-08 5/2022-01-08 8/2022-01-06 10/2022-01-04 10/2022-01-04 10/2022-01-03 9/2022-01-03 5/2022-01-03 10/2022-01-03 5/2021-12-30 5/2021-12-28 5/2021-12-22 10/2021-12-16 5/2021-12-14 5/2021-12-13 5/2021-12-12 5/2021-12-11 20/2021-12-09 10/2021-12-06 5/2021-12-03 20/2021-12-03 8/2021-12-03 20/2021-12-01 10/2021-11-30 5/2021-11-28 5/2021-11-27 10/2021-11-27 5/2021-11-26 10/2021-11-22 5/2021-11-20 5/2021-11-17 5/2021-11-17 10/2021-05-19 5/2021-05-11 5/2020-10-10 5/2020-09-09 5/2020-06-21 5/2020-06-17 5/2020-06-15 10/2020-06-15 5/2020-06-15 5/2020-06-15 10/2020-06-12 5/2020-06-12 10/2020-06-08 10","This is the fundraiser for the Comiston  Buckstone & Fairmilehead People - Swap & Sell Facebook group.     Currently raising funds for the Edinburgh Children's Hospital Charity. £3 500 already raised in total (£400 for Edinburgh School Uniform Bank and £200 each for Edinburgh Children's Hospital Charity  Dads Rock  Marie Curie Hospice Edinburgh  Fairmilehead Parish Church Roof Repair Fund  Best Bib n Tucker CIC  The Trussell Trust  Oxgangs's Care  CHAS  Soul Food Edinburgh  Edinburgh Young Carers  U-Evolve  Steps To Hope SCIO  Edinburgh South East Food Bank and Social Bite  and £300 total for our local primary schools).",False
