Title,Location,Link,Raised,Target,MostRecentDonation,Created,Organization,OrganizationDetails,DonationCount,Donations,Description,Complete
" Support Lewisham Local Food Bank born from Barbers ","London, Greater London, United Kingdom",https://www.gofundme.com/f/support-lewisham-local-food-bank-born-from-barbers,4000,2800,2022-01-26,2020-04-22,,,75,"2022-01-26 20/2021-06-08 40/2021-05-11 30/2021-05-05 25/2021-05-05 25/2021-05-04 25/2021-03-25 100/2021-02-26 100/2021-02-26 200/2021-02-24 20/2021-02-23 50/2021-02-08 30/2021-02-06 20/2021-02-06 10/2021-02-05 10/2021-02-04 20/2021-02-04 10/2021-02-03 10/2021-02-01 15/2021-01-29 20/2021-01-28 200/2021-01-25 15/2021-01-06 250/2020-12-07 50/2020-12-07 10/2020-11-26 25/2020-11-16 30/2020-11-10 30/2020-10-27 50/2020-10-20 50/2020-08-27 50/2020-08-06 20/2020-07-22 50/2020-07-04 10/2020-07-03 25/2020-07-03 25/2020-07-03 50/2020-07-02 20/2020-07-02 50/2020-07-02 30/2020-07-01 5/2020-07-01 5/2020-07-01 30/2020-07-01 10/2020-07-01 10/2020-07-01 20/2020-07-01 25/2020-06-11 20/2020-06-09 25/2020-06-09 10/2020-06-09 15/2020-06-09 15/2020-06-09 50/2020-06-08 10/2020-06-08 20/2020-06-08 30/2020-06-08 20/2020-06-08 100/2020-05-30 135/2020-05-25 20/2020-05-25 20/2020-05-15 50/2020-05-10 50/2020-05-08 25/2020-05-06 100/2020-04-27 20/2020-04-26 30/2020-04-24 10/2020-04-24 20/2020-04-24 10/2020-04-24 10/2020-04-24 25/2020-04-23 20/2020-04-22 5/2020-04-22 10","Ziggy  the owner of Progress Barbers in Catford  Lewisham has done something well out of the ordinary...        Due to the pandemic  countless numbers of small and local businesses have been forced to close - with barbershops/hair salons being examples of the businesses that are suffering the most. Now  the normal response for the owner of a business like this would be to take advantage of rate relief  seek bridge funding for the business and also look for financial support being offered to people that are self-employed.    But not Ziggy...        Ziggy has converted the Barbershop into a Food Bank that is specifically focused on helping the elderly and other vulnerable members of the local community to have access to the food and sustenance they need in a time when it may be challenging to make trips to supermarkets or go shopping themselves.    We all know that local businesses like barbershops are massive pillars within communities as they are connected to so many people and aware of a range of local issues. So  who better and where better for a Food Bank to support vulnerable people to come from?        As it stands  Ziggy is not only travelling (on his own dime) to his shop  to the homes of people who cannot make it to his Food Bank and even spending his own money to buy food if he is short on donations from local people that are aware his Food Bank Exists. ALL WHILST HE IS LOSING MONEY AS HE CANNOT TRADE AND RUN HIS BUSINESS AS NORMAL.    So  now we need to support this local hero by helping to alleviate the financial pressure that comes from still having to maintain the utility costs at the shop  the transport costs that come with running the Food Bank and also to help access further food to support vulnerable local people.",False
" Ramsbottom Pantry food bank ","Ramsbottom, North West England, United Kingdom",https://www.gofundme.com/f/ramsbottom-pantry-food-bank,2500,2147,2022-01-31,2021-03-01,,,51,"2022-01-31 10/2022-01-20 15/2021-12-23 120/2021-12-08 100/2021-12-05 15/2021-12-02 100/2021-12-02 100/2021-10-25 40/2021-10-15 40/2021-10-14 10/2021-10-08 100/2021-10-08 100/2021-10-01 25/2021-09-30 25/2021-09-30 50/2021-09-30 20/2021-09-30 30/2021-09-30 10/2021-09-29 20/2021-09-28 10/2021-08-22 30/2021-07-28 60/2021-06-22 30/2021-05-25 30/2021-05-03 50/2021-04-29 40/2021-04-05 50/2021-04-05 20/2021-04-03 10/2021-04-01 12/2021-03-31 140/2021-03-30 10/2021-03-30 5/2021-03-29 15/2021-03-29 20/2021-03-29 10/2021-03-29 20/2021-03-29 50/2021-03-29 20/2021-03-29 20/2021-03-29 20/2021-03-29 15/2021-03-29 100/2021-03-27 100/2021-03-24 30/2021-03-13 170/2021-03-13 20/2021-03-13 20/2021-03-06 20/2021-03-05 50/2021-03-05 20","We are a voluntary food pantry based in Ramsbottom. Our function is to be the arms that reach out to the community directly. We are a completely donation driven food pantry who rely on the generosity of the local community to help those who need it.    The COVID-19 pandemic has brought unprecedented challenges to so many peoples lives and has truly highlighted how anybody can be in need of emergency food at anytime. There is no 'type' of person. When a crisis hits we aim to bridge the gap and offer our support. Whether you have been furloughed  had your hours reduced  lost your job  waiting on a Universal Credit payment or had unexpected additional expenses we are here to help.",False
" Fill The Food Bank 2021 !! ","City of Birmingham, West Midlands, United Kingdom",https://www.gofundme.com/f/mcskgz-fill-the-food-bank-2021,400,500,2021-12-14,2021-11-25,,,24,"2021-12-14 10/2021-12-13 50/2021-12-08 30/2021-12-07 40/2021-12-06 50/2021-11-30 5/2021-11-30 15/2021-11-30 10/2021-11-30 50/2021-11-30 10/2021-11-28 50/2021-11-27 10/2021-11-26 15/2021-11-26 20/2021-11-26 10/2021-11-26 10/2021-11-26 20/2021-11-26 10/2021-11-26 20/2021-11-26 5/2021-11-26 5/2021-11-26 5/2021-11-26 30/2021-11-26 20","Hi everyone  you may or may not remember me doing a similar thing last year.   Last year as a group we raised a whopping £3 000 !! Which was a massive increase on 2019. This year we are looking to smash that record again - with your help!!  Mine (and your) contribution last year was £275 which I am so grateful for - but it would be amazing to beat that this year!!    We are just a group of friends who raise money every year in the run up to Christmas to buy food for local food banks around the South Birmingham area.   Now more than ever  your donations and support will mean so much more.  COVID has caused complications and tough situations for everybody  some more than others. Food banks were crying out for food to support local communities last year and this year is no different!!    Any and all donations are hugely appreciated and will go directly to purchasing food and non-perishables requested by the local food banks!!    Thank you for taking the time to read this and thank you in advance for your generous donation - you have made a massive difference!!",False
" CMS Instant Neighbour Christmas Food Bank Appeal ","Aberdeen, Scotland, United Kingdom",https://www.gofundme.com/f/cms-instant-neighbour-food-bank-appeal,800,705,2021-12-17,2020-12-01,,,35,"2021-12-17 50/2021-12-15 15/2021-12-15 25/2021-12-15 10/2021-12-14 30/2021-12-10 10/2021-12-07 10/2021-12-07 10/2021-04-08 30/2021-04-07 10/2021-04-01 10/2021-03-30 20/2021-03-29 20/2021-03-29 10/2021-03-26 10/2021-03-26 20/2021-03-26 30/2021-03-26 30/2020-12-17 50/2020-12-17 10/2020-12-17 30/2020-12-17 10/2020-12-17 20/2020-12-17 10/2020-12-17 50/2020-12-16 10/2020-12-07 10/2020-12-03 50/2020-12-01 50/2020-12-01 10/2020-12-01 10/2020-12-01 5/2020-12-01 10/2020-12-01 10/2020-12-01 10","Following the success of our 2020 CMS Aberdeen Christmas Food Bank Appeal and the Easter Holidays food bank drive we are keen to continue to provide support and assistance to the wider Aberdeen community through our office-wide Responsible Business offering. We have therefore decided to run our Christmas Food Bank Drive for the second year running in support of Instant Neighbour  a local Aberdeen charity who provide emergency food parcels and support to vulnerable individuals requiring urgent assistance.     Due to the ongoing COVID-19 pandemic  we have decided to  instead of collecting physical items from individuals  collect monetary donations via a GoFundMe page which will be used to purchase food and supplies for Instant Neighbour to be delivered in a COVID-secure way. All donations will help towards purchasing food items for inclusion in parcels for vulnerable people across Aberdeen. Any donations made can be marked as “anonymous” if preferred.     Any donation  however small will help towards purchasing food items for inclusion in parcels for vulnerable people and families across Aberdeen.    The GoFundMe page will be open for donations until Friday 17th December with a drop-off of the purchased food being scheduled for the week after. Thank you in advance for your generosity.",False
" Sufra Fundraising - Help our local food bank. ","Wembley, Greater London, United Kingdom",https://www.gofundme.com/f/nw-sisters-community-fund,500,510,2021-12-23,2021-12-18,,,26,"2021-12-23 10/2021-12-23 20/2021-12-22 5/2021-12-22 10/2021-12-22 5/2021-12-22 50/2021-12-22 5/2021-12-22 5/2021-12-22 23/2021-12-22 5/2021-12-21 50/2021-12-21 5/2021-12-21 50/2021-12-21 10/2021-12-21 50/2021-12-21 40/2021-12-21 12/2021-12-21 10/2021-12-21 20/2021-12-21 20/2021-12-21 10/2021-12-21 10/2021-12-21 10/2021-12-21 20/2021-12-21 50/2021-12-21 5","Assalamalaykum wa rahmatullahi wa barakatuhu!   Our local food bank  Sufra  has successfully been serving our community in North West London for many years. They’ve provided food for hundreds of families but as it is winter  supplies have been reduced. Sufra needs our support so this winter  families and children have the food they need!   We intend to use this money to place a delivery order straight to Sufra which will include foods such as tinned/canned foods  rice  flour etc.   Please kindly donate and share the link with your family and friends - a small amount will go a long way.   ~Nw.sisters Team~ ",False
" Food Bank Christmas Donations ","Southsea, South East England, United Kingdom",https://www.gofundme.com/f/food-bank-christmas-donations,200,375,2021-12-10,2021-11-08,,,17,"2021-12-10 20/2021-12-09 10/2021-12-09 5/2021-12-06 5/2021-12-04 20/2021-12-02 30/2021-11-29 20/2021-11-28 20/2021-11-25 15/2021-11-18 25/2021-11-18 100/2021-11-17 15/2021-11-16 30/2021-11-09 10/2021-11-08 10/2021-11-08 20/2021-11-08 20","Once again as Christmas is close approaching so please take a minute to appreciate what you have. Even though this year has been mad for everyone there is still a lot of people who do not have the support & luxuries that most of us probably take for granted.  Sadly we are still live in a world where people and their families need your support. So again for this Christmas I will be doing a collection for Waterlooville food bank. I will be raising money which will go towards requested gifts for the families or can collect donations of presents/gifts - anything is acceptable!!     If you are in a position to donate anything at all I urge you to do so! It doesn’t have to be much & doesn’t have to be through me  even if over the next couple of weeks you can add a few extra bits to your shopping for your local food bank at a supermarket  anything helps!     So if you have a little extra money to donate this Christmas  I can guarantee there will be someone out there who will really appreciate it!     Please message me if you would like to donate gifts towards this and I’m more than happy to collect any local donations if required!!I will be looking to have donations by the 15th December 2021.",False
