Title,Location,Link,Raised,Target,MostRecentDonation,Created,Organization,OrganizationDetails,DonationCount,Donations,Description,Complete
" Sponsor a musalla and leave behind lasting legacy ","London, Greater London, United Kingdom",https://uk.gofundme.com/f/sponsor-a-musalla-and-leave-behind-lasting-legacy,5000,1671,2021-04-30,2020-05-08,"PURLEY ISLAMIC COMMUNITY CENTRE","Registered charityDonations eligible for Gift Aid.",34,"2021-04-30 20/2021-04-30 10/2021-04-16 5/2021-03-02 30/2020-05-26 90/2020-05-23 150/2020-05-22 20/2020-05-21 15/2020-05-21 50/2020-05-20 10/2020-05-20 50/2020-05-19 25/2020-05-18 500/2020-05-17 46/2020-05-17 75/2020-05-16 100/2020-05-15 5/2020-05-15 10/2020-05-14 10/2020-05-14 5/2020-05-14 10/2020-05-13 10/2020-05-12 25/2020-05-12 5/2020-05-12 15/2020-05-10 100/2020-05-09 25/2020-05-08 50/2020-05-08 20/2020-05-08 50/2020-05-08 100/2020-05-08 5/2020-05-08 25/2020-05-08 5","Do you want to join me in making a difference? I'm raising money in aid of PURLEY ISLAMIC COMMUNITY CENTRE and every donation will help. Thank you in advance for your contribution to this cause that means so much to me.I’m trying to raise at least 10 musallas for the reward to be passed to all family members and the prophets ummah who have passed away for their esale sawaab. Donate some money and May your loved one get the reward also.Uthman inn Affan reported: The messenger of Allah  peace and blessings be upon him  said  : “Whoever builds a mosque for Allah  Allah will build for him a house like it in Paradise.”  source: Sahih al-Bukhari439  Sahih Muslim 533    More information about PURLEY ISLAMIC COMMUNITY CENTRE: We are a not for profit organisation which provides prayer facilities  a food bank for the needy and many facilities for women and children in the community. ",False
" Commuters Funding for Covid-19 ","London, Greater London, United Kingdom",https://uk.gofundme.com/f/commuter-funding-for-covid19,5000,4800,2020-06-03,2020-03-21,"NATIONAL EMERGENCIES TRUST","Registered charityDonations eligible for Gift Aid.",111,"2020-06-03 45/2020-04-30 100/2020-04-23 200/2020-04-21 25/2020-04-14 50/2020-04-14 70/2020-04-11 200/2020-04-11 10/2020-04-11 10/2020-04-11 10/2020-04-10 10/2020-04-10 10/2020-04-10 20/2020-04-10 10/2020-04-10 10/2020-04-10 20/2020-04-10 30/2020-04-10 30/2020-04-09 100/2020-04-09 30/2020-04-09 50/2020-04-09 30/2020-04-08 50/2020-04-08 100/2020-04-08 20/2020-04-08 100/2020-04-08 25/2020-04-08 30/2020-04-08 30/2020-04-07 50/2020-04-07 30/2020-04-07 30/2020-04-07 30/2020-04-07 100/2020-04-07 100/2020-04-06 30/2020-04-06 100/2020-04-06 50/2020-04-06 30/2020-04-06 45/2020-04-06 100/2020-04-06 200/2020-04-06 30/2020-04-06 30/2020-04-06 30/2020-04-06 30/2020-04-05 30/2020-04-05 25/2020-04-05 30/2020-04-04 35/2020-04-03 15/2020-04-03 20/2020-04-03 10/2020-04-03 30/2020-04-03 35/2020-04-03 30/2020-04-03 10/2020-04-03 10/2020-04-03 30/2020-04-03 35/2020-04-02 20/2020-04-02 25/2020-04-02 200/2020-04-02 15/2020-04-02 200/2020-04-02 50/2020-04-02 200/2020-04-02 10/2020-04-02 10/2020-04-01 10/2020-04-01 10/2020-04-01 30/2020-04-01 65/2020-04-01 35/2020-04-01 20/2020-04-01 10/2020-04-01 25/2020-04-01 10/2020-03-31 50/2020-03-31 30/2020-03-31 50/2020-03-31 30/2020-03-30 20/2020-03-30 30/2020-03-30 75/2020-03-30 90/2020-03-30 20/2020-03-27 10/2020-03-27 30/2020-03-27 40/2020-03-26 30/2020-03-26 20/2020-03-26 20/2020-03-25 20/2020-03-25 50/2020-03-24 25/2020-03-24 50/2020-03-24 30/2020-03-24 50/2020-03-23 50/2020-03-23 30/2020-03-23 20/2020-03-22 15/2020-03-22 15/2020-03-22 20/2020-03-22 15/2020-03-21 30/2020-03-21 15/2020-03-21 30/2020-03-21 30/2020-03-21 30","For a large number of professionals  who are fortunate enough to work from home - and whose jobs aren't impacted by the crisis - we are left feeling powerless to help in the fight against Covid-19.     With the resounding government message that the biggest support we can give NHS is social distancing  we're hearing from a lot of our friends and colleagues that they feel unable to make a difference in a meaningful way during this unprecedented global and national crisis.     In day four of our self quarantine (and with a lot of time on our hands!)  we've come up with an idea.     i. How can commuters help?     In total  most professionals working from home are likely to make inadvertent economies  for example in London commuters will no longer be paying:    - The daily TfL capped tube fare is £10.40  - A daily coffee will set you back £2.50 (on average)    If we were to invest the savings we weren't expecting to have (or even a portion of it) to a charity  we could all make a huge difference to those on the frontline in hospitals and in the charity sectors (e.g. managing food bank shortages)  with funds being made quickly available to those who are in critical need.     ii. Why support the National Emergencies Trust?    On Wednesday 18 March  Prince William launched a Coronavirus fundraising appeal as part of the National Emergencies Trust. It is working collaboratively with a wide range of organisations to ensure the maximum amount of money is raised and distributed securely  effectively  and fairly to those organisations and local charities who can do most to help those in need.     Through a partnership network established over the past few months  the funds raised will only be channelled through the most trusted and reputable organisations  so you know you’re giving to those who need it the most.    iii. Next steps     Calculate your daily/weekly work-from-home savings and make a donation here of an appropriate amount  which will be directed to The National Emergencies Trust.     We've set a target of £5 000 but let's aim BIG!     Thank you for your time and contribution!",False
" Pine Scully 10,000 Step Challenge ","Sawtry, East of England, United Kingdom",https://uk.gofundme.com/f/pine-scully-10000-step-challenge,2000,2740,2021-01-17,2020-06-05,"Give Back Peterborough","Registered charityDonations eligible for Gift Aid.",113,"2021-01-17 100/2021-01-13 30/2021-01-13 10/2021-01-13 10/2021-01-10 100/2021-01-09 20/2021-01-07 50/2021-01-01 20/2021-01-01 20/2020-12-31 20/2020-12-31 10/2020-12-31 10/2020-12-31 50/2020-12-31 5/2020-12-31 5/2020-12-31 5/2020-12-31 5/2020-12-30 25/2020-12-30 20/2020-12-30 25/2020-12-30 10/2020-12-11 30/2020-11-13 20/2020-11-13 100/2020-10-19 100/2020-10-18 20/2020-10-14 20/2020-10-14 100/2020-10-13 100/2020-10-13 15/2020-10-12 30/2020-10-12 20/2020-10-12 50/2020-10-12 40/2020-10-09 5/2020-10-09 10/2020-09-15 5/2020-09-06 5/2020-09-06 10/2020-09-05 30/2020-09-05 20/2020-09-05 10/2020-09-05 5/2020-09-05 10/2020-09-03 10/2020-09-02 5/2020-09-02 10/2020-09-01 10/2020-08-08 10/2020-08-04 10/2020-08-03 50/2020-08-03 50/2020-08-02 10/2020-08-02 90/2020-07-13 10/2020-07-12 50/2020-07-12 10/2020-07-08 30/2020-07-07 20/2020-07-07 10/2020-07-06 20/2020-07-06 10/2020-07-06 20/2020-07-06 25/2020-07-06 50/2020-07-06 10/2020-07-04 10/2020-07-04 20/2020-07-04 10/2020-07-04 20/2020-07-04 5/2020-07-04 25/2020-07-04 25/2020-07-04 5/2020-07-04 50/2020-07-04 5/2020-07-04 5/2020-07-04 10/2020-07-04 5/2020-07-04 5/2020-07-04 5/2020-07-02 5/2020-07-02 10/2020-07-02 50/2020-06-29 5/2020-06-29 10/2020-06-29 10/2020-06-29 5/2020-06-24 10/2020-06-24 10/2020-06-21 50/2020-06-21 30/2020-06-20 30/2020-06-19 20/2020-06-15 10/2020-06-11 10/2020-06-10 10/2020-06-09 50/2020-06-07 20/2020-06-07 20/2020-06-06 20/2020-06-06 20/2020-06-06 20/2020-06-06 20/2020-06-06 10/2020-06-06 10/2020-06-05 10/2020-06-05 5/2020-06-05 10/2020-06-05 10/2020-06-05 10/2020-06-05 100/2020-06-05 100","Hi  I’m Vicky!    Half of the walking duo that decided back in November 2019 to walk 10 000 steps every day  starting from the 1st January 2020. For those of you have followed us from the start  you might know this  but we thought we’d give the back story of how this came about…     I’ve been friends with Brian Snr on Facebook for a while now  and every year since 2012 he has attempted to walk 10 000 steps a day  every day  for as long as possible. Like we do now  he always reported daily to prove that he was one step closer to his end goal. It started off as a way for him to lose weight and get fit. He quickly gathered support from friends and family  liking the posts  commenting messages of support  and one particular follower (me!) started posting silly hashtags #TeamScullySnr #WalksForDays #HeAlwaysWalksAlone becoming some of my favourites.     Brian’s previous record was 142 days back in 2016.    Fast forward to November 2019. Brian Jnr and I met up in London to watch a show at the o2. As Brian Snr works in the city  we arranged to meet up at the pub at Kings Cross station. I had to ask the question that people that had seen his posts for the last few years  were dying to know ‘are you going to walk again next year?’ Brian was unsure.     I quickly came out with ‘if you do it  I’ll do it with you’ – I might have been a couple of pints/gins in at this point! Brian Jnr laughed. Claimed that we’d never be able to do it. So confident  that he wagered £100. If we both walked 10 000 steps a day  for 143 days  he would pay us £50 each. The bet was made and the challenge set.     I’ll be honest  the only day I’d walked 10 000 steps last year  was that day in London. And I got no-where near it again for the rest of November and December. First of January came and I was worried what I had got myself into!    On Friday 22nd May 2020  we’d done it! No-one had ever heard of coronavirus back in November when this was discussed. Through all dark  cold and wet nights  to the country going into lockdown and only being allowed out once a day to exercise  we’d managed to still walk 10 000 steps every.single.day.    It had never been about the money for us. We streamed a zoom call between the three of us to Facebook live and announced that we wanted to donate the money to a local Peterborough charity. Brian Snr lives just outside of Peterborough  and although I now live in Bournemouth  I grew up in Market Deeping  so it seemed like a no-brainer. Amazingly  our dear friend Maxine offered to match Brian Jnr’s donation too!    We’ve had so much amazing support  and with the excitement and emotion that came on that day  we somehow managed to sign up for another 143 days!! Our new target date is Monday 12th October 2020. We have another £100 wagered with Brian Jnr.    Thank you so much if you’ve managed to read this far. And please if you can  help us raise as much money possible for all the amazing work Give Back Peterborough do in their local area.    More information about Give Back Peterborough: Working hard this help the local community. For the last 4 years we have helped and provided the parents in The Amazon NICU and transitional care by giving essentials such as food drink and hygiene products. We also work with womens aid  the local food banks and school.",False
" 100 miles in October ","Greenock, Scotland, United Kingdom",https://uk.gofundme.com/f/100-miles-in-october,1500,2719,2020-11-08,2020-09-24,,,130,"2020-11-08 50/2020-11-08 20/2020-11-08 40/2020-11-06 10/2020-11-06 20/2020-11-06 5/2020-11-05 10/2020-11-05 20/2020-11-05 5/2020-11-05 20/2020-11-05 20/2020-11-04 20/2020-11-04 20/2020-11-03 10/2020-11-03 25/2020-11-03 20/2020-11-02 24/2020-11-02 20/2020-11-02 20/2020-11-01 100/2020-11-01 10/2020-11-01 15/2020-10-31 10/2020-10-31 10/2020-10-31 15/2020-10-31 10/2020-10-31 20/2020-10-31 20/2020-10-31 20/2020-10-31 15/2020-10-31 10/2020-10-31 15/2020-10-30 10/2020-10-30 15/2020-10-30 10/2020-10-30 15/2020-10-30 10/2020-10-30 15/2020-10-30 20/2020-10-30 10/2020-10-30 50/2020-10-29 50/2020-10-29 25/2020-10-29 20/2020-10-29 20/2020-10-29 50/2020-10-29 50/2020-10-29 20/2020-10-28 20/2020-10-27 20/2020-10-27 20/2020-10-25 10/2020-10-25 10/2020-10-24 20/2020-10-24 20/2020-10-24 10/2020-10-23 20/2020-10-23 5/2020-10-22 5/2020-10-22 10/2020-10-22 20/2020-10-22 5/2020-10-22 5/2020-10-22 10/2020-10-22 20/2020-10-21 50/2020-10-20 40/2020-10-20 10/2020-10-19 10/2020-10-19 30/2020-10-18 40/2020-10-18 50/2020-10-18 10/2020-10-16 20/2020-10-15 20/2020-10-15 32/2020-10-14 10/2020-10-14 30/2020-10-14 50/2020-10-14 25/2020-10-12 20/2020-10-11 10/2020-10-09 15/2020-10-07 10/2020-10-07 10/2020-10-07 10/2020-10-06 30/2020-10-04 10/2020-10-03 10/2020-10-03 10/2020-10-02 20/2020-10-02 10/2020-10-02 10/2020-10-02 100/2020-10-02 20/2020-10-02 10/2020-10-02 10/2020-10-02 20/2020-10-01 10/2020-10-01 20/2020-09-30 5/2020-09-29 10/2020-09-29 10/2020-09-29 10/2020-09-28 30/2020-09-28 10/2020-09-28 10/2020-09-27 18/2020-09-26 20/2020-09-25 100/2020-09-25 10/2020-09-25 10/2020-09-25 20/2020-09-25 20/2020-09-25 50/2020-09-24 30/2020-09-24 30/2020-09-24 10/2020-09-24 50/2020-09-24 10/2020-09-24 20/2020-09-24 10/2020-09-24 25/2020-09-24 50/2020-09-24 10/2020-09-24 10/2020-09-24 20/2020-09-24 20/2020-09-24 10/2020-09-24 20","I hope all friends and families are well. With it being a tough few months for everyone stuck in lockdown  as the restrictions ease we are looking to get back to netball as soon as possible.    Many of the opportunities where we would fundraise for our netball club such as presentation night  quiz nights etc were cancelled therefore we are looking at a different approach to raise some funds this year which will benefit our club. We aim to run/cycle/walk 100 miles in October and to allow all members of our club to participate the younger players have been put into teams to complete this with one another. This will encourage team work to get the miles complete as well as a bit of fitness which we all love since we have not had any pre-season! Our older players will either work in teams of 2 or complete the 100 miles as an individual to really set the challenge! Not only will our club benefit from the fundraising but we have chosen 2 charities that we feel would really benefit from this too: Inverclyde Food Bank and Talk on Inverclyde    Both of which are very important during these hard times and we are working together to help a little where we can. 60% of the funds raised will go to the Clyde Netball Club and 20% each to the above charities.    Any donations would be greatly appreciated and we will keep you updated on our journey through the Clyde Netball Facebook page!",False
" Sheffield Food Bank Campaign ","Sheffield, Yorkshire and the Humber, United Kingdom",https://uk.gofundme.com/f/sheffield-food-poverty-campaign,15000,4914,2021-02-05,2020-03-31,"S2 FOOD POVERTY NETWORK","Registered charityDonations eligible for Gift Aid.",151,"2021-02-05 20/2020-12-18 125/2020-12-18 50/2020-12-16 30/2020-12-15 20/2020-12-15 10/2020-12-12 30/2020-12-09 20/2020-12-09 20/2020-12-04 20/2020-12-02 10/2020-11-23 20/2020-11-20 20/2020-11-18 22/2020-11-18 10/2020-11-18 20/2020-11-13 5/2020-11-09 20/2020-10-22 5/2020-07-28 10/2020-07-06 20/2020-07-03 20/2020-07-03 20/2020-07-03 10/2020-07-03 20/2020-07-03 20/2020-06-30 20/2020-06-21 100/2020-06-12 20/2020-06-11 300/2020-06-09 20/2020-05-27 15/2020-05-27 20/2020-05-20 50/2020-05-19 25/2020-05-19 10/2020-05-19 20/2020-05-19 10/2020-05-18 10/2020-05-18 10/2020-05-18 20/2020-05-18 20/2020-05-18 10/2020-05-18 100/2020-05-06 50/2020-05-06 25/2020-05-06 50/2020-05-06 20/2020-05-06 20/2020-05-06 40/2020-05-06 25/2020-05-06 50/2020-05-06 10/2020-05-06 10/2020-05-05 10/2020-05-05 166/2020-05-02 10/2020-05-01 16/2020-05-01 10/2020-04-28 100/2020-04-27 50/2020-04-27 20/2020-04-23 20/2020-04-19 10/2020-04-18 5/2020-04-17 20/2020-04-17 25/2020-04-16 50/2020-04-14 15/2020-04-14 20/2020-04-14 90/2020-04-14 20/2020-04-14 10/2020-04-14 10/2020-04-14 5/2020-04-14 9/2020-04-13 5/2020-04-12 20/2020-04-10 30/2020-04-10 25/2020-04-10 90/2020-04-09 20/2020-04-09 20/2020-04-09 14/2020-04-08 20/2020-04-08 25/2020-04-07 20/2020-04-07 40/2020-04-07 30/2020-04-06 30/2020-04-06 50/2020-04-06 45/2020-04-06 20/2020-04-06 50/2020-04-05 100/2020-04-05 50/2020-04-05 30/2020-04-05 43/2020-04-05 10/2020-04-04 20/2020-04-04 5/2020-04-04 9/2020-04-04 20/2020-04-04 50/2020-04-04 20/2020-04-03 40/2020-04-03 5/2020-04-03 10/2020-04-03 10/2020-04-03 50/2020-04-03 10/2020-04-03 100/2020-04-03 250/2020-04-02 100/2020-04-02 20/2020-04-02 100/2020-04-02 20/2020-04-02 5/2020-04-02 25/2020-04-02 40/2020-04-01 50/2020-04-01 10/2020-04-01 25/2020-04-01 20/2020-04-01 20/2020-04-01 20/2020-04-01 10/2020-04-01 100/2020-04-01 50/2020-04-01 20/2020-04-01 20/2020-04-01 20/2020-04-01 30/2020-04-01 5/2020-04-01 20/2020-04-01 10/2020-04-01 20/2020-04-01 10/2020-04-01 10/2020-04-01 20/2020-03-31 50/2020-03-31 50/2020-03-31 30/2020-03-31 50/2020-03-31 10/2020-03-31 10/2020-03-31 10/2020-03-31 20/2020-03-31 40/2020-03-31 50/2020-03-31 40","Sheffield Business Together(SBT) https://sheffieldbusinesstogether.org.uk / Hosted in VAS  brings together like minded businesses  to collaborate and share resources across sectors  to address some of the key challenges facing our city and communities.    The Challenge  Covid -19 is an unprecedented challenge for us all. SBT feel our immediate priority is ensuring our food banks have adequate food to help the most vulnerable in the city. They are struggling with donations due to panic buying whilst facing increased demand.     What can I do?  We have partnered with the Sheffield food bank network http://www.sheffieldfoodbank.org.uk/food-bank-list/. There are 15 food banks in the network who helped over 40 000 people last year. We would like those of you who are not experiencing financial hardship  to consider donating a weeks bus fare  petrol  parking charges  or whatever you can afford. Given most businesses have implemented some form of home working  many may not have incurred these costs.    Donations will be shared across the 15 food banks in the Sheffield network.     Thanks in advance for your contribution  together we can make a massive difference.    Sheffield Business Together is hosted in VAS who are co-ordinating the Voluntary Sector response to the COVID Crisis. For uptodate information and details on how to get support or volunteer to help please see     https://www.vas.org.uk/what-we-do/covid19/",False
" Help stateless victim save family home ","Corby, East Midlands, United Kingdom",https://uk.gofundme.com/f/help-stateless-victim-save-family-home,4000,3106,2019-04-07,2018-11-20,,,118,"2019-04-07 10/2019-01-29 25/2019-01-22 1000/2018-12-27 10/2018-12-27 10/2018-12-23 5/2018-12-23 50/2018-12-14 5/2018-12-14 10/2018-12-13 11/2018-12-10 20/2018-12-10 10/2018-12-10 45/2018-12-09 15/2018-12-07 40/2018-12-05 18/2018-12-04 5/2018-12-02 10/2018-12-02 10/2018-12-01 10/2018-12-01 30/2018-12-01 5/2018-12-01 20/2018-12-01 10/2018-12-01 5/2018-12-01 5/2018-12-01 5/2018-11-30 100/2018-11-30 20/2018-11-30 50/2018-11-30 5/2018-11-30 50/2018-11-30 5/2018-11-30 30/2018-11-30 20/2018-11-30 10/2018-11-30 5/2018-11-30 5/2018-11-30 10/2018-11-29 10/2018-11-29 10/2018-11-29 10/2018-11-29 5/2018-11-29 10/2018-11-29 12/2018-11-29 15/2018-11-29 30/2018-11-29 15/2018-11-29 5/2018-11-29 10/2018-11-29 10/2018-11-29 10/2018-11-29 5/2018-11-29 10/2018-11-29 10/2018-11-29 100/2018-11-29 20/2018-11-29 10/2018-11-29 20/2018-11-29 10/2018-11-29 10/2018-11-29 10/2018-11-29 5/2018-11-29 50/2018-11-29 10/2018-11-29 50/2018-11-29 50/2018-11-29 20/2018-11-29 20/2018-11-29 10/2018-11-29 10/2018-11-29 10/2018-11-29 5/2018-11-29 10/2018-11-29 15/2018-11-29 15/2018-11-29 10/2018-11-29 20/2018-11-29 20/2018-11-29 10/2018-11-29 10/2018-11-29 25/2018-11-29 10/2018-11-29 20/2018-11-29 10/2018-11-29 20/2018-11-29 10/2018-11-29 10/2018-11-29 20/2018-11-29 45/2018-11-28 15/2018-11-28 10/2018-11-28 25/2018-11-28 10/2018-11-28 20/2018-11-28 5/2018-11-28 25/2018-11-28 10/2018-11-28 50/2018-11-28 20/2018-11-28 10/2018-11-28 10/2018-11-28 20/2018-11-28 10/2018-11-28 10/2018-11-28 50/2018-11-28 10/2018-11-28 25/2018-11-24 10/2018-11-24 20/2018-11-24 10/2018-11-21 20/2018-11-20 20/2018-11-20 20/2018-11-20 10/2018-11-20 20/2018-11-20 40/2018-11-20 15","Hello all  I am starting this page on behalf of my daughter; her pride would not allow her to ask for help from anyone but there is a time when we all need a little help. My daughter Amanda Bruce is a victim of a situation similar to that of the wind rush generation. She was made stateless in February 2016 and was unable to work  lost her job and unable to claim any benefits until the resolution in May 2018 and was given a passport within 24 hours of calling the wind rush hotline and reinstating her right to work. I am a British citizen   as was my partner. We went on a family holiday to Australia for a year (as my partners both again British parents emigrated to in the 1960 s)where my daughter was born. We returned to the UK when she was just 6 months old and has spent her entire life in this country  worked from the age of 16  paid her taxes all up until February 2016. Amanda is a hard working single mother of 2 children  she has struggled to keep the roof over her and her children’s family home in which they have lived for over 10 years . The past 2 years with no income have left her in tremendous debt. Unable to pay council tax which is now in arrears of £2 500 and her rent which is now in arrears of £2000. During the period of being unable to work or claim  my daughter prioritised feeding her son and daughter with the money friends  family and the children’s father although separated; all while sometimes starving her self and paying what little she could to keep the house as the council could not help her in any way due to the fact she was not classed as a British citizen by the government(and was unable to even claim food bank vouchers as she was not in receipt of any benefits due to being left stateless) . My daughter is now faced with the threat of eviction from her private rent company and is unable to be rehoused by the council due to the arrears over the 2 years she could not pay them (a catch 22 situation) . Bailiffs are a common sight knocking on her doors and she fears for her son and daughters well being. We do not come from a rich family  we are working class people and have struggled to keep the rent paid to date but have fallen behind and struggling to get the money together to keep the house. The Christmas holidays are coming up and while many will be celebrating  I know that my daughter will be having many sleepless nights fearing the risk of losing everything through no fault of her own. We are distraught at the way our own government has treated us over these past 2 years; when a hard working individual is victimised by the very system they have worked in for over 20 years. We ask you today for help. All we want for Christmas this year is to know that my daughter and my grandchildren will sleep in their own beds on Christmas Eve. If you wish to read more on this story  the article can be found on the evening telegraph website. I would also like to note that the wind rush compensation scheme(to which was our only means of calling the hotline to get this horrid situation finally sorted) is still in the works and we have been told it could take over 5 years to receive a penny if any ; the threat of eviction is immediate and we worry how long it will be before they are homeless. We hope you can find it in your hearts to help us in our time of need and we thank you all sincerely for taking the time to read my daughters horrific story. Any sort of help would go a long way and would be greatly appreciated  thank you all. We hope no more people are affected by this in the future it really is a horrendous situation for anyone thank you.",False
