Title,Location,Link,Raised,Target,MostRecentDonation,Created,Organization,OrganizationDetails,DonationCount,Donations,Description,Complete
" Help a single father with a baby ","London, Greater London, United Kingdom",https://uk.gofundme.com/f/help-a-single-father-with-a-baby,3000,22854,2020-10-27,2020-09-14,,,879,"2020-10-27 100/2020-10-12 30/2020-10-10 10/2020-10-10 30/2020-10-10 50/2020-10-09 10/2020-10-09 40/2020-10-08 20/2020-10-02 10/2020-10-01 25/2020-10-01 5/2020-10-01 75/2020-10-01 10/2020-09-29 20/2020-09-28 25/2020-09-28 20/2020-09-28 30/2020-09-28 40/2020-09-28 5/2020-09-27 20/2020-09-27 20/2020-09-27 5/2020-09-27 25/2020-09-27 20/2020-09-27 25/2020-09-27 20/2020-09-26 10/2020-09-26 15/2020-09-26 10/2020-09-26 20/2020-09-26 15/2020-09-26 5/2020-09-26 5/2020-09-26 10/2020-09-26 20/2020-09-26 20/2020-09-26 40/2020-09-26 45/2020-09-26 40/2020-09-25 40/2020-09-25 10/2020-09-25 40/2020-09-25 5/2020-09-25 20/2020-09-25 20/2020-09-25 100/2020-09-25 20/2020-09-25 100/2020-09-25 20/2020-09-25 20/2020-09-25 70/2020-09-25 50/2020-09-25 10/2020-09-25 50/2020-09-25 20/2020-09-25 50/2020-09-25 20/2020-09-25 50/2020-09-25 50/2020-09-25 20/2020-09-25 15/2020-09-25 50/2020-09-25 20/2020-09-25 50/2020-09-25 20/2020-09-25 10/2020-09-25 10/2020-09-25 10/2020-09-25 15/2020-09-25 10/2020-09-25 20/2020-09-25 10/2020-09-25 30/2020-09-25 20/2020-09-25 10/2020-09-25 10/2020-09-25 50/2020-09-25 10/2020-09-25 20/2020-09-25 50/2020-09-25 5/2020-09-25 10/2020-09-25 10/2020-09-25 10/2020-09-25 20/2020-09-25 88/2020-09-25 50/2020-09-25 10/2020-09-25 10/2020-09-25 10/2020-09-25 10/2020-09-25 5/2020-09-25 5/2020-09-25 10/2020-09-25 50/2020-09-25 20/2020-09-25 20/2020-09-25 10/2020-09-25 10/2020-09-25 20/2020-09-25 100/2020-09-25 25/2020-09-25 20/2020-09-25 20/2020-09-25 20/2020-09-25 10/2020-09-25 15/2020-09-25 45/2020-09-25 100/2020-09-25 100/2020-09-25 10/2020-09-25 250/2020-09-25 5/2020-09-24 10/2020-09-24 10/2020-09-24 30/2020-09-24 30/2020-09-24 100/2020-09-24 50/2020-09-24 30/2020-09-24 30/2020-09-24 20/2020-09-24 10/2020-09-24 5/2020-09-24 10/2020-09-24 10/2020-09-24 5/2020-09-24 20/2020-09-24 5/2020-09-24 20/2020-09-24 20/2020-09-24 5/2020-09-24 5/2020-09-24 10/2020-09-24 20/2020-09-24 43/2020-09-24 5/2020-09-24 10/2020-09-24 25/2020-09-24 15/2020-09-24 10/2020-09-24 5/2020-09-24 20/2020-09-24 10/2020-09-24 20/2020-09-24 10/2020-09-24 20/2020-09-24 10/2020-09-24 100/2020-09-24 10/2020-09-24 50/2020-09-24 20/2020-09-24 10/2020-09-24 15/2020-09-24 20/2020-09-24 20/2020-09-24 20/2020-09-24 50/2020-09-24 20/2020-09-24 10/2020-09-24 10/2020-09-24 20/2020-09-24 20/2020-09-24 20/2020-09-24 20/2020-09-24 30/2020-09-24 10/2020-09-24 10/2020-09-24 5/2020-09-24 10/2020-09-24 20/2020-09-24 20/2020-09-24 5/2020-09-24 5/2020-09-24 10/2020-09-24 50/2020-09-24 10/2020-09-24 20/2020-09-24 20/2020-09-24 10/2020-09-24 30/2020-09-24 25/2020-09-24 25/2020-09-24 50/2020-09-24 20/2020-09-24 10/2020-09-24 20/2020-09-24 85/2020-09-24 30/2020-09-24 50/2020-09-24 10/2020-09-24 10/2020-09-24 20/2020-09-24 10/2020-09-24 50/2020-09-24 15/2020-09-24 50/2020-09-24 20/2020-09-24 20/2020-09-24 10/2020-09-24 10/2020-09-24 30/2020-09-24 5/2020-09-24 5/2020-09-24 20/2020-09-24 30/2020-09-24 5/2020-09-24 5/2020-09-24 10/2020-09-24 10/2020-09-24 10/2020-09-24 5/2020-09-24 25/2020-09-24 25/2020-09-24 50/2020-09-24 5/2020-09-24 30/2020-09-24 10/2020-09-24 10/2020-09-24 50/2020-09-24 5/2020-09-24 10/2020-09-24 50/2020-09-24 48/2020-09-24 5/2020-09-24 50/2020-09-24 10/2020-09-24 10/2020-09-24 50/2020-09-24 15/2020-09-24 10/2020-09-24 10/2020-09-24 20/2020-09-24 50/2020-09-24 25/2020-09-24 10/2020-09-24 10/2020-09-24 5/2020-09-24 10/2020-09-24 20/2020-09-24 20/2020-09-24 10/2020-09-24 20/2020-09-24 270/2020-09-24 20/2020-09-24 10/2020-09-24 100/2020-09-24 10/2020-09-24 500/2020-09-24 20/2020-09-24 20/2020-09-24 10/2020-09-24 100/2020-09-24 10/2020-09-24 15/2020-09-24 20/2020-09-24 10/2020-09-24 10/2020-09-24 5/2020-09-24 10/2020-09-24 20/2020-09-24 15/2020-09-24 10/2020-09-24 5/2020-09-24 20/2020-09-24 5/2020-09-24 10/2020-09-24 5/2020-09-24 250/2020-09-24 50/2020-09-24 10/2020-09-24 20/2020-09-24 20/2020-09-24 20/2020-09-24 20/2020-09-24 50/2020-09-24 20/2020-09-24 20/2020-09-24 20/2020-09-24 20/2020-09-24 5/2020-09-24 50/2020-09-24 20/2020-09-24 10/2020-09-24 30/2020-09-24 10/2020-09-24 10/2020-09-24 5/2020-09-24 25/2020-09-24 20/2020-09-24 20/2020-09-24 20/2020-09-24 10/2020-09-24 20/2020-09-24 10/2020-09-24 50/2020-09-24 20/2020-09-24 20/2020-09-24 10/2020-09-24 50/2020-09-24 5/2020-09-24 50/2020-09-24 21/2020-09-24 20/2020-09-24 5/2020-09-24 20/2020-09-24 25/2020-09-24 10/2020-09-24 10/2020-09-24 5/2020-09-24 5/2020-09-24 20/2020-09-24 5/2020-09-24 10/2020-09-24 10/2020-09-24 5/2020-09-24 50/2020-09-24 40/2020-09-24 50/2020-09-24 100/2020-09-24 5/2020-09-24 20/2020-09-24 25/2020-09-24 20/2020-09-24 5/2020-09-24 10/2020-09-24 20/2020-09-24 10/2020-09-24 40/2020-09-24 10/2020-09-24 5/2020-09-24 10/2020-09-24 15/2020-09-24 20/2020-09-24 10/2020-09-24 500/2020-09-24 20/2020-09-24 30/2020-09-24 5/2020-09-24 20/2020-09-24 15/2020-09-24 10/2020-09-24 10/2020-09-24 5/2020-09-24 50/2020-09-24 15/2020-09-24 25/2020-09-24 5/2020-09-24 8/2020-09-24 100/2020-09-24 30/2020-09-24 20/2020-09-24 40/2020-09-24 10/2020-09-24 20/2020-09-24 10/2020-09-24 20/2020-09-24 10/2020-09-24 50/2020-09-24 20/2020-09-24 20/2020-09-24 19/2020-09-24 50/2020-09-24 15/2020-09-24 5/2020-09-24 5/2020-09-24 20/2020-09-24 10/2020-09-24 10/2020-09-24 25/2020-09-24 5/2020-09-24 10/2020-09-24 20/2020-09-24 50/2020-09-24 20/2020-09-24 10/2020-09-24 10/2020-09-24 20/2020-09-24 10/2020-09-24 100/2020-09-24 10/2020-09-24 50/2020-09-24 10/2020-09-24 15/2020-09-24 20/2020-09-24 10/2020-09-24 5/2020-09-24 20/2020-09-24 250/2020-09-24 10/2020-09-24 20/2020-09-24 10/2020-09-24 5/2020-09-24 150/2020-09-24 50/2020-09-24 91/2020-09-24 100/2020-09-24 50/2020-09-24 40/2020-09-24 20/2020-09-24 200/2020-09-24 20/2020-09-24 10/2020-09-24 5/2020-09-24 10/2020-09-24 30/2020-09-24 5/2020-09-24 10/2020-09-24 100/2020-09-24 10/2020-09-24 20/2020-09-24 200/2020-09-24 10/2020-09-24 5/2020-09-24 20/2020-09-24 30/2020-09-24 100/2020-09-24 50/2020-09-24 20/2020-09-24 5/2020-09-24 10/2020-09-24 5/2020-09-24 15/2020-09-24 10/2020-09-24 7/2020-09-24 15/2020-09-24 20/2020-09-24 10/2020-09-24 20/2020-09-24 50/2020-09-24 20/2020-09-24 20/2020-09-24 5/2020-09-24 20/2020-09-24 100/2020-09-24 20/2020-09-24 5/2020-09-24 10/2020-09-24 10/2020-09-24 10/2020-09-24 5/2020-09-24 10/2020-09-24 9/2020-09-24 20/2020-09-24 5/2020-09-24 30/2020-09-24 9/2020-09-24 10/2020-09-24 10/2020-09-24 10/2020-09-24 5/2020-09-24 20/2020-09-24 10/2020-09-24 10/2020-09-24 50/2020-09-24 10/2020-09-24 10/2020-09-24 20/2020-09-24 10/2020-09-24 10/2020-09-24 10/2020-09-24 25/2020-09-24 10/2020-09-24 50/2020-09-24 5/2020-09-24 10/2020-09-24 10/2020-09-24 5/2020-09-24 15/2020-09-24 10/2020-09-24 10/2020-09-24 10/2020-09-24 10/2020-09-24 25/2020-09-24 20/2020-09-24 20/2020-09-24 30/2020-09-24 20/2020-09-24 20/2020-09-24 50/2020-09-24 10/2020-09-24 25/2020-09-24 250/2020-09-24 20/2020-09-24 5/2020-09-24 20/2020-09-24 5/2020-09-24 50/2020-09-24 50/2020-09-24 10/2020-09-24 25/2020-09-24 10/2020-09-24 15/2020-09-24 10/2020-09-24 10/2020-09-24 20/2020-09-24 25/2020-09-24 12/2020-09-24 25/2020-09-24 10/2020-09-24 10/2020-09-24 5/2020-09-24 20/2020-09-24 10/2020-09-24 25/2020-09-24 10/2020-09-24 10/2020-09-24 10/2020-09-24 10/2020-09-24 10/2020-09-24 20/2020-09-24 10/2020-09-24 10/2020-09-24 15/2020-09-24 10/2020-09-24 10/2020-09-24 5/2020-09-24 5/2020-09-24 25/2020-09-24 30/2020-09-24 20/2020-09-24 20/2020-09-24 100/2020-09-24 10/2020-09-24 10/2020-09-24 10/2020-09-24 25/2020-09-24 30/2020-09-24 5/2020-09-24 5/2020-09-24 20/2020-09-24 10/2020-09-24 20/2020-09-24 10/2020-09-24 150/2020-09-24 5/2020-09-24 100/2020-09-24 10/2020-09-24 10/2020-09-24 10/2020-09-24 10/2020-09-24 20/2020-09-24 5/2020-09-24 10/2020-09-24 5/2020-09-24 5/2020-09-24 5/2020-09-24 20/2020-09-24 5/2020-09-24 5/2020-09-24 20/2020-09-24 20/2020-09-24 100/2020-09-24 20/2020-09-24 20/2020-09-24 9/2020-09-24 5/2020-09-24 125/2020-09-24 10/2020-09-24 10/2020-09-24 50/2020-09-24 25/2020-09-24 10/2020-09-24 50/2020-09-24 10/2020-09-24 20/2020-09-24 15/2020-09-24 20/2020-09-24 10/2020-09-24 50/2020-09-24 10/2020-09-24 5/2020-09-24 5/2020-09-24 10/2020-09-24 25/2020-09-24 10/2020-09-24 15/2020-09-24 10/2020-09-24 100/2020-09-24 50/2020-09-24 50/2020-09-24 5/2020-09-24 10/2020-09-24 10/2020-09-24 10/2020-09-24 20/2020-09-24 25/2020-09-24 50/2020-09-24 20/2020-09-24 15/2020-09-24 23/2020-09-24 5/2020-09-24 10/2020-09-24 100/2020-09-24 10/2020-09-24 5/2020-09-24 100/2020-09-24 5/2020-09-24 10/2020-09-24 20/2020-09-24 25/2020-09-24 50/2020-09-24 10/2020-09-24 20/2020-09-24 5/2020-09-24 20/2020-09-24 20/2020-09-24 25/2020-09-24 50/2020-09-24 25/2020-09-24 10/2020-09-24 50/2020-09-24 15/2020-09-24 100/2020-09-24 5/2020-09-24 25/2020-09-24 20/2020-09-24 10/2020-09-24 30/2020-09-24 50/2020-09-24 10/2020-09-24 5/2020-09-24 10/2020-09-24 10/2020-09-24 20/2020-09-24 17/2020-09-24 10/2020-09-24 20/2020-09-24 10/2020-09-24 5/2020-09-24 5/2020-09-24 20/2020-09-24 20/2020-09-24 10/2020-09-24 20/2020-09-24 20/2020-09-24 10/2020-09-24 20/2020-09-24 10/2020-09-24 10/2020-09-24 20/2020-09-24 10/2020-09-24 10/2020-09-24 20/2020-09-24 90/2020-09-24 30/2020-09-24 20/2020-09-24 20/2020-09-24 20/2020-09-24 15/2020-09-24 5/2020-09-24 25/2020-09-24 25/2020-09-24 20/2020-09-24 10/2020-09-24 10/2020-09-24 100/2020-09-24 15/2020-09-24 10/2020-09-24 5/2020-09-24 10/2020-09-24 20/2020-09-24 100/2020-09-24 5/2020-09-24 20/2020-09-24 15/2020-09-24 10/2020-09-24 100/2020-09-24 10/2020-09-24 10/2020-09-24 10/2020-09-24 10/2020-09-24 50/2020-09-24 25/2020-09-24 10/2020-09-24 5/2020-09-24 20/2020-09-24 10/2020-09-24 10/2020-09-24 10/2020-09-24 5/2020-09-24 20/2020-09-24 30/2020-09-24 5/2020-09-24 250/2020-09-24 5/2020-09-24 25/2020-09-24 50/2020-09-24 10/2020-09-24 10/2020-09-24 100/2020-09-24 10/2020-09-24 10/2020-09-24 30/2020-09-24 10/2020-09-24 10/2020-09-24 10/2020-09-24 40/2020-09-24 50/2020-09-24 10/2020-09-24 10/2020-09-24 10/2020-09-24 25/2020-09-24 10/2020-09-24 10/2020-09-24 10/2020-09-24 5/2020-09-24 20/2020-09-24 20/2020-09-24 10/2020-09-24 50/2020-09-24 15/2020-09-24 10/2020-09-24 20/2020-09-24 20/2020-09-24 10/2020-09-24 20/2020-09-24 5/2020-09-24 10/2020-09-24 50/2020-09-24 10/2020-09-24 10/2020-09-24 20/2020-09-24 30/2020-09-24 20/2020-09-24 90/2020-09-24 50/2020-09-24 45/2020-09-24 50/2020-09-24 15/2020-09-24 20/2020-09-24 50/2020-09-24 45/2020-09-24 20/2020-09-24 50/2020-09-24 5/2020-09-24 25/2020-09-24 5/2020-09-24 20/2020-09-24 20/2020-09-24 10/2020-09-24 5/2020-09-24 300/2020-09-24 30/2020-09-24 5/2020-09-24 10/2020-09-24 10/2020-09-24 10/2020-09-24 50/2020-09-24 50/2020-09-24 20/2020-09-24 38/2020-09-24 20/2020-09-24 20/2020-09-24 50/2020-09-24 10/2020-09-24 40/2020-09-24 10/2020-09-24 5/2020-09-24 5/2020-09-24 10/2020-09-24 10/2020-09-24 10/2020-09-24 51/2020-09-24 10/2020-09-24 20/2020-09-24 50/2020-09-24 10/2020-09-24 15/2020-09-24 25/2020-09-24 12/2020-09-24 10/2020-09-24 5/2020-09-23 50/2020-09-21 100/2020-09-21 50/2020-09-21 50/2020-09-21 100/2020-09-21 10/2020-09-21 9/2020-09-21 15/2020-09-21 5/2020-09-21 10/2020-09-21 15/2020-09-20 10/2020-09-20 5/2020-09-20 10/2020-09-20 10/2020-09-20 10/2020-09-20 10/2020-09-20 5/2020-09-20 5/2020-09-20 10/2020-09-20 10/2020-09-20 30/2020-09-20 5/2020-09-20 10/2020-09-20 10/2020-09-20 5/2020-09-20 5/2020-09-20 40/2020-09-20 20/2020-09-20 5/2020-09-20 20/2020-09-20 20/2020-09-20 10/2020-09-20 10/2020-09-20 10/2020-09-20 10/2020-09-20 20/2020-09-20 10/2020-09-19 10/2020-09-19 20/2020-09-19 10/2020-09-19 15/2020-09-19 100/2020-09-19 10/2020-09-19 10/2020-09-19 10/2020-09-19 10/2020-09-19 20/2020-09-19 20/2020-09-19 20/2020-09-19 30/2020-09-19 100/2020-09-19 100/2020-09-18 20/2020-09-17 10/2020-09-17 10/2020-09-17 50/2020-09-15 5/2020-09-15 20/2020-09-15 10/2020-09-15 10/2020-09-15 10/2020-09-15 20/2020-09-15 50/2020-09-14 10/2020-09-14 5/2020-09-14 5/2020-09-14 20/2020-09-14 20/2020-09-14 100/2020-09-14 20/2020-09-14 5/2020-09-14 25/2020-09-14 10/2020-09-14 50/2020-09-14 10/2020-09-14 10/2020-09-14 100/2020-09-14 50/2020-09-14 15/2020-09-14 30/2020-09-14 10/2020-09-14 10/2020-09-14 20/2020-09-14 5/2020-09-14 20/2020-09-14 20/2020-09-14 25/2020-09-14 10/2020-09-14 10/2020-09-14 75/2020-09-14 40/2020-09-14 25/2020-09-14 25/2020-09-14 10/2020-09-14 20/2020-09-14 40/2020-09-14 20/2020-09-14 20/2020-09-14 5/2020-09-14 20/2020-09-14 10/2020-09-14 10/2020-09-14 100/2020-09-14 10/2020-09-14 20","Hi there  this is Andy and my daughter Pema. Pema is now 10 months old  when she was born  the mother texted me from the hospital saying she’s giving her up for adoption without consulting me.  I then went through social service and claimed her back. During the parental assessment I brought up an issue that I’m on zero hour contract teaching violin for local council music program and covid 19 means all of my concerts and gigs are cancelled.  The social workers have been reassuring me that I will get help from the government  but the financial support is based on calculations and seems to ignore the fact that I have no income when there’s no school.   I’m quite desperate now because all the schools are in the settling period meaning they won’t start music or instrumental lessons until October.   I always get paid for September at the   end of October. With no work in September  there is no pay in October. Works I do in October will pay at the end of November. It’s only mid September and I can’tsurvive until the end of November.  In October I will have to start taking my daughter to child minder  and I have to payahead. I just can’t hold out that long. And I have a lot of debt also since lockdown started(from friends and credit card) I am staying at the homeless hostel room so we are ok for accommodation now but universal credit won’t pay me this month because I received self employed grant in August but that’s only £500.  I will be super grateful if you can help.   I also have been visiting food bank and soif you can contribute to nappy and formula cost  that will be great.  best wishes   Andy ",False
" Tam Tam the Piping Bam, one-fifth to charities ","Broxburn, Scotland, United Kingdom",https://uk.gofundme.com/f/tam-tam-the-piping-bam-min-1-fifth-to-charities,1000,1103,2021-04-30,2020-05-21,,,49,"2021-04-30 40/2021-04-29 50/2021-04-18 25/2021-04-03 50/2021-04-01 45/2021-03-17 25/2021-03-15 30/2021-02-09 25/2020-12-21 50/2020-11-22 40/2020-11-07 40/2020-10-30 40/2020-10-09 20/2020-09-17 5/2020-09-17 20/2020-09-16 5/2020-09-10 20/2020-09-04 10/2020-08-22 20/2020-07-28 70/2020-07-21 20/2020-07-09 13/2020-06-27 40/2020-06-14 10/2020-06-13 20/2020-06-12 20/2020-06-11 20/2020-06-08 30/2020-06-05 20/2020-06-05 25/2020-06-05 25/2020-06-04 15/2020-06-03 20/2020-05-30 15/2020-05-30 5/2020-05-29 50/2020-05-28 10/2020-05-27 10/2020-05-24 10/2020-05-24 10/2020-05-23 10/2020-05-23 10/2020-05-23 5/2020-05-23 10/2020-05-23 10/2020-05-23 10/2020-05-23 10/2020-05-22 10/2020-05-22 10","This fundraiser is primarily for anyone who wishes to reward me for my efforts to raise morale by bagpiping round every part of Broxburn and Uphall and the district since 20 March 2020. Twenty percent of all donations goes to local charities named here from time to time. So far we have been giving to the vulnerable families charity Home-Start West Lothian  to WL Food Bank  Bipolar Scotland (Bathgate)  and Enable Scotland (Crofthead  Livingston  in memoriam Philip Fleming)  Broxburn and Uphall Community Website  Almond Valley Heritage Trust  Uphall Community Education Centre Association....     A pipe-walking roadmap  With the Scottish Government relaxation of lockdown guidelines on 28 May I began gradually reducing the frequency and extent of my pipe-walking  concentrating on the main or bigger streets. I had a quiet autumn and even quieter winter  but as of early April 2021 I am getting active again. I plan to continue as last year  but much less intensively. Please keep requests coming for any special events and occasions you may have. For children and the elderly  ill or vulnerable  the level of modest donations I suggest is significantly lower than for others.    And if you know your history....   On 28.3.20  I picked up my oft idle bagpipes and started wandering rather cluelessly round Broxburn and Uphall playing them. I had realised that as a semi-retired person I was pretty much 'alright Jack' under lockdown and wondered if I could do anything to help others. My first idea  on 20 May  had been to go to NHS Strathbrock and play for the amusement of staff and patients. That day I also put my busking hat down with a sign saying ""all proceeds to...."" After securing permission from the police  I decided to put the hat back on my head and start my ""pipe-walks"" around Kirkhill and West End  intending to return to the Strathbrock  of course  and at least three facilities for older residents near me. Soon I was getting more than one request on average per day  from all over B&U and beyond....     Thank you  t.... y..  t.... y..  +1 ⚓☀️   I have been so astonished and moved by the huge warm response everywhere I've walked and played in the months since. Many people were soon wanting to give me money in return for my effort to cheer them up and relieve boredom  and when I refused all payment some suggested I should start some kind of fundraiser. Enter Kelly - thank you. I'm already adding to and improving my musical equipment and piper's costume. If it is welcomed by you  B&U  this new GoFundMe will continue that  compensate me for lost busking earnings during lockdown  while giving 20% to charity.",False
" Go With The Flow: Year Four ","London, Greater London, United Kingdom",https://uk.gofundme.com/f/galsgowiththeflow,1500,1047,2021-04-29,2016-09-19,,,70,"2021-04-29 20/2021-04-29 7/2021-04-15 12/2021-04-11 28/2021-03-10 12/2021-02-18 10/2021-02-15 12/2021-02-11 20/2021-02-10 20/2020-12-17 20/2019-06-10 10/2018-09-21 30/2018-09-04 30/2018-05-28 5/2018-04-26 5/2018-02-06 20/2017-12-31 50/2017-12-29 24/2017-12-29 12/2017-12-04 12/2017-12-02 15/2017-11-28 12/2017-11-28 12/2017-11-28 12/2017-11-28 20/2017-11-26 24/2017-11-26 20/2017-11-26 12/2017-11-26 12/2017-11-26 12/2017-11-26 10/2017-11-26 12/2017-07-21 18/2017-06-16 10/2017-06-15 10/2017-05-06 20/2017-05-01 40/2017-04-06 5/2017-04-05 5/2017-03-28 20/2017-03-08 10/2017-03-01 35/2017-01-27 10/2017-01-09 5/2017-01-05 20/2017-01-05 20/2017-01-05 24/2017-01-05 12/2017-01-04 12/2017-01-04 20/2017-01-04 10/2017-01-04 10/2016-12-28 5/2016-12-28 20/2016-12-01 10/2016-10-23 10/2016-10-23 10/2016-10-22 20/2016-10-22 20/2016-10-17 10/2016-10-17 5/2016-10-16 12/2016-10-07 10/2016-09-30 12/2016-09-28 10/2016-09-28 5/2016-09-21 10/2016-09-20 5/2016-09-20 5/2016-09-19 20","I create and distribute 28 period packs filled with menstrual products to Lewisham food bank every month.     I’ve calculated that for less than a £1  I can supply 7 sanitary pads  2 panty liners  7 tampons (applicator + non-applicator) and a chocolate bar for people in need of them.     Menstrual products aren’t a luxury; they are essential to well-being  hygiene and happiness  which many of us take for granted. Go With The Flow believes that periods are everyone's problem (humankind wouldn’t exist without them!) and so I also call upon the boys to donate too.     Go on  it’s bloody important!",False
" South Queensferry 3D Printing Collective ","South Queensferry, Scotland, United Kingdom",https://uk.gofundme.com/f/south-queensferry-3d-printing-collective,300,8504,2020-09-14,2020-03-30,,,280,"2020-09-14 5/2020-07-27 30/2020-07-14 30/2020-07-09 50/2020-07-01 5/2020-06-27 10/2020-06-25 10/2020-06-25 10/2020-06-18 5/2020-06-17 20/2020-06-07 30/2020-06-06 30/2020-06-05 50/2020-06-05 50/2020-06-04 45/2020-06-03 20/2020-05-28 100/2020-05-28 30/2020-05-27 10/2020-05-22 50/2020-05-20 20/2020-05-18 50/2020-05-16 50/2020-05-16 20/2020-05-14 60/2020-05-14 100/2020-05-13 60/2020-05-13 10/2020-05-13 10/2020-05-13 19/2020-05-12 20/2020-05-12 20/2020-05-12 10/2020-05-11 20/2020-05-11 50/2020-05-10 20/2020-05-09 20/2020-05-08 20/2020-05-08 16/2020-05-08 100/2020-05-07 20/2020-05-07 20/2020-05-06 100/2020-05-06 40/2020-05-05 30/2020-05-05 10/2020-05-04 15/2020-05-04 30/2020-05-04 20/2020-05-03 20/2020-05-01 250/2020-05-01 30/2020-05-01 10/2020-04-30 10/2020-04-29 10/2020-04-29 30/2020-04-29 50/2020-04-28 20/2020-04-27 20/2020-04-26 30/2020-04-26 10/2020-04-26 40/2020-04-26 100/2020-04-25 45/2020-04-23 20/2020-04-23 40/2020-04-23 50/2020-04-23 30/2020-04-23 30/2020-04-23 20/2020-04-22 40/2020-04-21 200/2020-04-21 160/2020-04-21 18/2020-04-20 60/2020-04-19 20/2020-04-18 50/2020-04-17 20/2020-04-17 200/2020-04-17 400/2020-04-17 20/2020-04-17 15/2020-04-17 70/2020-04-17 50/2020-04-17 10/2020-04-16 10/2020-04-16 15/2020-04-16 100/2020-04-15 100/2020-04-15 20/2020-04-15 40/2020-04-15 10/2020-04-15 25/2020-04-15 20/2020-04-14 5/2020-04-14 20/2020-04-14 15/2020-04-14 100/2020-04-13 30/2020-04-13 10/2020-04-13 10/2020-04-13 20/2020-04-13 90/2020-04-13 10/2020-04-13 25/2020-04-12 30/2020-04-12 10/2020-04-12 18/2020-04-12 5/2020-04-12 30/2020-04-11 30/2020-04-11 20/2020-04-11 10/2020-04-11 20/2020-04-11 15/2020-04-11 100/2020-04-11 120/2020-04-11 20/2020-04-11 30/2020-04-10 20/2020-04-10 15/2020-04-10 25/2020-04-10 25/2020-04-10 20/2020-04-09 20/2020-04-09 50/2020-04-09 5/2020-04-09 50/2020-04-09 50/2020-04-08 10/2020-04-08 25/2020-04-08 20/2020-04-08 50/2020-04-08 30/2020-04-08 10/2020-04-07 25/2020-04-07 30/2020-04-07 25/2020-04-06 22/2020-04-06 30/2020-04-06 30/2020-04-06 20/2020-04-06 25/2020-04-06 20/2020-04-06 20/2020-04-06 5/2020-04-05 20/2020-04-05 100/2020-04-05 5/2020-04-05 10/2020-04-05 20/2020-04-04 25/2020-04-04 5/2020-04-04 10/2020-04-04 20/2020-04-04 10/2020-04-04 50/2020-04-04 10/2020-04-04 50/2020-04-04 15/2020-04-04 10/2020-04-03 25/2020-04-03 30/2020-04-03 20/2020-04-03 50/2020-04-03 20/2020-04-02 25/2020-04-02 50/2020-04-02 50/2020-04-02 10/2020-04-02 20/2020-04-02 50/2020-04-02 200/2020-04-02 50/2020-04-02 50/2020-04-02 5/2020-04-02 25/2020-04-01 50/2020-04-01 30/2020-04-01 20/2020-04-01 10/2020-04-01 10/2020-04-01 10/2020-04-01 200/2020-04-01 5/2020-03-31 20/2020-03-31 20/2020-03-31 10/2020-03-31 30/2020-03-31 10/2020-03-31 15/2020-03-31 20/2020-03-31 10/2020-03-31 5/2020-03-31 10/2020-03-31 10/2020-03-31 100/2020-03-31 10/2020-03-31 10/2020-03-31 20/2020-03-31 10/2020-03-31 10/2020-03-31 25/2020-03-31 20/2020-03-31 10/2020-03-31 20/2020-03-30 10/2020-03-30 9/2020-03-30 20/2020-03-30 15/2020-03-30 20/2020-03-30 10/2020-03-30 10/2020-03-30 10/2020-03-30 5/2020-03-30 10/2020-03-30 20/2020-03-30 10/2020-03-30 20/2020-03-30 30/2020-03-30 10/2020-03-30 30/2020-03-30 20/2020-03-30 10/2020-03-30 8/2020-03-30 20/2020-03-30 20/2020-03-30 15/2020-03-30 15/2020-03-30 10/2020-03-30 5/2020-03-30 20/2020-03-30 10/2020-03-30 10/2020-03-30 20/2020-03-30 15/2020-03-30 15/2020-03-30 10/2020-03-30 10/2020-03-30 50/2020-03-30 50/2020-03-30 10/2020-03-30 10/2020-03-30 20/2020-03-30 20/2020-03-30 10/2020-03-30 10/2020-03-30 20/2020-03-30 9/2020-03-30 20/2020-03-30 20/2020-03-30 10/2020-03-30 20/2020-03-30 20/2020-03-30 11/2020-03-30 9/2020-03-30 10/2020-03-30 10/2020-03-30 11/2020-03-30 5/2020-03-30 10/2020-03-30 10/2020-03-30 20/2020-03-30 10/2020-03-30 50/2020-03-30 10/2020-03-30 25/2020-03-30 40/2020-03-30 10/2020-03-30 10/2020-03-30 20/2020-03-30 10/2020-03-30 20/2020-03-30 15/2020-03-30 10/2020-03-30 10/2020-03-30 10/2020-03-30 20/2020-03-30 10/2020-03-30 9","Help us keep them safe  so they can keep us safe.     We are using our 3D printers to produce face shields  which we are distributing to local health-care workers  nurses  care homes  pharmacists  and others who need them. The demand has been overwhelming  as has the offers of help. These workers are putting their health and even their lives at risk in order to keep South Queensferry healthy  so we are doing what we can to support them with 3D printing technology.     We are currently running three printers. The masks take just under an hour each to print. So we are trying to raise funds in order to purchase a fourth printer  (likely an Ender 3  or a CR-10)  which will enable us to make far more masks  and help far more people.     The money will also be used to buy supplies as needed  more PVC sheets  more filament  or more elastics. We will also support anyone else in the community who has a printer  and wants to join our team.     Once this crisis has passed  and it *will* pass  we will be donating the printer and any left over supplies to the local high school. There it will be used to teach a new generation on how to use this technology  so that next crisis we will be even more prepared to help. Any leftover money will be donated to the food bank.     3D printing has  all around the world  proven to be vital during this epidemic. There are ER rooms in Spain  midwives in the Philippines  nurses in Sweden  all using 3D printed face shields  when no other protection is available. Thank you for helping us with this revolution.",False
