Title,Location,Link,Raised,Target,MostRecentDonation,Created,Organization,OrganizationDetails,DonationCount,Donations,Description,Complete
" Free Meals, Full Hearts - Reading ","Earley, South East England, United Kingdom",https://uk.gofundme.com/f/free-meals-full-hearts-reading,7000,5100,2021-05-01,2020-11-16,,,170,"2021-05-01 25/2021-04-30 8/2021-04-30 40/2021-04-30 25/2021-04-28 5/2021-04-28 30/2021-04-28 5/2021-04-28 30/2021-04-28 30/2021-04-28 10/2021-04-28 20/2021-04-28 20/2021-04-28 50/2021-04-28 10/2021-04-21 40/2021-04-20 50/2021-04-18 30/2021-04-18 50/2021-04-17 20/2021-04-17 30/2021-04-17 20/2021-04-17 20/2021-04-17 20/2021-04-17 20/2021-04-17 50/2021-04-17 30/2021-04-17 40/2021-04-17 50/2021-04-17 30/2021-04-17 10/2021-04-17 20/2021-04-17 10/2021-04-17 20/2021-04-14 15/2021-04-13 15/2021-04-07 50/2021-04-07 50/2021-04-06 25/2021-04-05 20/2021-04-05 10/2021-04-05 10/2021-03-28 50/2021-03-27 30/2021-03-27 30/2021-03-27 20/2021-03-27 20/2021-03-26 20/2021-03-26 20/2021-03-24 200/2021-03-20 10/2021-03-19 15/2021-03-19 15/2021-03-15 100/2021-03-14 10/2021-03-14 20/2021-03-14 20/2021-03-14 10/2021-03-13 10/2021-03-13 150/2021-03-13 10/2021-03-13 30/2021-03-13 25/2021-03-13 10/2021-03-13 10/2021-03-13 5/2021-03-13 50/2021-03-12 25/2021-03-12 10/2021-03-12 10/2021-03-12 10/2021-03-12 10/2021-03-12 10/2021-03-12 20/2021-03-12 10/2021-03-12 50/2021-03-12 5/2021-03-12 10/2021-03-12 10/2021-03-12 10/2021-03-12 27/2021-03-12 20/2021-03-12 30/2021-03-12 50/2021-03-12 100/2021-03-12 15/2021-03-12 10/2021-03-12 20/2021-03-12 10/2021-03-12 20/2021-03-12 10/2021-03-12 20/2021-03-12 10/2021-03-12 10/2021-03-12 30/2021-03-12 50/2021-03-12 10/2021-03-05 50/2021-03-03 50/2021-03-03 10/2021-03-03 25/2021-03-03 25/2021-03-03 10/2021-03-03 50/2021-03-01 15/2021-02-27 50/2021-02-27 25/2021-02-26 40/2021-02-26 50/2021-02-26 10/2021-02-26 10/2021-02-26 25/2021-02-26 25/2021-02-26 10/2021-02-26 10/2021-02-25 25/2021-02-25 30/2021-02-25 5/2021-02-25 20/2021-02-25 20/2021-02-25 30/2021-02-25 90/2021-02-25 20/2021-02-25 30/2021-02-19 30/2021-02-17 30/2021-02-11 10/2021-02-09 10/2021-02-05 500/2021-02-03 10/2021-02-02 10/2021-02-02 30/2021-02-01 100/2021-02-01 10/2021-01-30 20/2021-01-30 20/2021-01-30 15/2021-01-29 10/2021-01-27 100/2021-01-23 15/2021-01-20 10/2021-01-20 10/2021-01-19 10/2021-01-19 50/2021-01-19 25/2021-01-19 10/2021-01-19 25/2021-01-19 28/2021-01-19 20/2021-01-14 30/2021-01-08 15/2021-01-07 50/2021-01-06 25/2021-01-06 50/2021-01-04 20/2020-12-24 20/2020-12-23 50/2020-12-23 50/2020-12-23 10/2020-12-22 10/2020-12-22 20/2020-12-22 50/2020-12-21 10/2020-12-21 25/2020-12-21 30/2020-12-21 15/2020-12-21 30/2020-11-26 50/2020-11-26 20/2020-11-17 17/2020-11-16 50","FREE MEAL  FULL HEARTS - Reading    I started Free Meals  Full Hearts in October and thanks for my team of reps  we have helped 100s of families who may have ordinarily gone hungry  invariably due to lack of confidence to reach out ask for help or they are too embarrassed go to a food bank.    Free Meals  Full Hearts is designed to bridge that gap and ensure that if your situations changes quickly  or you just need a little help - we're here for you. Anonymously.    I have heard some truly eye opening stories since creating this charitable group - everything from families only eating one meal a day and a couple who hadn't had a hot meal in days to another family who had literally only eaten canned beans and hoops for 10 days solidly because their weekly food budget was £9 to feed 5. It really does put life in perspective.    No-one in our community should go hungry. Ever.    The Reading community has shown time and time again that when faced with challenges or adversities  we come together. The camaraderie  generosity and positivity around us every day is overwhelming.    Feeding yourself and your family is a basic but essential human necessity but unfortunately far too many people in the Reading area are skipping meals and going hungry because they simply can't afford to eat. I can only imagine this must be particularly heartbreaking if you're a parent who is unable to feed your children. As momentum has increased and more and more people have heard about Free Meals  Full Hearts and we occasionally find ourselves struggling to help due to lack of physical food donations. When this happens  I either dip into the reserve pot or sometimes  out of my own pocket i'll buy emergency food shops for families (between £30-£50 per week depending on the size of the family). I have also ordered last minute takeaways for families and bought other essential items such as medical prescriptions and personal hygiene and cleaning products    'Free Meal  Full Hearts' is a anonymous platform where people (single  couples or families) can reach out and ask for food should they need to  without judgement.    If you are able to help  please do. It's massively appreciated - not just by me  but by every family who are committed to helping    Thank You    Newpaper Article",False
" 1 Million Steps In April ","Rhyl, Wales, United Kingdom",https://uk.gofundme.com/f/raising-funds-for-the-rhyl-royal-british-legion,1000,1762,2021-05-02,2021-02-25,,,82,"2021-05-02 35/2021-05-02 100/2021-05-01 5/2021-05-01 20/2021-04-30 50/2021-04-30 25/2021-04-30 5/2021-04-30 20/2021-04-30 10/2021-04-30 20/2021-04-30 20/2021-04-30 25/2021-04-30 10/2021-04-30 20/2021-04-30 250/2021-04-29 12/2021-04-25 100/2021-04-25 20/2021-04-24 10/2021-04-24 5/2021-04-24 100/2021-04-24 20/2021-04-22 10/2021-04-22 10/2021-04-21 25/2021-04-20 5/2021-04-20 23/2021-04-20 15/2021-04-16 10/2021-04-16 10/2021-04-16 20/2021-04-11 10/2021-04-10 30/2021-04-10 5/2021-04-10 5/2021-04-10 20/2021-04-09 5/2021-04-09 5/2021-04-09 10/2021-04-08 8/2021-04-08 7/2021-04-08 5/2021-04-08 20/2021-04-04 10/2021-04-04 9/2021-04-03 20/2021-04-02 5/2021-04-01 25/2021-04-01 5/2021-04-01 20/2021-04-01 10/2021-03-31 5/2021-03-31 10/2021-03-31 5/2021-03-31 15/2021-03-31 25/2021-03-30 10/2021-03-29 20/2021-03-29 5/2021-03-28 25/2021-03-28 10/2021-03-28 20/2021-03-28 5/2021-03-28 5/2021-03-28 5/2021-03-28 20/2021-03-27 10/2021-03-26 5/2021-03-25 10/2021-03-23 10/2021-03-20 5/2021-03-18 10/2021-03-18 25/2021-03-13 28/2021-03-13 10/2021-03-13 115/2021-03-13 10/2021-03-12 10/2021-03-10 25/2021-03-04 25/2021-03-03 25/2021-02-26 10","I'm raising money for five Rhyl charities that help the local community.  The Rhyl RBL  Rhyl RNLI Brighter Futures Osborne trust  Rhyl food bank.  I will walk/run 1 million steps  over 500 miles with an incline if over 38 000 feet which is higher than mount Everest. ",False
" HELP FOODBANKS FEED PEOPLE DURING CORONAVIRUS ","Southend-on-Sea, East of England, United Kingdom",https://uk.gofundme.com/f/help-foodbanks-feed-people-during-coronavirus,10000,87424,2021-02-17,2020-03-16,"The Trussell Trust","Registered charityDonations eligible for Gift Aid.",1000,"2021-02-17 5/2021-01-30 10/2021-01-26 30/2021-01-15 10/2021-01-13 15/2020-12-21 200/2020-12-02 9/2020-11-18 15/2020-11-15 90/2020-10-31 30/2020-10-31 20/2020-10-27 100/2020-10-27 50/2020-10-27 10/2020-10-27 20/2020-10-27 20/2020-10-26 50/2020-10-26 15/2020-10-26 10/2020-10-26 15/2020-10-26 16/2020-10-26 10/2020-10-26 10/2020-10-26 20/2020-10-26 25/2020-10-26 10/2020-10-26 7/2020-10-26 10/2020-10-26 25/2020-10-26 20/2020-10-26 15/2020-10-26 50/2020-10-26 50/2020-10-26 10/2020-10-26 10/2020-10-26 10/2020-10-26 50/2020-10-26 50/2020-10-26 20/2020-10-26 10/2020-10-26 20/2020-10-26 10/2020-10-26 20/2020-10-26 20/2020-10-26 10/2020-10-25 25/2020-10-25 10/2020-10-25 40/2020-10-25 20/2020-10-25 25/2020-10-25 10/2020-10-25 10/2020-10-25 10/2020-10-25 25/2020-10-25 20/2020-10-25 10/2020-10-25 10/2020-10-25 20/2020-10-25 40/2020-10-25 20/2020-10-25 50/2020-10-25 20/2020-10-25 20/2020-10-25 5/2020-10-25 20/2020-10-25 25/2020-10-25 15/2020-10-25 40/2020-10-25 20/2020-10-25 5/2020-10-25 50/2020-10-25 10/2020-10-25 10/2020-10-25 20/2020-10-25 20/2020-10-25 20/2020-10-25 30/2020-10-25 20/2020-10-25 20/2020-10-25 20/2020-10-25 50/2020-10-25 25/2020-10-25 10/2020-10-25 10/2020-10-25 5/2020-10-25 10/2020-10-25 30/2020-10-25 10/2020-10-25 15/2020-10-25 15/2020-10-25 20/2020-10-25 10/2020-10-25 25/2020-10-25 10/2020-10-25 10/2020-10-25 10/2020-10-25 10/2020-10-25 30/2020-10-25 20/2020-10-25 15/2020-10-25 5/2020-10-25 100/2020-10-25 20/2020-10-25 30/2020-10-24 50/2020-10-24 15/2020-10-23 100/2020-10-22 50/2020-10-01 100/2020-09-29 30/2020-08-03 20/2020-07-21 40/2020-07-13 50/2020-07-11 20/2020-07-10 35/2020-07-06 50/2020-07-04 50/2020-06-29 50/2020-06-19 100/2020-06-17 20/2020-06-17 30/2020-06-16 30/2020-06-16 100/2020-06-14 40/2020-06-13 10/2020-06-12 200/2020-06-12 50/2020-06-12 20/2020-06-08 20/2020-06-08 50/2020-06-07 50/2020-06-06 20/2020-06-06 20/2020-06-03 10/2020-05-31 20/2020-05-23 100/2020-05-23 10/2020-05-23 100/2020-05-22 20/2020-05-21 20/2020-05-19 20/2020-05-19 10/2020-05-12 10/2020-05-12 40/2020-05-09 25/2020-05-09 10/2020-05-08 50/2020-05-07 10/2020-05-06 25/2020-05-06 20/2020-05-05 15/2020-05-05 20/2020-05-05 10/2020-05-05 10/2020-05-04 10/2020-05-04 200/2020-05-04 30/2020-05-03 5/2020-05-03 10/2020-05-03 10/2020-05-03 25/2020-05-03 30/2020-05-02 20/2020-05-02 10/2020-05-01 20/2020-05-01 100/2020-05-01 27/2020-05-01 9/2020-05-01 5/2020-04-30 25/2020-04-30 10/2020-04-30 50/2020-04-30 25/2020-04-29 25/2020-04-28 8/2020-04-27 20/2020-04-24 10/2020-04-24 10/2020-04-23 30/2020-04-23 30/2020-04-23 40/2020-04-23 5/2020-04-23 9/2020-04-22 30/2020-04-22 5/2020-04-22 100/2020-04-21 10/2020-04-21 20/2020-04-21 20/2020-04-21 100/2020-04-21 10/2020-04-21 20/2020-04-21 10/2020-04-21 20/2020-04-21 25/2020-04-21 10/2020-04-21 10/2020-04-21 30/2020-04-20 5/2020-04-20 25/2020-04-20 100/2020-04-19 5/2020-04-19 5/2020-04-19 5/2020-04-19 180/2020-04-18 100/2020-04-18 40/2020-04-18 15/2020-04-18 50/2020-04-18 20/2020-04-18 10/2020-04-18 20/2020-04-18 65/2020-04-18 5/2020-04-18 25/2020-04-17 10/2020-04-17 200/2020-04-17 25/2020-04-17 10/2020-04-17 50/2020-04-17 15/2020-04-17 50/2020-04-17 10/2020-04-17 50/2020-04-17 10/2020-04-16 50/2020-04-16 50/2020-04-16 5/2020-04-16 5/2020-04-16 5/2020-04-16 20/2020-04-16 20/2020-04-15 5/2020-04-15 20/2020-04-15 50/2020-04-14 100/2020-04-14 5/2020-04-14 5/2020-04-14 10/2020-04-14 15/2020-04-14 50/2020-04-13 50/2020-04-13 30/2020-04-13 40/2020-04-12 30/2020-04-12 30/2020-04-12 100/2020-04-12 11/2020-04-12 50/2020-04-12 30/2020-04-12 10/2020-04-11 10/2020-04-11 50/2020-04-11 20/2020-04-11 100/2020-04-11 6/2020-04-11 40/2020-04-11 20/2020-04-11 37/2020-04-11 5/2020-04-11 10/2020-04-11 50/2020-04-11 50/2020-04-11 60/2020-04-11 50/2020-04-11 30/2020-04-11 25/2020-04-11 50/2020-04-10 20/2020-04-10 30/2020-04-10 20/2020-04-09 50/2020-04-09 50/2020-04-09 50/2020-04-09 20/2020-04-09 5/2020-04-09 50/2020-04-09 100/2020-04-09 50/2020-04-09 10/2020-04-09 10/2020-04-09 50/2020-04-08 10/2020-04-08 100/2020-04-08 10/2020-04-08 30/2020-04-08 20/2020-04-08 100/2020-04-08 10/2020-04-08 50/2020-04-08 20/2020-04-07 25/2020-04-07 20/2020-04-07 20/2020-04-07 20/2020-04-07 25/2020-04-07 20/2020-04-07 30/2020-04-06 50/2020-04-06 25/2020-04-06 100/2020-04-06 25/2020-04-05 25/2020-04-05 10/2020-04-05 25/2020-04-05 15/2020-04-05 100/2020-04-04 5/2020-04-04 10/2020-04-04 100/2020-04-04 5/2020-04-04 100/2020-04-03 10/2020-04-03 10/2020-04-03 8/2020-04-03 50/2020-04-03 200/2020-04-03 150/2020-04-03 10/2020-04-03 100/2020-04-03 50/2020-04-03 15/2020-04-03 50/2020-04-03 100/2020-04-02 40/2020-04-02 20/2020-04-02 50/2020-04-02 10/2020-04-02 50/2020-04-02 100/2020-04-02 10/2020-04-02 10/2020-04-02 10/2020-04-01 30/2020-04-01 25/2020-04-01 30/2020-04-01 30/2020-04-01 50/2020-04-01 30/2020-04-01 50/2020-04-01 20/2020-04-01 20/2020-04-01 15/2020-03-31 10/2020-03-31 50/2020-03-31 30/2020-03-31 50/2020-03-31 20/2020-03-31 20/2020-03-31 20/2020-03-31 45/2020-03-31 50/2020-03-31 20/2020-03-31 35/2020-03-31 20/2020-03-31 20/2020-03-31 15/2020-03-31 50/2020-03-31 100/2020-03-31 10/2020-03-31 10/2020-03-31 10/2020-03-31 10/2020-03-31 25/2020-03-30 10/2020-03-30 10/2020-03-30 50/2020-03-30 100/2020-03-30 50/2020-03-30 20/2020-03-30 50/2020-03-30 25/2020-03-30 50/2020-03-29 100/2020-03-29 10/2020-03-29 10/2020-03-29 5/2020-03-29 30/2020-03-29 40/2020-03-29 10/2020-03-29 200/2020-03-29 5/2020-03-29 100/2020-03-29 7/2020-03-29 50/2020-03-29 10/2020-03-29 100/2020-03-28 20/2020-03-28 200/2020-03-28 20/2020-03-28 10/2020-03-28 5/2020-03-28 48/2020-03-28 10/2020-03-28 50/2020-03-28 10/2020-03-28 50/2020-03-28 20/2020-03-28 20/2020-03-28 20/2020-03-28 5/2020-03-27 20/2020-03-27 25/2020-03-27 50/2020-03-27 20/2020-03-27 8/2020-03-27 100/2020-03-27 50/2020-03-27 50/2020-03-27 85/2020-03-26 10/2020-03-26 5/2020-03-26 25/2020-03-26 20/2020-03-26 5/2020-03-26 50/2020-03-26 50/2020-03-26 60/2020-03-26 10/2020-03-26 20/2020-03-26 20/2020-03-26 20/2020-03-26 100/2020-03-25 10/2020-03-25 20/2020-03-25 20/2020-03-25 10/2020-03-25 20/2020-03-25 30/2020-03-25 30/2020-03-25 70/2020-03-25 5/2020-03-25 100/2020-03-25 30/2020-03-24 5/2020-03-24 20/2020-03-24 20/2020-03-24 5/2020-03-24 10/2020-03-24 30/2020-03-24 25/2020-03-24 20/2020-03-24 15/2020-03-24 10/2020-03-24 50/2020-03-24 20/2020-03-24 25/2020-03-24 30/2020-03-24 10/2020-03-23 5/2020-03-23 30/2020-03-23 20/2020-03-23 150/2020-03-23 10/2020-03-23 10/2020-03-23 50/2020-03-23 15/2020-03-23 10/2020-03-23 5/2020-03-23 20/2020-03-23 20/2020-03-23 20/2020-03-23 30/2020-03-23 50/2020-03-23 30/2020-03-23 50/2020-03-23 20/2020-03-23 20/2020-03-23 50/2020-03-23 20/2020-03-23 10/2020-03-23 25/2020-03-23 25/2020-03-22 50/2020-03-22 10/2020-03-22 50/2020-03-22 30/2020-03-22 5/2020-03-22 20/2020-03-22 30/2020-03-22 10/2020-03-22 30/2020-03-22 30/2020-03-22 25/2020-03-22 10/2020-03-22 30/2020-03-22 50/2020-03-22 150/2020-03-22 5/2020-03-22 5/2020-03-22 19/2020-03-22 30/2020-03-22 10/2020-03-22 100/2020-03-22 100/2020-03-22 20/2020-03-22 100/2020-03-22 100/2020-03-22 150/2020-03-22 100/2020-03-22 20/2020-03-22 50/2020-03-22 10/2020-03-22 20/2020-03-22 5/2020-03-22 50/2020-03-22 20/2020-03-22 20/2020-03-22 20/2020-03-22 10/2020-03-21 10/2020-03-21 50/2020-03-21 10/2020-03-21 20/2020-03-21 5/2020-03-21 10/2020-03-21 30/2020-03-21 10/2020-03-21 20/2020-03-21 10/2020-03-21 20/2020-03-21 10/2020-03-21 100/2020-03-21 30/2020-03-21 50/2020-03-21 10/2020-03-21 10/2020-03-21 20/2020-03-21 5/2020-03-21 21/2020-03-21 100/2020-03-21 5/2020-03-21 10/2020-03-21 10/2020-03-21 20/2020-03-21 10/2020-03-21 20/2020-03-21 10/2020-03-21 25/2020-03-21 17/2020-03-21 9/2020-03-21 10/2020-03-21 20/2020-03-21 25/2020-03-21 10/2020-03-21 20/2020-03-21 100/2020-03-21 20/2020-03-21 50/2020-03-21 10/2020-03-21 50/2020-03-21 30/2020-03-21 15/2020-03-21 50/2020-03-21 10/2020-03-21 30/2020-03-21 15/2020-03-21 5/2020-03-21 100/2020-03-21 10/2020-03-21 50/2020-03-21 100/2020-03-21 10/2020-03-21 20/2020-03-21 20/2020-03-21 665/2020-03-21 30/2020-03-21 20/2020-03-21 20/2020-03-21 10/2020-03-21 20/2020-03-21 20/2020-03-21 50/2020-03-21 25/2020-03-21 10/2020-03-21 20/2020-03-21 10/2020-03-21 25/2020-03-21 10/2020-03-21 50/2020-03-21 10/2020-03-21 10/2020-03-21 20/2020-03-21 5/2020-03-21 10/2020-03-21 10/2020-03-21 10/2020-03-21 10/2020-03-21 10/2020-03-21 50/2020-03-21 5/2020-03-21 10/2020-03-21 10/2020-03-21 10/2020-03-21 30/2020-03-21 30/2020-03-21 10/2020-03-21 10/2020-03-21 9/2020-03-21 15/2020-03-21 10/2020-03-20 10/2020-03-20 40/2020-03-20 20/2020-03-20 20/2020-03-20 5/2020-03-20 10/2020-03-20 300/2020-03-20 10/2020-03-20 100/2020-03-20 20/2020-03-20 10/2020-03-20 25/2020-03-20 25/2020-03-20 200/2020-03-20 25/2020-03-20 20/2020-03-20 20/2020-03-20 20/2020-03-20 50/2020-03-20 20/2020-03-20 100/2020-03-20 10/2020-03-20 50/2020-03-20 30/2020-03-20 25/2020-03-20 50/2020-03-20 50/2020-03-20 100/2020-03-20 10/2020-03-20 50/2020-03-20 10/2020-03-20 25/2020-03-20 50/2020-03-20 250/2020-03-20 20/2020-03-20 5/2020-03-20 20/2020-03-20 50/2020-03-20 20/2020-03-20 100/2020-03-20 10/2020-03-20 10/2020-03-20 10/2020-03-20 10/2020-03-20 5/2020-03-20 50/2020-03-20 13/2020-03-20 20/2020-03-20 10/2020-03-20 10/2020-03-20 10/2020-03-20 50/2020-03-20 5/2020-03-20 10/2020-03-20 20/2020-03-20 30/2020-03-20 5/2020-03-20 10/2020-03-20 10/2020-03-20 9/2020-03-20 20/2020-03-20 20/2020-03-20 10/2020-03-20 20/2020-03-20 20/2020-03-20 5/2020-03-20 20/2020-03-20 15/2020-03-20 10/2020-03-20 20/2020-03-20 50/2020-03-20 25/2020-03-20 30/2020-03-20 50/2020-03-20 100/2020-03-20 50/2020-03-20 100/2020-03-20 20/2020-03-20 20/2020-03-20 5/2020-03-20 10/2020-03-20 10/2020-03-20 50/2020-03-20 24/2020-03-20 50/2020-03-20 20/2020-03-20 40/2020-03-20 10/2020-03-20 50/2020-03-20 25/2020-03-20 10/2020-03-20 50/2020-03-20 50/2020-03-20 23/2020-03-20 10/2020-03-20 30/2020-03-20 25/2020-03-20 30/2020-03-20 50/2020-03-20 40/2020-03-20 100/2020-03-20 25/2020-03-20 20/2020-03-20 10/2020-03-20 20/2020-03-20 50/2020-03-20 100/2020-03-20 10/2020-03-20 100/2020-03-20 50/2020-03-20 100/2020-03-20 20/2020-03-20 10/2020-03-20 100/2020-03-20 20/2020-03-20 250/2020-03-20 10/2020-03-20 35/2020-03-20 10/2020-03-20 20/2020-03-20 500/2020-03-20 40/2020-03-20 30/2020-03-20 40/2020-03-20 20/2020-03-20 20/2020-03-20 20/2020-03-20 20/2020-03-20 50/2020-03-20 20/2020-03-20 5/2020-03-20 50/2020-03-20 20/2020-03-20 20/2020-03-20 50/2020-03-20 50/2020-03-20 10/2020-03-20 50/2020-03-20 15/2020-03-20 10/2020-03-20 5/2020-03-20 10/2020-03-20 100/2020-03-20 10/2020-03-20 10/2020-03-20 50/2020-03-20 5/2020-03-20 20/2020-03-20 30/2020-03-20 20/2020-03-20 50/2020-03-20 10/2020-03-19 20/2020-03-19 30/2020-03-19 20/2020-03-19 300/2020-03-19 10/2020-03-19 50/2020-03-19 20/2020-03-19 50/2020-03-19 100/2020-03-19 30/2020-03-19 20/2020-03-19 10/2020-03-19 40/2020-03-19 5/2020-03-19 10/2020-03-19 20/2020-03-19 50/2020-03-19 15/2020-03-19 20/2020-03-19 100/2020-03-19 10/2020-03-19 10/2020-03-19 50/2020-03-19 50/2020-03-19 50/2020-03-19 20/2020-03-19 10/2020-03-19 10/2020-03-19 20/2020-03-19 10/2020-03-19 10/2020-03-19 10/2020-03-19 30/2020-03-19 20/2020-03-19 20/2020-03-19 30/2020-03-19 25/2020-03-19 20/2020-03-19 50/2020-03-19 20/2020-03-19 30/2020-03-19 10/2020-03-19 30/2020-03-19 20/2020-03-19 100/2020-03-19 50/2020-03-19 20/2020-03-19 20/2020-03-19 10/2020-03-19 50/2020-03-19 15/2020-03-19 30/2020-03-19 20/2020-03-19 50/2020-03-19 5/2020-03-19 20/2020-03-19 30/2020-03-19 40/2020-03-19 100/2020-03-19 30/2020-03-19 10/2020-03-19 30/2020-03-19 20/2020-03-19 50/2020-03-19 25/2020-03-19 10/2020-03-19 30/2020-03-19 20/2020-03-19 10/2020-03-19 25/2020-03-19 40/2020-03-19 5/2020-03-19 10/2020-03-19 50/2020-03-19 40/2020-03-19 25/2020-03-19 25/2020-03-19 10/2020-03-19 10/2020-03-19 20/2020-03-19 10/2020-03-19 10/2020-03-19 20/2020-03-19 5/2020-03-19 20/2020-03-19 30/2020-03-19 20/2020-03-19 10/2020-03-19 10/2020-03-19 10/2020-03-19 10/2020-03-19 25/2020-03-19 5/2020-03-19 10/2020-03-19 10/2020-03-19 10/2020-03-19 10/2020-03-19 20/2020-03-19 50/2020-03-19 10/2020-03-19 550/2020-03-19 10/2020-03-19 56/2020-03-19 50/2020-03-19 25/2020-03-19 50/2020-03-19 50/2020-03-19 15/2020-03-19 30/2020-03-19 20/2020-03-19 100/2020-03-19 20/2020-03-19 10/2020-03-19 50/2020-03-19 10/2020-03-19 100/2020-03-19 20/2020-03-19 1000/2020-03-19 50/2020-03-19 50/2020-03-19 50/2020-03-19 10/2020-03-19 30/2020-03-19 50/2020-03-19 25/2020-03-19 10/2020-03-19 20/2020-03-19 20/2020-03-19 5/2020-03-19 15/2020-03-19 50/2020-03-19 100/2020-03-19 10/2020-03-19 50/2020-03-19 50/2020-03-19 20/2020-03-19 50/2020-03-19 30/2020-03-19 5/2020-03-19 10/2020-03-19 10/2020-03-19 20/2020-03-19 200/2020-03-19 25/2020-03-19 15/2020-03-19 10/2020-03-19 20/2020-03-19 100/2020-03-19 50/2020-03-19 25/2020-03-19 10/2020-03-19 15/2020-03-19 50/2020-03-19 10/2020-03-19 30/2020-03-19 10/2020-03-19 25/2020-03-19 30/2020-03-19 20/2020-03-19 50/2020-03-19 150/2020-03-19 10/2020-03-19 10/2020-03-19 50/2020-03-19 30/2020-03-19 25/2020-03-19 10/2020-03-19 25/2020-03-19 100/2020-03-19 20/2020-03-19 20/2020-03-19 50/2020-03-19 20/2020-03-19 300/2020-03-19 10/2020-03-19 20/2020-03-19 5/2020-03-19 20/2020-03-19 10/2020-03-19 50/2020-03-19 18/2020-03-19 150/2020-03-19 10/2020-03-19 25/2020-03-18 30/2020-03-18 30/2020-03-18 20/2020-03-18 50/2020-03-18 9/2020-03-18 100/2020-03-18 20/2020-03-18 100/2020-03-18 5/2020-03-18 10/2020-03-18 15/2020-03-18 15/2020-03-18 30/2020-03-18 20/2020-03-18 30/2020-03-18 20/2020-03-18 20/2020-03-18 30/2020-03-18 10/2020-03-18 10/2020-03-18 50/2020-03-18 20/2020-03-18 25/2020-03-18 20/2020-03-18 10/2020-03-18 20/2020-03-18 100/2020-03-18 55/2020-03-18 5/2020-03-18 10/2020-03-18 10/2020-03-18 5/2020-03-18 25/2020-03-18 30/2020-03-18 10/2020-03-18 10/2020-03-18 20/2020-03-18 20/2020-03-18 20/2020-03-18 10/2020-03-18 7/2020-03-18 20/2020-03-18 10/2020-03-18 5/2020-03-18 10/2020-03-18 5/2020-03-18 5/2020-03-18 5/2020-03-18 10/2020-03-18 10/2020-03-18 10/2020-03-18 20/2020-03-18 25/2020-03-18 60/2020-03-18 10/2020-03-18 30/2020-03-18 50/2020-03-18 20/2020-03-18 10/2020-03-18 10/2020-03-18 50/2020-03-18 18/2020-03-18 5","WE ARE IN THE MIDST OF A GLOBAL PANDEMIC. SUPERMARKET SHELVES ARE EMPTY. BUSINESSES ARE CLOSING. PEOPLE ARE LOSING WORK.     1.3 MILLION FOOD BANK PARCELS WERE HANDED OUT BY THE TRUSSELL TRUST IN EMERGENCY SITUATIONS LAST YEAR  to people who would have gone hungry if not for charitable help.    I've been a food bank user myself. I'm only here today because of the kindness of strangers - donating food  distributing it  identifying that I was struggling and helping me out.     And now the supermarket shelves are empty. People are filling up their own trollies and cupboards to try to deal with the panic of an unknown pandemic - and food banks up and down the country are running out of food.    As the impact of coronavirus takes hold  and the knock on effect of unpaid work  unfulfilled contracts  zero hours workers getting literally zero hours  new universal credit claims (currently a six week delay  who knows how much longer it will be with so many new claims to process?!)  More and more people are going to find themselves at the door of the food bank  only to find that their shelves are empty too.    It's my birthday today (17th March) and I'm sitting here on my sofa at half past midnight truly thankful to be seeing another birthday at all. But all I want - really - is for people to dig as deep as they can and help restock struggling food banks so that the most vulnerable people in our neighbourhoods can access a little help in this precarious and difficult time.    People who can't afford to stockpile. People who buy their shopping in meagre amounts day to day. People who were already struggling who now won't be able to make ends meet.    We don't know how Covid19 is going to end up. We have no idea of the impact on our economy  society  communities. But poverty is already isolating  lonely  and exhausting. If we all turn inwards and only look after ourselves  more and more people are going to slip through the cracks.    All the money raised here does directly to the TRUSSELL Trust who will use it to support people in need and at risk of food insecurity and hunger throughout the UK.    If you can't afford to donate - sharing it on social media is free. Thankyou for your support.    The Trussell Trust  in conjunction with local communities  develops and runs sustainable projects in the UK tackling poverty and exclusion. Through the UK Foodbank Network and Community Enterprises we work with marginalised people in real need  providing practical care and support. www.trusselltrust.org.    All the best    Jack Monroe. ",False
